user_name,star,comment_time,geo_ip,vote,short
迷雾之晨,5,2015-06-08 00:53:19,unknown,5920,同为曾暗恋者，别人这样劝我：这个不是真正的爱情，是宗教般的体验，来源于父爱的缺失，来源于自卑。
娅,4,2013-06-12 15:24:07,unknown,4442,我始终为你而紧张，为你而颤抖；可是你对此毫无感觉，就像你口袋里装了怀表，你对它紧绷的发条没有感觉一样；这根发条在暗中耐心地为你数着你的钟点，计算着你的时间，以它听不见的心跳陪着你东奔西走，而你在它那嘀嗒不停的几百万秒当中，只有一次向它匆匆瞥了一眼。
lullabi,4,2011-12-05 22:00:32,unknown,1646,暗恋是低到尘埃里的欣喜
桃兜兜,3,2014-06-06 10:49:59,unknown,1482,哪怕我已经死在床上假如你呼唤我我就会立即获得一种力量站起来跟着你走
巟良,4,2015-12-18 12:10:26,unknown,1195,茨威格一定是一个神经质的人，他的爱情都是很卑微和疯狂的，不管男女。看他的小说就能知道他最后肯定会自杀。这个女人好愚蠢啊。这个男的可能是脸盲症啊，可能是爱无能啊，她对这个男人真正又了解多少呢。自作多情演了一辈子的戏，那男的只见过她没几面，他不记得也很正常啊。我不觉得这种爱伟大，我觉得很愚蠢。倒觉得她还挺幸福的其实，这男的根本谁都不会记得，但这个男人还至少给过她几天，也给了她一个孩子，她自己也知道，不会更多了。她自己愿意把自己的一生定义在一个男人身上，那她也得到了她想得到的。其实她根本就不清楚自己想要什么。我倒是觉得那些爱她的男人很惨，爱上了一个偏执狂。我觉得她根本不需要怜悯，她的一生已经值了，这根本就是她自己想要的。怜悯她的人才都错了。
郑宁素,5,2011-04-14 18:04:43,unknown,446,最了解女人的作家，名不虚传，如此极端的想象还能把女人的心理描写的淋漓尽致，实在是高手
傻乐的猫,NaN,2013-12-11 22:13:20,unknown,637,小时候以为是爱情，现在才发现是写精神病的。
光,5,2010-05-12 16:02:31,unknown,402,偏执的人总是特别容易打动人
竹取,5,2013-06-26 16:07:46,unknown,396,用一生去暗恋，直到迷恋爱情，忘却爱人。——一个陌生女人的来劲。
盼,4,2013-05-02 12:40:34,unknown,345,书，不长，很快看完。内心却是煎熬的。陌生女人对作家的爱太执着，太宿命，不予置评。我只是想，是不是总有个人，在你不知道的情况下，曾经爱过你。
august,5,2012-06-25 19:36:51,unknown,229,这是我看的第一本斯台芬·茨威格。就像当初看麦卡勒斯一样，我毫无抵抗力的喜欢上了。读到他们是我近段时间发生的最好的事之一。当我把这本专注女性的短篇小说集看完后发现作者尽然是个纯爷们儿时彻底惊讶了，麦卡勒斯是透过女性的视角来描写孤单，不仅想问究竟是男人更了解女人，还是女人更了解自己？
豆友44887432,5,2013-12-22 11:20:50,unknown,209,可是请你相信，没有一个女人像我这样死心塌地的爱过！过去是这样，这么多年过去了，仍然是这样。因为这个世界上没有什么东西可以比得上一个孩子暗中怀有的、不为人察觉的爱情，因为这种爱情不抱希望、低声下气、趋意奉迎、热情奔放，这和成年女人那种欲火炙烈、不知不觉中贪求无厌的爱情完全不同。只有孤独的孩子，才能把全部的热情聚集起来。我毫无阅历，毫无准备，我一头栽进我的命里，就像跌进一个深坑，从那一秒钟起，我的心里只有一个，就是你。
薄荷娃娃,4,2016-04-11 09:16:13,unknown,254,Itissogoodbutsowrong.
商夏,4,2013-02-08 21:10:57,unknown,202,爱情就是一场盛大的误会。
Pirouette,4,2011-06-27 20:06:59,unknown,192,暗恋的极致
刘十九,4,2013-01-21 22:24:24,unknown,186,在16岁的时候，我也有过这样盲目的爱，在冬季寒冷的地铁口等了一班又一班的车，只为瞥一眼倾慕的男老师的脸。年少的姑娘就是容易义无反顾陷入情网，这样的爱是弥足珍贵的，同样也是危险的。这个世上从来不缺坚贞女子的悲情故事。如果不对这些冒着傻气的姑娘施以援手（对她们来说却是万恶的阻拦），那她们的一生也有可能像这位陌生女子一样悲惨，绝非虚言。
Mathis,5,2013-12-02 17:21:17,unknown,243,话痨女与脸盲男。
三和后浪える酱,4,2013-04-23 23:31:45,unknown,204,就是因为他没娶她才造就她如此爱他的幻梦。
scar,5,2014-07-09 16:38:05,unknown,166,多么悲哀啊！狂热的爱着一个不爱你的人。比死亡更悲哀。
BLACK,4,2011-10-27 17:46:24,unknown,106,千奇百怪情欲下孕育出的爱情，有多少会是畸胎啊。
安小嗔,1,2015-07-18 14:34:19,unknown,143,史上最严重的花痴
青绿十一,5,2015-04-12 00:39:57,unknown,110,短篇小说合集，都蛮好看。但是还是最著名的这篇最好看，绝望的虐哭了的少女心，临终之际——“而我如今只有你，与我素昧平生的你，我执迷不悟地深爱着的你。”
crushipper,4,2008-04-25 12:46:22,unknown,178,恐怕R先生没有想到，写了一辈子小说的他会被这个陌生女人编排进她那场由爱构成的伟大的行为艺术演出中。
小小虫,4,2015-09-17 10:03:11,unknown,137,只读了《来信》一篇。情感上很难引起共鸣，难以置信爱到如此卑微还能感觉快乐，也不很相信真会有这等痴情女性存在。故腹黑地猜想这又是一种男性的“美好想象”：我魅力无边，迷倒万千少女，她们爱我但从不打搅我的生活，不过最重要的是，我不care你们这群迷妹，因为你们于我而言不过是默默无闻的“陌生女人”罢了。#走火入魔的对抗式阅读#但文笔还是非常优美，特别是怀表的比喻。大文豪写爱情，不是三流地摊玛丽苏能够比拟的。
[已注销],5,2012-05-26 11:41:13,unknown,88,哭地稀里哗啦的。。突然想起了夏雨荷等了一辈子恨了一辈子想了一辈子怨了一辈子去依然感激上苍有这么一个可等可恨可想可怨的人要不然人生将会如一口枯井了无生趣。。
动机在杭州,4,2012-02-04 22:49:56,unknown,110,不求回报奉献一生的爱情，是每个女人的噩梦，每个男人的梦想。
liequanhu,5,2020-01-18 16:17:26,unknown,104,很多描写很棒。不过，就女主而言，少女时代脑子进水可以理解，但之后一直不把水放出来，反而越进越多，越进越上瘾，我就不能理解了。暗恋的极致，就是这种毫无尊严，不计后果，所谓的跪舔？这种极端一点都不美好。
我昨天叫何宝荣,4,2009-06-14 09:20:36,unknown,53,这种女人，只能远观，不能亵玩。
toolass,4,2012-04-28 21:54:04,unknown,95,就是那种我觉写得真好可是喜欢不起来的书。
周游雪场,3,2018-02-16 19:58:55,unknown,64,”只有像我这种从小孤独的女人才能够把满怀的热情集中在一个人身上。“
撒旦的表妹,5,2016-02-22 22:45:19,unknown,57,疯子
柴斯卡,NaN,2020-07-10 23:49:03,unknown,126,为了准备下周一个豆瓣活动重新读了一遍，可真是有点被恶心到了。完完全全是茨威格作为一个高度自恋的男性作家，对女性心理的意淫。这种到生命最后一刻也始终温暖的、一厢情愿的付出，显然的反人性的。从中读不到任何真正立体的女性成长，只有对男作家近乎反常的、温柔的执着。纵使当时的作家中能写好女性的也不多，茨威格被评为最懂女性的作家也是很讽刺的。把笔递给她，我们会看到与之完全不一样的叙述。
五月微蓝,5,2011-08-14 22:44:41,unknown,37,极致的爱情。庞大而绝望，却对自己无能为力，只能用尽一生去爱你。
、雅韵乃扬。,5,2011-08-01 12:31:08,unknown,56,没有什么能够比一个少女在最寂寞最迷茫的豆蔻梢头萌发出的朦胧的情愫更加奋不顾身、更加倾尽所有的了、
鱼剑,5,2015-12-30 14:49:37,unknown,70,很多人在读完《一封陌生女人的来信》这篇小说时都过于纠结这份感情的真实性，为女主角感到不值或者对男主表示轻蔑。但这篇小说的意义远不在于讨论这一一份感情的可行性，而是探讨这样一种状态的爱情的意义我们在喜欢上一个人时一定程度上不也是这种状态嘛？那么如果这种依恋极端化后是否还是爱情呢?
青豚|shiny 圈,5,2011-07-09 00:07:35,unknown,38,她爱的单纯，不求回报。那执着若隐若现，浓郁忧伤；最终，他感受到死亡，看到了不朽。茨威格极其擅长心理描写，他懂得怎样用心灵的共振来虏获你的阅读感官。一股巨大的力量贯穿始终，牵引着我，朝你而来。
小M,3,2007-12-28 15:32:05,unknown,43,一个男人细致成这样。。
炯之,4,2017-07-21 10:26:46,unknown,41,絮絮叨叨地谈一个人，支支吾吾地说一个人，心心念念地想一个人，战战兢兢地爱一个人。
Miaou,4,2010-11-29 02:02:43,unknown,34,现实感强烈的爱。爱是痛苦的，卑微的，难以得到的，因而也是炽烈的深刻的。爱是什么？爱不是简单的，爱是复杂的，带有基因，荷尔蒙，心理学的。可，爱依然是一切的救赎，生命的救赎。
锅蒸之鱼,5,2012-09-10 09:39:14,unknown,42,徐静蕾翻拍《一个陌生女人的来信》时，在电影海报上加了一句无比悲情的注解：“男人的一夜，女人的一生。”原著其实比男人的一夜更短，这部同名小说集还收录了茨威格其他几个经典中短篇小说。书中上流社会的气息分外浓重，但他想说的却是爱情是任何人都可以拥有的奢侈品，爱的门槛不是资产。
微笑的鱼,5,2009-04-13 12:50:42,unknown,24,最感人的情书
[已注销],5,2010-04-15 20:55:05,unknown,36,若是不到死，我是不会告诉你这些的。
有寂,4,2013-06-04 18:48:45,unknown,30,能把一个早已猜到结局的无聊故事写的那么柔情，悲剧，富有魅力。
卿一一一一一,4,2017-10-11 14:22:04,unknown,46,和年少时的自己很像，现在看来过于卑微和可怕，不同在于书中的人物从来没想过自救和成长，而我每天都在努力摆脱那种没有自我的状态，如今终于感觉内心回了家，何其幸运
Griet,5,2007-10-10 12:51:39,unknown,27,IcriedmyeyesoutwhenIwasreadingthisbook.
吴明,4,2014-05-21 11:52:14,unknown,27,我怎么以前没保存吗。以前读过。书和中国版的电影都看过。怎么说，书中的女性真的是境界很高，如飞蛾扑火。也许她活的并不快乐，为何你甘愿成为一个男人短暂留恋的牺牲品。让我想起了张爱玲。悲剧。其实局外人是不懂的。也许这也是一种爱情。如果再给一次选择，这个陌生的女人还是会愿意，张爱玲也是。
晴蘭,NaN,2011-01-27 21:45:10,unknown,33,“我爱你，与你无关。”
酚酞,5,2010-03-08 19:07:24,unknown,22,翻译的书总是显得矫情
又烧包小队长,4,2012-12-01 20:27:01,unknown,43,千言万语一句话。。。。那女人是傻逼！！！！！
易又饕,2,2013-12-06 18:46:45,unknown,16,说实话，不明白这部小说怎么就成为小清新的标志性装饰了，我实在喜欢不上，甚至看了徐静蕾之后还是喜欢不上。
CoCo✂️,3,2020-07-11 01:51:21,unknown,60,隔一段时间就会读一下，时时警告自己，千万不要成为这样的傻逼女子。
妍妍啊～,4,2013-02-16 22:29:52,unknown,24,自卑与自恋之间是自虐。
临素光,5,2017-08-07 16:08:30,unknown,17,如果要选一个人物当做茨威格的文学意象，我一定选《马来狂人》。看起来普通而和善，但他会突然跳起来，拿着匕首开始狂奔。不论什么东西拦住他，他都会用匕首把它捅倒在地，这种嗜血的醉意只有使他更加激昂暴烈。直到人家把他像条疯狗似的一枪打死，或者他自己口吐白沫倒地身亡，才能终结这种疯狂。
mado1983,3,2017-05-27 09:26:57,unknown,14,情感细腻，修辞精致的言情小说，可是依然是言情小说啊~~不懂为何人人都说好，也许我读了一本假书。。。
云的眼泪,4,2013-04-16 16:00:20,unknown,22,这爱，是一种自虐式的宗教崇拜~
Vince,4,2015-04-13 17:24:11,unknown,27,低三下四，隐忍，卑微，吃苦，都不等于崇高。伤害自己不应该被赞颂。
我认出风暴,4,2010-07-27 20:12:35,unknown,27,多少有点恋父情结
夏棉满,5,2007-08-27 09:23:06,unknown,12,女子的绝望与美艳，本是场盛大的绽放。
春花,5,2017-10-28 22:46:13,unknown,19,迷妹，狂热，爱的不是作家而是陶醉于所幻想下的爱作家的感觉。默默付出渴望回报又害怕失去她的精神信仰。她口风很紧，身边的人都认为她腼腆含羞，其实她只是不把秘密告诉任何人而已。久而久之她的心里产生了一股钢铁般坚定的意志。
王家祥悉达多,4,2015-10-10 11:05:40,unknown,20,女人最悲哀的事情，就是用一生的时间爱着一个并不爱她的人。
sUsU,5,2008-08-02 17:18:16,unknown,23,寄生于另一个生命的女人
momo,3,2020-08-17 13:17:15,unknown,38,3.5分。很多人都说茨威格很擅长写女人，很了解女人，但我并不是这么认为的。他写的有点接近于男人想象中的女人。也不能说写的不好，总比男频网文写的女人好多了。但依旧不是真实的。我不赞成这种爱情，太卑微了。
艾小柯,4,2019-01-04 22:56:01,unknown,33,茨威格的心理描写可真细腻啊，种种爱而不得，令人唏嘘慨叹。然而最令人印象深刻的是那个业余棋手，迷醉而可怕的梦魇，摄人心魄。作为最著名的《一个陌生女人的来信》，怎么读都是一种隐喻或者寓言，是一篇情绪之梦，是人世间种种短暂欢愉之后求而不得的深切遗憾，是给所有的未完结送出的一个美丽的句号。
豆友182975599,4,2020-02-04 02:16:35,unknown,18,我感觉到，那里的每一件东西都渗透了我的激情，都是我童年时代的相思的象征：在这个大门口我千百次地等待过你，在这座楼梯上我总是偷听你的脚步声，在那儿我第一次看见你，透过这个窥视孔我几乎看的灵魂出窍，我曾经有一次跪在你门前的小地毯上，听到你房门的钥匙咯嘞一响，我从我躲着的地方吃惊地跳起。我整个童年，我全部激情都寓于这几米长的空间之中，我整个的一生都在这里，如今一切都如愿以偿，我和你走在一起，和你一起，在你的楼里，在我们的楼里，我过去的生活犹如一股洪流劈头盖脸的冲了下来。
Jus,4,2012-05-08 13:50:10,unknown,23,怎么都觉得女主是消极性依赖人格失调的症状
甘草披萨,4,2016-10-14 23:32:11,unknown,14,气氛总是如水汽氤氲的湖面，飘着淡淡哀愁的林中薄暮，伤感遗憾的茨威格，描写那么细腻，悲哀的曲调，传奇的故事，在他笔下最终都化为优美的意境；著名的陌生女人来信读过数遍，她爱的并不是具体的“他”吧，她爱的其实是自己在永恒的思念里的倒影，这一生的念想，支撑着卑微的她熬过所有的艰难世事
Kris™在路上,5,2012-02-03 12:30:54,unknown,14,多么让人痛彻心扉并永生铭记的爱情。
密谋小和弦,4,2019-04-07 10:26:21,unknown,19,记得以前有人问我，这个故事是否真有可能存在？我回答说有——毕竟绝望而浓烈的爱，藏于心底或者公之于众，在世上遍地都是。
大力兔女王,5,2008-10-24 21:48:45,unknown,12,一辈子总要真的爱一次.
椰汁冰茶,4,2018-10-25 05:31:14,unknown,12,高中读的时候觉得神神叨叨顾影自怜，后来才明白，人总会爱上自己不该爱的人，人会爱上各种各样的人，哪怕是素昧平生的陌生人。
Luffyjun,4,2020-02-11 15:27:45,unknown,10,茨威格真是心理描写的高手，这就是西方爱情中的一种经典形式吗——美人鱼式（另一种是灰姑娘式），女人一直沉溺在自己的想象里，自我感动自我救赎，最后儿子的死是牵动她最后的一根神经也断了。如果她能多接触其他人就不这么盲目了，但她应该不会吧。。沉溺又没人来救【听】
魏老师,5,2020-05-23 18:38:21,unknown,10,“可是往后，还有谁会在你的生日时，给你送去白玫瑰呢？那个花瓶往后只能空着了。我那一年一次的问候，飘在你身边的微弱气息，也将就此消失了。”
ullmann,NaN,2015-08-19 00:05:05,unknown,14,“我”真可怕，“你”好自恋
火狗,4,2020-05-15 19:29:28,unknown,9,说是卑微，但是感觉更想做的是“驯服”。
豆瓣资深用户,4,2016-06-09 11:12:59,unknown,8,太过卑微的暗恋
伟大的伟,3,2009-11-26 10:28:28,unknown,11,只花了周末一个晚上的两个小时读完了这本书。其实应该不是书，这仅仅是一封信。只是在这封信前后加了个帽子和尾巴，变成了一本书。非常凑巧，昨天在一个碟评？碟介？频道看到徐大才美的同名电影片断。最后读完书，回想到电影那个片断，应该是女人成了交际花后偶遇寻欢的男人，被男人带回住所的那段。拿一生来爱一个人，但从未让其知晓。13岁的锁孔窥视，夜夜守候他的窗外，生育他的孩子，被当成妓女召来开心。他的生命里，她只是偶尔出没，无法连贯组成的陌生片断，他却是她魂魄栖息的全部所在。拿一切来爱他，却是他绝对的陌生人。这样的爱，史前绝迹植物一样怪异庞大，却同时执拗单纯。这是爱的极端姿态。可以被解读成无数种版本，被援引成无数的例证。但它突破了精神的束缚，成了物质的形态，一个可以触摸到的实体，如同雕塑、化石、广场或高楼一样。它成功进化成为真实存在的物体，而不再是可以被随便臆想或歪曲的精神。
[已注销],5,2013-09-01 21:00:10,unknown,12,意淫之王。
贝加尔海,4,2009-03-01 15:33:25,unknown,8,高二，祥哥的语文课。一位太适合教语文的老师，嗯。
L·梦さん,4,2014-01-19 21:43:38,unknown,11,倒是更喜欢象棋大师的那一篇。原来每一个少女都曾有过一段暗恋经历，而那段暗恋永远都是最纯最美的回忆。只是这本书，千万不要让17岁的小女孩看到啊，不然那少女的美妙经历就不那么神奇了。
戈浅,3,2019-12-16 09:14:00,unknown,17,男主是多么薄情和脸盲才能记不住一个和自己睡过两次的女人黑人问号脸
Mademoiselle B,NaN,2012-11-28 00:02:50,unknown,10,茨威格手中这支尖利的笔，串成的是阵阵教人发抖的寒意。
桥山小野姬,5,2015-08-05 00:41:05,unknown,10,双鱼女。。。。
yuki,5,2015-08-07 22:06:45,unknown,12,这是不是一种病态？
日下圭介✨,5,2013-07-17 23:34:39,unknown,7,恋爱心理独白果然独树一帜
Lanita,5,2019-04-12 13:05:11,unknown,4,似乎这个世界上所有的深情都是用来被辜负的。
哈尔乔丹的绿箭,5,2020-08-31 19:00:22,unknown,7,好的文学作品与诗一样，只有当你心境到了，才能体会作者的微言大义，才能与作者澎湃的情感力量产生共鸣
Menglu的记事本,5,2012-08-19 04:00:44,unknown,15,有没有爱过一个，他一直在那就像是一种信仰。这种爱情，真的是：我爱你，和你没关系。不是为了陪伴和占有，那个人就像是人生的希望和光源。单纯爱你这件事，就可以给我幸福。
✖,5,2009-09-07 23:06:47,unknown,5,我求你听我谈一刻钟，别厌倦，我爱了你一辈子也没有感到厌倦呀。我要把我整个的一生都让你知道，我的一生始终是属于你的，而对我的一生你却始终一无所知。世界上再也没有比置身于人群中却有感到孤独更可怕的事情了。
Sweets,4,2021-05-12 22:31:27,unknown,5,这真的是一个太过真实的暗恋的故事了，我想这篇短文之所以能够打动那么多人，因为这种暗恋的感觉都或多或少经历过，那些不能言说的秘密在这篇文章里面真的是被展现得淋漓尽致。那种见不得人的偷窥，所有的悲喜都随着那样一个人而转移，恨不得将自己所拥有的一切都给那样一个人，而所有的错误都是自己的。到最后越来越卑微，只求那个人能正眼看自己一下。茨威格说过：除了强烈的感情之外，什么都与不朽无缘。这也是我们生而为人最难得的一点呀，一定不要再成长的过程中丢失了这种本能。
彭—庄影,3,2020-07-02 22:17:02,unknown,9,这种感情真的不觉得美好，欣赏不来。
朝朝,4,2020-04-14 21:58:33,unknown,8,柔肠百转中尝尽心酸苦楚。这本书在很大程度上影响了我的爱情观：爱一个人应该是飞蛾扑火，热烈汹涌的。但现在的我希望这样的女孩少一些，首先要成为一个独立的人，有自己所热爱的事情，然后再去爱人。
小兰,5,2021-01-16 22:32:06,unknown,7,茨威格就差说出：“我知女人心”那句话了！
黑大壮女神,4,2009-06-26 19:57:59,unknown,3,我承认我并不是那么喜欢茨威格的书。
竹林小筑,3,2020-04-03 21:58:12,unknown,7,读完一个陌生女人的来信，不太认同这种盲目的爱情，单纯但有害。暗恋狂魔为一个花心男人忍受一生的孤独，暗暗生孩子、卖身、孩子最后还悲剧地死去，仅为了一个人品不好的把妹达人，悲惨卑微的爱啊。虽文学作品处理的比较夸张，但女生还是多爱爱自己。
[已注销],2,2012-12-01 11:32:00,unknown,8,ican'tgetit
Carmen,3,2021-03-08 04:16:37,unknown,16,看的时候就猜想她是个受虐狂，R就是她的主人她的神，在他面前只有臣服。是父爱的缺失和童年自卑的结果，是一种宗教式的爱情（而抛开来说，总感觉这故事是一个男人的意淫，就像个爱情的a片
顽木匠,4,2014-10-09 10:24:04,unknown,5,也算暗恋的极致了，打死你我也不说。
Whatever,5,2020-04-29 23:27:25,unknown,5,我还是要说茨威格把那些戳心窝渗骨髓的感受，全写出来了，好像是几个“你永远不懂我伤悲”的短篇故事。早就知道讲暗恋，可一直不太敢看《一个陌生女人的来信》，怕故事的走向影响我的人生，直到我明确自己从心底结束了这场贯穿高中大学及初入社会的七年暗恋进程之后，觉得可以看了。十句话八句离不开的灼热、每周都会梦到的卑微、提到就不自觉的心跳脸红、抓住一个针孔都不能不的窥探、相见表面冷静而内心的炸锅狂喜、闭上眼睛的思绪意淫、表白到嘴边的无数次退缩…而对方得知后仅当一个故事听的文不对题，都是暗恋的荒诞和有趣之处。《朦胧夜的故事》你以为和现实发生之间的冲突尴尬，错置的思绪，是人生没法避免的谬误与无奈。《灼人的秘密》孩子变成大人才能懂大人，兜转周旋各怀鬼胎的暗暗发力，人与人之间有太多不能直说的秘密，无解于是只好算了。
麻瓜赫敏。,5,2012-11-07 21:31:34,unknown,6,我爱你。爱着不同时候的同样的你。为了这样的你，我甘愿隐藏着自己。
李念河重出江湖,5,2013-04-15 04:25:54,unknown,5,我的一生都是属于你的，而你却对我一无所知。孤独又美丽，真不明白书这么好，电影怎么可以拍得那么烂。
Seki怎么又瘦了,NaN,2015-11-29 12:17:09,unknown,3,就像自己当年对michelangeloalbertazzi的暗恋一样
Ann,4,2018-11-16 09:57:12,unknown,1,少女心写得可真好啊，喜欢一个陌生女人的来信和家庭女教师
Hesperia,4,2011-06-24 23:42:33,unknown,3,昨天晚上看了电影又一口气读完原著，都快三点了才睡。梦里全是那个女人，她的爱和情绪。
眠去,4,2007-10-01 18:02:26,unknown,3,小暖送我的礼物：）
吃西瓜放糖,5,2014-01-19 19:16:29,unknown,2,女孩的心思男孩你别猜！
小徐师傅,5,2011-05-01 12:19:53,unknown,3,我更中意的是第三篇《贵妇失宠》
加州没有雨,5,2020-02-24 07:35:02,unknown,8,我讨厌这样卑微到尘埃里的爱情但我又控制不住为这样的爱而流泪
花似瑾,5,2021-07-13 23:52:39,unknown,3,爱不爱情我不好说，不过总觉得这个算是好多病娇文的鼻祖了，把女主内在性格的偏执和占有欲外向化，就是典型一病娇
李可笑,5,2012-10-02 15:40:34,unknown,6,闻名便醉心，未见已相怜
蝉,NaN,2014-03-10 12:50:10,unknown,2,:	I521.45/4154-52
不擅长,4,2011-12-30 09:13:50,unknown,1,火烧火燎的秘密、马来狂人
冬梨梨梨子,4,2018-12-21 17:55:33,unknown,2,《一个陌生女人的来信》这篇，文笔十分凄美。但可能不同年龄、不同经历的人读完后，会有不同的感受吧！我佩服这位女子对爱执着的勇气，可我并不赞赏她的行为。如果一个女人把满腔爱意都倾注于一个男人身上，不求回报甚至不求被知晓，那便会在爱中迷失了自我呀！到头来，万千守护、万千付出、万千等待、万千痴迷，只不过感动了自己罢了。
Comel,4,2013-11-08 22:33:38,unknown,2,重读又有新体验，茨威格的创作是指向上层人士在现实社会中的反差，虚荣与欲望的反复斗争，心理描写很赞，但修辞痕迹很很明显，于是有时能一眼看中作者心思
