user_name,star,comment_time,geo_ip,vote,short
Philex,4,2019-12-29 00:22:02,unknown,40,推荐!！读这本书时常能让我想起自己成长的艰辛和反复；每一次认知重组都是在屋脊逆风快走，而我或还没有作者那么幸运，有体贴的男友或睿智的良师相伴提携，任暗夜蹉跎。卷首语提纲挈领，这本书的主题是过去和教育。正如杜威所言，“教育必须被视为一种对经验的不断重建；教育的过程和目标合而为一，是一回事。”教育归根到底是习得如何恰当地理解、重建以及期待过去。书本上的知识只有用自我经验反复浇炼才会成为真的知识，而自我经验也只有被反复颠覆拓宽才有可能从傲慢偏见朝真相格进。行路难，且珍惜！
飞鱼牙牙,2,2020-04-24 20:03:32,unknown,54,要是小说我能打三星，自传只能两颗星。这书为啥这么火？我还是眼界比较小，不了解美国，不了解美国教育更不了解摩门教，所以没有什么代入感，这书也不励志啊？只能说主角光环强到爆炸。这一家子的基因都很奇特，各种大难不死，前几天刚看完那本《荒诞医学史》，这个能量疗法也挺荒诞的。但是美国可能是一个脑回路和我们完全不一样的国家，你看看川建国的脑回路，这个精油加能量疗法还能发家致富。这本书告诉我们不用去学校，只要你愿意并有点儿天赋，连博士都是你的。这本书告诉我们对于神经病不用治疗他，因为他可能是个大富豪。这本书告诉我们生病不用去医院，上帝会保佑我们。新冠肺炎美国已经八十多万了，女主一家屯的物资终于派上了用场，这本书既然是自传，又这么火，应该有不少人去买精油才对啊。没准女主一家最后拯救了世界。
greatabel,3,2019-11-22 18:02:54,unknown,40,出生在健全没有经历过黑暗的家庭的人不能体会：家有时候有一种亲近，但是有时候觉得离开这里去几千里之外反而更放松，内心里你说不准是爱是恨，慢慢的更多是一种无所谓：父母缘分也只是因缘际会的一种，只不过消耗得更久点，三观无法相互理解之后、都不生活在一个世界后迟早双方会形同陌路的，当然在此之前你肯定不相信“这些奇葩的事”有一天会发生在你身上
琴声何来,5,2021-01-28 15:37:13,unknown,35,最近认识到，对我来说24小时内读不完的书，可能24天也读不完。差不多又一口气地，读完了这本书。读的时候一直在想原生家庭的问题，到最后一章才恍然大悟，哦，教育。fleeasabirdtoyourmountain.我曾以此勉励自己要快点经济独立，脱离父亲。很少的父亲以摩门教旨的形式来控制孩子、企图将孩子自己从孩子身上驱除，他们往往用更隐秘的形式，在中国常常是“孝道”。为什么我们和父母之间不能有理性的对话。为什么总是没有征兆的爆怒，无端的指责。为什么我是一个好的学生、朋友、员工，却无法成为一个好的孩子，除非我顺从他。除非我把我的拥有者改做他。但也开始思考，是不是我错了。
沈十六,4,2019-10-31 18:35:43,unknown,36,“无论你成为谁，无论你把自己变成了什么，那就是你本来的样子。它一直在你心中。不是在剑桥，而是在于你自己。”
我爱阳光,5,2020-02-21 01:44:23,unknown,24,没想到还能看到如此深刻有力的当代小说，估计是我的年度最佳了，内心好几次被击破。作者拥有一个近乎奇迹的人生，却举重若轻，没有写成神棍或鸡汤，笔法真实细致，感觉跟着她共同成长了一遍。
momo,3,2019-11-23 14:18:55,unknown,27,为什么要吐槽书名，结合内容来说这个书名真的取得非常好。这样的家庭出了三个博士简直就是奇迹。再一次证明了恋爱脑有多可怕，一个受过良好教育的女性嫁人之后就被洗脑成这样。上学之后的情况描述的不多，更多是在回忆与家庭的关系。多亏了遇到的教授，大家都拉了她一把。这种学习的天赋和运气不是每个人都能有的。一个年轻女性的回忆录，挺精彩的但是我不喜欢。
是我的海,5,2019-11-03 18:31:23,unknown,16,看到出中文版了，火速上亚马逊买来看。人自我实现的能量和教育的能量大到令人惊讶。虽有文化差异，书中各个片段应该都会让大家或多或少引起共情。看完后劲儿有点大。
会飞的鱼,5,2019-12-27 19:17:34,unknown,38,原生家庭真的很重要以及……这一家人真的命很大
吴情,5,2019-10-27 21:28:08,unknown,24,真像书中那位博士所言，塔拉的人生可谓萧伯纳《卖花女》的现实版，太传奇了。
猫咪长犄角,4,2021-01-07 13:39:13,unknown,54,去年读过，一直不知道写什么短评。偶尔看到塔拉的访谈，“你可以爱一个人，但仍然选择和他说再见；你可以每天都想念一个人，却仍然庆幸他已不在你的生命中”。最适合这本书。
一张韵,5,2021-05-10 01:22:31,unknown,33,自由灵魂宽广视野辩证思想独立思考这就是教育的意义
espionage,4,2019-10-28 12:02:44,unknown,22,接受美式碎碎念后，感受人对过往生活剖析的这面镜子。作者授意的中文版书名别有意境。
Never L,5,2021-05-23 22:40:21,unknown,23,不知道为什么把educated翻译成这样一句诗，读完就明白它何止是一句诗。
电子梦,5,2021-02-20 23:35:28,unknown,26,刚开始读的时候以为又是个恶意虚构夸大阴暗的故事读到三分之一的时候才觉得真实的令人心惊作者在泥潭中挣扎出来的坚强原生家庭教育的影响通过这种扭曲抽象的宗教观念刻凸显的像个恐怖片
Magic 露,5,2019-11-12 17:40:01,unknown,29,你被锁🔒在他人话语密布的世界里，可悲的是难以避免被同化。塔拉很幸运的受到教会和老师的帮助，文中真实的表现了塔拉在受教育的路上与家庭的矛盾，以及她的胆怯和妥协，害怕与脆弱，最后她求助于心理咨询，总算逃离了自我责备的囚牢。看他人的故事时总会为对方的经历感到心惊肉跳，有时候还会在一头鼓劲给，别回去！他们不爱你！你为什么非得要他们承认不可？但事实上，寻求爱与认同是人的本能，作者以写出她的故事让我反观自己，提醒自己不要陷入这样的牢笼。以及以更平和的心态对待所有的权威与崇高。“是谁书写了历史？”“是我。”
小猫钓鱼,2,2020-03-23 12:34:07,unknown,36,从没有这么煎熬读过小说，一开始读不进去，冲着19年榜首，特别想知道它好在哪。读完，也没觉得好在哪。看书名看推广觉得应该超励志，读完就是一部故事书，还比较凌乱。作者能在这样的家庭里成长起来，实属不易。再无其他了。好吧，就当我没读懂，不做过多评论。
☕️刀刀妞,5,2021-06-06 12:16:14,unknown,38,你可以爱一个人，但仍然选择和他说再见；你可以每天都想念一个人，但仍然庆幸他已不在你的生命中。
SWX,5,2020-02-18 22:50:34,unknown,19,在去年的三本畅销书中，金智英，房思琪和这本鸟山，这本毫无疑问是最佳的。在微信读书上看了三分之一之后，决定买了一本kindle版的，我需要不受打扰地集中注意力看完剩下的部分。事实上这并不那么「励志」，与其说是山沟里飞出了金凤凰，不如说很多地方都在反思educated这个事实给作者带来了什么。在很多方面上跟《橘子不是唯一的水果》有类似之处，同样有很多来自圣经中的如火一般的话语，但是幸运的是，翻译比橘子好太多了。
脆脆鲨（已黑化,3,2020-03-16 18:34:55,unknown,34,生理性不适，不是抗拒看到丑恶，只是觉得充斥着狭隘暴力的家庭有什么好留恋。这些从来都没有爱的内核。
七月 莲灿，,3,2021-02-05 15:58:32,unknown,31,总的来说，这个评分我认为是过誉，整本书给我的感觉是不真实。作者的自传故事具有特殊性，且非常主观。最令我不能接受的是，一个十七岁之前没有接受过正常基础教育的人，是怎么走入哈佛剑桥的。如果不是她的故事中缺失了什么重要的东西，就是国外的教育体制太具有主观性。然而抛下这个不谈，这本书讲的其实是自我救赎，是教育带来的独立思考和坚持真理和自我的力量。单从这个角度而言，作者的故事很震撼。这本书的译名我觉得很用心，一开始未读前，我认为很生涩。读过以后，觉得不会有比这更贴切的名字了。山是一种意象，”你当象鸟飞往你的山”，既是逃离原生家庭，也是回归自己灵魂。
张春[阿卡纳],4,2020-01-19 19:20:02,unknown,19,这书出来，真是决裂了。
普鲁士蓝,NaN,2020-02-05 23:10:28,unknown,16,到底哪里值得这样高的评价，除了文字叙述确实流畅细腻优美之外，名为educated，也没读出来“教育”和作者间的火花啊。除此之外还越读越生气，如此反人类的生活方式发生在当代美国（但当然这是自己的问题，本就存在，何必生气
桃子,5,2021-01-31 22:36:00,unknown,25,全书在讲的是作者对原生家庭的爱恨以及各种复杂的感情，与教育对作者的影响。虽然说作者认为教育对她很重要，但是我觉得更重要的是作者的自我审视能力和她的勇气。原生家庭给人带来的创伤是很大的，在很多家庭以不同的方式存在的。作者能直面它，并且批判它，形成自我的价值观，而不是把自己一直禁锢在家庭强加的思想和阴霾下，我觉得已经比很多人好太多太多了。我觉得这本书说的教育，一个是他人教育，一个是自我教育。在他人教育中，学习了知识技能、了解包容不同的生活和思想观念；不容易的是自我教育，是一次又一次否定现有的看似宁静的生活，一点又一点转变快要顽固的想法，自我成长、自我重塑、形成自我价值。正如作者所说：“我的一生都活在别人的讲述中。他们的声音铿锵有力，专治而绝对。之前我从未意识到，我的声音也可以与他们的一样有力。”
三狗大将军,5,2020-04-17 05:10:06,unknown,21,想说的东西很多。这本书讲的是一个人如何脱离黑洞一样的家庭这个过程。我思考过那些在不健康的家庭里长大的成年人如何与自己的父母从精神上脱钩，经过长期观察，得出的结论是，这真是玄学。你看这本书里的故事也是，都是在痛苦的环境里，有些人就会觉醒，会随着直觉去受教育，有些人就还是一生都泡在这个池子里，哪怕一生都痛苦。所以这本书啊……会从黑洞家庭里脱离的人不看这本书也会脱离，不会脱离的人看了这本书也不会脱离，——你以为他们在这本书之前看的书影音还少吗？但是看过的东西不会在他们身上显现作用，他们有两套分离的观念，知和行能够不合一、却奇怪地自洽地同时运行。但那也是他们长久以来保护自我不被黑洞一般的家庭氛围吞没的保护机制。怒其不争，也哀其不幸。希望这本书能让人的内心更有力量，但不要有错觉，觉得谁都能逃脱。
呀Pain,3,2020-03-08 07:41:53,unknown,19,作者的个人经历可能足够让人揪心，但故事真的太冗长，反而让人不觉得教育有多么伟大了
朝东风凉,5,2020-01-29 19:49:00,unknown,16,令人震动的是，真正的教育可以带来如此彻底的撕裂，可以给予人最大的勇气去认知和定义自我。这不仅仅是一个17岁前没有上过学的女孩后来成为剑桥历史学博士的励志故事，这是关于文明的拉扯，必然包含了沉重的原生家庭和女性主义的问题。无知、控制、暴力只有在被了解之后才是问题，而之前它们以爱的名义天经地义的存在着。你甚至无法指责，这些痛苦在另一些人心里来自于神。塔拉身负如此巨大的创伤一再回到山里回到家中渴望得到认同和理解，哪怕到最后的说明里还在为自己可能产生的记忆偏差而让父亲背负更多恶名而惶恐。这不是岔路，这是两个世界。这是一个真实的故事。TaraWastover，1986年生，她是我们同一代的人。
J.Skywalker,3,2020-04-05 13:22:22,unknown,24,这本书到底是为什么火的？说是教育改变她的人生但是教育在里面的描写看起来又没那么重要。邪教家庭在cult片里看过很多所以没有太多让我震惊的东西。
量子,5,2021-01-06 20:59:53,unknown,15,塔拉是剑桥哲学硕士，历史博士，她说她应该对之感激涕零，却又丝毫提不起热情。看了难过，塔拉在用一生治愈童年。
新世纪腐银战士,4,2019-12-23 17:08:34,unknown,15,惊悚类励志书。负向原生家庭的最可怕之处，不在于它牢牢把持你的童年，而是在于当你自以为长大成人、可以主宰生活的时候，你渐渐发现无论逃得多远、怎样改头换面，都会被它狠狠攫住。它成为你性情突变、阴骘癫狂的隐患，你怎么样都逃不出那个圈，然后就像齐秦那首歌里唱的一样，发现“我还是原来的我”。
leo,3,2021-06-20 11:00:12,unknown,26,不说作者是否撒谎，但是给我的感觉是她隐去了很多其他的信息，至少是个不可靠叙述。抛开真实性，这本书就是那种其隐含的社会意义远大于文学性的一类书，不是很喜欢，前半段当个鸡汤看还行，后半部分给我的观感十分奇特，好似作者故意刺激其明知不可能改变的家庭成员，然后得到新的素材以供写作之感。
幸福地生活,5,2021-02-18 22:03:50,unknown,22,震撼记一下书封上作者塔拉·维斯特福的话，“如果人们受过教育，他们应该变得不那么确定，而不是更确定。他们应该多听，少说，对差异满怀激情，热爱那些不同于他们的想法”
麦子,4,2019-11-27 00:00:08,unknown,18,今天终于读完，内心十分震撼。想了想，其实在中国应该也有不少这样的孩子，超越环境，跨越阶层，只是没有写出来而已。总之，认知决定一个人，而教育又是最好的拓展完善认知的方式。
此情做梦呢,5,2020-04-05 16:21:09,unknown,11,势如奔马。无论是写书的人还是看书的我，我只想到了这四个字。看得无法停止，眼睛无法从字上挪开。作者仿佛割了腕，蘸着汩汩涌流的鲜血，在深渊之上，写作。我想马上开始看第二遍，又不能承受这苦难。对于已经可以安然承受惊人痛苦的灵魂来说，人性，只有深埋在灵魂深处的人性，的觉醒，才是走出深渊、探求本我的那一丝光吧？要不，顺从地腐烂在深渊里，也比剥皮刮骨重新找回自己简单些吧？这是重生啊，这是人性的光辉啊！人，可以被禁锢到什么样子，外人不能相信；一个国，可以被禁锢到什么样子，世界不能相信；人类，可以荒诞到什么样子，如果宇宙间有其他智慧，他们也不能相信吧。
闻夕felicity,5,2020-03-03 01:50:51,unknown,21,原本我对这本书期待并不高：盐湖城摩门教的匪夷所思程度不会超过《TheWitnessWoreRed》，我估计我会看到另一个穷苦少女翻身记，就像《风雨哈佛路》沉迷于虚假的美国梦的自我欺骗，打着嗟来之食的哈佛招牌用“人生辅导”招摇撞骗。本书超越了这些。她拒绝了《风雨哈佛路》的套路，拒绝了“进了剑桥人生就完美了”这种极为便利的自我欺骗。她接受了自己的过去，并且勇于保持警醒地思考，不害怕把自己最大的劣势变为优势。她的诚实让我觉得她确实有大智慧，也让我相信历史学，宗教研究和比较政治skillset对人的精神发展有意义。她放弃了学音乐去教堂指导合唱的梦想，而选择去问一些真正重要的（但更痛苦）的问题，比如民权、宗教、女性主义、历史由谁写成？这个决定拯救了她。面对原生家庭的伤害，如何自我救赎？本书即答案
Fleurs.哼哼,4,2020-03-03 16:29:25,unknown,22,看之前就觉得评分偏高，途中影视感上来以后更觉如此。但不可否认，本书和那不勒斯四部曲前两本从本质上来讲有着如出一辙的轨迹与诉求。前一段我也不无感慨的说道：过了三十以后，我们会发现自己越来越像自己的父母”。当看到塔拉说“父亲想从我身上驱逐的不是恶魔，而是我自己”时，再一次挑动了神经。那横亘的大山和那封闭的小城是原生家庭的抽象，身在其中的我们需要多少挣扎和勇气才能摆脱“天命”的缺陷与蚕食，才能将“运气”死死掌握在自己手里，才能真正的改变“命运”。读书、求学、工作、婚恋等等、甚至和路边卖煎饼果子的大妈聊天都是可能是一次洞穿灵魂的“教育”。属于自己的“教育”，才能真的帮你像鸟飞往你向往的山。
Yujie,5,2019-12-12 14:19:34,unknown,19,一口气读完，做了一夜的噩梦，人生撕裂到这样的程度，竟然还能展翅高飞。就像书中教授所说：无论你成为谁，无论你把自己变成了什么，那就是你本来的样子。它一直在你心中。
云小三,2,2021-06-11 01:31:22,unknown,44,一本传记小说，充满了凡尔赛的味道。大半部分都在渲染一个病态甚至是变态的家族。我没看懂作者为什么不反抗，为什么不逃离，为什么逃出去了还要三番五次地想要回来。我想看到的是人物如何觉醒，如何反抗，唯一的对哥哥反抗还是充满了戏剧性的巧合软处理了。我更想看到一个从未上过学的人是怎么认知世界，怎么认知过去和现在，怎么融入社会，也顺便想知道怎么样才能成为学霸的。结果作者根本没写，要么看了一夜书考了满分，要么偶然写篇论文就拿到了剑桥哈佛的名额。就差没有直接告诉你“因为老娘是天才了”
李荷西,5,2020-03-31 19:35:02,unknown,13,花了10个小时读完。觉得一个人无论如何都不能从原生家庭中逃离。就像作者最后所说的，被养育的那个自己并没有消失，虽然她不再出现在镜子里，但其实还深藏在自己的身体里，那是另一个自己。
清樾,2,2020-03-31 22:41:20,unknown,22,摘录了几句有意思的句子，然后仅此而已。印证了那句话：没经过5年以上考验的书，还是别看吧。ps：书名因为特别，所以挺喜欢的。Fleeasabirdtoyourmountain.
cookie.z,5,2020-02-07 23:20:34,unknown,12,这本书写起来一定很不容易，因为这意味着要讲述她的一生；更何况她的过往如此畸形、混乱，要梳理出来错综复杂的记忆和情感，要颠覆自我认知、摇摆、重塑，太不容易了。很多片段读起来会觉得很不可思议，那是幸运的人；只有身处其中、经历过的人才会深有体会、一生难忘。好的是，作者是幸运的，遇到很多贵人，很多没有放任泥浆中沉沉浮浮的她不管。她当然也是强大的，即便有反复，也是坚定的！
stina525,5,2019-11-17 12:48:49,unknown,13,去年就听说了这本书，英文版看了四分之一，结果在机场发现了中文版，直接买下一天啃完。我觉得，这是我看过关于自我成长最深刻，刻画最细腻的一本书。当然作者的情况非常特殊，但是她对于自我重塑的过程，包括蜕变时的分裂，矛盾，冲突，成形后的坚定与安稳，都描写的非常精彩！这本书适合所有人，因为我们永远都在成长重塑的路上。
秃发树机能,4,2021-06-13 08:18:06,unknown,13,读完英文版后，反复推敲应该如何看待这部作品。一方面，作者拥有难以想象的勇气、勤奋与才智，而另一方面，Educated文学性匮乏，通篇是无焦点的平铺直叙，比起对于教育和家庭的反思，更像是一个内心受创的病患的控诉。作者作为幸运儿中的幸运儿，经历几乎不具任何可复制性。思来想去，还是决定推荐这部作品，因为它或许具有一些激励的意义，能让更多人走出心中的大山。
阿灰有只阿啾啾,4,2020-01-15 13:30:01,unknown,14,在读完全本之前，我并不知道这是一本自传。读后想起那句：“自我是看不见的，与强大相碰撞，反弹回来才会了解自己”。
宽袖,5,2021-05-11 13:11:42,unknown,10,張哲瀚生日會直播推薦mark，三月陌生人交換好書時收到了這本，還沒來得及看。
Young,5,2021-07-19 17:06:14,unknown,10,你可以爱一个人，但仍然选择和他说再见；你可以每天都想念一个人，但仍然庆幸他已不在你的生命中。
不滚滚来,5,2019-11-12 12:48:10,unknown,12,或许明日太阳西下倦鸟已归时，你将已经踏上旧时的归途。不用比了，这肯定会在我2019年读过的最喜欢的几本书之列，内容好，文笔也好。中文版书名是作者塔拉亲自选定，出自圣经·诗篇Fleeasabirdtoyourmountain，英文版书名是Educated，各有韵味。成长于极端保守的家庭，塔拉在控制欲极强的父亲有暴力倾向的大哥影响下长大，从小没上过学，17岁偶然去了杨百翰大学，才开始一步步接触外边的世界。候鸟会北归，塔拉从杨百翰到剑桥到哈佛，离现代社会越近就离家越远，与家庭的羁绊却未减半分，时不时又会受到父亲这座大山的吸引、放弃自我。本书意图并不在于夸赞一番教育的益处，它的层次多多了。它是塔拉的自传，描述着少年塔拉、青年塔拉的成长，记录着塔拉与父亲为代表的家庭的纠缠、决裂与新生。
小明的sister,5,2020-01-13 19:40:29,unknown,12,过去是一个幽灵，虚无缥缈，没什么影响力。只有未来才有分量。
𓆡𓆝𓆟𓆜𓆞𓆝𓆟,3,2020-02-29 20:57:11,unknown,10,【2020012】跟之前想象的不一样，这是一本略被高估了的书。本以为是通过如何努力奋斗拼搏受教育获得重塑自我自我探索发现自我的过程，意外地发现是这样的故事，家庭成员之间琐碎的关系和纠葛，略失望，低于之前预想。就文学角度来说，感觉生硬单薄了些，虽然书里的故事很多地方看起来也很感同身受，有些地方还是挺隔膜的，总之，挺特别的阅读体验，完全没意料到。另外，作者的受教育之路感觉如此轻而易举顺风顺水，羡慕。主题呢也有点多，宗教，女权主义，家庭关系等。书名Educated，教育的部分着墨少之又少。感觉是豆瓣“父母皆祸害”小组的成员，这个家庭也够奇葩的。在我们初面临这个世界时，父母家庭就是我们的一切来源，随着成长逐渐认清，修正原来接受的讯息，跟原生家庭决裂找到自我，这也是我们很多人走过的路。
边城玫女,5,2020-03-28 15:27:25,unknown,8,我也有一个糟糕的童年，可惜我没有她的坚强。但是我仍在挣扎，因为我知道，这个世界上，我们并不孤单。
毒妇脸少女心。,3,2020-03-18 20:12:52,unknown,15,我想这本书成功的极大原因，并不是因为比尔盖茨的倾力推荐，很多人可能根本无法想象生于1986年的塔拉，在如此扭曲的仿佛游离于现代文明之外的家庭环境中成长起来，而是它有非常多的共情点，山区农村家庭的生活、长期家庭暴力、初到大城市遭遇一系列困窘境地等等。所有人都在“写作”，也就是说，每个人都有一个“故事”，书中文字的叙述不必被过多挑剔，在经过不同读者重新在脑海中修改、拆解和播放，又组合在一起，阅读感受不会因语言的局限改变而会随着他们的个人经历而改变。所有历经的生命里的创痛深化了“自我教育”的观念，但就针对“自我教育”如何完成的这一部分交待未免显得有些草率，越往后面读反而会有些质疑，不过翻译很流畅。
狐姑娘,2,2020-07-26 16:07:33,unknown,35,后悔认真看完了这本书，老实说我感受不到作者的诚意，她的经历是真的，但在书中她并没有敞开自己，且隐瞒了许多，刻意地将读者拘束在她约克峰的家中，纠结于她的魔鬼家人们，甚至用离奇的故事挑战读者（精油续命），至于标题的教育，不过是本书的零星点缀。
cynthia,5,2021-07-30 12:23:41,unknown,15,作者文笔非常棒，剥离原生家庭，就像把把自己身上的肉切下来，长出一个新的器官的感觉。这么痛这么难过的经历，作者以一种温柔的想象力，用丰富画面的文字去描述的，这是我最欣赏的地方，泪不住流。另外她坚韧的性格让人触动，特别是文章最后一句，你可以把它看作为背叛，我把它称之为教育啊。通透的力量。202103NO3
