user_name,star,comment_time,geo_ip,vote,short
小满Zoe,4,2020-04-05 16:01:59,unknown,9,所谓光辉的岁月，并不是后来闪耀的日子，而是在无人问津时，你对梦想的偏执。生命就是这样，一个过程，一个不断超越自身局限的过程，这就是命运，任何人都是一样的，在这个过程中，我们遭遇痛苦，超越局限，从而感到幸福，所以一切都是平等的，我们毫不特殊。无论你出生于什么家庭，原生家庭又带给你什么样的伤害，但是能够决定你未来命运的永远是你自己，生命在自己手中，你想要去过怎样的生活，你就应该朝哪个方向去努力。
薇羅尼卡,4,2020-01-16 21:33:06,unknown,6,残酷成长物语。看到一半去翻简介才知道这是作者的亲身经历，震撼又多了一层。与原生家庭的决裂，或者说寻找认知自我的过程相当艰辛，每一笔都饱含着作者的深思。人与人之间的理解太难了，而又有多少打着爱的旗号的威胁与绑架。
东来,4,2019-12-22 16:35:25,unknown,11,不仅是一个女性的教育经历记录，也是一部反抗父权的个人史诗。“离经叛道”，也是逃离父母设下设下的藩篱，挣脱社会成见之枷锁，从小走到大，从他人的正确走向自我的正确。“你可以用很多说法来称呼这个自我：转变，蜕变，虚伪，背叛。而我称之为：教育。”
热带雨林,3,2021-07-04 19:36:35,unknown,16,营销号让我的期望冲天，然而就是一本无聊到爆炸的书
弥山,2,2020-10-19 17:46:45,unknown,17,牙疼形容的跟抽筋断骨一样我就知道这作者可信度有限
Zhuo,4,2019-12-05 11:56:34,unknown,12,英文版看了一半，接力把中文版读完了，译的不错。作者本身家庭的魔幻程度超越了她的文笔，这个家庭表现出来的偏执、躁郁、厌女、被害妄想，让人很难想象这是一个现代社会的故事。但越读到后来越觉得困惑，作者因受到高等教育而成功逃离，却在另一方面因为割裂了家庭关系不被父母兄妹接纳而遗憾，很矛盾啊…
旁观者,4,2019-12-30 16:29:29,unknown,8,“我开始明白，我们为一种话语发声，这种话语的唯一目的是丧失人性和残酷地对待他人——因为培养这种话语更容易，因为保有权力总是让人感觉在前进。”单独摘出来之后，你会以为这是在说此岸。东西方所有的传统中都有权力控制和崇拜、把人当工具、奴役女性和儿童的因素，而正是启蒙运动和现代性改变了这一切。这本书是一本关于教育的书，但要谨记教育的目的，是学会不确定和开放性，学会质疑和思考，要从自由和平等开始，要有理性运用自己的理智。然而，我还是毫不怀疑，会有很多人，在喜欢这本书的同时，去咒骂废青，去崇拜权力，对大一统的爱国主义教育毫无反思。
yesshen,5,2020-01-31 12:40:47,unknown,8,“如果你在美国，无论你在哪个角落，我们都可以去找你。我在地下埋了一千加仑汽油。世界末日来临时我可以去接你，带你回家，让你平平安安的。但要是你去了大洋彼岸……”家是一个无论你犯多少错，对你犯了多少错，都难以割舍的羁绊。原生家庭把性情、能力无保留地展现，那是一个组织的上限，接下来任何迭代与提升都只能自己完成。教育有无穷的力量，允许它改变自己，再回过头来看，一定会看到差距。无法反哺便独善其身，可以反哺便努力去开化提高。
竹子,5,2019-11-13 09:40:54,unknown,11,于控制畸形中生出一个“新我”不易；新我旧我斗争不易；新我旧控制体系思想（亲情）斗争不易；但是她就是重塑了一个自己。“负罪感源于一个人对自身不幸的恐惧，与他人无关”。她接受自己，她终于成为了她自己。
Lavender,5,2021-01-25 22:49:10,unknown,10,无论你成为谁，无论你把自己变成了什么，那就是你本来的样子。它一直在你心中。不是在剑桥，而是在于你自已。你就是黄金。回到杨百翰大学，甚至回到你家乡的那座从地山，都不会改变你是谁。那可能会改变别人对你的看法，甚至也会改变你对自己的看法一即便是就金，在某些光线下也会显得晦暗，但那只是错觉。金子一直是金子。教育意味着获得不同的视角，理解不同的人、经历和历史。接受教育，但不要让你的教育僵化成傲慢。教育应该是思想的拓展，同理心的深化，视野的开阔。教育不应该使你的偏见变得更顽固。如果人们受过教育，他们应该变得不那么确定，而不是更确定。他们应该多听，少说，对差异满怀激情，热爱那些不同于他们的想法。
林安,5,2020-03-20 16:03:47,unknown,8,一个人用成年后的自我去不断冲破原生家庭带来的阴影。生而为人，她只是想按照自己的意愿活着。
葡萄琥珀,3,2019-11-19 12:30:50,unknown,13,读美国文学就怕碰到宗教相关的叙述，除此之外，重点侧重于家庭教育，反而成年之后的自我救赎的描述篇幅过少，有点儿失望😞
Leslie,3,2021-04-05 11:48:55,unknown,14,内容和翻译都不能算优秀，读得过程非常痛苦，硬着头皮看完了
Captain Kwok,5,2021-06-05 11:09:09,unknown,11,当原生家庭带来的只有愚昧动荡压抑和毁灭时，教育可能真的是重塑自我、救赎自我的唯一通道。作者的救赎之路，才是上帝的旨意吧。
三撇,4,2021-02-02 01:21:19,unknown,9,“我已不是当初那个被父亲养大的孩子，但他依然是那个养育了她的父亲。”
kiki,5,2020-02-10 21:31:30,unknown,6,十分不错。
失叙,5,2021-05-11 11:24:18,unknown,14,如果说它励志，会觉得这个词拉低了它的内核；如果说报以同情，我想自己根本没有资格。一个是被父亲掌控、充满宗教狂热的巴克峰；一个是平等自由、为普世推崇的象牙塔(剑桥、哈佛)，两种环境跨越之大，仿佛天堑。事实上我们的生活中有很多世界观在对立，只是没那么激烈，但我要学会去调整与选择。读者并不是为了猎奇来读她怪异的童年，也不是为了所谓的自学方法去模仿她的成才之路，我看到一个意图摒弃糟糕传统的灵魂在奋力挣扎，支离破碎的思想在重塑自我，塔拉做到了大多数人做不到的，她在告诉我们一个事实：没有流血受伤，就不会有新生。也许大家不会认为这样一个家庭值得去爱，可这也是最令人动容的部分：“你可以日日夜夜思念一个人，却仍为他消失在你的生活中感到高兴。”Educated，Change，可以取决于环境，也能取决于自己。
Serendipper,5,2021-06-10 23:29:27,unknown,11,教育从不是教给你某样东西，它让你更加辩证的看待这个世界。我们每个人或许都生活在迷宫中，却鲜有人走出去。少说多做，真的很无知
五反田,3,2020-02-08 20:50:14,unknown,13,流水账，叙述水平不高，通篇都是作者用夸张的语气描述其原生家庭的愚蠢。即使作者后来取得了哈佛博士学位，仍然自卑又优柔寡断，不断纠结于父母兄弟姐妹的琐事。性格如此，纵使走到天涯海角，也仍和所谓的家人纠缠成一团乱麻。
sophie,3,2020-07-20 21:39:56,unknown,13,作为一本完美契合各种时下热点的畅销书，这本书的文笔已经算是不错了。我觉得最好的地方其实是翻译，很有可读性。作为一个重新包装后的启蒙叙事，如果非要说书中有什么“惊人”之处，那应该是剑桥教授的那句话，“你的论文是我30年来读过最好的论文之一”（大意如此）。基于作者自述的成长经历以及她在赴剑桥交流之前存在的部分知识盲点，一方面我惊讶于神灵赐予作者如此卓越的天赋，另一方面我也惊讶于剑桥大学某专业过去30年的学生质量。
X.,3,2021-06-27 01:27:16,unknown,15,我觉得如果作者出一本分享学习方法的书应该会有更多人买
柳叶刀削面,5,2021-06-16 20:01:14,unknown,10,后三分之二是让人屏息一气读完的震动……起初你看到被狭隘所困的人们，然后你发现自己也被困在某种狭隘里
不靠谱小姐,NaN,2020-01-30 16:58:43,unknown,5,前半部有些难以进入状态常常看两三页就困意袭来后半部渐入佳境一气读完然后明白前半部的无法进入是因为幸运限制了我的想象力
微霄,NaN,2020-03-05 11:02:03,unknown,4,并不能太打动我
David.Song,1,2020-05-19 08:30:14,unknown,12,实在没觉得哪里好……
东邪。,3,2020-02-24 21:15:35,unknown,9,最初被书名吸引，读完之后感觉译名背后的故事远比作品本身更有吸引力，不过是作者对自己人生的流水记录，阅读起来比较流畅，但是整体阅读体验一般，只能说是成功的营销案例。
nownornos,2,2021-04-07 15:20:41,unknown,13,阅读体验很差，杂乱无序，无法耐着性子读下去
事儿后烟,4,2019-11-04 10:19:02,unknown,14,如果把这本书归纳为“励志”，倒是有点浅薄了。作者从一个不让上学，抵制政府和医疗，有暴力和虐待的原生家庭中，17岁才通过教育最终成为剑桥大学的历史学博士。更多的评论集中在“教育是否可以摆脱原生家庭”，但我认为本书的价值就在于如何去实现真正的自我。原生家庭，社会背景，行业趋势都只是隐含假设的画地为牢。你的起点绝不是你的终点，接纳自己才能释放自己，这才是整本书对我来说的价值。
東寫西讀,4,2020-06-04 17:15:01,unknown,6,这本书告诉了我们如何告别愚昧无知状态，如何用自己的理性去思考判断。作者出身在美国当代一个保守的摩门教家庭，15岁前没有接受过任何学校教育，这并不是发生一百年前女子教育未普及的时代，你可以想象身边的朋友并非因为家庭贫穷和智力因素没有上过一天学吗？在我即将读完这本书的时候，刚好看到一则澳大利亚民众抗议的新闻，目的是反对目前保持社交距离的禁止令、停止5G网络建设、甚至要求逮捕比尔盖茨。不要认为进入到21世纪，就可以远离偏见与无知，在现代社会各种愚昧会穿上新的甚至是科学的外衣，去影响人类的认知、干扰正确的判断、滋生新的恐慌、激发新的动荡。启蒙主义从来不会落时，要想摆脱蒙昧，接受良好的教育，形成自己的价值判断是不可或缺的，认识自我、认识社会，在宽阔的世界里，做一个不狭隘的人，唯有点亮心灯，方能照见黑暗
Emmaの遇见,4,2021-08-14 08:24:21,unknown,8,自身的意愿是动力，努力是工具，但是我想，作者还是有天赋的
西兰花,5,2021-04-17 21:41:23,unknown,8,看得揪心，有好几次都很担心塔拉回家会死在肖恩手里🤷🏻‍♀️庆幸塔拉靠自己离开了这种原生家庭
晏回,2,2020-08-08 12:12:53,unknown,8,作者的人生经验很特别，所以本身很吸引人去看。然而，拿掉那些推荐语和她所获得的荣誉，单纯作为一本书来看，只觉得写的太乱了，阅读体验比较差。
一只圆圈,5,2021-01-31 22:49:38,unknown,8,难以置信却又可以感同身受
菜花花去春游,5,2019-12-31 17:45:20,unknown,6,“我已不再是当初那个被父亲养大的孩子，但他依然是那个养育了她的父亲”，一流的阅读感，不落俗套的故事，看完觉得中文译名特别合适，收获和失去是并存的，而选择因人而异。
来日方长,5,2019-12-12 12:55:03,unknown,7,和多数人一样，对有这样家庭的存在感到震惊。虽然作者说这与摩门教无关，但这可以能是我这样的无神论者感到震惊的原因，因为没有宗教信仰，而承认这样的差异的存在。确实是受到了教育使作者认识到了世界的辽阔，挣脱出牢笼，但是心里又隐隐约约的想回去。和那么多扶弟魔一样吧，知道这是有问题的，他们有自己一套说得通的逻辑，但是还是会继续那么做。另外，这本书的翻译个人挺喜欢的，读起来很顺畅，喜欢翻译过来能读懂的文字，而不是将英文直翻的直白。
曼特黑,2,2020-11-17 16:50:41,unknown,11,远低预期，本书甚至可以说是本相当成功的《成功学大师课讲义》，裹了层俺们老百姓最爱的糖霜——摩门教小女孩反抗原生家庭凭自学跟不懈努力挣脱原生桎梏，跻身well-educated的上流精英阶层，实现完整的普罗大众期待中那样的华丽转身阶级跨越。实则换汤不换药。窜了味了都。再次印证一句话“畅销书，励志书不可读，尤其这俩tag赶一块儿的畅销励志书”。。。
pascalKcooper,4,2021-01-17 16:14:13,unknown,9,也许是被太多的推荐拔高了期待感，真正阅读的时候震憾的感觉不多，逃离一个世界，甚至是一个世界观真的不易。就像是深处黑井，沿着光滑的墙壁往上爬，随便一次都会滑至深渊，再也上不去。可以看到作者在强大的意志力、天赋及很多人的帮助下终于找到了自己真正的归属。可以从文中感受到失去家庭、信仰之根是一种强大的痛苦，但是作者对自己的生活，以及对家人带有情感色彩的描绘，使得每个人物失去了丰满的机会，因为对待亲人是无法客观的。也许这就是回忆录和小说的区别吧。PS已经了解过太多的世界观，摩门教的也并不稀奇。看过那不勒斯四部曲后，本书中人生与命运对抗的曲折显得就太单薄了。只会让我更加喜爱那不勒斯四部曲。
NSBetter,5,2020-02-19 15:45:05,unknown,8,你真的能感受到，无知和蒙昧能在多大程度上摧毁一个人的理智和同情，又能感受到在这种畸形关系下藕断丝连的脆弱的亲情。作者浸泡在毒液中长大，并且在离开了穷山沟后，梦魇依旧穷追不舍。教育带来的改变不在于让她飞的多高多远，而在于给了她一个离开山沟的可能性。当她真的勇于把自己的过去讲述给他人的时候，一定意识到了这些轻描淡写的谈资，本可能就是她一生的全部。“你没有经历过，就永远不会理解。”请不要滥用这句话，这是对真正受难者的亵渎。2020015.
李九弟Jody,5,2020-05-03 20:35:45,unknown,7,最后60页就像是用血泪铸成的钢刀，那么锋利轻易地就能在心上划开一道口子。“我所有的奋斗，我多年来的学习，一直为了让自己得到这样一种特权：见证和体验超越父亲所给予我的更多的真理，并用这些真理构建我自己的思想。我开始相信，评价多种思想、多种历史和多种观点的能力是自我创造力的核心。如果现在让步，我失去的将不仅仅是一次争论。我会失去对自己思想的掌控权。这就是要求我付出的代价，我现在明白了这一点。父亲想从我身上驱逐的不是恶魔，而是我自己。”但不管怎么做，一个人的过去都是无法逃避的，沼泽会永远找到你。从未有真正的放下，唯一能做的就是放过自己。“当一个人对家庭的责任与他对朋友、对社会、对自己的责任冲突时，他该怎么做？”不管答案为何，请记住这不是你的错。请勇敢地走开，你不欠他们，请大胆书写你自己的历史。
自由行走的花,5,2021-05-09 16:48:27,unknown,8,“过去是一个幽灵，虚无缥缈，没有什么影响力，只有未来才有力量。”
Summer笔记,5,2020-02-21 03:10:55,unknown,7,原著Educated这本书没有被翻译成“教育”是对的，因为这本书所要讨论的不是传统意义的学校教育，更多的是自我探索，认识自己的过程。而自我探索得越深入，也越发现对他人和世界的理解有更多可能性，也越知道一个人的起点绝不是终点，原生家庭的创伤也不是你必然要背负的枷锁。在我看来，这本书有个很好的且真实的故事，但更强的是其文学性。
李妙生,4,2019-12-25 07:07:43,unknown,3,书写的还是很好看的。但就像塔拉自己说的那样，这是由她自己书写的历史，里面到底多少真实与虚幻，就很难讲了。但最终无论如何还是一个了不起的人。
锦瑟,2,2021-03-18 20:24:36,unknown,11,过誉了。说白了就是主人公原生家庭很奇葩（摩门教徒，爹妈还有哥哥似乎都有点精神问题），然后她遭遇了哪些哪些（比较震惊，但是这个行文乱七八糟的什么鬼），怎么突破重围重获新生的故事但是我感受不到她的努力。反反复复都是家里人的精神病态的描写。我同时还在读米歇尔奥巴马的自传《成为》。高下立现。那本书本来没报什么希望，结果读起来爱不释手
小叶子,3,2020-04-16 13:09:12,unknown,8,感觉不是很信服…有些地方也让我不是很舒服（避重就轻，言行不一etc）
秋禾 啾,5,2020-05-20 19:58:17,unknown,7,读到最后最喜欢的一句话在注解里，我们都比故事分配给我们的角色更复杂。
从前有棵树,3,2020-09-16 15:23:59,unknown,10,我第一次读书狂躁到想砸烂我的kindle
盐少女,3,2020-03-28 09:32:58,unknown,7,还好不像我之前担心的，还好没有写成一本励志故事。读到最后莫名想起《了不起的盖茨比》里的一句话：“于是我们奋力逆水行舟，又注定要不停地退回到过去。”教育改变不了一切，但确实能改变一些事情。
sensen1,5,2020-02-15 21:44:30,unknown,8,太惊人了，看得我泪流不止。原生家庭对人的巨大影响永远比一般人想象的更大。要想进入一个全新的对的世界，就要全盘否定自己的家庭和信仰，用这样的方式成长的每一秒，都是生命不可承受之重。启蒙以后，真理便意味着“背叛”，孤独地去承担新世界的重量。感谢勇敢的小塔拉把爱搁置在那里走了出来，当我们最终能读到这么好的小说。
Darlin,5,2020-01-07 19:22:19,unknown,9,很难想象生长在那样一个极端的宗教家庭里，从未上过学，二十年所建立的一切价值和世界观都源于身患躁郁症病态又偏执的父亲，被暴力又控制欲极强的弟弟折磨，几次与死神擦肩，储存干粮枪支，随时准备等待末日到来，在这样扭曲的世界观所构筑捆绑的家里，爱是裹着蜜糖的砒霜，以爱之名行奴役之事，他们时刻提醒你，死亡无足轻重，地狱与你同行。读到最后，你会发现花费最大力气逃脱不是那座大山，不是那个称之为家乡的地方，而是你内心深处的牢笼，你无法丢弃那个孩童时便存在的东西，它构成了家最初的概念，哪怕长大后你发现它破败不堪，充斥着恶毒和残暴，消耗着你的自由和生命，但它为你建立最初的生存法则和意义，它早已存在你的血脉里。喜欢作者所言，教育不应该使你的偏见变得更顽固。如果人们受过教育，他们应该变得不那么确定，而不是更确定。
恪彥,4,2020-05-26 14:21:33,unknown,3,教育，赋予自我更多自由选择的可能。可以选择苟全性命于盛世，亦可选择Fleeasabirdtoyourmountain！作者对于她的学业方面的努力提及甚少，可能独立精神、自由思想而言，努力学习真是不值一提！哎，愈发悔恨那些挥霍的岁月。祝福作者，天助自助者。P.S.从作者家人种种“怪异”的行为，结合长相外貌，严重怀疑是乱伦加家暴所致。
榛果笔记,5,2019-11-01 01:08:43,unknown,6,太好了
复合型废物,3,2021-03-18 22:29:58,unknown,16,感觉高开低走，三分之一过后就越来越不想看了。扭曲压抑的家庭简直让人窒息，人的偏执、愚昧、暴力、软弱体现地淋漓尽致，书中有很多在我看来很矛盾的情节，作者又没有解释，实在令人不解。作者本人的经历着实是“开挂”，但我既不觉得合理也不觉得畅快。作者想强调教育的作用，但在书里我看不到教育具体怎样让她的心智与思维渐渐成熟，这部分的描写我认为有点少且无法打动我。总体而言阅读体验并不好，只觉得痛苦、难以置信和不可理喻。这种痛苦和阅读悲剧的痛苦不一样，看这本书就好像是冷眼看着演员在舞台上卖力地表演，我感受得到他们的情绪但是口中始终重复着：“我不相信，这不合理”，从挑剔和审视的视角看它自然体验感不会好，应该说从三分之一处我就和这本书脱离了。
董董Mercurio,5,2020-04-11 19:29:54,unknown,5,激动的阅读体验，动人的叙事，人生在叙事中被建立、改写，作者笔下的事实严酷，却笔触温情涌动。我希望为这本书写篇文章，有点点畏难，但要开始。
小木心熊,5,2020-01-18 20:53:04,unknown,6,特别好，我倒觉得这本书重点不是在讲教育的意义，而是如何突破原生家庭的束缚以及如何在新的生活里对抗过往的自己。这个思想和心路历程最让人触动
san950831,5,2019-11-03 10:00:39,unknown,6,作者自身的传奇经历使这本书更具有震撼力在一个畸形的家庭里成长过程中都很少接受外界的信息在这样的一个家庭里面对父亲哥哥这样的操纵者以及母亲姐姐这样的被操纵的跟随者如何摆脱操纵是一生的奋斗是教育使她重塑自我理解了中英文书名的含义文笔上仍稍显不足整个书中儿时经历描写篇幅占比略大但是仍然为这本书带来的感动和震撼打五星
许泽Sylvia,3,2020-01-18 15:11:13,unknown,5,在警察、社工、心理医生都可以提供帮助的美国，我实在无法想象在当代会有这样严重的情况，且持续那么久。虽说作者最后特意说明，但我还是觉得宗教信仰有时候真的很可怕。
吴回音,1,2020-05-26 14:19:40,unknown,16,塔拉从来没有真正觉醒，所受教育只是让她在过去的信仰和现实之间摇摆，她向往的还是那山，我想如果家庭环境稍微不那么恶劣的话，她一定会奋不顾身回去，这真令人失望。她一路都算顺利，拿到剑桥的修读机会，再到哈佛。要知道她刚上大学时几乎可以说是没有什么基础知识的人。可是她可以在教授帮助下去剑桥去哈佛，真是感觉不甘。她获得了这样多，可是实际上既没有多少改变自己，也没能帮助到别人，令人失望。
点__,3,2021-07-04 13:11:40,unknown,6,某种意义上来说，这一大家子运气也过于好了，命也是真的大，还各个混得都不错。中间有些时候读得我很生气…以及不知道该感叹作者家族基因好还是美帝高考太简单……
dj,2,2021-07-29 17:52:21,unknown,21,整本书写的最好的就是这个中译名了
娇羞海霸蟹珍珍,4,2019-12-06 09:19:54,unknown,7,有点沉重，那种一群人在否定你让你不断怀疑自己的情绪，在家庭忠诚和自己所见所闻中摇摆太痛苦了…
二二です,5,2021-06-20 19:25:44,unknown,6,你很难想象这不仅仅是个故事，而是有事实基础的。作者靠着一己之力走到现在就已经足够令人钦佩了以及看完这本书对张桂梅老师的敬佩又上升一层，她改变了那么多孩子的一生，让他们能够看到更高更远的一个世界
豆友35496190,5,2020-02-13 09:14:52,unknown,2,作者在结束语里说“我们都比故事分配给我们的角色更复杂。”前半段野性的成长甚至让我有过一丝向往，可后半段长大成人又让我近乎感同身受的窒息了，悲剧的细节总是都有着离奇的相似。最终摆脱不该存在的“罪恶感”，只能靠自己。我希望有一天，我也可以。
朱老板,4,2021-01-11 11:18:59,unknown,4,断续十个月，看得气愤几度中断。想象不到在当今社会还有这样的愚昧，还夹杂着暴力和家庭PUA。看之前觉得中文译名很好，看完觉得还是英文原名Educated包含更多含义。教育不光指的学校教育，更包括家庭负向教育和求生的自我教育过程。尽早和原生家庭切割，自主意识才能萌芽，抵抗父权才是成长的真正开始。生命是爸妈给的，更是自己的，如果他们想毁了你，那就值得背叛他们。
玖号小裁缝,1,2021-02-23 15:50:41,unknown,15,愚蠢的父母（拒绝学校和医院，母亲车祸、父亲烧伤、哥哥坠落全靠身体自己恢复以及一些草药的辅助），有暴力倾向的某位哥哥（pua妹妹是日常，动手打人和道歉无限循环），懦弱的姐姐（明知妹妹被欺负也不敢出面阻止甚至不敢告诉母亲），以及上了大学也没见思想有多大变化的作者本人（关键时刻还是要靠哥哥泰勒提点才能清醒），从来没怎么读书却在短期内通过大学入学测试、继而去最好的学校读硕士、博士，只能说作者真是天赋异禀，这种飞一般的人生经历不适合“激励”凡人。中间章节哥哥肖恩欺负作者而作者妥协时看的我拳头都硬了，最后看到姐姐奥黛丽决定在家教育孩子，不得不感叹愚蠢的爸爸不但害了自己的女儿继而也害了外孙。不敢想象这本书都激励了谁，真的是满心期待地开始读，握着拳头合上书。
