user_name,star,comment_time,geo_ip,vote,short
PirateQ,5,2020-02-21 09:39:51,unknown,7,看简介误以为是励志鸡汤，其实讲的是自我挣扎与救赎。我认为甚至可以当作一本心理学书籍来读。不幸的童年要用一生去治愈，作者的幸运在于她有一个机会飞出了那座山。即便学习、自省能力如此出类拔萃，脱离家庭阴影仍然长路漫漫。世界很大，往前飞吧，别回头。
啊啊啊听氧！,5,2021-08-29 12:20:18,unknown,11,延迟追书。看之前莫名其妙被推了很多吐槽帖，以为是一本雷书。但是看完以后心情真的很复杂，甚至在某些时刻和书里的塔拉有了共鸣。离开巴克峰很容易，彻底和家人分裂却很难，而教育的意义正是在于看到这些“难”后，仍知道自己的人生应该怎么走。
Aloe,5,2020-01-24 16:47:34,unknown,5,还剩两章，但真的太好读，极为惊艳。崎岖的经历简直不似一本自传。能读出的事情有很多，愚昧、原教主义、摩门教、家庭权力、脑科学、自我解放、男权视角下的家庭结构、不安全型亲密关系、缺爱……单纯理解为不同教育方式实在是少了很多乐趣和体会超佩服作者跳出家庭后的自我奋斗，天降大任，自我救赎作者研究的领域也很使人感兴趣诶。译名也好，翻译也好，都很棒
徐若风,4,2021-05-11 18:11:00,unknown,11,竟然不是鸡汤...读了才知道当年为啥这么火。这本书几乎是个把“原生家庭的黑暗与矛盾”拉到满的极端版本，其对家庭的描写之恐怖程度，在邪教式的宗教信仰与社会区隔的情境下，显得极其不可思议，但又是真实发生的。相比之下陆依萍的原生家庭都“小打小闹”了。而展示的亲情关系同样令人绝望，恨意里带有些许温情和爱，反而会让人反复斡旋其中，无法自拔。唯一实现自我价值的方式，唯有与家人决裂，如此一条路可以走。btw神奇的是，这样的家庭最后都走出了多位博士。
sweet&sulty,NaN,2020-06-05 09:03:00,unknown,5,读不下去……
rwmxaybz,4,2021-07-31 23:37:58,unknown,4,其实有点失望，我能读到作者往年不易蜕变艰难，但是我觉得她的改变不仅仅是书中最后一章提到的“教育”的作用，甚至不是决定性作用。相应的，我更觉得中文译名更像书传达给我的感受，当作者终于不再留恋往日畸形的家庭时，才终像鸟飞往自己的山。
猪脚雪糕,3,2020-04-23 13:02:25,unknown,6,翻开书迅速被与众不同的故事吸引，但是慢慢就开始失去共情能力，大概是故事的狗血度有点高，读起来反而觉得疏离了。本书的题材几乎囊括了所有爆点，不爆才不科学，但总觉得作者可以处理得更好一点的。
Elwing_,4,2021-08-22 06:53:20,unknown,8,当你知道她来自什么样的家庭，你真的会惊叹于她走得有多远
璞瑜,3,2020-07-15 22:17:50,unknown,6,荒诞到让人想不到这是一本传记。相比狗血的家庭，我更想看到教育的细枝末节是如何重塑作者的，仅凭文字会让人误以为读个博士也是轻飘飘的。要是现实的原生家庭也是这种纳粹式的模式，绝交起来倒也轻松，但更多的是温柔的捆绑，进退两难。
延迟,4,2021-05-27 23:00:41,unknown,9,作者能不能再出一本书，讲一讲她是怎么学习的
王祖咸酥鸡,3,2021-01-06 00:02:52,unknown,8,2.5分。大失所望。一开始离奇的故事的确很引人入胜，但是越到后面这本书就越显单薄，只带给我不可信的感觉。同类型书籍个人觉得不如那不勒斯四部曲。
皮皮虾起飞啦,2,2020-02-16 01:06:29,unknown,8,作者在一些关键的节点上缺乏对父亲/家庭的形象以及作者自己想法的描述，导致我对作者的一些行为和想法有些困惑。作者有很多细节试图证明/辩解自己是个非常顺从的女儿，是“不得不”走向反抗父亲这一步的。她到现在依然无法坦诚面对自己的叛逆，是否意味着她并没有真正从原生家庭中走出来？这种“可以承认一部分问题，但绝对不触及核心”的面对自我的态度，是不是原生家庭带来的性格问题？这本书没有它宣传的那样鼓舞人心，相反的，作者某些“卖惨式”的回忆和书中隐约体现出的性格中不可改变的偏激仿佛证明着原生家庭带来的种种问题并不会随着教育而改变。当你陷入这个家庭的环境中，即便只是回忆，你依然是那个家里的你。
A。,5,2020-01-25 16:48:48,unknown,6,我以为知识力量的觉醒是主线，但最重要的其实是与家人间无法隔断的羁绊。她可以凭靠知识走出了山野与蒙昧，却无法摆脱“背叛”家人的内疚与失落。真实的力量，就是让人们看到，人在所谓“成功”过程中的挣扎和动摇，“我甚至可以放弃一切，放弃理智与文明，只为了有人爱我”。
HeyMarjorie,5,2020-01-05 16:01:38,unknown,4,难以想象一个人居然能够从如此扭曲的家庭里存活，也很难想象世界上竟然能有父母会在自己亲生子女身上施加如此巨大的伤害和恶意。阅读过程让我太痛苦了，每次看到塔拉不停的自我怀疑，说服自己，口是心非的时候，看到她无比努力的去否认自己的过去，在得到一丁点来自家庭的肯定和温暖，又一次次被从不间断的暴力和控制狠狠地摔进深渊的时候，我的心也跟着碎成一片一片了。教育的巨大力量，在于让我们在宏大的世界里树立属于自己的世界观，让我们不用被迫在一些无法认可的价值观面前妥协和屈服，置换一部分完整的自我。在教育面前，我们能做的就是找到自己，认可自己，飞往属于我们自己的山。
懋,4,2020-02-26 21:57:55,unknown,3,【2020037】3.5积沙成石，女性岩石一样一成不变的命运需要去打破，这座远山是父权。日常话语里带有的层层歧视、规训，我们应该从日常去修改，教育是一条出路。（作为小说来说，这种平铺写法并不喜欢，低于预期。有种《风雨哈佛路》、等你必然成功感……
福尔磨叽,5,2020-07-03 20:37:58,unknown,6,“只是随着年龄的增长，我开始思考，我的起点是否就是我的终点——一个人初具的雏形是否就是他唯一真实的样貌。”讨伐父母和原生家庭不是没有意义，但人应该为自己的人生负责，去抓住机会为自己翻盘或许才是更重要的事。
齊克斯尼力佐飛,5,2020-05-05 18:34:19,unknown,7,超强的叙事能力和冷酷的笔触展示残痛和转变，拽着我急切跟进每一步，好久没看到吸引力这么猛的小说了。一度很恨作者笔下描写无知、顽固、暴力、懦弱的家人，也试图高喊作者赶紧脱身，但渐渐能明白人都会选择对自己有勇气面对的路，如果反抗带来的伤害比持续受伤难，那么人就可能默许这种伤害的正当性。所以作者的家人选择继续加害，无论是精神上的，还是肉体上的，因为他们认定了只有继续才会保持住原本生命的完整性，破裂是不能接受的，他们或多或少看到自己三观的破裂了，但不容许坍塌。而作者明白，这座山即使坍塌了，也会有另一座山能够容身，你不努力飞离，就只能永远困在原地了。
潇逸霏,5,2021-05-26 00:33:13,unknown,9,又是一本和女性教育有关的好书，塔拉的三次觉醒来源于：哥哥泰勒让她去读杨百翰大学，恩师让她去剑桥大学做访问学者，第三次觉醒来源于与家人彻底的决裂，尤其是有精神分裂症的肖恩。教育可以说是帮助了很多女性开始自我觉醒
喳喳喳,4,2019-12-25 12:11:45,unknown,4,看开头还以为是一个在家受教育不受社会约束的轻松故事，谁知那么沉重。第一次看到肖恩的暴力时，我都惊呆了，怎么一个刚刚还温情脉脉的哥哥转脸就变得这么丧心病狂的残暴。每个人都屈服于他的暴力，每个人都被扭曲。躁郁症的爸爸也很可怕，没人被害死也是奇迹。看的过程几乎一直很郁闷，为什么摆脱不了。不能全说是教育，内心深处那点不甘使她迈出改变的第一步。
Miya,2,2020-08-29 21:28:00,unknown,11,典型的鸡汤机场文学，是一个不太熟的朋友送我的生日礼物，在抱着它去往地铁站的路上袋子破掉，它掉在地上，我非常尴尬的捡起来，羞愧的想要把自己埋进地里，因为我不想给人看到我竟然拿着这么没品的一本书，也不想让它出现在我的书架上。另，怎么主人公那么容易就进剑桥、又进哈佛了呢？这是什么魔法吗？这本书为什么会被比尔盖茨推荐，是因为她得了盖茨奖学金啊朋友们。。。
伦敦在逃火野丽,5,2020-01-27 04:56:55,unknown,6,看得非常难受，我看一段都刷会儿微信微博缓一下。简直是作者把自己都剖开了，鲜血淋漓的写作，这也是作者自我救赎的方式。看的过程非常愤怒，一个不让子女上学、去医院的家庭，用教义之名行暴君之行的父亲，用暴力和羞辱对妹妹进行精神控制的哥哥，分分钟让人觉得应该断绝关系。然而人又是复杂的，和原生家庭断绝关系，其实就是一场痛苦的外科手术，把自己一部分剥离下来。而写作，可能是最好的剥离方式。
月缺几人知,5,2021-05-11 12:37:04,unknown,6,很早之前就读过，忘了评分了，今天既然被cue了，来补个分
肥宅柠檬水,NaN,2019-11-27 22:11:07,unknown,4,这个中文名翻译的…一言难尽
一鸣,4,2021-09-05 02:06:01,unknown,4,之前还以为就是普通励志故事，所以不抱期待地开读。第一部分挺好，描述萌发求学的心态转变历程和努力。从第二部分大学开始尤其是硕士阶段，已经明显重建知识结构的塔拉，反而仍在反复陷入自我怀疑及纠结是否回归家庭。另外还有些想不通的，在这样的家庭氛围与环境下，居然还能从7位子女中诞生3位博士？！
howie.serious,5,2020-02-18 11:56:34,unknown,7,1、Q:出生在垃圾场一样的原生家庭中，大学之前连一天学校都没去过，每天就是处理垃圾和挨揍，这样的人竟然能奋斗到剑桥和哈佛上学，拿到剑桥博士学位，这是怎么做到的？A：读完这本书，你就会多活一辈子，从作者的角度活一轮，找到答案。2、原生家庭两大要素：控制和暴力！tara的逃离之路非常漫长而艰辛：多年被洗脑，慢慢醒来，十几年的无数次反抗，最终成功逃离。其他孩子的反应，非常值得琢磨；3、求学：在充满控制和暴力的原生家庭，求你醒来，求你争气，求你学习。
壶中仙,2,2020-04-14 16:34:14,unknown,9,可以总结成一个各种不服的PTSD成长史。你们要看风雨哈佛路？要看幸福来敲门？那还是去看电影吧。作者的家庭比前两个好n倍，首先祖父那一辈的就算当地一个小城市中产，更何况最后她妈虽然神叨叨却还成了当地最大的精油制造商。说到底里面的问题完全是firstworldproblems，我实在看不出来作者励志在哪里。读书对她来说只是逃避父母和变态哥哥的方式，中间不过是遇到有些神人拉了一把让她实现了学术阶级跃迁。直到最后她还是没有认清父母内心的扭曲以及没有勇气与原生家庭决裂。中间无数次试图逃离，结果还是PTSD地屈服了。米帝大背景下有各种援助，连逃离家庭都是自驾我还能说什么。放在中国，一个家里7个子女的家庭的小女儿的最终结果只会是辍学放羊早早嫁人。See，firstworldproblem。
Stupid Chen,5,2021-07-25 22:39:06,unknown,5,“我所有的学习、阅读、思考和旅行，是否已将我变成了一个不再属于任何地方的人？”
孑人曰,3,2021-06-16 17:59:28,unknown,6,白莲鸡汤和翻译腔哪个更令人绝望？合上一年前有人英语pre时提过（后来知道她也并不推荐）豆瓣看到吐槽又前室友拥有的回忆录，除了感受到教育使作者与家人之间产生巨大隔阂和对原生家庭愤懑和控诉，就是惊叹其天天刷剧还自学满分的天赋异禀以及无微不至甚至充当心理治疗的导师关怀。反而是大量试图克制又藏不住的歇斯底里的“地铁老人手机”质感段落，放在科罗娜时代倒有种“偏执父母为世界末日的准备最终也成了未雨绸缪”的幻觉。于是在这两种心态此起彼伏之下，印象最深的是她看过BreakingBad和BuffyTheVampireSlayer，不知在看这俩如此不“正派”剧集时是否内心也有着拉扯.../讽刺的是自己读Educated是最不想上课的时候。08/17/2023【NYUSHReads·19-20】
Lucifer,4,2020-01-14 10:17:29,unknown,4,畅销一是有启示，另一个是有共鸣。高分是一种进步，也是很多人的悲剧的控诉。
Bukki：不是同学。,4,2020-04-14 23:49:55,unknown,4,四星给翻译的文笔。美国考大学好简单？作者描述的经历是否是她一路走来的敲门砖？
宜,5,2019-12-12 13:23:49,unknown,3,201912用了四天左右看完这本书一开始是被书名和封面吸引而后以为是印第安人故事文学最后才恍然原来是传记！传记！她的生活太遥远，以致于我在一开始并没有把它当作回忆录看待发现自我、成就自我，和过去和解这一切都太不容易了我想我又开始看书了
林一竹,5,2021-04-03 00:56:40,unknown,6,这绝不是一本励志鸡汤文。
王小刀,5,2019-12-11 10:55:14,unknown,4,《你当像鸟飞往你的山》，非常好看！扣人心弦又叫人心碎。作者讲述自己生于长于一个极端的摩门教家庭，如何奋力冲破桎梏并逐渐成长的故事。文笔生动犀利，翻译得也相当流畅，想推荐给更多人。想起了张悬的《如何》唱道：“岁月在这温凉如丝却也能灼身”“你要如何能原谅时光遗失的过程，要如何才能容忍它发生，要如何才能想而不问”。读《你当像鸟飞往你的山》，觉得心都揪着，既愤怒又心疼，残酷的世界是真实存在的，糟糕到谷底的原生家庭也不是虚构的。
豆友73852227,4,2021-06-24 13:07:10,unknown,3,只有身在其中的人才能明白，当你生活在这样一个泥沼一样的家庭，从小被灌输的都是扭曲、暴力、强权这样的洗脑式观念，不接受教育，很少接触外部世界，需要付出多大的努力、遭遇怎样的打击才能摆脱桎梏，拥有真正属于自己的人生。所有的挣扎、对抗和觉醒都藏在生活的每一个细节里，这是一段漫长的成长之路，从几岁开始产生疑惑，到成长过程中不断爆发家庭矛盾，可以充分感受到家庭、父母、兄弟的压抑与作者自我意识觉醒之间不断爆发、一次强过一次的激烈对抗。但值得庆幸的是，作者最终还是走出了、摆脱了。不是坐在学校里接受的才叫教育，作者自己对自己思想的解放，对自己的世界的塑造，她的所有经历，都是教育的一部分，所有的一切加起来，才促使她改变了一切。
