user_name,star,comment_time,geo_ip,vote,short
五无唔巫唔,5,2021-09-26 21:39:41,unknown,1,感谢刘擎，高屋建瓴，循循善释。这给了我面对和做为的勇气。
L,5,2021-04-06 23:16:51,unknown,1,可读性极高。越看越起劲，睡不着了😂
桃桃桃纸,5,2021-04-08 11:47:16,unknown,2,目前读过的最好的入门科普类书籍
乾元,5,2021-06-14 21:22:50,unknown,2,引用《浮士德》中的名句“真美啊！请等一等！”我真正感动的是引导我去观赏桑德尔现场《正义》授课的那契机，那种教师技艺与现场引导，现实政治制度与古老哲人的碰撞。终于明白柏拉图“哲人王”的另一含义，那并不是尘世的罗马王，而是天国教诲落入世间的醒悟———激发智性的百变思想魔术。另外这本书仅仅是一块砖，美玉需要自己之追寻。
Doney,4,2021-05-10 00:06:21,unknown,1,一扇新的大门。
劢和清,5,2021-03-06 13:13:38,unknown,1,“人类因为理性而伟大，因为知道理性的局限而成熟”
Eleven,5,2021-06-19 14:15:53,unknown,1,读完！2020年疫情期间喜欢上两位学者：项飙和陈嘉映；2021年，加上刘擎。最好的西方现代思想入门读物，条理清晰，文字流畅，深入浅出。只要翻开第一页，自然而然就会往下读，终于把我从近来消消乐杀时间解乏的恶性循环中解救出来。后遗症是按照刘老师的指引，又去买了一堆书，又该去“买书如山倒，读书如抽丝”小组报道了！😂
捷7744,5,2021-02-16 20:37:58,unknown,3,读这本书的时候脑海里全是刘擎教授磁性温婉的声音太幸福了｜一天时间读完了饕餮盛宴以后还会再看“人类因为理性而伟大，因为知道理性的局限而成熟。”
awsl,5,2021-04-18 23:29:00,unknown,1,怎么夸这本书都不为过。读起来极流畅，过去许许多多的问题都得到了回答和拓展，要是自己看那些著作真的不可能看的完，而且也不会有这种有逻辑的一条路走下去的可能。真的感谢让我看到这本书，在我最最找不到方向的时候。“未经考察的人生是不值得过的人生，过度考察的人生是没法过的人生”，要是没看到这段话的这篇补充讲解，不知道还要纠结难受多久。
