user_name,star,comment_time,geo_ip,vote,short
𓇗𓅮شياو,5,2021-02-02 17:47:27,unknown,4,用深入浅出的语言和经典案例阐述现代思想理论，给我走向大哲学家世界的勇气。古今变革现代性因启蒙理性主义而产生和深远影响；马克斯韦伯世界的祛魅，价值的不可量度及诸神之战，工具理性制度下的现代铁笼；尼采被理性杀害的上帝和生命力量超人及西绪福斯的幸福，视角主观性；萨特虚无的自由及其残酷；20世纪的灭绝悲剧背后的整体主义；极端恶却具有平庸性，独立判断的艰巨；波普尔的证伪主义对科学理性主义的攻击，批判理性主义和反乌托邦；苏格兰传统哈耶克理性的自负理论；柏林对积极自由的概念防范；马尔库塞面对虚假需求和单面人的洞见；罗尔斯无知之幕的平等原则；诺齐克放任的正义；德沃金对无可选之人的平等关怀；桑德尔的社群义务和反个人自由观；沃尔则对原子化个人的现代性重塑；泰勒的本真性和哈贝马斯的在人间的树立等。
玄月廿一,5,2021-07-06 20:40:52,unknown,6,曾经看很多书评中提到读完这本书有种豁然开朗的感觉，但内心却认为这些或许只是夸张的广告。在这本书读到一半的时候，我突然想起杨绛先生的一句话“你的问题主要在于读书不多而想得太多”。我自认为读书不算少，但其实还是读的有用的书太少。原来那些我困惑或迷茫的问题，思想家前辈们早已给出了自己的回答。深感自己读完一遍还是不能完全理解，因此买来纸质书珍藏，时常翻看。希望借此机会，让自己变得内心强大，能在这百年未有之大变局的时代里，成为自己想成为的人。
海底小妖,5,2021-02-01 19:07:35,unknown,5,奇葩说追过来的。很好的哲学入门书，想装X又看不进去原著的，一定要买来看看！“人生的意义何在？”这个问题不紧急，但是重要，时不时就会蹦出来——太戳中了呀！“每个人都是自由的，但伴随着自由带来的，你要为自己的选择负责——这就是自由沉重的代价。”——爱上了萨特。
飞林沙,5,2021-04-05 22:44:36,unknown,3,第一次完整读完并且深感兴趣的一本哲学书，深感哲学的有趣，把西方的哲学家们典型的思想娓娓道来，再加上通俗易懂的例子，对于初学者来说简直不能更友好。强烈推荐，
若庵,5,2021-02-08 13:18:47,unknown,3,一场极其愉快的阅读体验普罗米修斯也是这个样子吧
繁缕,5,2021-04-18 11:20:34,unknown,4,能常读常新而且还能跳进兔子洞
赵水水,3,2021-04-26 16:12:05,unknown,12,快餐讲义hold不住哲思。想学还是要尽量读原著。
刘飞,5,2021-04-24 14:44:19,unknown,4,一方面是把过去看的零零散散的哲学和社会学的概念串起来了，另一方面也回答了一些个人价值观和生活的疑问。是本超级好的哲学入门书。
巴喆,5,2021-08-31 21:41:49,unknown,3,整本阅读非常流畅，高度浓缩了近现代西方思想主流观点。有人说是快餐式的绍介，这也不能说不对，因为这里头随便一位思想大咖随便哪一本书都比这本书深厚。本书就是讲义，深入浅出简明扼要，从另一个角度上看，在现在趋向于保守的民粹环境，对了解现代文明思想基石，本书作为一本简约的纵向提取，尤能填补一些国内读者对西方思想的认识，我觉得挺好的。我把它当做一本总纲，从书尾的书单文献里备注了好些，也入手了几位大家的大作。其实这些书还不如两游戏皮肤充值的钱，只是现在很多人居然连这样的入门级的都看不下去了。
華而不实,5,2021-05-03 00:38:47,unknown,5,相见恨晚，完全可以作为一套入门西方现代思想的导读。就是，…为啥没有福柯呀！！！
炸毛小豆子,4,2021-07-20 18:06:42,unknown,4,很好的了解西方思想的入门书不过太偏政治哲学了没有我想看的拉康福柯德里达这些
琇琇的铁拳,5,2021-02-28 23:48:50,unknown,3,人类因为理性而伟大，因为知道理性的局限而成熟
葱葱,5,2021-06-07 00:34:50,unknown,3,好好读，停不下来那种，不过这样也就少了很多思考，等整理笔记再重温一下。另外，又有了好多想看的书！
藏柒,5,2021-05-19 08:20:37,unknown,4,读完此书，又火速去书店正价买了《2000年以来的西方》《如何做一个清醒的现代人》。刘擎老师厉害的地方在于，阐释问题时，通俗的与学术的语言比例刚刚好，不但能吸引普通读者没有障碍的读下去，同时仍然保留问题本身的深度，给人以停下来思考的空间。更为宝贵的读后收获是，我竟然有了系统的对知识体系的认知。比如亨廷顿《文明的冲突》，我是在读刘老师的书时自然而然对亨产生兴趣，结果赫然发现自己书架上就有这本！但，如果不知道他和福山的争论，以及他在整个思想史序列中所处的位置，我大概永远也不会开啃《文明的冲突》。这就是有《讲义》最美好的地方，谢谢刘擎老师拓展了我的思想边界！
🐖🐖🐖🐖🐖🐖,5,2021-03-08 17:07:06,unknown,2,我觉得man好的，就很易读的入门读物，梳理得也蛮清晰，文笔也蛮好，点到为止的流行用语。内容上，也蛮映照当下的现实。
Yang,5,2021-02-08 00:35:48,unknown,2,“本真性的理想，一方面让我们忠于自己的内心感受，一方面要求我们不要陷入唯我论的独白，积极地介入对话和反思，这是自我通向共同背景的通道，把我们和一个更开阔的世界联系在一起。最终，向对话和反思开放，让自我变得更加清醒、更加丰富，才能更好地'成为你自己'。”“人因为理性而伟大，因为知道理性的局限而成熟。”再读要好好做笔记。
赵心心,5,2021-04-16 01:31:39,unknown,6,网红作者网红书。作为“导游”册子来说，几乎完美。推荐大家看。看完少吵架。
博子,5,2021-04-30 11:16:27,unknown,2,5星推荐~书里把每位思想家的观点梳理的非常清晰，从介绍思想家的生平开始，让你觉得不会很难，然后逐渐进入观点内容，并且精选了符合西方现代思想相关的内容，砍去了每个哲学家理论里不相干的部分。比起《2000年以来的西方》，要容易读很多~
dodo,5,2021-02-18 08:42:11,unknown,3,一次珍贵的阅读，几乎每页都有让我豁然的地方，为了不马上忘掉这些点，我看的很慢很慢，一个假期过去，一本书才看完。刘擎把一些我之前隐约感受到的东西以理论系统讲解和呈现，系统、重心突出、思考深厚，且目光坚定，带着理想主义该有的样子，真是大师级教授。
凉皮没皮,5,2021-03-02 16:21:31,unknown,5,不光有哲学还有政治相关，感觉吃了麦当劳1+1，满足。最近因为尼采看哲学相关刹不住车。不是为了更好的自我安慰，怎么会觉得哲学书好看呐。比起喜欢哲学的有趣，可能更多的是喜欢一种没有结果但依然在发展的事物吧。
席耳洛,5,2021-03-03 13:11:38,unknown,3,补上了之前阅读《西方哲学史》20世纪的那一块，除去那些可以让人复制粘贴的话，我最喜欢的是对于约翰·密尔有关苏格拉底和猪的解读——这样的反思和求知到底有什么用，避开这些终极的问题一样可以好吃好睡。但是这样的假装只能骗自己一时，这些关键问题并不总是显露，但它如影随形，像幽灵一样潜伏在你心里。你可以每次都逃避，但是总会有那么一刻你要去面对它。
Hart,5,2021-03-06 16:34:50,unknown,2,思想家们的论述往往艰深晦涩，让一般人敬而远之，而读这本书却没有太大阻力，还时有醍醐灌顶、三观震颤之感，是一本很好的领路书。
smiling,5,2021-03-23 19:20:56,unknown,2,感谢上头使我冲动消费但并不后悔冲动对于我来说刘擎教授带领我打开了一扇新世界的大门是默默寻找(被动等待)了很久的世界不要停止探索不要停止思考要成为更好的人同时mark第一次在得到上听完一套课程<人类因为理性而伟大因为知道理性的局限而成熟>自勉以及共勉
laf,5,2021-03-01 21:36:01,unknown,2,“不要你觉得我要我觉得”出现了两次哈哈！从后记可以读到刘擎老师非常可爱～力荐！热衷思考这件事的人都应该读一读（plus一边读一边觉得我版排得真好读！hoho
猪舀的彩虹桥,5,2021-02-20 14:29:44,unknown,2,“人是悬挂在自己编织的意义之网上的动物”“许多冲突是无法化解的，这就是韦伯说的，诸神之间无穷无尽的斗争”“理解多元价值冲突的困境，对我们有什么价值呢，我想，面对自己和身边时而发生的激烈争论，我们可以变得更加平和和从容”读了一遍，没忍住拿起书再读一遍的冲动。
绍牧,5,2021-02-20 19:01:56,unknown,2,一本哲学版的《中国历代政治得失》，条理明晰，详略得当，功夫极深。
太木及星,5,2021-02-09 17:03:57,unknown,2,打开了我一扇新世界的大门
Lc,3,2021-04-07 14:44:08,unknown,7,评分虚高夸张，一本过于通俗粗疏的导读，不值一读，你读多少本导读，不如一窥尼采等人之作品全貌，靠快餐是吃不饱的
旧的海,5,2021-05-17 11:27:24,unknown,2,在酒店伴着纯音乐看完，翻阅最后的参考文献和人名索引的时候似乎是在看电影落幕后长长的演职人员表。不同于一般的哲学入门读本，大部分停留于概念和逻辑的思辨，刘擎老师十分注重现代思想的演变脉络、思想家之间的关联以及这些重要的思想概念在生活中的具体事例与社会现象的体现。这些都让本书成为了一种读者可以深度参与的“思想之旅”。阅读难度至多三颗星，推荐给高中及以上的人文社科爱好者阅读。
IgLoo,5,2021-06-03 22:28:37,unknown,2,通俗易懂，多年以后刘擎老师的这本书会成为经典。以前零碎了解到的韦伯、尼采、萨特、马尔库塞、伯林、阿伦特、哈耶克思想读了这本书有些由点成线了，此外还首次接触到波普尔、哈贝马斯等人的思想。没想到尼采的哲学是如此深刻迷人。
Muraveinik,3,2021-03-23 17:17:15,unknown,5,内容十分基础，面向对西方现代思想史完全不了解的大众。这种书，我可能比较推荐中学生看，可以培养兴趣，端正态度。
Aaliyah,5,2021-05-09 23:29:08,unknown,2,写得非常好，相当深入浅出、条理清晰，可读性极高。当然读完第一感受还是不是天才不配做哲学家哇，这一个二个不是早慧就是优中选优，此书可以改名《天才在想些什么》
七彩云男,4,2021-01-27 13:01:43,unknown,3,又是认识各种大家，然后买买买…
吴厝坑,5,2021-03-08 22:39:25,unknown,1,2021BOOK07：因为《奇葩说》知道的刘教授，也一直关注这本书的出版情况。跟周濂的《打开》一样，都是我心中上佳的哲学/思想史入门书籍。而且比较通俗，没有晦涩的表达（如：冗长的定语）。阅读的过程也思考很多问题，现代性，正义，平庸之恶，人生的意义。合上书本的时候，刚刚我完成了离职。在两份工作，跨行业，跨地域的衔接中，这本书也给予了我思考跟选择上很大的帮助。推荐。
周大姐,3,2021-04-05 00:01:36,unknown,2,很柔软的讲义，喜欢尼采的部分
Dr. Ma,5,2021-04-09 18:23:35,unknown,1,讲义的好处就是把各种纷繁复杂意识流式的知识系统化总结出来，简明扼要直中要害，也因此在近一个月的时间里通过清晰的梳理消除了之前对尼采、弗洛伊德、萨特等人的误解（心里有数么你配误解这些伟大的人物😏？）读刘擎教授越久，越觉得薛兆丰丰子是个精致的经济理性人，把人看得太自利和理性。刘教授说的最好:人类因为理性而伟大，因为知道理性的局限而成熟❤️❤️。
Doremi,5,2021-04-08 02:05:31,unknown,1,人类因为理性而伟大，因为知道理性的局限而成熟。未经反省的人生是不值得过的，因而宁愿做一个痛苦的苏格拉底，也不愿意做一头快乐的猪。哲学会永远是我思维世界的启明星。美好的人生就是一生都在追求美好人生的人生，自勉。
苍穹之泪,4,2021-05-28 12:27:14,unknown,1,对书中提到的每个思想家和著作都挺熟，十之八九读过，但依然感到耳目一新。作者极擅长提纲挈领，写得浅白但不肤浅，通俗但不庸俗，是可用来轻松愉快地梳理所学、温故知新的佳作，也是一张初学者极好的导航地图。很喜欢这本书，大概也是因为“虚无”、“正义”与“何以为我”恰恰是我最感兴趣的主题。顺便书里有些奇奇怪怪的幽默莫名好笑……PS：最早因为这书的营销搞得我一点都不想读，反向营销的典型……
基里洛夫的幽灵,5,2021-04-01 21:27:19,unknown,2,五星五星！两天读完酣畅淋漓。与老师的网络课程相比在某些章节论述更加丰富与富有条理，但由于主题的集中少了一些重要的思想家:海德格尔、福柯等。本书基本上将思想家的一些核心思想讲得很透彻，尤其精彩的是生动精确的例证与比喻以及最后的答学友问，可以为解决一些常社会上见的问题与困惑提供非常有价值的答案或线索。稍有遗憾的就是福柯等后现代主义思想家的缺席。
南珂,4,2021-04-24 15:36:55,unknown,2,这本书让我再次体会到了18年在北大上《西方现代思想》那门课时的自由与快乐。
桂魄梅妆,5,2021-02-11 18:19:12,unknown,2,讲课是启发式的，这本讲义更精炼、更确信。整套体系把内在关联都有呈现，可读性强，不太有断断续续的突兀感。
Fleurs.哼哼,4,2021-07-04 11:14:58,unknown,4,一直到马尔库塞还算还算是中规中矩的本科通识哲学启蒙佳作。后程全崩，原因不复杂，因为只有提出问题的问题，没有解决答案的答案。这不是刘擎的问题，他或者当代的绝大多数的学者也只是整个哲学光谱的投射者和注释者而非巨人肩膀上的开拓者。
子扉我[已注销],NaN,2021-03-02 17:25:13,unknown,1,https://athenacool.wordpress.com/2021/03/03/%e5%88%98%e6%93%8e%e8%a5%bf%e6%96%b9%e7%8e%b0%e4%bb%a3%e6%80%9d%e6%83%b3%e8%ae%b2%e4%b9%89/
虫虫,4,2021-09-08 14:39:44,unknown,7,3.5就我读过的几位思想家来说无异于蜻蜓点水，当然我自己更是蜻蜓点水，最近正好在读阿伦特，20世纪的教训这部分还是挺不错的，毕竟每个人精力有限，可以用来了解那些没时间细读的思想家。
向北向北,4,2021-09-11 20:15:25,unknown,4,2021已读027。思想观念是人的构成性要素，这就是我们为什么要探索思想的缘由。现实生活是哲学的实践场，每有困惑需要解答。现代性问题起于古今之变，困惑连着困惑，省察带着疑虑：我要怎么做？我是正确的吗？作者在书中提供的智者之思可供自我启发。到处都是正确答案，看到多样面貌后依然选择成为自己，这也是答案。书中提到不少参阅书目，有些已经放在书架上很久，慢慢读。
☀Sylvia,4,2021-01-31 18:39:43,unknown,1,哲学入门和启蒙，深入浅出梳理了一个脉络，易读易接受
羊男的圣诞节,4,2021-02-07 11:59:09,unknown,1,合上书，又想再读一遍
breathsea,4,2021-02-07 23:59:09,unknown,1,很赞的梳理，佩服思想家的睿智，最大的收获是明白了这个时代普遍存在的困惑来源于何处，也许理性带来繁盛的同时，无可避免地同时带来了空虚。这就是怯魅后的世界
爱吃鱼的大脸猫,5,2021-01-27 10:09:09,unknown,2,人类因为理性而伟大，因为知道理性的局限而成熟。
香草菌,5,2021-01-29 05:40:31,unknown,1,没有看书，作为b站上四十八讲的标记。很好的概述，熟悉了一些人名和理论，明晰了对一些概念想当然的理解，也发现可能人们在对话中应用这些名词的时候不一定明白其含义，接下来再细细研究。
PIKA,5,2021-03-06 20:26:54,unknown,1,特别喜欢书里引用的弘一法师的一句话“一念放下，万事从容”。读哲学给人的通透感以及释然，就如这句话一般，看清但不执念，淡定做事。买来之后就迫不及待的开始读了，作为哲学的门外汉，也能读得津津有味，作者的文字深入浅出，令晦涩的哲学理论变得好理解。
雀斑英式老考拉,5,2021-02-06 16:57:04,unknown,1,受益匪浅。刘老师的表达很有魅力。
屁,5,2021-02-17 12:46:13,unknown,1,没有一句废话看的很爽。
Echo,5,2021-02-17 22:32:57,unknown,1,痛快！！！
Seawind,5,2021-02-13 21:09:22,unknown,1,Bravo！无数次希望在本科入学的时候就能读这本书，可以帮我少走很多弯路。
heteropetalous,5,2021-03-06 16:10:10,unknown,1,感觉学院派的好与坏都在奇葩说上看到了，薛老师就是典型的象牙塔灾难，刘擎老师才是学院派春风
麦少侠,5,2021-02-27 11:42:24,unknown,1,虽然我认为读通论性质的内容应该在详细了解过每一个细分部分之后，但对思想史这么广阔的内容先读本好的导论也不错。收了点书单，会优先看一看尼采阿伦特罗尔斯诺齐克，当然也要把庄子继续翻起来。话说刘教授真是一个非常有温度的学者。
siddhar,5,2021-03-14 16:25:54,unknown,1,获益匪浅！刘擎教授拥有极强的提炼总结能力，将庞杂晦涩的思想简明地介绍给大众读者，做了一件了不起的科普工作。更为难得的是，刘擎教授以一种学者的温柔，在每一种思想的结尾都安排了积极的结论（包括尼采萨特），不像有些公知专通过震慑吓唬大众来获取智识上的优越感。读完一遍只是这趟思想旅程的启航，至少还要再读一遍。西方现代思想还未盖棺定论，我们仍在经历它的一些推翻和验证，发展和发现，无论愿意与否，我们都将伴随它一同探索前进。保持开放，保持好奇。
一个隐士,5,2021-02-17 22:23:58,unknown,1,一本顶百本。
象鼻尾猫,5,2021-02-28 13:18:30,unknown,1,哲学版一千零一夜
十三维,4,2021-03-03 22:59:10,unknown,2,简明，通俗易懂，当普及读物，但就现代思想构成来说，缺点还是不够深入，这和刘擎老师旨趣有关，毕竟政治哲学只是表象，虽然能直接影响社会思潮，还只是知其然。即便如此依然瑕不掩瑜，另一面看可以说是普及读物的标杆
舌根纹了玛丽亚,4,2021-02-21 10:51:25,unknown,3,通俗且浅里面的书单可能比书更值钱
彼地无冬,5,2021-02-06 23:34:05,unknown,1,一场关于现代化的观念探索之旅。可以对照现今所处的时代病症及困境，也可以反思自己所经历的挣扎与困惑。知其然，也只其所以然。刘擎老师的阐述深入浅出、环环相扣、娓娓道来，推荐。
印地安老斑鸠,5,2021-03-02 23:25:38,unknown,2,清晰的主线和坚定的问题意识，让本书在最大程度的简化下保留了思想的深度。高中生能看，学者也能看，要是形而上思考都像这样明朗健康，学习该有多幸福。
夏日扬帆,4,2021-02-02 20:38:36,unknown,1,可以算是读过的最通俗易懂的哲学讲义了，至少能让我这样的门外汉小小的了解，但是我也知道，越方便快速得到的东西忘得也会越快。对于以塞亚伯林关于两种自由和相关的延伸感触最深
君をのせて,5,2021-05-21 20:48:19,unknown,1,几天前我和朋友说，我的后高考时代结束了。不得归所的异乡人，拼命想证明自己存在的合理性，转而诉诸工具理性。然而彻底的工具理性无法被实践，其中既无出路，亦无救赎。四年前精神支离破碎，拼命想回答“我是谁”，这个答案来得有点晚，所幸迷途未远——“我们不是什么，而总是在成为什么”
曹昂Hsiu,3,2021-06-25 17:11:20,unknown,5,一言以蔽之，现代人享受着现代性的一切便利，又承受着现代性的所有恶果。既然讲的是「现代思想史」，又是科普性质的讲义，确实没必要深挖现代性背后的经济根源，只说意识形态。现代性的基本面向是「多元」，这就决定了身处其中的人无法像在前现代的传统社会中一样，循环往复地践行祖先的人生经验，当人们试图沿着上一代人的成功路径继续行走的时候，发现没有路了，现代社会，没有路径依赖。有意思的是，至少在中国，我们这一代人的父辈恰好成长在前现代传统破碎与现代性规则草创的交汇点上，所以他们从零开始走出一条新路。然而他们在这条新路上走到最后，依然落到了前现代传统社会的思维定势里：「我在这条路上获得了成功，那么下一代想要成功，就也得走这条路」。残酷的事实是，时过境迁，曾经的「新路」也难逃沦为「老路」的命运。
南京lock,3,2021-07-03 20:55:24,unknown,4,咋说呢，感觉总结的还不错，但是只能算通识，而且还通识地不那么严谨，引用原文居然会没有注释。确实讲的浅显易懂，但评分虚高
傅踢踢,5,2021-04-12 13:24:12,unknown,2,像是重回校园
fishbird,3,2021-06-07 22:28:40,unknown,2,看完前言后很激动，感觉发现宝藏了。读完内容后很失望，感觉上当了。内容是很好的，可以太过浅显了，太浅了，每个思想家就总结成一句话，丰满的人物被薄片化，立体的变成平面的，就像压缩饼干一样，不过瘾！
Oceantaotao,5,2021-04-13 09:33:30,unknown,2,你所有的困惑，前人都有过。继续走吧，去寻找智慧和糖果。
凌晨酱,5,2021-04-18 02:16:05,unknown,2,看的过程心里忍不住赞叹，赞叹又赞叹。你以为人类悲欢并不相通，但是你的烦恼与困境，你苦苦思考许久的人生命题，其实在几百年前，就有哲学家给出答案，然后一层一层下来的更新迭代，到现在仍旧受用！刘擎浅显易懂地把这些哲学家的思想拎出来讲，太太太受用了。
流亡艺术家,5,2021-04-15 15:26:37,unknown,1,比较浅显易懂的梳理，最近一直在浮躁，在飘，被下坠的情绪拉着挣脱不出。每个人的境遇不同，但人类的精神境遇或许相通。19年被法学挤在狭小角落的时候是哲学拉了我一把，能把那滞后牢固但令人厌倦的框架烧了吗？”破除悲观，获得清明，达到从容。”
豆友69602754,5,2021-03-29 15:57:26,unknown,1,解惑101本刘老师书单读起来
夕颜,4,2021-04-15 23:20:33,unknown,2,刘老师把西方这些思想家的观点讲的清晰简洁，以至于让人有一种错觉，太吸引人应该很简单。这世上最难的事情就是思考，尤其独立思考关于人类的一切。
骑白马的黑人,5,2021-03-28 23:47:12,unknown,1,行文流畅，逻辑条理，讲述观点能做到提纲挈领，可读性非常高。
樱木十贰,4,2021-05-28 20:36:49,unknown,3,为什么入门级别科普性质的书籍需要被鄙夷，该被鄙夷的不应该是那种只读了入门级别就以为自己掌握了全部真理而大肆炫耀的人吗？读了这本书激发了我对很多思想家浓厚的兴趣，尤其是尼采和马尔库塞，接下来准备好好去读原著。大部分人都是日复一日的活着，零星几个人在思考，思想光芒永远闪耀。哎，我又在思考人活着的意义究竟是什么。
子适,4,2021-05-08 08:46:42,unknown,1,轻松又不失准确的梳理
Will~P,5,2021-05-08 22:11:31,unknown,1,看到陈嘉映教授的推荐语就毫不犹豫的买了，果断没错。本书是得到图书系列里难得的精品，刘擎教授将西方现代思想从马克思-韦伯到塞缪尔-亨廷顿清晰的梳理娓娓道来，本书以讲课的形式呈现很像茂木诚先生那本经典《撼动世界史的思想家格斗》，两本都是值得推荐的启智类入门级好书。
平成少女牛肉丸,5,2021-04-27 21:14:04,unknown,3,曾经有一位豆友在林来梵教授的《宪法学讲义》一书里评论说：张千帆或许是猛人，但我们国家需要更多林来梵这种老成谋国的人。我想刘擎教授在做的事情也是另一个层面的老成谋国。
葫芦娃,4,2021-02-05 15:17:22,unknown,2,书名劝退，但是内容非常精彩，浅显易懂，贴近生活，值得一读
Arc Kant,5,2021-03-23 23:30:59,unknown,1,人类理性的成熟就在于认识到理性的局限性。近一个世纪，没有笛卡尔的“我思故我在”，没有尼采的“上帝已死”，没有萨特的“存在即虚无”（就拿自己看的那点书说）更多的是为现代化下人类理性作的注脚。时代造就思潮，这样琐碎，繁杂的时代也只能以这种方式来回应吧！（自说自话）
Mr.Craner,4,2021-02-21 11:49:28,unknown,1,刘老师的语言太好，由衷地佩服……唯一的不满是，大概限于篇幅而遗漏了弗洛姆和福柯，太遗憾。
马猴儿在嚎叫,5,2021-04-30 16:13:39,unknown,1,哲学比经济学读起来难度要大的多，逻辑性没那么强，有点吃力，但还是有不少收获
沸腾的凉白开,4,2021-04-27 22:59:37,unknown,1,4.5一次结结实实的“思想体操”可以反复拿出来温习的20世纪哲学、政治理论的入门小书
