user_name,star,comment_time,geo_ip,vote,short
马行万里,5,2021-01-17 21:38:02,unknown,2297,以前，总觉得哲学家，都是一群吃饱了撑得没事干的人，瞎琢磨。这本书，让我深深地觉得，正是因为这群没事干的人，才创造了当前现代社会的精神文明。
doughnuts hole,5,2021-01-14 08:10:00,unknown,714,人类因为理性而伟大，因为知道理性的局限而成熟。很有趣的西方现代思想科普，等出版了可以再读一遍。
沃特,4,2021-02-08 10:26:54,unknown,1032,虽然这样比较不太合适，但我想说同样是“讲义”，刘老师不知比薛兆丰好多少倍。
Sinclair.,NaN,2021-01-18 10:33:21,unknown,407,看过老师的视频课程，真的是精准、生动且没一句废话，整个课程像聊天一样就娓娓道来了，所以我相信老师的文字也是很好的。老师这次的书非常期待，粗看目录，内容应该有几点补充：1.导论与章节过渡。该补充对第一次了解西方现代思想的读者较友好；整本书阅读起来也更流畅。2.内容的深化和补充。可以看到视频一节内容，在本书里有明显更多的书写。比如韦伯就占了20多页；较近且重要的哈贝马斯也占了好几页。3.补充、问答、推荐书单与文献。问答竟有30页，我很好奇有哪些问题。推荐书单与文献可以体现刘老师把这本书放到什么位置——领读者到“新世界”的门口，看看外面的风景，门口到迈过去这一段你想走的话也帮助你。🆗以上就是应综艺了解到刘老师，然后在知乎上看到学生安利MOOC，去学习后对刘老师的感激和支持吧。（期待读
子夜歌,2,2021-04-03 18:01:27,unknown,776,这本是写的还真是通俗，很浅，学术快餐，适合那些不学无术还喜欢借助名人装点门面的人。个人觉得这本书会教坏这些人，思想得来的太容易了，思想哪来得这么容易啊，不静下心下点功夫，这本书中任何一个人你都无法理解他们真实的想法。
文刀健次郎,4,2021-01-27 16:08:36,unknown,176,“这个世界应该让那些不好的选择消失”振聋发聩。受够了薛兆丰的利己和罗振宇的油腻，刘擎简直就是这季奇葩说的一股清流。
張小得,5,2021-01-28 22:47:13,unknown,140,谁能想到我2021年的第三把“冰镐”竟是封面和书名都看起来这么“硬核”的书。这本书常常让我有醍醐灌顶的感觉，忍不住拿起笔写写画画，那些一直萦绕在我脑壳儿，难于梳理的问题都得到了清晰的解答。不过最厉害的是：不单单给读者们介绍了西方现代思想知识层面的内容，不仅仅介绍了19位思想大家构建思想大厦的地基与框架，而是把他们拉回地面与现实，让内容不难以理解，更贴近我们生活，沉浸其中，才能更好的引领我们思考。就像封面上写的那一句“来一场观念的探险”。
Joey,5,2021-01-31 20:36:05,unknown,229,没有席瑞所说的豁然开朗，我感觉是被点亮了一盏油灯如豆，然后发现脚下是错综复杂的道路，茫然和兴奋。
大只,5,2021-02-10 18:27:39,unknown,181,国内人文社科界太缺这种能把艰涩理论说明白的学者了。深入浅出，简明扼要，体贴而恳切，是一份非常漂亮的求知路线图。“人类因为理性而伟大，因为知道理性的局限而成熟”，全书所述所论，也就是这条百多年来无数杰出大脑如何因发现重重困境而解题破题的前赴后继光彩熠熠之路。
履覆长清,2,2021-03-23 23:13:32,unknown,226,他们就这样从思想里偷出些断章残句，拼凑出自己的言语
随遇而安,5,2021-05-17 23:37:23,unknown,221,这个时代需要刘擎这样的公共知识分子，既有足够的学术水平，还能有平易近人甚至引人入胜的表达。这本书明显不是给专业人士读的，但我知道如果不是这样的书，可能这些思想一辈子也不会走进某些人的头脑，从而给他们带来哪怕一点点启发。
Edison,5,2021-01-31 18:35:03,unknown,76,2021的第一本个人五星之作诞生！花了一整天细细读完，过瘾，叹绝，读完后体力脑力竟都已有透支之感……了解这些人类最伟大的思想，才不枉这辈子为人一次吧！
自喻适志与,3,2021-04-10 14:15:02,unknown,153,基本相当于英美哲学家讲义，同类通俗书中比周濂写的要好，但分数这么高也是刘擎走网红路线的结果。尽管我不熟悉刘的具体研究，也没有看过他的节目视频，但这样的人出来做网红，肯定要比把同类市场交给各种黑化/粉蛆/五毛学者来的好。难道憋在大学里写几篇论文，丰富学生参考书目，进行学术自我繁殖才是唯一的正途么？
忘川,5,2021-01-29 20:46:43,unknown,89,非常喜欢。一边读一边想自己上学的时候读过的那些令人痛苦的原典，以及每一堂讨论课我们在一起舞弄的玄之又玄的概念。哲学通向深邃，但接近它的路径如果可以轻松一些，会不会吸引来更多的人呢？
xi曦,5,2021-02-22 02:25:06,unknown,68,1什么是“现代”？第一次这么清楚地被告知！2终于读到一本书可以用一条主线把近100多年的思想、问题、哲学家、思想家、知识分子串起来；3终于将很多既熟悉又陌生名字与思想和著作对应起来；4获得了一份足够读2-3年的书单；5这是本西方现代思想的地图，带着这地图能走向很远；6是否存在东方现代思想？
终极之梦,5,2021-01-28 09:11:06,unknown,61,将韦伯、尼采、弗洛伊德、萨特、鲍曼、阿伦特、波普尔、哈耶克、柏林、马尔库塞、罗尔斯、诺齐克、德沃金、桑德尔、沃尔泽、泰勒、哈贝马斯、福山和亨廷顿的核心思想，清晰地组织在一起，对世界观、人生观很有帮助。人类因理性而伟大，因为知道理性的局限而成熟。
無事小神仙,5,2021-02-09 00:56:50,unknown,61,如果说JK罗琳让全世界回到了纸质书阅读的狂欢年代，那么刘擎老师让中国知识文化圈层重新回到阅读、探讨哲学的年代，似乎感受到了前辈们怀念的“迷人的80年代气息”。（书配合得到课程食用味道更加哦
🃏,5,2021-02-04 04:31:47,unknown,56,对于我这种一大半人名不认识的小白读者来说是绝佳的入门读物。喜欢的几段都拍下来放相册了，也希望读过的文字能成为我思考的基石。谢谢刘擎教授，为马克思的“动物的东西成了人的东西，而人的东西成为动物的东西”感动的您能在辩论场上说出“人类应该让不好的选项消失”，真是太有魅力了。
芳菲天,5,2021-03-12 12:05:13,unknown,80,很好的一本科普书，可能哲学素养好的人会不屑于，但是这是写给大众的一本书，可读性极强，一点都不枯燥。如果有人觉得韦伯、弗洛伊德这些人的中译本很难读，这会是一本很好的入门书：现代哲学之所以很难，是因为每个思想家都有自己的思想体系和概念，而刘老师很优秀的能力便是将这些诘屈聱牙的概念用浅显易懂的语言深入浅出的解释清楚，把每一位哲学家的思想脉络、人生阅历和核心框架给大家呈现出来，所以我一天就把这本书看完了！读完之后，感觉自己很想去读读书中所出现的人物和思想，我想这本书的目的就达到了！书中关于尼采真相的观点和阿伦特恶的平庸性的解读很有意思，虽然不完全同意他的解读，但是很有启发。另外，刘老师行文和说话语言风格真的很好，雅俗共赏，没有那种理性的自负感，受教了！
Sarcophagus,5,2021-05-16 18:51:19,unknown,54,在建设世一大伟大征程中，规划设计者想象对象拥有这等思考气象格局，课堂教学者想象对象拥有这等中学知识基础，通识学习者想象教师拥有这等教学技巧和深浅把握，而所有人都不愿承认需以补课建立基本共识，需更加通俗因为高考不考。更何况这都是西方那一套，虚伪矫情而且输了。
手肿河马,3,2021-02-10 16:03:11,unknown,56,过于浅显，感觉是一份书单的扩充。
恩井,5,2021-02-02 11:42:47,unknown,20,肩负自由的疲惫与轻盈，但同时也是唯一可能的出路，在达成充分而完整的人的路上。因为放弃它，我们的生活就变成了虚假、廉价、不值得过的赝品。但这种轻盈“不可承受”，时时刻刻的困惑而疲惫不堪，没有美好的许诺嘉奖之地。这是唯一可能的路，比任何轻易的纵身一跳都来的艰险。这不是封闭之路，甚至永远望向别处，因为如尼采所说我们需要运用更多的眼睛达到客观。在一种徒劳的激情中获得短暂的溢出快乐。
luc,5,2021-01-24 17:53:27,unknown,22,从韦伯到哈贝马斯，从信仰危机到“人间沟通”，这是一本酣畅淋漓的哲学通俗读物。哲学经常被误解为玄学，这本书很好地解释了哲学的现实价值，大到公共政策，小到个人抉择，推荐！
神威,5,2021-07-09 14:42:09,unknown,62,修行30th，其概括之简练叙述之清晰篇幅之短小令我惊骇，这需要极其深厚的功夫。书评区有认为此书太过浅白的声音，这些人懂不懂能把如此艰深思想尤其是哈贝马斯和阿伦特说到如此浅白而不失真是什么样的概念？思想科普可分三种，第一类是浅显而失真，为风趣幽默而风趣幽默，混淆目的与手段，以其昏昏故作解人。如《哲学家都干了什么》；第二类是宁失读者也不失真，在能力限度之下最大程度的阐述清楚并降低阅读门槛，此类中绝大多数失去了绝大多数读者，本书正是此类中佼佼者，深入浅出且有系统的逻辑关系，无论冲突、承继或是推陈出新；最后一类则是在哲学思想主题下做出的对话或实验范例，如《洞穴奇案》，这三类的读者，第一大于第三并远大于第二。人类因为理性而伟大，因为知道理性的局限而成熟，理性的局限和现代性的问题，是此书主题，也是好处
执,NaN,2021-02-02 14:07:06,unknown,24,获得了理论武装
爱徒步的小猴子,5,2021-01-30 21:54:08,unknown,15,相比较其他关于现代性话题的作品，刘老师从现代性的核心问题—“古今之变”即理性的扩张及其带来的后果，分别从个体的精神危机、公众社会领域的困境（主要针对政治合法性争论和自由主义的挑战）以及国际政治中的文化与制度孰优孰劣之争三个部分，以深入浅出的讲课方式介绍了19位思想大咖的理论，让我清晰地了解到当前精神困境的来源（理性的祛魅）、问题（诸神之争、工具理性的扩张与价值理性的衰弱）和目前最好的解决方案（建立新的交往理性）。个人认为是学习西方现代思想史的入门佳作没有之一。
鳕戈,5,2021-03-22 15:14:15,unknown,48,本想靠此书治愈失眠，没想到令我瞬间清醒。
Owen,5,2021-03-10 00:14:10,unknown,20,掩卷之后难以平复内心的感动...这才是真正的公共知识分子！在后记里，刘老师写到“我在想，听过我们这类课的朋友以后和人说话，会不会不一样？这样的话，我自己的劳作还是有意义的吧？这些努力虽然微不足道，但汇聚起来，也能成为一种‘慢变量’，从而能够滴水穿石、聚沙成塔吧？两万多人，就是两万多粒沙子，也可能，会是两万多粒种子....”——今晚对我来说，就是“理想主义澎湃的深夜”，只希望“现实主义觉醒的清晨”离我远去，我要将这本书送给所有爱思想的人！
意纳百川,5,2021-02-19 22:43:19,unknown,26,人类因为理性而伟大，因为知道理性的局限而成熟。
第欧根尼的桶,3,2021-04-11 09:28:05,unknown,35,内容比较浅显，适合那些对于哲学、社会学一无所知的小白入门。如果说你对政治哲学、现代性问题稍微有些了解的话，就没必要读这本书了。
Keto,5,2021-03-25 15:48:52,unknown,19,常去的那家小书店碰巧断货了，只能找朋友借了一本来看。哪知前言都没看完，朋友就催促着还书，一问才知，朋友借我这本也是找人借的，主人要二刷，不得不还。暂且把朋友的评价抄录下来，做个索引，免得以后忘了读：“这是一本现象级的好书，刘老师儒雅博学，说理清晰，引人入胜，不可不看。借我这本书的人是我小学的一个女同学，基本搞不懂柏拉图和凯撒的区别，但是她连王者荣耀都不打了，一天喝三杯星巴克，就为了熬夜读这本书，其可读性可见一斑”。
荒原兔,3,2021-04-25 10:16:05,unknown,21,买了这本，423搞的很火，因为涉及很多名家，就是想好奇看一下到底到啥水平。只能说令人失望，像缝合怪，也不能引发人的思考。。
刘挥手,5,2021-05-17 23:10:05,unknown,59,一些差评喷得没在点上，一个综艺导师写的入门普及书不应该被“理论深度”困扰。光凭把「现代」这个词从简中的崩坏语境里面挽救出来，就对得起这个评分了。刘老师有一句话隐隐的没有说，我来说一下：“现代化不等于现代性。”
Lunaluliu,5,2021-01-27 11:50:05,unknown,31,科普读物，但是大学生需要这样的科普。所有面向大众的哲学方面的科普读物都值得打五星。
绿子,5,2021-01-28 22:41:54,unknown,20,几乎我所有疑问都在这里得到了解答，牛
Kafka,5,2021-01-31 15:53:28,unknown,20,海洋里的鱼最熟悉自己，但只有海洋学家才真正明白鱼的生活。这些思想家，是最具有抽身能力的伟大人物，他们深刻地指出了人类运行的机制和终极问题，总是因为因为过于深邃地触碰到无法逾越的边界而痛苦，但他们快乐而令人着迷。他们是“盲眼诗人”和“猫头鹰前哨”：洞察出了一个真相，提出了一个概念、确定了一个标准、探索出了一条路径，让人类知道应该往哪里走。思想观念是人的构成要素，未经省察的人生不值得过
TIM,5,2021-02-22 19:27:45,unknown,30,我老觉得每一节后面留一个这样的思考题有点拉低整本书的格调
祝羽捷,5,2021-05-20 22:18:24,unknown,23,桑德尔说哲学不应该只是少数哲学家的事情，《西方现代讲义》真的实践了这句话，是让人读得畅快一本书。前三章在一些作品里有过了解，再读非常平易近人，但是第四章辩证思考自由、平等给了我很大启发。
slowlycatcher,5,2021-03-13 20:36:12,unknown,17,在看这本书的过程中，经历了多个“理想主义澎湃的夜晚”，也经历了几乎同样数量的“现实主义清醒的早晨”。尤记得某个心慌意乱的晚上，正好看到尼采的部分，那种巨大的冲击力直接将人拍在地上，让人匍匐在伟大的思想面前（当然尼采本人是拒绝信徒的这种迷信和崇拜的），并意识到自己的渺小。而掩上书卷进入生活，我也深刻地体会到，相比于书面经验的不足，生活经验的匮乏于我是更严重的问题。我想，关心人生意义和终极价值的人，本质上来说都是（至少曾经是）非常乐观的人，因为努力构想过关于美好人生的图景。而正是因为有过这重想象，当现实生活让想象落空时，我们才会由乐观转向悲观，被虚无主义和“生命之轻”所困扰。但对于人生意义的求索，纵然以一场注定的失败告终，也不该中途放弃。认清真相后还愿意积极行动，是一个人成熟的标志。
江凌,5,2021-02-18 23:14:02,unknown,19,或许会是里程碑式的一本书。讲西方现代思想的书非常多，但是在系统性、条理性、可读性方面做到均衡的不多，如此深入浅出、精简凝练的更少，何况还有流量加持。当代都市人尤其是年轻人应该读一读这本书，那些困扰着我们的命题，意义、自我、正义、自由、公平等等，都有所阐述，让我们看清自己处在怎样的迷局里，虽然都没有最终答案，这样的一次观念之旅却是弥足珍贵。
装腔,5,2021-05-04 19:51:39,unknown,11,1.很难想象刘擎老师的水平这么高，可以讲得这么简单，而且文字好亲切。我有信心可以买来分享给朋友看了，他们一定可以理解。2.这本书让我渡过了非常愉快的一天。但是真正的探险是焚膏继晷砥身砺行的历程。3.这样的书给人希望。
NSBetter,5,2021-04-02 18:28:55,unknown,18,每次读到优秀的科普都会对作者产生由衷的敬意。只身前往人类认知的边界，把宝贵的财富掰开揉碎讲述给懵懂的人听。尤其是20世纪的教训和自由主义的理论及其批判两章委实受益匪浅。一是讲述类似题材，同时对读者友好的作品实在难寻，二是这两个主题的探讨对当今青年人的生活状态有极大的指导意义。多元价值标尺打破了生活的枷锁，也造成了精神上的迷茫无依，唯有坚实的思考能让我们重新落地，不再随波逐流。2021020.
低级马里奥,3,2021-04-06 13:15:44,unknown,49,“讲义”是大学老师讲课的底稿，只有功成名就的学者才敢把讲义出成书的。自从罗翔之后，“讲义”成了“学科通俗演义”的代名词。刘擎原本可以做政治思想界的葛兆光，可他偏要学罗翔，上综艺、讲微课、出讲义。不是不可以，大材小用，学术上止步不前，可惜了。把每一位思想家的深邃理论体系极简处理，比如韦伯就是“祛魅的世界、诸神之战、现代性的铁笼”，尼采就是“人生虚无、理论虚假、生命强健”，确实朗朗上口易于背诵，但除此之外读者能学到什么呢？哲学思辨所要求的概念的清晰界定、逻辑的严密推演，学术思考所需要的意义阐发、缜密分析、比较研究、谱系定位都不要了，一切都服务于通俗化，也就是有趣。有趣只是学术的附加品，不应该是压倒性的目标。
JulyChan,NaN,2021-04-17 16:04:45,unknown,12,看过一个八卦，姚谦在张悬面前装逼，张悬揶揄他，你懂什么叫存在主义吗？从那以后我就有一个夙愿，搞清楚萨特的存在主义。看完这本网红书，依然懵懂。公众号环境的速食学术，就手的逼格武装。喜欢刘擎教授，但也知道学问是另一回事，学问不找代糖、没有捷径。
姜小白,5,2021-04-05 10:41:08,unknown,13,谦逊而雄辩的个人解读，配上精确到飘逸的用词，给人一种清凉洗涤的微妙快感。引起共鸣的发问视角，用现代人内心的孤独、飘摇做线引，现代思想依傍哲学共舞一段段专供解答问题的描述，人生本无意义，这种近乎宗教“无常”的虚无，绝望后更给人希望：是啊，这世上找不到任何一种可以模仿的模板来给人生赋予意义，因此你可以做任何事，你能成任何人，都基于你的个人选择，你只要承担你个人选择的代价。西西弗斯的确是徒劳而永无尽头，可他也可以是积极而勇敢的重复，我不喜欢社交网的丧文化，是我不想承担“丧”的代价，排斥虚无主义，我更愿意承担其它的选择，像坚毅勇敢积极的西西弗斯。生今之世，承诸圣之表章，经群英之辩难，我得以坐集千古之智，折中其间，岂不幸乎。
九零年的九零後,5,2021-02-03 13:22:23,unknown,10,什么是奢侈品，贵而无用的就是。在大众的固有印象里，哲学无疑是奢侈的。它为现实生活提供不了实在的价值，又让人觉得晦涩难懂。一直以来，哲学学科的从业者蒙受了不少误解，但刘擎老师的这本书则架起了业内人士与普罗大众之间的桥梁。这本书逻辑清晰，简单通俗，但又兼具思想深度和反思性。书中选取的人物我们或多或少有所耳闻，但读到之后才明白这些人的思想早已渗透到我们每个人的生活。当我们跟随刘擎老师的步调不断了解这些思想，不断了解这些伟大的思想家时，我们也在重新审视世界，审视自己。这样一趟观点的探险对于任何对周遭生活有所好奇的人来说，都是一场思想盛宴。
绵绵太空漫游,5,2021-02-28 09:52:33,unknown,6,逻辑清晰，用语精准，重点突出。第一次看一本讲义看的停不下来舍不得离手。这也体现了作者表达的技巧非常好，能把难读难理解的思想讲的如此有趣又平易近人，还是让人很佩服
vivian,5,2021-02-12 18:23:31,unknown,5,2021年第14本。太开心牛年初一读完这本有意义的书，伟大思想间的交锋，真是惊心动魄又荡气回肠。刘擎教授引领我们遍历了现代19位思想大家在现代性问题的大背景下的理论思考与变迁。启蒙理性主义帮我们驱散了混沌的愚昧，但也带来了更多的重大问题，最核心的原因是价值观的多元性，难以再有统一的尺度与标准。对理性，我们要“在勇敢运用理性的同时，直面自己永远不可能完全摆脱的无知，勇敢地与不确定性共存”。对于价值观，如何实现“自由、平等、多元”的三全其美，将是值得我们不断思考与探索的。五星好书，强烈推荐。
宇云瓷,2,2021-04-02 13:04:51,unknown,21,做入门书、学习大纲是很足够了，但书中刘老师为了通俗化对很多人都做了庸俗化的误读（特别是弗洛伊德），有点难受
一碗刀削面,5,2021-03-17 08:36:02,unknown,6,人因为理性而伟大，因为知道理性的局限而成熟。这句话总结的真好能通俗易懂深入浅出的把这么多晦涩的思想讲清楚，刘擎老师真是高手。
Mona,5,2021-02-17 22:07:07,unknown,7,本来担心很枯燥，没想到可读性那么强！而且读出了幸福感！！！
一个小可爱,5,2021-03-20 15:31:14,unknown,6,2022.7.13第二遍一本满分入门书。也仅仅是用于入门。如思想史一样提纲挈领地将一个世纪的大思想家们介绍给你，这是直接拓展眼界的绝佳路径，手牵着手领你入门，然后指明方向让你自己去继续深入。2021.3.20返校高铁上读完第一遍。填补西方现代思想的空白。好多思想家和理论头一次接触，初见的兴奋是一种透彻的通贯，的确是开了眼界，一个对我全新的领域从未思考过的领域。学完西方哲学史和政治学通识再看这本书，感觉很友好很刺激，书中内容太贴近生活又很难有这么角度惊奇的思考。但是，本书也有个缺点：为了某到APP的受众，为了迎合普通听众的快餐知识课，删减了理论的深度，看的不过瘾，太过于入门，期待刘擎老师写一本自己的书，放开了写的书。
云工智棱,1,2021-04-06 15:31:19,unknown,7,journalist-teacher
April,3,2021-04-02 20:23:35,unknown,5,14讲稿范儿很明显，看短评才知道是得到文字稿。个人觉得这类成书的作品大概适合两类人：需要从头开始被科普的，和有一些了解的，看得出来用词举例推敲为了第一类受众花了心思，所以整体深度不会太深。
冬贝贝,5,2021-05-23 19:54:21,unknown,11,很认可佘天俊的推荐语：在一个想亲近却不得要领的领域，获得了绝佳的导游
Leooooo,4,2021-02-04 01:39:21,unknown,4,刘擎老师的表达真是谦逊而有魅力，从世界的怯魅到自由主义，却是古今观念的探索，不能说是打开哲学的门但感觉看到了一束光。
luoluoo,5,2021-01-30 16:36:20,unknown,8,毫不夸张地说，这可能是我近一两年读过最具思想价值收获和实质启发的一部作品。就像作者在描述桑德尔后期的著作时写道的：“尽可能用现实中的具体事例来引发问题，然后再展开哲学的讨论，这样就能做到深入浅出。”——其实这本书正是把这句话的含义发挥到了极致。无论是伯林的“两种自由”，还是马尔库塞的“虚假需求”，都从哲学角度给了曾经多少因此迷茫和困扰过的我一个答案。在看到萨特的存在主义时，我想到周作人曾写过的：“虚空尽由他虚空，知道他是虚空，而又偏去追迹，去察明，那么这是有意义的，这实在可以当得起说是最伟大的捕风。”有些内容现在的我还无法完全企及，之后一定会再次阅读的。
云何,5,2021-03-12 19:29:47,unknown,4,深入浅出的背后，一定是作者经历过的无数次在先贤和自我间的思想碰撞。感恩刘擎教授用文字的力量拉着我的手，带领着我与他脑海中的那些思想家们见了面。
车欠,5,2021-04-30 16:04:06,unknown,19,老师很照顾我浅薄的脑子
