user_name,star,comment_time,geo_ip,vote,short
肆,5,2021-05-04 21:06:39,unknown,1,越读到最后回归到我们所处的现实问题移民脱欧浪潮全球化加剧但是又无法统一规范的情况就让人恐慌
曾经的你004,5,2021-05-04 20:24:43,unknown,1,浅显易懂，结合当下现代人的困境，将看似高不可攀的哲学思想娓娓道来，竟让人看得欲罢不能。对哲学有兴趣的小白或者对当下生活感到迷茫的人五星力荐！
小麻猫,5,2021-05-04 21:06:30,unknown,1,太震撼了。这本书解答了我一些思想意识的由来，启发我去深入思考我的价值观，值得反复阅读。
Lix,NaN,2021-05-04 19:24:18,unknown,1,非常好读，其它哲学课乱七八糟也看了不少，刘老师这本有解我不少惑，写得简明易懂，有认真拿小本本记笔记。
ac1046,4,2021-04-26 21:01:28,unknown,1,主要是讲20世纪的晚期现代思想，核心是现代性问题，认识现代社会的特征，对现代性问题进行反思和批判，并对19位现代思想家及相关思想进行了介绍。包括：一、现代化的开端：韦伯（理性化，祛魅）；二、个人精神危机：尼采（积极的虚无主义）、弗洛伊德（打破理性人概念）、萨内（存在主义）；三、社会政治困境：鲍曼（官僚系统）、阿伦特（平庸之恶）、波普尔（可证伪）、哈耶克（理性的自负）、塞亚伯林（两种自由）、马尔库塞（异化）；自由主义批判：罗尔斯（无知之幕）、诺齐克（放任自由主义）、德沃金（平等关怀）、桑德尔、沃尔泽、泰勒（社群主义）、哈贝马斯（放任理性）；四、全球化问题：福山（历史终结论）、亨廷顿（文明冲突论）。
土越,3,2021-02-22 00:21:27,unknown,2,这个评分就很矛盾。如果按照中国大多数书籍的品质，这本书的内容无疑是丰富的。那它肯定值八分以上。如果按照学者出书做研究的角度，这本书又缺乏严谨，分值多少不好说。同样，给出评分显得我理中客，不给出评分又让我没有参与感。那就大家一起中庸之道吧。
玛莉朱莉查理,5,2021-03-13 00:00:44,unknown,1,对“终极关怀”的问题，没有终极性的答案，我们都是一直“在路上”。这是人之为人的“存在性特征”。
武当派掌门,4,2021-04-21 18:48:07,unknown,1,“人类因为理性而伟大，因为知道理性的局限而成熟”-好想把刘擎老师这句话送给人民银行那几位呼吁少学文科、多学理科的所谓“博士”啊！因为讨论范围限制在二十世纪以来的西方哲学，所以对现代性的反思是全书主题。现代性的最核心问题是原子化的个人：个人脱离了自古以来依附的社群获得了自由，但自由带来的不止是解放，还带来了虚无感。我认同刘老师的判断：自由主义在二十一世纪初虽然遇到了重大的挫折，但是它仍将是可见的未来里西方社会唯一可能的主流，这是社会经济现实决定的-从最初的工业化到如今的互联网，原子化个人的趋势是越来越强的，几乎不可逆转了。通过反思官僚社会、极端理性化，强调社群作用、平等理念等等可以进一步修补自由主义，但是取而代之的思想还不可及。
luscar_,4,2021-05-07 23:58:38,unknown,1,人类因为理性而伟大，因为知道理性的局限而成熟。
頤眞,4,2021-05-07 23:08:28,unknown,1,通识向的小书，大部分人读了会忘，一部分人觉得太泛....但对我这样“西方现代思想”尚未登堂的读者而言却是恰当，顺着作者的讲义又捋了一遍脉络，加深了几分印象。
文艺理工男,5,2021-03-02 13:52:12,unknown,2,10分，刘教授的现代思想写的非常清晰，语言朴实易懂，真是实践了书中桑德尔所说，哲学不应只是少数哲学家的事情，应该成为公民教育的活动，被刘教授圈粉，也是罗振宇推荐的为数不多的不浮躁的好书。
yellow画吉桑,5,2021-02-18 00:23:49,unknown,1,人生第一本认真读完的哲学书🧠
哈哈学院院长,5,2021-01-28 12:58:25,unknown,1,可读性非常强！关于萨特的解释让我感觉很清晰，当然，因为奇葩说，这本书也便宜不了🐶
麦克默多的浮冰,4,2021-11-17 00:09:16,unknown,6,很好的通识快餐，最重要的意义自然是点明现代性之下的种种切身之灾、切肤之痛，最贴近当下的认知与反思，自然最能共情于此刻的种种内心困惑。当然这也只能是一本问题之书，简化的同时也难免挂一漏万。它的使命旨在将读者从“理所应当”的自我欺骗中唤醒，并不负责解答困惑，因此更适合三四年前的自己去读，并不能算是此书的理想读者。我对“是什么”和“为什么”的问题已经积累了相当程度的心得，但面对“怎么办”的问题依旧毫无头绪。当然作为一份长长的书单，很多问题的尝试性解答就藏在那些厚厚的原典当中。以此为契机继续读下去，反正“存在结构永远会溢出我们所占有的对象”，躺平谷底只是彻底放弃了自己的主体性而沦为……被唤醒之后，这种徒劳的激情便只有在耗尽全力推石上山的过程中才是有意义的。（你们还在聊天的时候我已经卸了一车水泥了！）
Bubble,5,2021-09-22 00:25:22,unknown,1,从七月一直断断续续读到九月整个阅读过程几乎总能让我找到内心平静受益匪浅答疑解惑认识怀疑坚定（再循环但没事最近有个关系很密切的朋友突然不理我了理由是没有获得双向情感回报觉得我自私摈不住和另一个朋友说了没想到她也觉得我的确自私举例说明了十年前的一件小事当时我就情绪崩溃了我第一次被朋友说自私也的确意识到了自己的自私以前建立起的自己是个好人的自我认识打破了突然再一次迷茫了以前觉得再怎么样还有朋友能够理解和陪伴现在发现原来他们也并不是百分百喜欢我唉…还是读读书吧可能以后一起养老的朋友都没有真的好难接受关系的分崩离析因为我永远是被动的那一个且真的从来不会主观伤害朋友算啦还是随缘“未经考察的人生是不值得过的人生，过度考察的人生是没法过的人生！”
Journey,5,2021-09-21 21:37:45,unknown,1,由于刘擎老师一直没有上电子版，所以我买了纸质版来读。虽然课已经听了好多遍，但是读文字版本还是有另一番感受。真正在现代西方思想史当中有深刻影响的人非常厉害，他们大多出现在我香港的课堂上，也出现在后期时而接触的阅读里。更像是一份地图，引导你走向深处。值得重读。
林点林,4,2021-09-22 15:31:07,unknown,1,也叫《刘擎用西方思想带你抵抗现代的价值迷茫》，鸡汤味的西方思想介绍。因为是讲义，文字很白话，浅显易懂地介绍了几位西方的思想家，看完基本能把握该思想家的一些核心观点，也受限于要讲述的主体太大，免不了会有些走马观花，讲得蜻蜓点水。当然，刘擎对西方思想的知识积累确实深厚
不是堂吉诃德,5,2021-08-09 21:06:54,unknown,1,我从来不知道「哲学」离我的生活这么近，不对，它根本就在生活里。一次如沐春风醍醐灌顶的绝妙阅读体验，不露痕迹地提示我要谦卑：你以为的真相和本质是真的「真相」和「本质」吗？它们是怎么来的？中间的逻辑能说服自己吗？思考到某个「结论」就结束了吗？思考有尽头吗？......迷人的思想，上佳的哲学入门讲义，刘擎这个男人太有魅力了。
赫玛芙罗狄特斯,2,2021-09-30 10:09:14,unknown,2,如果通过一本书激起个人对于哲学的兴趣，它适用。如果想深刻的理解思想，它不适用。思想这种东西，来的太快太浅，等于没来。
风子,5,2021-08-27 09:59:14,unknown,2,希望多一些刘擎这样的大学老师，这本书胜过我一学期的课。
douban2019,5,2021-08-31 00:30:44,unknown,1,以多个角度认知世界思考使人平静没有百分百的真实理论向适应当下生活的方向前进
fraise,5,2021-09-02 15:58:41,unknown,1,话题在宏观和微观中间自由切换，在哲学家和思想家的著名理论和我们的日常命题中来回穿梭，游刃有余。以前只关心小命题，在自我的世界里画圈圈，殊不知，“我”也只是沧海一粟的存在而已。（此书值得反复再读）
猫脾气,5,2021-09-01 23:59:40,unknown,1,“人是悬挂在自己编织的意义之网上的动物。”“金钱只是通向最终价值的桥梁，而人是无法栖居在桥上的。”“登上顶峰的斗争本身足以充实人的心灵，应该设想，西西弗斯是幸福的。”“人类因理性而伟大，因认识到理性的局限而成熟。”
Karen,5,2021-04-21 23:20:46,unknown,1,刘擎的书通读了一遍。写得条理清楚，深入浅出，很适合做导论。准备再读一遍。刚好还买了一本阿伦特的《艾希曼在耶路撒冷》，先看清楚大的思想史背景就更好理解了。另外前段看了一本《禅与摩托车维修艺术》就现代社会问题从西方思想的源头开始做了一些思考，也很不错。
哭之笑之,4,2021-04-06 22:54:25,unknown,3,从入门的角度看，可以说非常好了。问题联系生活，思想联系现实，能引发兴趣；只抓几个重点概念，考虑受众的接受能力；最值得肯定的是，例子举得很好，生动活泼。（跟了了一起读~
Echo,5,2021-07-25 14:01:30,unknown,1,断断续续一个月之内读完一本书，哈哈……比起刚开始读这本书时那种新鲜兴奋感，现在读完之后，进入一种慵懒木然的状态，内心却有什么在牵扯着，但是却有一种自洽平淡的感觉。现在反复在脑海里回荡的是那句:“人类因为理性而伟大，因为知道理性的局限而成熟。”我在阅读的过程中会不由自主地在沉浸体验的时候突然跳出，回头去看曾经的认知和曾受到思想影响，写到这里，突然鼻子一酸想掉眼泪，这本书带给我最深的体验是“祛魅”，而我此刻的情绪波动想必也是祛魅初期的一种思想和情感困境，但很幸运在祛魅中我获得了自知自觉和独立的思想。要继续关注继续阅读相关书籍，余生这样的作品会成为我阅读体系里的一个必不可少的专题。
小山,5,2021-08-20 17:58:46,unknown,1,在心理学那里没有得到的解答，在哲学中得到归属和救助。
当康,5,2021-06-25 20:53:15,unknown,1,向公众传达观念的方式很值得借鉴，哲学不应该是孤芳自赏
叫我妖而不孽,4,2021-03-03 22:50:10,unknown,1,我以为有多好呢，香港01的无睡意哲学，不更香？当然梳理的还是可以的，尽管我对这样的简化是越来越警惕了：没有历史复杂性的反复洗礼，这么简化容易成为人群中彼此攻讦的武器——如此反倒有悖于以韦伯开始以哈贝马斯结尾的结构了。刘擎还是在选人的时候很有私心的，不过不妨碍他一家之言。我对刘擎好几次貌似下意识地用家族相似性来表达维特根斯坦的影响感到好笑。看到有人推荐高三学生读本书以积累论据，我感到悲哀；听到求我带他们划重点，我更怒从中来。但IB的学生又容易用此武器只砍向对其历史没有温情的本国。有种感觉，未来从事哲学的必须要有数学系博士学历，懂比如复微分几何，否则只能和刘擎、周濂一样成为哲学史家。
光,3,2021-08-29 11:26:24,unknown,6,买之前我谨慎了，但还是得小马过河。读完后我的定位：消遣读物。①我指的消遣读物是，可以随意翻阅，前后内容没有显著的逻辑相关性。譬如报刊杂志。高数就不是，不学第一章后面学不动。这本书?随便翻。你跳着读都能看懂。②文字表达上很不精炼。总是“插科打诨”比如什么“人间不值得”，还有n多的八卦史。有意思的话很少。③最后是纯个人层面。这本书聊的太广，而我目前关心的议题只是个人。不想管政治哲学。但实际上大部分内容是在讲类似社会架构和国际政治价值。补：还是有点点用的。能从其他书里看到影子。但信息含量确实低。又补：三星升四星。这说明不同领域一点点的突破就会带来很大改变。再补：四星改二星。看过一点点西方哲学史后，觉得那才是干货。要了解，请正经入门。0408再再补：二星升三星。配着正经书读或许不错。
momo,4,2021-04-19 23:43:44,unknown,1,1、现实离不开思想。2、理性主义。工具理性、价值理性、交往理性。祛魅。3、理性与理性的局限、片面的理性，过度理性造成的不理性。官僚化。人的工具化、异化。4、形而上，实体之上。相信存在更真实的、有目的的、有统一性的本质世界。（它充满确定感，形而上学是虚无主义的根源）5、存在主义、存在即虚无，存在先于本质，然后我们有自由（自由之沉重），进而积极行动。（我们对物的占有填不满虚无）6、他人即地狱。主体权的斗争。7、弗洛伊德的自我、本我、超我，可证伪，伪科学。但改变了我们理解人性的方式。8、饱暖思承认。被认可，有尊严，被尊重的需求。9、明白自己是谁，自己在做什么，以及为什么这么做。10、智性成熟：破除悲观，获得清明，达到从容。11、与困境、不确定性共存。
Winterreise,3,2021-04-25 09:33:09,unknown,1,讲义后面部分更多是角度局限的浮浅的表层社会现象的思想纷争，且无从根本上去反思，全书当中有几位思想家是有引发到哲学问题的底层，有其点状成就，但终究不能触及根本。这样一本讲义固然有其澄明以往思想家的观点的要义，但是不得不说，哲学的新思域已经出现，旧有思想的局限和无知也已经被打破。
堂吉磕碜,4,2021-03-09 23:52:46,unknown,2,就很适合入门，脉络也很清晰，先从现代世界由理性引起的困境说起，接着说了韦伯，然后分别从个人层面（尼采，萨特，弗洛伊德）和社会层面（马尔库塞，哈耶克，伯林等人）说起，后面又接着说对自由主义的批评。比较有启发的是波普尔的科学的可证伪性，即鉴定是否为科学，要在经验上有证伪的可能性，而不是自圆其说。还有伯林的积极自由与消极自由。马尔库塞的虚假需求（被市场营销制造出来的需求），还有尼采的“上帝死了，是我们杀死了上帝”，这是指在尼采看来，形而上学是虚假思想，当虚假思想与生命本能相冲突，人就会怀疑虚假思想，陷入虚无，进而杀死上帝。还有就是关于社群主义的内容，传统社群经过地域，身份，婚姻，政治等的变动，不再稳固，出现了原子化的个人。最逗的是知道了弗洛伊德的精神分析学说在如今的心理学领域没啥地位了。
阿杜的杜杜杜,4,2021-07-16 15:34:28,unknown,2,两星半还行吧，当做一种书单类型的书。警惕一种知识，就是把百科类的书籍看过之后，了解了名字和梗概，就以为是自己思考得到的内容。在知识的大门前徘徊，还以为进去屋子里浏览了一番，这样不太好。看了十三邀关于刘擎的一个访谈，作者自己也很明白，是个导图，按照这个定位来说，很推荐。
良生。,4,2021-07-30 18:58:54,unknown,1,再次感叹遇到一名好的老师有多棒。他运用多年勤学所得抓住繁复困难的核心，而后用直白的语言将其教授于你，还要留下问题，所以你不由自主的被吸引了。解决了现世的困境了吗？也许并没有，但被鼓励了。
北阳向暖^,5,2021-06-18 16:46:56,unknown,1,很好的入门书，打开了新世界的大门。
长门有希的消逝,5,2021-03-12 15:11:57,unknown,1,因为接触过一些政治哲学领域的相关著作，所以更加感慨刘擎老师这样一本大众化、通俗化著作出现的可贵。
7.7.7,5,2021-03-12 12:19:47,unknown,1,非常精华，为初学者建立坐标系，光写作方法就值得多看几遍。
星海,5,2021-07-30 10:31:40,unknown,1,终于明白自己为什么在这个群神共舞的年代流离失所
芥子淼,5,2021-03-13 16:29:36,unknown,1,罗老师说过，哲学是关于死亡的学问。在这本书里浅尝辄止，窥见一斑。
oNe1,5,2021-02-17 20:33:41,unknown,1,初识刘擎老师是一个他与陈嘉映对话的视频，视频中他的积极表达，与陈嘉映的点到即止，活脱脱的展现了英美哲学和欧陆哲学的两种表达。而后，他成为了奇葩说的导师，本季加入了哲学导师，可能也正体现了“通识”教育开始逐渐热门的趋势。随着节目的热播，刘擎也越来越受到大家的喜爱，相比之下，薛兆丰那坚毅的工具理性，让人觉得好像少了一些“人味儿”。刘擎老师真的太可爱了，书中他那跳脱出哲学专业用语的情感表达，也许非常白话，但是非常真性情，也真正拉近了哲学和我们普通人的距离。除了丰富的思想演变史的阐述，文人特有的暗讽和幽默也展现的淋漓尽致。比如讲述福山思想的那一章，笑到肚子痛。具体内容不多言说。只希望自己在面对现在如此多样化的选择时，不再是简单的说一句“我喜欢”，它简单到无法辩驳，却也脆弱到连自己也陷入怀疑。
李扎,5,2021-08-21 18:43:09,unknown,1,比“抛砖引玉”走得更远，应该很难有比这本书写得更好的了。
IMSIL2016,5,2021-08-21 20:21:41,unknown,1,非常棒的一次阅读体验，应该是我读过的哲学书籍中最平易近人的。由于好读，就读得快，太快了就感觉有点消化不了了，得慢慢回头思考。
Joy,5,2021-07-31 01:26:35,unknown,1,感觉思想得到了深化通俗易懂且引人深思值得反复阅读
啸谷,5,2021-02-09 18:05:06,unknown,1,这是让我惊喜的一本书。作者用深入浅出的语言把深奥难懂的政治、经济、哲学等等各方面的思想讲透了，站在全人类文明发展的视角，从马克思.韦伯的“破”开篇，讲述了如何“立”及如何面向未来。既有广度又有深度，值得反复阅读。
旺财,5,2021-03-19 17:28:22,unknown,1,刘擎教授真的在很认真地写
一位用户,4,2021-06-21 23:49:06,unknown,1,很有价值，把很多重要的东西讲得清楚好理解。这些东西值得当代人去了解，但是途径太少了
ll,5,2021-06-06 16:07:12,unknown,1,降低了我类文盲的阅读门槛，后现代普罗米修斯。
几山,1,2021-06-27 22:18:25,unknown,5,有几句话很到位，但整体读起来像流水账，看了一半看不下去了，就这样吧，9.1分的高分书我不敢苟同
S级通缉犯,5,2021-04-15 08:58:47,unknown,1,看完了很棒，学习了很多现代思想的常识.ps:淘宝上有很多盗版书别贪便宜，(别问我为什么知道...)
Be2wardsdeath,5,2021-06-14 10:15:51,unknown,3,刘教授真的写的太好了，深入浅出把问题讲明白，以后和同门师兄、师姐讨论问题再也不用担心啦！（不是）。比起振聋发聩，我更喜欢娓娓道来。
Mignon松弛地,5,2021-06-07 00:42:24,unknown,2,非常好的框架梳理。如刘教授自己说的，他在把复杂的事情说得通俗易懂这点上特别擅长。
碧茶解药,5,2021-03-29 06:43:58,unknown,1,作为一名喜爱人文的读者，没有对哲学思想有着一般的stereotype，但是仍然将哲学类的阅读趣味性设置得有偏差。我更倾向于了解距离我们更远的“先贤”，而对年代教近的“思想”缺少兴趣。并且政治哲学更是被天然抵触的。如果不是粉了《奇葩说》里刘教授的发言，我可能很难买一本讲义类的书籍。入手以后一口气读完，发现比预期得更加引人入胜。恰如其名，这的确是一本现代西方思想的入门讲义，然而除了罗列各学者及其理论，用非常深入浅出的方式结合事例阐述了现代性带来的困境和某个思想想集中解决的问题。如果了解新知识最好的状态是“师傅领进门”，这本书充分诠释了师傅是怎么引导了兴趣，让学生心甘情愿“修行在个人”。读完以后，我觉得以前在一些心理学书籍上没有找到的答案却在这里找到了共鸣和理论依托，引起我浓浓的兴趣想读更多原作。
袖手旁观,5,2021-09-21 17:21:25,unknown,1,自由与平等，公平与正义
悦雨丁香,5,2021-05-07 15:48:01,unknown,1,真的好喜欢这本书！知道刘擎老师还是因为奇葩说。常常觉得站在台上的刘擎老师整个人都在blingbling地闪光。记得老师在奇葩说上说，“每个人都是关系型的自我。”(relational-self)这本讲义也很棒，很适合我这种小白😊从韦伯的价值理性与工具理性；阿伦特的“极端的恶”与“恶的平庸性”；柏林的积极自由与消极自由；萨特的“存在先于本质”“他人就是地狱”；哈贝马斯的“主体间性”；波普尔的科学的可证伪性……很多人名很熟悉，最令我激动的一点是刘擎老师让我看到了这些思想和社会政治的密不可分的联系，思想和现实犹如一个硬币的两面。看完现代视域下的19位思想家，觉得很幸运能遇见这本书。后面的“答学友问”也解答了我一直以来的困惑。书单也很棒。“人类因为理性而伟大，因为知道理性的局限而成熟。”
snowyfyrh,5,2021-10-04 22:51:44,unknown,1,大概是最好懂的思想史了
卡特里娜小姐,5,2021-02-15 01:40:00,unknown,1,今年的第一本书于不能出游的春节，非常浅显易懂的讲述了“最近”的西方哲学思想，仿佛耳边就回响着刘教授温柔的声音，让很多晦涩的概念变得“好玩”了一些，其实我在读的时候最大的念头就是：哇不一样，好希望有人总结一下这里的流变，就像我买了那么些西方艺术史的书，各种通俗各种细分，可到了中国美术史，能说得出名头的，就那么几本。
夏安妮特,5,2021-07-17 18:37:34,unknown,1,本来是四星，但因为刘擎老师实在是非常真诚以及后记中表现出的可爱劲儿（以及完美主义拖延症症候群的同病相怜之感），五星奉上。当然，我在哲学领域是一个还没进入幼儿园的状态，因此以上这段评价是不够得体的。不过我想关于这本书我最大的遗憾绝非来源于写作者的水平（我配质疑这一点？），而是源于自身的无知以及巨大的孔洞：我瞥见一丝智慧的光芒，于是意识到自己惊人的匮乏处境。继续走吧，道阻且长，我们还有一生的时间用来前进（或后退、原地踏步及跳舞和发疯）。
七月流火,5,2021-02-08 21:59:38,unknown,1,在我脑海里掀起了旋风，感觉到直击眉心的重击
一口一个大芝士,5,2021-05-16 18:55:34,unknown,1,有点浅，但是科普是极好的。
alan,5,2021-05-16 23:01:19,unknown,1,通俗易懂，生动深刻，哲学入门好书。“本真性的理想，一方面让我们忠实于自己的内心感受，一方面要求我们不要陷入唯我论的独白，积极的介入对话和反思，这是自我通向共同背景的通道，把我们和一个更开阔的世界联系在一起。最终，向对话和反思开放，让自我变得更加清晰，更加丰富，才能更好地’成为你自己’。”
少年见雀悲,5,2021-05-18 03:23:11,unknown,1,我指控刘擎老师对我进行了一场知识权利的施暴😂
faith,5,2021-02-14 09:32:30,unknown,1,关于思想、自由、社会制度等等……打开了一个更加开阔的世界，也尝试回答“人生的意义”这一终极话题，强烈推荐。
木头人,4,2021-02-14 21:55:42,unknown,1,1.忠于自我的内心感受明朗地看待自己2.积极地开放地介入对话和反思3.不要放弃对自由的渴望，享受求知与思考，去接近充分而完整的人
sinkorswim,5,2021-02-14 19:59:15,unknown,1,虽然大多都是得到课程的讲义还是复习一遍刘老师的文笔流畅遣词用心没有掉书袋适合大家入门哲学。他之前在采访谈到参加奇葩说和哈贝马斯有关用这段话与刘老师共勉“一方面让我们忠实于自己的内心感受，一方面要求我们不要陷入唯我论的独白，积极地介入对话和反思，这是自我通向共同背景的通道，把我们和一个更开阔的世界联系在一起。最终，向对话和反思开放，让自己变得更加清醒，更加丰富，才能更好地成为你自己。”
矮子白,5,2021-05-12 16:31:15,unknown,2,好书的价值在于作者把饱读后的领悟无私分享给你，而且讲得透彻。可以看到，关于我们的迷茫和困惑，思想家们都已经做过深刻的反省和探索，确实是一部传道解惑之书，能引起进一步深入探究思考的书。这样的书值得一读，也应该去读。
琨霓,5,2021-09-27 00:25:28,unknown,1,从前觉得哲学虚无不值一提，当看到这些人类思想巨匠的伟大思考结晶时，才发觉原来是自己无知。思想没有真相也没有终点，然而思考，却是人独一无二的构成性要素。在阅读和思考中，学习而成为自觉。btw，准备趁产假把历史、哲学、美学的经典大部头通读一个遍，太幸福了！
