user_name,star,comment_time,geo_ip,vote,short
censored dump,5,2017-11-16 22:52:47,unknown,4,在那篇虚构的赫伯特奎因的作品分析中，博尔赫斯说“美的事物不能没有惊奇的因素，从回忆中得到惊奇则很困难。”这等于在说，要靠想象，想象的惊奇在于创造性地破坏，破坏线性时间及其因果律。于是我们看到循环、分裂、无穷无尽，在这种文字的诡计中，虚构得到了不朽的魔力，被时间的火舔舐而不毁，就像环形废墟中的少年。这像是量子文学，“又是一头公牛，一朵玫瑰和一场暴风雨”，博尔赫斯把他的诗意安放在迷宫的角落，令人晕眩又回味，重读同名篇的时候，我找到的是“傍晚显得亲切、无限。道路继续下斜”，这个树枝在天空交接的傍晚，如其所是地完成某种交换，用生命交换启迪。所以，让总督是奴隶，让现实与梦境置换，让没发生的留存在记忆中。PS，一直在想那句“我不属于艺术，我属于艺术史。”
Lottie,5,2020-07-27 17:34:07,unknown,5,是目前为止读起来最慢的一本博尔赫斯，读最后两篇时太过震撼了，不得不承认作家的认知、叙述和想象力远超常人。把纷繁的梦境塑造成形、无限而周而复始的图书馆、将来当成过去那样无法挽回……这才是“世界的混沌性和文学的非现实感”。
baibai,5,2015-08-26 07:17:12,unknown,2,关于文字的文字，关于书的书。奇妙的脑洞收敛于一点，随即又飞速散开。扯淡扯的汪洋肆恣。
tequilagirls,5,2019-11-15 21:40:49,unknown,2,感觉博尔赫斯想做的事就是把复杂的世界简单化。《小径分叉的花园》看似是以时间为谜底的迷宫式的叙事，但迷宫若显示了其存在，身在迷宫中的人却不再害怕迷路。有时候我们看不清，周围的环境、形式，博尔赫斯告诉我们：一切都是迷雾笼罩下的暂时光明。说真的，看了这本书我不害怕那些模糊的概念、不可触摸的未来了。
恪彥,5,2016-03-21 13:13:22,unknown,3,妙不可言.如果得用一个字来形容博尔赫斯的作品，我觉得肯定是，妙!
孖抹麓,3,2015-11-04 23:28:49,unknown,2,一直很想拜读这位大师的作品，然后书展上因为其中一段话买了书.....结果除最后一篇其他几篇完全没看懂
洛阳小流氓,5,2019-06-16 11:34:19,unknown,3,《特隆》是像香蕉鱼般一直住在我脑海里的篇目，它展现了有限而消退的记忆和更珍贵、更艰巨的材料间的长久较量。“连续性”直接指导了一部分文学中的幻想:利用极短的简介或一些有条不紊的片段，像侦探一样反推受到歪曲和破坏的宏大历史。博尔赫斯是给后人列写作计划的人，尝试新菜品不一定比阅读菜谱更让人身心舒畅。短小篇章都带着象征性的轮廓，《吉诃德》——证实荒谬，《环形废墟》——稍纵即逝、支离破碎的幻影记，《巴比伦》——完善、公开的暴政，《奎因》——对称、随心所欲、厌倦的背面，《通天塔》——目录的总目录，无限究竟是什么？《小径分岔的花园》:仅叙事层面就足够精妙了，身份、名字的多重作用。对位移（时间测量方式，或许是日出日落，或许是脉搏）的一丝怀疑。迭代是对循环这一伟大技巧的拙劣模仿。花园将留给不同的未来
微笑迦朵,5,2015-12-03 18:35:04,unknown,2,2015年已读084。篇篇经典。
撒旦的表妹,NaN,2019-03-20 11:09:52,unknown,1,《通天塔图书馆》想到了《星际穿越》～再次验证，数理差的人（比如我）读博尔赫斯真是太费劲了～
FermeFaon,5,2018-12-29 15:10:54,unknown,3,环形废墟也好分岔花园也罢，博尔赫斯极爱玩弄迷宫技巧，消解时间空间的意义甚至意义本身，构成永恒叙事。不断循环，困惑之中寻找存在，宇宙观和形而上的意味不言自明。想起格里耶的《在迷宫里》，异曲同工之妙。
风满蜃气楼,NaN,2017-07-08 22:45:14,unknown,1,看一千零一夜梁文道讲博尔赫斯的那几集特别喜欢，但书却没有听来得有趣。各种长串的名称看得我头大…
Malaimo,5,2021-06-02 20:08:41,unknown,3,「环形废墟」
湖,5,2017-09-18 10:41:45,unknown,2,一本正经故弄玄虚，一本正经的掉书袋。很好玩
♪ ひとり日和 ,5,2021-04-28 18:42:45,unknown,3,或许是因为书名太具有欺骗性了，没有看简介，误以为是一本轻松的读物。没想到第一次读博尔赫斯就差一点被劝退了，幸好没有放弃，真心建议从最后一篇开始倒着读。
Maskenfreiheit,NaN,2018-10-20 19:46:57,unknown,2,形式和意象。惊喜的只有特隆，彩票没什么感觉，与其说是小说，更像散文式的思想实验，关于时间空间和图书和梦，以此引发的哲学思考我觉得大部分人都想过吧……但不同的是博尔赫斯是个学者人物；诺兰说过他最喜欢的小说家便是博尔赫斯，看，谜底揭开了，诺兰也是喜欢玩弄时间且是个形式化很厉害的导演；翁贝托也是类似博学型人物，但更具体实在，每一个空间都不是模糊而是具体的，清单狂魔，意象狂魔，玄学和神秘主义
爱德华拴住儿,3,2019-09-11 16:32:16,unknown,4,有点随心所欲了。读者是什么，作者能否面对饕餮食客而随意腹泻。虽然不需要精致料理，互相尊重还是要有的。唯我独尊，这世界上我见过三个。改变了事物的门槛。福楼拜的勤劳，殚精竭虑，一丝不苟的穷尽细节。导致了作者挠头，读者崩溃。文学之门由此厚重。后来意识流种种，此为肇端。康德的自闭，无视读者，不加修饰的直抒胸臆，从此垫高了哲学门槛。第三个就是博氏之流，没有风格为风格，没有艺术为艺术，晦涩的掉书袋，比直接的掉书袋更可恶。
秉存,4,2021-05-07 17:49:03,unknown,3,“宇宙是一系列思维过程，不在空间展开，而在时间中延续……空间能在时间中延续。看到天际的烟雾，然后看到燃烧的田野，再看到一支没有完全熄灭的雪茄。”
镜中,4,2019-01-21 13:36:55,unknown,3,博尔赫斯笔下的“小径分叉”可以看作他的形而上学思想的一个重要交汇点。既可以解释文学作品阐释的多样性，也可以作为宇宙的起源解释。博尔赫斯在序言里说的“侦探小说”实在是自谦，毕竟丝毫没有侦探小说的阅读快感，只有一脸懵逼
伤逝,1,2017-06-07 19:04:00,unknown,8,去他妈的王永年毁了多少小说了
卢西安,5,2020-08-30 18:08:15,unknown,4,大概是读过最漫长的99页，但读完又迫切地想再读一遍。
想起窗外一只鸟,5,2019-07-25 00:18:16,unknown,2,《环形废墟》和《小径分岔的花园》早已读过，拉美神秘的雾和燥热的火让命运循环和时间分叉的故事扑朔迷离。几篇假想书评大概是满足博尔赫斯因过于丰富的知识积累和过于蓬勃的想象力而产生但又不方便形成长篇的诸多对叙事方式的构思。第一篇则是设想了另一种语言体系中的所有文化系统，这确实可算科幻——多像阿西莫夫啊——只是这“科”是“社科”之“科”。《巴比伦彩票》和《通天塔图书馆》则是寓言，一个刻画偶然和无序，一个通往无限。
春原百濑momo酱,2,2021-12-10 11:00:44,unknown,9,一般我骂“狗都不读”，只是开个玩笑，不对我口味，没办法。但这是第一本让我真情实感骂出“狗都不读”的书。我不理解为什么有人喜欢掉书袋，喜欢用别人听不懂的话来讲别人听得懂的东西。在这里，博尔赫斯像是一道写在纸上的数学公式，在宏大的议题中失去了人的情感，冰冷而笨拙。我觉得这很吓人，仿佛他的生活只有图书馆和字符。不过起码字里行间有一丝温柔浮现，不然我真觉得他不是人，是AI。
楚腰纤细掌中轻,5,2019-12-09 23:07:42,unknown,4,微言大义。“特隆”讲思维的对称和词义学上繁芜的精确，“找到”未必是“遗失”的；“吉诃德”否定意义，历史的真实不是已经发生的事情，而是我们认为已经发生的事情；“环形废墟”直指上帝的虚幻；“巴比伦彩票”改写自《塔木德》一两则迂回心理的笑话；“通天塔图书馆”中的六角形不就是大卫星吗；“花园”是“奎因”的升级版，以电影来作比方，就是《穆赫兰道》对《失忆》的升级。一点个人感受：博尔赫斯哲学观很大程度上来自犹太文化，反线性、反释义、反崇拜、因末日不至而时间循环，是对地球生命最真挚的剖解，最悲切的任性。而在如何驾驭文体的思考中，虚假表象的“原注”颠倒了“本末”，是一系列犹太作者们讲述的“等待”间的笑话。
源,NaN,2020-03-18 01:35:08,unknown,3,＃补标2016＃这本集子可以说是博尔赫斯开始“认真”起来的作品，之前他阅读过的庞杂浩繁的书籍开始隐藏在小说里，提取的精华配合上博尔赫斯自身的理念，融汇出了“博尔赫斯式”[Borgesian]的作品。最著名的《小径分岔的花园》，据传是受到了曹雪芹《红楼梦》的影响，据点是因为其中的叙述者“余准”（雨村的谐音），是《红楼梦》中牵连情节发展的人物贾雨村。而且博尔赫斯在别处也说过《红楼梦》是一本关于“时间”的小说。故事情节就像博尔赫斯在序言中写道：“这个集子里的七篇故事不需要很多诠释。第七篇（《小径分岔的花园》）是侦探小说；读者看到一桩罪行的实施过程和全部准备工作，在最后一段之前，对作案目的也许有所察觉，但不一定理解。另外几篇是幻想小说。”
hibi,5,2019-03-08 02:04:33,unknown,2,还是比较喜欢《环形废墟》这一篇。博尔赫斯的小说真的不是哲学和文艺批评吗。以及看好几篇的时候都想到了《寒冬夜行人》。
老泰瑞,5,2018-04-28 22:54:51,unknown,3,博尔赫斯上学时应该选理科。。。《小径分岔的花园》和《巴比伦彩票》，实质上就是关于平行宇宙和熵的文学化表达；《环形废墟》和《通天塔图书馆》，则是关于知识边界论的哲学小品，有点超现实，道理其实没多难懂。
/,4,2021-05-27 22:49:10,unknown,2,私以为，整本书几个短篇探讨的东西是有共通性的，即“另一种解法”，或者说“另一种形式”，无论什么。总之，是文字、文学、思想、生命、集体、世界、宇宙，一切的一切的另一种解法。读懂博尔赫斯或许要花一辈子吧，也可能不止。永远不要在“思考”这件事上偷懒，深度思考是丰富灵魂的必由之路。
Eva,NaN,2015-08-10 14:25:16,unknown,2,站在书店看完的。还好只有4万字。内容没法评论，看得各种不懂，译者的用词很考究，局部也有点晦涩，句法甚至有一点古旧的痕迹，后面有个地方是明显的错字简直让人怀疑前面看不懂的词是不是也有错字…读下来感觉前后左右都遥相呼应，里外全是梗各种明喻暗喻，但又完全想不透。果然最喜欢最后一篇小径分岔的花园，有一种用朴素方式描述多维平行世界的感觉。
La Lune,NaN,2020-10-23 10:33:18,unknown,2,可能是因为短，竟然有2.3万人看过...只觉得《小径分岔的花园》妙不可言，主人公的华人身份也有几分亲切感，其他几篇皆是不明觉厉，上来第一篇《特隆、乌克巴尔、奥比斯·特蒂乌斯》就把我看蒙了。。无力评分。
您的月亮掉了！,NaN,2015-07-26 16:09:53,unknown,2,既然再版那我也就买买买【
托尼·王大拿,4,2019-06-20 14:23:38,unknown,2,用文学的笔触去写哲学甚至神学
人类学科研究员,5,2017-06-08 21:33:57,unknown,1,整个世界就是一场梦。无限循环的一周目二周目三周目四周目。
Micco Chiu,5,2020-01-01 15:51:19,unknown,2,读书恨晚
澍子,4,2015-10-28 21:02:24,unknown,1,除了同名短篇，其余读起来多少费劲～
米周,2,2017-02-03 19:46:16,unknown,1,我读的一定是假博尔赫斯
laprily,5,2021-04-21 11:34:42,unknown,2,平庸如我最爱《环废》，就好像连下7局棋，6局对面都是AlphaGo唯有这局对手是个真人。
Mr.虫,5,2015-08-20 11:49:29,unknown,3,时空的虚无、混沌如此精妙呈现，这就是所谓拓宽了文学的可能性的人吧，不敢说看懂，却深陷其中
栗子酱,5,2021-04-23 22:54:15,unknown,2,赶在读书日结束前看完了。很奇妙的阅读体验，有时候你看不懂，却依旧为之痴迷地看下去，这种状态是很有意思的。前面大部分是在地铁和课间看完的。晚上在自习室看完的两篇，《通天塔图书馆》、《小径分叉的花园》都很喜欢，也大致明白作者的意思。我觉得博尔赫斯的这几篇都有科幻的色彩，特德姜应该是有模仿他的风格的，那种时间带来的诡谲感与神秘感和博尔赫斯非常像。巴比伦塔和图书馆就很像，你一生的故事和花园很像。
王小蹽,2,2021-04-22 10:14:54,unknown,4,要不是篇幅少，我是读不完的[尴尬]
独自退场,4,2015-10-01 04:03:33,unknown,1,小说短篇小说
夏目二暖,5,2020-11-16 14:44:21,unknown,2,博尔赫斯本身就是一座小径分岔的花园啊，很多作家可以被模仿和复制，博尔赫斯不可以，无可超越。
鸟枪换炮,5,2019-05-01 17:14:03,unknown,1,想到可能性是无限的，你是兴奋还是绝望？就如同博尔赫斯的故事之于你的文学理想一样，你是跃跃欲试还是望而却步了呢？
别的熊,NaN,2016-01-10 19:44:00,unknown,1,记得有位歌手以「用自己的声音作为乐器」为志。从某个角度上来说，博尔赫斯对文字的掌控是惊人的，在他笔下文字也完全成了他的「器」，以此随心所欲编织他想要的效果，完全是指哪儿打哪儿。会买这本书是在读完格非的《相遇》后埋下的引子，现在读完了，确实有相似的氛围啊。
游牧人·芳汀,NaN,2018-07-02 21:04:02,unknown,1,“他认为时间有无数系列，背离的、汇合的和平行的时间织成一张不断增长、错综复杂的网。由互相靠拢、分歧、交错或者永远互不干扰的时间织成的网络包含了所有的可能性。在大部分时间里，我们并不存在；在某些时间，有你而没有我；在另一些时间，有我而没有你；再有一些时间，你我都存在。目前这个时刻，偶然的机会使您光临舍间；在另一个时刻，您穿过花园，发现我已死去；再在另一个时刻，我说着目前所说的话，不过我是个错误，是个幽灵。”
🐾Z,NaN,2015-09-27 13:04:05,unknown,3,十多年前就听人说过环形废墟，可惜，完全理解不了博尔赫斯的写作思维，整本书在我看来就是杂和散，十多年的期待落空了。
一只大鱼,5,2016-01-21 15:43:33,unknown,1,环形废墟、巴比伦彩票、通天塔图书馆、小径分叉的花园，只看目录就毋须多言。博尔赫斯用巧妙的笔法寥寥数语编制起了一座座迷宫。无限、混乱无序、偶然性、时间的错综复杂。“在大部分时间里我们并不存在；在某些时间有你而没有我；再有一些时间你我都存在…”
陆支羽,5,2021-09-22 18:40:32,unknown,4,5.0。1.历史所孕育的真理是时间的对手，事件的储存，过去的见证，现在的榜样和儆戒，未来的教训。2.根据诺斯替教派的宇宙起源学说，造物主塑造了一个红色的、站不起来的亚当；魔法师花了那么多夜晚塑造出来的梦中的亚当，同那个泥土捏的亚当一样笨拙、粗糙、原始。3.我想象出一个由迷宫组成的迷宫，一个错综复杂、生生不息的迷宫，包罗过去和将来，在某种意义上甚至牵涉到别的星球。4.在大部分时间里，我们并不存在；在某些时间，有你而没有我；在另一些时间，有我而没有你；再有一些时间，你我都存在。目前这个时刻，偶然的机会使您光临舍间；在另一个时刻，您穿过花园，发现我已死去；再在另一个时刻，我说着目前所说的话，不过我是个错误，是个幽灵。
Chaos,5,2018-03-07 17:34:44,unknown,2,就喜欢这种用简短的文字讨论终极问题的天才。
我是烟,5,2016-01-04 23:25:19,unknown,1,凭着环形废墟的最后一段都要给个满分
狂澜,3,2018-07-21 00:38:56,unknown,3,和这位伟大的图书管理员没什么缘分吧get不到大家为之疯狂的原因……
袖手人约翰,5,2016-04-21 02:36:24,unknown,1,博尔赫斯的惊艳之处倒未必在于文体，反倒是那信手拈来的狡黠背后那瑰丽的绝望。PS：对哲学专业的友邻强烈安利《特隆》这一篇。
kissdemon,NaN,2018-10-16 22:26:03,unknown,0,2018第23本。感觉被轰炸机炸了一遍，读完大脑就当机了，博尔赫斯煞介有事地胡诌的能力也太牛了吧，特别是两篇书评，这是啥，这都是啥！这种从来不写长篇，偶尔给自己想象的长篇写写书评的作者，太slay了，偶像啊！个人比较喜欢《特隆》、《环形废墟》、《小径分岔的花园》这三篇，因为比较好懂（不是
元非,4,2015-12-28 17:06:56,unknown,0,通天塔图书馆的梗被Dennett用了多少次啊……
滿君_Alex,5,2016-06-12 15:37:35,unknown,1,只用几百字，他就讲明白了时间与宇宙，真实与梦境——在一段不明确的时间里，我觉得自己抽象地领悟了这个世界——他朝火焰走去。火焰没有吞噬他的皮肉，而是不烫不灼地抚慰他，淹没了他。他宽慰地，惭愧地，害怕地知道他自己也是一个幻影，另一个人梦中的幻影。——我像图书馆里所有的人一样，年轻时也浪迹四方，寻找一本书，也许是目录的总目录；如今我视力衰退，连自己写的字几乎都看不清了，我准备在离我出生的六角形不远的地方等死——在所有的时刻，我始终感谢并钦佩博尔赫斯写作了小径分叉的花园。
血源2出了吗？,5,2017-08-03 01:34:06,unknown,0,开心
孟藻,5,2015-08-29 00:44:22,unknown,1,部分近乎荒诞的人物、设定以及故事让人莫名想到卡夫卡。博尔赫斯的涉猎之广以及想象力之丰富令人叹服。不得不说，陷入对时间与空间无尽的思考，哪怕任由自己漂向虚无，感觉也是挺好的。
毒妇脸少女心。,5,2017-11-17 15:44:19,unknown,1,一头公牛、一朵玫瑰、一场暴风雨
_,NaN,2015-12-24 00:10:49,unknown,2,看这本书的一段时间频繁的去西溪湿地散步，那儿就是我小径分岔的花园。
momo,4,2015-12-20 21:09:08,unknown,1,连着好几篇形式相仿也是有点审美疲劳…环形废墟和通天塔的图书馆不错。
Liane,3,2018-02-02 13:26:06,unknown,0,深受唯心哲学影响的纯文学作品，用现实与虚幻交替出的迷径，仿佛通向无数个可能。
簏眯矽汼,5,2018-09-05 13:18:35,unknown,1,这短篇小说集真的是太牛逼了，感觉是可以反复阅读多遍，每一篇故事都充满独特的感觉，关于时间，关于宇宙，关于多重不同的结果
茫宝,NaN,2016-04-02 21:00:07,unknown,1,博尔赫斯，坦白说，不是我的菜。从语言上说。太难了。
轻盈的云树,3,2016-03-12 11:18:03,unknown,2,Ihavereaditlikeneverread.π_π
无忌,5,2021-04-01 19:47:21,unknown,1,这是一本我看得不懂却仍然觉得牛逼的书，喜欢《环形废墟》、《通天塔图书馆》、《小径分岔的花园》这几篇魔幻语言、科学而又饱含哲理的小说。如同梵天梦中的文明、图书馆书架上无数的微型世界、小径分岔的无限诱人的未来……借由语言与讲述结构以及想象，勾勒了小说的无限可能。
momo,5,2021-01-03 20:55:57,unknown,1,他不知道（谁都不可能知道）我的无限悔恨和厌倦。
出走小凡,5,2021-04-01 18:14:29,unknown,1,我看不懂，但我大受震撼。
Anytimedarling,NaN,2021-07-13 22:00:14,unknown,1,传说的诗性代码，文字化宇宙
江寒园,3,2019-02-11 11:13:48,unknown,1,不同于传统的storyteller式的短篇小说，即以讲故事、塑造人物性格和情节为主，这里，博尔赫斯式的短篇，主要是从书里或历史缝隙构思出来的故事，更像是思考式的哲学随笔，而他的一些诗像短篇，散文则像诗。博尔赫斯笔下混杂、模糊了各文体的界限
TyuTyu,3,2016-03-02 09:35:38,unknown,1,毛搭糊浆糊弄过去了，还得定心看一遍。
Mu,3,2019-05-24 23:51:23,unknown,1,？？？？这到底是什么书？我服了完全看不明白
极地单子星,5,2018-04-06 13:50:07,unknown,3,他喜欢迷宫，一如卡尔维诺喜欢蛛网，纳博科夫喜欢蝴蝶。
李草木,4,2017-02-05 00:05:38,unknown,1,短小的一篇就能揭示整个宇宙，需要时间消化……个人喜好前3：小径分岔的花园，巴比伦彩票，环形废墟
fugue,4,2016-02-29 11:00:17,unknown,1,《特隆、乌克巴尔、奥比斯·特蒂乌斯》一篇让人豁然开朗架空的特隆是博尔赫斯对所有用药物才能强烈感知onenesswithuniverse的凡人的一剂春药《环形废墟》换了个方式讲同样的无限性和合一性不禁莞尔
阿龙,4,2020-06-04 05:08:04,unknown,1,佛了，这对我来说属于科幻类
小蓝。,5,2019-01-12 23:48:30,unknown,1,喜欢。
鲛人河,4,2020-03-29 06:55:13,unknown,1,无法理解的想象力。只记得很多年前启蒙老师对我说过“图书馆是通往宇宙之门”。
Nan.C,3,2020-06-19 08:34:52,unknown,1,总感觉有点故作神秘。以时间和空间为对象写故事中的故事，过于形而上学。也可能是翻译问题，文字可读性和流畅性极差。
🥳,5,2020-06-11 17:59:10,unknown,1,好看的特别好看，比如《环形废墟》。但是有的又很晦涩难懂，读的时候会有一种我是弱智的挫败感……总而言之是需要一定阅读量和平稳的心情才可以读进去的书。这99页纸我反反复复打开了十次才完全读完……最后实在想看，还是买点纸质书看吧看吧。对这本书的批注工作者致以最高的respect
Aray,4,2016-04-04 00:23:54,unknown,0,薄薄的一本小集子，因为题材问题（文学评论）有一半基本看不懂。
uzak,4,2018-06-02 12:06:48,unknown,1,他嘗試精確地描繪所有幻象，一場場科學家的酩酊大醉。
小屋君,4,2018-06-11 22:37:45,unknown,1,在大部分的时间里，我们并不存在；在某些时间里，有你而没有我；在另一些时间里，有我而没有你；在有一些时间，你我都存在。时间永远分岔，通向无数的将来。在某一个时刻突然发现，将来已经成了眼前的事实。\第一次读博尔赫斯，体会到了别人所说的，他的小说真的具有迷雾般的气质(´▽｀)
康师傅,4,2018-12-22 16:22:08,unknown,1,惊鸿一瞥。
haosure,5,2017-09-02 15:47:08,unknown,0,好喜欢小径分岔的花园和环形废墟其他的说实话没看懂呵呵呵
胡如隐,5,2018-05-15 22:59:30,unknown,0,写一座迷宫。
洛君,NaN,2021-01-13 20:06:06,unknown,1,深深遗憾自己没有在童年时代阅读博尔赫斯。痴长的年岁让我不由自主胡思乱想，妄图在小径分岔的花园中找到一条通往真理的道路，不能像一个天真的孩童一样全身心地沉醉在通天塔图书馆的奇伟壮阔之中。
喜欢一头牛！,4,2021-01-27 21:50:29,unknown,1,在文字和象征的游戏里晕头转向！
ca7thy,4,2017-06-26 22:16:55,unknown,2,在广州方所书架道长推荐第一本而且有点薄就买下回来读评价这么高我没想到难道大家不觉得翻译腔有点重吗。。想知道原文是啥语言。。最后一篇也就是小径分岔的花园比较赞这个故事听来好熟悉。。
叶子禾,5,2017-07-14 09:39:03,unknown,0,已被折服。
晓行夜宿,5,2020-06-20 20:51:23,unknown,2,一直被模仿，始终难超越。模仿博尔赫斯的忘了他的阅历（抖书袋式的文本也有隐蔽性，误以为博尔赫斯是书斋里的作家呢）
whiski,5,2020-12-09 16:53:13,unknown,1,在一个沉闷的工作日翻开这本书，一百出头的页数让我预想会读得轻松，然而事实却完全相反。久仰盛名，但这还是我第一次读博尔赫斯，开头让我觉得摸不着头脑，直到环形废墟惊艳了我，然后是更令人震动的巴比伦彩票，还有接下来的每一篇。原来是仅仅灵感就让人感到难以望其项背的作家。真希望能读一读特隆百科全书和那本小径分叉的花园。
manifloaterry,NaN,2019-05-10 02:11:51,unknown,1,我仍在那歧路花园里。
如雨乃可乐,5,2015-11-20 11:29:17,unknown,0,4.5星吧，标题作没前几篇好。
Owen,5,2019-10-03 21:57:40,unknown,1,从内涵来说或许博尔赫斯会更想表达的更多，但感觉还是卡尔维诺想象力、语言更为丰富优美，受限于此让其短篇于我的阅读感受不如卡尔维诺来的惊艳与震撼。——收回我的评论……是我还没够到门槛！博尔赫斯牛逼！
风独,5,2016-05-10 02:15:57,unknown,0,勾连分叉，回环往复的时空花园
索黑尔,4,2020-04-24 10:19:12,unknown,1,借用赫伯特·奎因的话：这不属于小说，只属于小说史。
午言,5,2016-11-15 20:12:27,unknown,1,还是很好很好啊，他影响了我的写作。
萝卜头,4,2020-10-21 15:00:26,unknown,0,神秘论者
