user_name,star,comment_time,geo_ip,vote,short
Rebel Scum,5,2020-07-19 12:19:06,unknown,0,标题作品说是侦探小说还真的是侦探小说。这才是subvertingexpectations的正确写法啊，早早摊牌，结尾来时猝不及防又余音绕梁。巴比伦彩票、图书馆、梦中人和分叉，都是读完让人意犹未尽的作品。命运、时空和宇宙规则的具象化探讨，没有枯燥的学术辞藻，而是想象力的细致展现，就这样秀出了生动又严谨的结构。虚构书评也许是作者本人就叙事和创作与自己对话吧。这种写作过程一定非常有趣。
做个犬儒就挺好,4,2019-10-10 17:40:38,unknown,1,博尔赫斯和卡尔维诺，太欺负人了！
否枝裕和,5,2020-01-10 15:38:46,unknown,1,卡尔维诺曾经在1972年虚构了许多用女子名字命名的城市，他说自己和哲学家不同之处在于，自己只遵循故事的内在逻辑。还说：“现代文学的力量就在于它说出了社会和个人本来想说而又没有意识到的一切，这就是文学所不断提出的挑战。我们住的房子越是明亮和豪华，房子的墙上就越有鬼影；因为进步和理性的梦中往往掺杂着鬼影。”而在此之前，博尔赫斯已经虚构一个地名，那个照出虚幻影像的镜子又无所不在，在那些莫须有的文本迷宫中，迈出自己探索的脚步。我们不去说过去存在或者今后将有的不称其为模仿的异曲同工，只说那是天才特有的禀赋。
齐物,3,2019-12-08 17:17:19,unknown,2,我真的是get不到博尔赫斯，也只有小径分岔的花园这一篇有点意思，剩下环形废墟和通天塔图书馆还不错，别的让人无语凝噎，可能我还没到能看懂它的年纪吧🌝总之，博尔赫斯热衷于一个无限递归的宇宙，一个薛定谔的宇宙，真想跪着求求他去搞量子物理，搞文学真是屈才了，这种物理，天文，生物，哲学交汇的高深领域，靠感性及主观思考能说明白吗？可能我也是被唯物主义科学教给戕害了吧。
豆友36544164,5,2018-01-10 21:22:19,unknown,0,无拘无束的想象力塑造出的充满禁忌和神秘的可爱的宇宙…虽然有两篇伪考据没看懂。。。
马扎罗,4,2017-05-08 17:18:07,unknown,1,阿乙老师给了五星好评并且评论“有四篇没看懂”，我也差不多。最后一篇著名的短篇竟然是中国人做主角，然而没太懂。
肉肉子🥛,3,2019-11-04 12:44:17,unknown,1,第二本博尔赫斯，我真的接受无力……可以读出博尔赫斯的思想深刻，但他的文字对我来说过于天马行空了，浅薄如我，不行不行。
半个半个,5,2018-04-18 03:02:07,unknown,1,一口气读完，最爱《特隆、乌克巴尔、奥比斯·特蒂乌斯》《环形废墟》《小径分岔的花园》，排名分前后。感觉活动到大脑一些平时未开发，不会用到的区域，目前体验过的有这些区域：日常，冥想，读博尔赫斯
林林酱,5,2019-11-10 11:41:28,unknown,1,博尔赫斯真是沉醉于迷宫、乱序及对无限的思考，整个宇宙不过是重重叠叠的象征。《小径分岔的花园》反倒是这次读最好进入的一篇，时间的分岔确实是迷人的，此刻，过去，将来，无数可能性及无数的我们交织成一个无限的宇宙。另外《巴比伦彩票》的隐喻也很有趣。
公子燕婉,4,2019-11-04 22:43:17,unknown,1,对不起，我不配读博尔赫斯，太难了，作为读者真的太难了。除了花园外，其他就真是看不懂。我真怕是读了个假的博尔赫斯。
曹白宇,5,2019-11-21 14:23:14,unknown,1,啊，这本小册子，大概是这十年里的第三遍读了。少时以为是异想小说，读书时认为是对文学的隐喻，现在则感觉是博尔赫斯通过虚幻构筑真实的私人哲学。《环形废墟》是一个能对人文学观产生极大震撼的短篇。不仅是一个阿拉伯式的自我指涉故事，而是展示了一种通过语言、想象、逻辑无中生有的可能，且这种虚假的真实是可以自我复制的。这是一种令人战栗的隐喻，洞穴之影的价值竟然与真实世界等同。《通天塔图书馆》中包含一切的文本宇宙和《小径分叉的花园》里无数重叠交汇的时空，很有点科幻小说的意思。博尔赫斯的知识结构究竟是怎样的？大概是一种很精美的存在吧。唯一的遗憾是博氏本身是个诗人，很难想象他的作品在语言上没有诗性。经过翻译，这种音韵的调配大概是不会得到完整的传达。但这个中文版本已经是非常不错了！
mno,4,2021-01-28 01:21:05,unknown,1,每篇都是读一会要往前翻翻再读一遍感觉一直飘着还得再读
爱丽斯提亚,5,2018-07-12 15:26:45,unknown,1,感谢本书，让我见到世界除辩证唯物主义之外美妙而令人惊叹的无限可能。仅有99页的短篇集，读之却如洞见一个浩瀚宇宙，博尔赫斯眼中的无限、偶然、不断增值的宇宙，藏于看似语焉不详的文字迷宫中，不懂的人路过高墙不知其意，而愿者自会留恋于他精妙的虚构世界，他的混乱巴比伦、他的环形废墟、他的巴别图书馆、他小径分叉的花园。遑论什么故作高深，最高级的谜题，愈是讳莫如深，解开的过程和窥见真相一角时的愉悦愈是无可比拟。
Sebastian,5,2018-11-22 00:03:51,unknown,1,理解博尔赫斯的过程将非常艰难…
你也偷吻月亮嗎,5,2020-01-12 17:17:00,unknown,1,还是读得晕乎乎的…
绝望的麦子,5,2018-12-22 15:56:09,unknown,1,博尔赫斯写了一座迷宫
無機酸,4,2020-11-03 17:11:45,unknown,2,三次，尝试三次终于读完了……HaroldBloom说阅读博尔赫斯越多，你（的写作）也会越来越接近博尔赫斯。我只能说，天下没有免费的午餐哈！
串串摊老板娘,4,2020-04-30 23:22:58,unknown,1,宇宙是一门玄学，博尔赫斯欺负我。“总有一只猴子能在打字机上敲出哈姆雷特，总有一个你能在小径分岔的花园里终生幸福。”
踏歌,NaN,2017-04-15 08:56:25,unknown,1,不会打分……希望我八十岁的时候能读懂博尔赫斯，捂脸哭
黄海,4,2020-11-29 17:12:20,unknown,1,博尔赫斯一生都在质疑、推翻、试图重构宇宙万物的秩序，因此造物主最终剥夺了他那双映射外界的眼睛，然而失明后的博尔赫斯所能看见的东西却比过去更多了。
Niki_白酱,5,2020-09-03 16:54:39,unknown,1,“美的事物不能没有惊奇的因素，从回忆中得到惊奇则很困难。”而这本就完全是想象力爆表，短小的篇幅里就可以构建一个完整的世界观，对空间，时间的无限想象，错综复杂，混沌杂乱中又秩序井然，太牛逼了#以及我严重怀疑诺兰是熟读博尔赫斯的#
nëdm,4,2018-05-18 21:46:53,unknown,1,如果一位小说家感到灵感匮乏，那不妨去读读博尔赫斯。
一时开不得口,4,2019-11-01 17:16:21,unknown,1,无数次看了开头，一直没有看完，写得很好，肯定够五星。但不喜欢他疏离的态度，只是思考，从不行动，在我的文学里，他是低于卡夫卡的那一类人。
小偷|隐忍沉定,3,2016-06-09 04:03:33,unknown,0,实体，米兰|为时间洒下的密语，为谜语塑造的谎言，纸张太重，浪费
AhFloyd,4,2017-03-18 17:28:25,unknown,1,镜子。迷宫。图书馆。无限。永恒。道路。梦境。时间与空间。周而复始。“一个人可以成为别人的仇敌，成为别人一个时期的仇敌，但不能成为一个地区、萤火虫、字句、花园、水流和风的仇敌。”
碎,5,2021-06-25 17:46:56,unknown,1,通天塔图书馆很有意思，像是隐喻人生和世界。书里有很多关于时间、无限的讨论，还有一些比较晦涩的借代，读起来很难理解。总的来说，读这本书需要一定的专业知识，而且需要多读几遍。（谁说文学家不懂物理呢？谁说文学家不能讨论研究时间永恒，生死是否无限，平行宇宙呢？）
北隈,4,2021-01-07 23:52:41,unknown,1,相当愉悦，五六年没这么愉快过了。如果没有布拉德雷与罗素这种名字，会更愉悦。喜欢环形废墟那一篇。
jdxyw,5,2015-10-16 17:04:43,unknown,1,这是要出博尔赫斯全集的节奏啊╭(╯^╰)╮
班斯特人,NaN,2019-10-09 19:40:48,unknown,1,博尔赫斯痴迷于元小说，将一些抽象概念（如无限、循环）给具体化。如果说要从博尔赫斯的作品中获得快感，那一定不是传统意义上的戏剧性的快感，而是一种思维碰撞后的惊异与新奇感
Reading King,5,2021-06-30 11:49:02,unknown,2,西方哲学功底很差的人，是永远读不懂博尔赫斯的。
古木凝,5,2021-07-01 21:27:48,unknown,1,循环无限与虚构的极致
阿朱,5,2021-07-17 17:09:54,unknown,1,很奇异他用文字勾勒出文学里的数学，无比晦涩的阅读过程，终于在每篇的某一行或最后一句感受到如解出难题后由衷赞叹数学之美的极致通透。为最后一篇怒打五星，文学作品之不朽在于，它在有限中描绘了无垠。
健康无公害战狼,5,2021-07-16 22:19:07,unknown,1,学了一年数学分析以后，（奇迹般地）可以读了
💫,5,2021-07-17 02:25:19,unknown,1,没怎么看懂，但我大受震撼，甚至想把博尔赫斯全集买来看。《特隆》用一元论和唯心主义构建了一个新的国家，哲学基础不够，没太懂。《吉诃德》有点解构主义的意味，也没太懂。《环形废墟》将真实与梦境有意颠倒，探讨存在问题，最后展现存在的虚无并让读者落入循环的圈套中。《巴比伦彩票》是一个象征和隐喻，讽刺人类社会政治。《赫伯特·奎因》和最后一篇有点关联，都讨论了无限、循环和迷宫，像一个文学游戏。《通天塔图书馆》以六角形图书馆为世界本体，其中的几何学和语言学问题很迷人。《小径分叉的花园》指出时间像分叉的小径，由此衍生出一个个平行宇宙，让我想到了《星际穿越》。这篇拍成电影一定一定很绝。博尔赫斯和卡尔维诺有一点点像，他们都擅长以简洁优美的文字，怪诞神秘的比喻或故事诠释存在与时间，读几遍都不为过。
xx,5,2021-05-10 11:16:42,unknown,1,我愿意称之为：“我读不懂但我大为震撼”系列
敬🌿,5,2020-08-07 10:43:55,unknown,1,“在大部分时间里，我们并不存在；在某些时间，有你而没有我；在另一些时间，有我而没有你；再有一些时间，你我都存在。目前这个时刻，偶然的机会使您光临舍间；在另一个时刻，您穿过花园，发现我已死去；再在另一个时刻，我说着目前所说的话，不过我是个错误，是个幽灵。”
卷微,4,2021-06-05 11:57:12,unknown,1,在复习过程中又抽了一个小时……像在读精缩版《s》和《哈扎尔辞典》，整体的阅读感受也很像《百年孤独》。不知道句式繁冗和人名奇长是不是幻想文学的共性。可能是热忱下降吧，对于读起来比尼采或者叔本华的哲学还费劲的文学作品，确实没什么耐性品读。
依艺义,5,2021-05-10 23:07:25,unknown,1,我看不懂，但我大受震撼。
卢墨,4,2016-11-01 15:16:24,unknown,1,不是太喜欢这种玄学意味特别重的小说…虽然《小径分岔的花园》《环形废墟》《巴比伦彩票》确实很妙
Macadamia,4,2021-05-20 16:50:56,unknown,1,当一个人觉得自己看懂了这本书那他就一定没有看懂但是这不妨碍我喜欢里面的每个故事
zzzzzzzzyc,4,2021-06-14 09:32:57,unknown,1,打卡《小径分岔的花园》2021.06.04-2021.06.14没怎么看懂但是觉得很厉害的书，寥寥四万字包罗天地宇宙的感觉。环形废墟、巴比伦彩票、小径分岔的花园是比较喜欢的几篇，环形废墟中的循环和延续，巴比伦彩票中的讽刺和荒诞都让人叫绝，喜欢小径分岔的花园是因为故事性相对较强，作者在序言中说这是一篇侦探小说，但我觉得侦探部分倒不是重点，而是在古典形式下阐述关于时间的平行与交汇。
一颗呆西瓜🍉,5,2020-12-29 00:33:13,unknown,1,这本书的存在充分证明了我的无知和浅薄。这本短篇小说集既神学又科幻。最后一文，把时间外化成迷宫的处理简直太魔幻了！无与伦比的想象力。
来一锅,5,2021-04-27 10:42:09,unknown,1,时间是个圈
Orange,4,2015-07-31 08:07:10,unknown,1,看得出，博尔赫斯对国内作家的影响有多大！虽然这本书只有7篇短篇小说，但是真的很难看懂啊！！！！！
aix,4,2019-10-17 03:53:03,unknown,1,感觉是《RickandMorty》剧本的原型...文学地解释递归/概率/平行世界/时空的一致性
柳薦棉,5,2020-11-29 19:59:31,unknown,1,实在是天才之作。巴比伦彩票和小径分岔的花园在不同层面上都极具启发。伪评论作品最喜欢奎因一篇，玩梗令人忍俊不禁，而一些点到为止的创意却不禁让人震慑于超越时代的天才感。
叫我妖而不孽,5,2018-07-05 11:15:20,unknown,1,典型的文学幻想小说，我觉得尝试释读这样的小说都是白花力气，不如找寻给你片刻的感悟就行了。文章虽短，动辄包容宇宙。这就是博尔赫斯。
Y,3,2016-05-02 11:14:03,unknown,1,同名确实有点意思其他就麻麻了
老衲经常梳头,5,2021-03-13 21:02:40,unknown,1,七篇小说，分别探讨了宇宙的混乱、创作的偶然性、梦境的嵌套、秩序的随机性、创新与模仿、世界的无序和有序、平行宇宙和时间。在大段晦涩的人物描写和情节铺叙之后，逐渐把你引入作者布下的迷局，再极其隐晦地给你指明出路，如果你能领会其中意图，就会看到走出迷局的希望，而在出口等待你的是宇宙的奥义。
花点子,4,2016-06-15 10:08:40,unknown,0,迷宫一样的文字……
