user_name,star,comment_time,geo_ip,vote,short
C,5,2015-11-19 22:15:26,unknown,3418,刘慈欣用百万字写三体，告诉我们宇宙是什么，时间是什么，博尔赫斯用几百字就做到了。
小城就好,5,2015-08-04 23:42:22,unknown,998,总有一只猴子能在打字机上敲出哈姆雷特，总有一个你能在小径分岔的花园里终生幸福。在文字领域与玄妙事物领域间的跨境，只有大师才能做到如此潇洒不羁。【从今天起，请给我“读过博尔赫斯”之标签。
非想,4,2015-09-04 13:20:29,unknown,779,博尔赫斯在此部小说集中明显的反映出自身的创作主旨：形而上学。以玄学来揣度人、宇宙本质的奇妙可能。是亚里士多德古代哲学的反照，重认识轻实践，这放在文学中开脱写作空间，而不是放在科学应用中也未尝不可。《小径分叉的花园》以伏笔、前后呼应来展现”因果律“的无常之妙。《特隆、乌克巴尔、奥比斯·特蒂乌斯》创造了一个奇特的唯心主义宇宙观，《通天塔图书馆》把书籍作为宇宙”本体论“的根源，幻想出六角形图书馆的无限空间科幻奇观。《环形废墟》把存在、自由意志、梦、灵魂放入循环悖论中，讲了一个迷雾重重的反转奇闻。《巴比伦彩票》和《凤凰教派》把人类社会隐喻在赌博、不宣之秘中，映射资本融资、集权、社会潜规则。博尔赫斯的短篇非常难读，很多内容无法参透而且有多种解读可能，花了很久才读完，阅读过程中既艰难又有趣。
江绪林,3,2015-09-16 00:44:44,unknown,670,不明白为何评分这么高。只有“通天塔图书馆”这一篇让我眼前一亮，因为自己也曾经想过有限的字母进行无限书写可以预先把一切发生的事情都叙述出来的问题。“小径分叉的花园”这篇比较巧妙。但整个而言，设计的情节都有点在讨论无限性或可能性问题（而似乎缺少微积分和分析方法），注重形式，这里博尔赫斯的灵魂是苍老的，仿佛从来没有自己的过去和年轻时刻似的。没有捕捉到青春的激情、也没有为什么灵感而惊诧。这里博尔赫斯似乎不属于自己，像个世纪老人一样属于人类，在那些陈旧的窗棂上重复着那古旧的打扫。
夏天。,4,2016-03-12 16:22:57,unknown,501,姑娘们追一部韩剧换一个老公，我是翻一本书换一个男神……
苦杏仁的气味,2,2015-12-22 23:00:41,unknown,265,读博尔赫斯给我的启示是，当别人都说好时，不要着急跟上去，它真的不一定适合你。抱歉，如果天堂真的是图书馆的样子，至少我们的不是一家。
江凌,5,2016-07-08 15:20:45,unknown,169,读天才的作家写出来的东西，只觉得宝马扬灰，一生也难望其项背。
拥抱,4,2015-09-02 14:47:47,unknown,184,我的智商或许不太够用？
宽松睡裤又如何,5,2017-04-03 18:54:33,unknown,129,博尔赫斯数学一定很好吧。
如来,5,2015-09-07 16:47:39,unknown,94,小径分岔的花园，通天塔图书馆，环形废墟，巴比伦彩票，真好。这套书有利有弊，装帧不算不用心，陆智昌设计，但放在博尔赫斯上，就显得不够配了，起码得有加缪文集那种规格才行。这批是全集第一辑，17本还欠一本文稿拾零，据说一共四十几本，最薄最便宜的都23一本，不能不说有“骗钱”成份，再考虑到未来可能再出硬壳精装，深坑，愿者入坑。
DaVinci's bug,5,2015-10-30 00:22:51,unknown,120,我操，博尔赫斯太厉害了，100页的短篇小说集把我弄得心烦气躁，想死的心情都有！读这本的感觉和《恶棍列传》完全不一样，非常恐怖，是一种被吓死的感觉！
欢乐分裂,4,2016-10-06 16:29:31,unknown,79,4.5；博尔赫斯自创的宇宙可以通过梦境、镜子、迷宫、卷轴或词源无限复制、繁衍，永无尽头，永无休止，如恒河沙数，包罗万象，这是一个超越时空的星球，它往往隐匿于某个球体、一本书或一座微雕，以一片树叶的姿态藏于树林，参悟其道即可澄清人类奥秘；他热爱以梦模拟、塑造现实，以想象产生现实，梦是通往/影响/改变现实的途径；他的时间观足以成为记忆碎片盗梦空间的范本。
小了,5,2015-08-16 21:50:01,unknown,74,记得某文青评论道：一本正经地胡说八道。再读依然很惊艳。
TISA,5,2018-01-19 23:45:03,unknown,72,一共7个短篇，建议倒着读
不流ᝰ,4,2019-01-12 09:19:37,unknown,64,《特隆》设定覆盖整个世界的世界，《吉诃德》设定覆盖塞万提斯的梅纳尔，《通天塔》设定覆盖字母所有排列的图书馆，《废墟》设定梦中人覆盖梦者的回环，《赫伯特》设定覆盖推理小说的小说，《小径》设定覆盖所有人生的花园，四十岁左右的博尔赫斯，借助庞杂阅读和聪明的头脑，仿佛没有年龄的约等于人类规则的代言人，简短的书写透露着庞大的野心，高超的技巧掩盖着情感的不足。十几年后重读，和十几年前巧然都在《巴比伦彩票》这篇时处于疲惫犯困，这篇便又像一片擦过梦境的模糊的小小烟云般滑过去了。已没有当年的震撼，对过于精妙的雕刻有了一点厌倦，但不是博尔赫斯的问题，是我自己的问题，他已经足够伟大了。
W,NaN,2016-04-28 15:17:11,unknown,43,P37的翻译或校对有问题
孟冬,5,2017-04-12 23:18:05,unknown,43,最后两个故事五星。在第五个故事中，博尔赫斯说文学所能提供的种种幸福感中，最高级的是创新。许多人只能满足于模仿，这样的作家数目很多。于是在这本小书里我们看到他似乎就是在追求这种文学的最高幸福——创新。他在创造一种空间，进行永恒的演绎。前五个故事远不如后两个精彩。在《通天塔图书馆》中，你会有一种跟着文字偏离现状，进入另一空间的感觉。而《小径分叉的花园》则是七个故事的最后升华，他一直在探讨深不可测的时间，时间又是怎样在书籍阅读的过程中发生分岔，怎样延续，怎样循环，怎样成为永恒。时间是最大的谜底，太迷人了。
Sarcophagus,5,2017-06-24 05:26:46,unknown,40,“……人类行将灭绝，而图书馆将会存在下去：青灯孤照，无限无动，藏有珍本，默默无闻，无用而不败坏。”——《通天塔图书馆》；“由互相靠拢、分歧、交错或者永远互不干扰的时间织就的网络包含了所有的可能性。……时间永远分岔，通向无数的将来。”——《小径分叉的花园》
blackboy666,5,2017-04-09 10:40:56,unknown,67,博尔赫斯不是在写作，而是在解构旧世界，重建新的宇宙秩序。很多精致的构思和细节让人觉得诧异。甚至可以发现很多导演的思路都借鉴于此，尤其是环形废墟，通天塔图书馆这两章。在模糊的情节叙述中，读来有点恐惧，生怕那支笔不留神捅破了生活世界的界限。对宏观秩序之思并无止境，寥寥几笔确似包揽万物
mt,2,2018-07-20 23:27:03,unknown,74,文学家在讨论时间，无限等问题时，应该辅以文笔，剧情，幽默或者幻想。空洞的探讨和浅显的发散导致文字既没有文学的美感，又没有哲学的美感。在无限的问题上，几十页的文字带给人的美感完全不及几个数学公式。7个短篇只有后两个稍具可读性，99页的书买到20多块，从各方面看都没什么推荐价值
加州没有雨,4,2020-05-20 05:57:04,unknown,78,镜子和男女交媾是可憎的，因为它们使人的数目倍增。
匪有韭无赚梁皇,3,2016-05-17 10:21:05,unknown,26,不是我的菜...翻译似乎也有点问题。重读《小径分岔的花园》，不如以前在高中看语文选读课本带劲了。
一粒傻兔,4,2020-02-01 22:44:31,unknown,65,我越读博尔赫斯越觉得自己是辣鸡，因为我根本看不懂，我是废物.jpg
ecstasyyyyyyyy,5,2016-01-18 20:05:58,unknown,0,
虫虫,5,2017-06-15 23:05:07,unknown,35,意犹未尽，发现博尔赫斯就像发现爱情，发现大海一样。
深邃,5,2018-12-10 18:29:24,unknown,33,诺兰曾接受采访表示自己很喜欢博尔赫斯的文学，看完这本书觉得自己也想去做诺兰了。
万有引力之后,NaN,2015-08-12 13:11:57,unknown,21,这里的作品是纯文学性的，其构筑的影像世界异常华丽而丰富，它本身就是座无限的图书馆、花园、迷宫。
成知默,4,2016-01-03 10:19:07,unknown,14,2016年已读001：博尔赫斯的故事不在空间中展开，而在时间中延续，他将这些关于时间的、支离破碎的梦境编织成一个个庞大的谜语，在这些背离的、汇合的和平行的时间里，当下无法确定，过去与未来也并不真实。“在大部分时间里，我们并不存在；在某些时间，有你而没有我；在另一些时间，有我而没有你；再有一些时间，你我都存在。目前这个时刻，偶然的机会使您光临舍间；在另一个时刻，您穿过花园，发现我已死去；再在另一个时刻，我说着目前所说的话，不过我是个错误，是个幽灵”。
局外人,3,2019-07-14 15:44:19,unknown,70,博尔赫斯最难读的一本，全都是中文但连起来不知道在讲什么的典范
WINGWING,4,2018-11-06 19:38:32,unknown,37,似懂非懂，很难读，这样的难不是句法和文化差异造成的难，而是叙述和精神内容造成的困难。读书确实是一件有门槛的事，要从博尔赫斯如轮回般的叙事方式和形而上学的故事内核中悟得真义，真的需要阅读上的积累和思辨。
Alain,5,2016-06-02 01:39:48,unknown,28,开头两篇实在是没法认真读下去，这是过滤掉没有耐心的读者吗？好在翻到后面渐入佳境，从最短小易懂的《环形废墟》开始（即使这样也读了五六遍），然后是《通天塔图书馆》和《小径分叉的花园》，特别喜欢。
亲爱的猥琐猪,5,2015-08-28 13:03:43,unknown,21,难得的每一篇都相当精彩的短文集。博尔赫斯和卡尔维诺是少数发现虚实文学交融地带的冒险家。以前读博尔赫斯，能被外秀内坚的文字吸引，也由于一种和卡尔维诺相似的世界观而不觉陌生，不过总难以理解具体段落。现在意识到博尔赫斯更像在写哲幻，以为笔下是历史，其实描述的是未来。《环形废墟》是人类对自身存在起源的唯心倾向戏谑探讨，但火的想法取自赫拉克利特？《通天塔图书馆》是对宇宙成因的叩问，其中列出多个流派，从中我似乎读到了随机无序论，现象学，唯理论，以及永恒回归。《小径分叉》则满足了之前所有对本篇保持的期待与妄想，也和通天塔一样，再次用书解决一切。剩下的几个虚构世界虚构书籍虚构作者（连奎因也不放过！）的故事也各成趣味。已经很久没碰到一本篇篇水准都很高的短篇小说集了，这是一场久违的甘霖。
晚不安,5,2017-12-10 00:38:05,unknown,11,博尔赫斯毋庸置疑是一个天才，极尽小说的各种形式探索未知之境。令人吃惊的还有他的博闻强识，文学、历史、哲学、社会学似乎无所不知。我目瞪口呆地置身于这个极端简洁又极端复杂的时间迷宫，感到自己的认知经历无数次崩塌和重组。他的小说仿佛也包含所有可能性，一遍匆匆读完，觉得有无限细节被自己忽略，但阅读他、走进他无疑也是艰难的路程。
杜鹏,5,2016-06-13 17:37:38,unknown,18,科学尽头是神学神学尽头是玄学
春花,5,2018-02-13 20:47:45,unknown,17,“在文学所能提供的种种幸福感中间，最高级的是创新”博尔赫斯即是如此在践行。此处是深坑，慎入。
麦克默多的浮冰,5,2019-04-12 14:09:42,unknown,16,故事的绝对虚构与细节的极端真实。这部集子里似乎所有小说都可以视为元小说，而这只是迷宫的一种理解方式。《特隆、乌克巴尔、奥比斯·特蒂乌斯》：谁发明了特隆？谁发明了小说？“那是虚幻世界对真实世界的第一次侵入。”最喜欢《环形废墟》这一篇：向上庄周梦蝶，向下格非的《锦瑟》。它们和《环形废墟》之间，也是父子相承的环形废墟。《巴比伦彩票》：在繁复的变形后，某事件重要的不再是结果，而是如何设计过程。这一过程不断延异……《小径分叉的花园》一篇主人公竟是中国人。（除了《锦瑟》，又一处被格非模仿的细节：“设一个谜底是棋的谜语时，谜面唯一不准用的字是什么？”“棋字。”《褐色鸟群》中那个叫“棋”的女人，整部小说都在逃离故事的真相……）这区区一百页的小说可以读到八十岁。读过这本，终于可以说，“我读过博尔赫斯”。
曹璇君,5,2015-08-12 11:30:24,unknown,10,喜欢环形废墟和小径分岔的花园，文字和迷宫一样，探索着宣泄的出口。
布卤,3,2019-08-04 15:33:19,unknown,19,数学不及格的人没法看这本书。读的时候我总想起我那高智商的同桌，他总是在一道题下面直接给答案或者顶多来几个大家根本看不懂的步骤然后得出结论。每次我惊讶地问他是不是偷看了答案的时候他总说，他已经经过了一系列严密推理，然后他开始讲，我一句也听不懂，他觉得奇怪，不是很清楚明白吗？我一直觉得我和这样的人不是一个维度的生物。或许博尔赫斯，是宇宙中那颗洞悉神秘的多维生物。
魚俄尼索斯,5,2018-06-10 21:21:33,unknown,8,通天塔图书馆和沙之书像是镜像一样的作品，关于图书馆与书超越空间的无限性(是博尔赫斯对于书籍与图书馆的礼赞)。环形废墟是关于造梦者与做梦者之间的无限嵌套。巴比伦彩票是概率上的混沌与无限。小径分叉的花园是将时间从小说情节中抽离出来，建造出迷宫一样的无限。感觉博尔赫斯的小说里往往都是互文的，因为主题本身是确定而永恒的。
엘라노,5,2019-04-30 19:13:47,unknown,8,之前粗读了整本的文集，第一次读这个版本一些拙见:最喜欢《小径分叉的花园》和《巴别塔图书馆》。在我想象中远观巴别塔图书馆应该是在一个二维的圆形中，借助六边形独特的结构嵌套而恰好严丝合缝。但近观确是埃舍尔式的视错觉，所有图书馆建立在一个三维的球体内，图书馆依然借助结构严丝合缝，但结构错综复杂，从不同角度观看，每一个图书馆相邻的都不尽相同，从一个图书馆可以直接通向另一个与其毫不相干的图书馆。而在《小径分叉的花园》中博尔赫斯并没有说时间是一维的，而是说它联结成一张网。或许他想要将这张网铺陈在球体内，将人类安放在每一个时间的节点上，让所有的文明共生沟通产生羁绊。挣脱时空的束缚，会发现沧海桑田不过白驹过隙，古往今来不过是弹指间时空的轮回，所有的秘密仅仅囿于这一百页之中，却又像沙之书一般取之不尽。
调反唱唱,4,2015-09-10 22:09:45,unknown,11,最喜欢《环形废墟》
张震老婆（V）,4,2020-06-08 14:54:41,unknown,16,《环形废墟》、《通天塔图书馆》和《小径分叉的花园》我还勉强能够得到一些，其他的的确是看不懂，极其可能是因为我实在不行，所以谈不上多喜欢这样的小说。
強子機器劉威廉,4,2015-09-04 20:57:35,unknown,7,和博老先生神交已久，但是未展卷相逢，原因在于老头儿的书已绝版。有那么一种现象是必定会发生的：经典的出版物会隔个十年或者二十年又或者三十年再版，就像猫头鹰的麦克卢汉的《认识媒体》，我想左岸的阿伦特也快再版了吧。博老师就是那么一种情况，从这一本开始，或许也算读过点书，所以博老师的想象力也不算那么惊人了，但是，要把老爷爷读完的念想确实在得知再版的消息后早就出产了的。
内陆飞鱼,4,2018-06-08 16:25:34,unknown,9,窗外还是惯常的房顶和下午六点钟被云遮掩的太阳。
渡边,3,2017-12-08 10:59:16,unknown,13,重读之下兴味索然，博尔赫斯没有变，变的是自己的意趣罢了。
祝羽捷,4,2021-02-04 15:16:51,unknown,14,一个人可以成为别人的仇敌，成为别人一个时期的重叠，但不能成为一个地区、萤火虫、字句、花园、水流和风的仇敌。
神经衰弱的猫,5,2021-05-12 22:23:37,unknown,13,明白他被好些学者所喜欢的原因了，看他的小说都会有种被他流露出的智识所压迫的感觉。
安德烈大叔,5,2019-02-22 23:40:26,unknown,14,不可言传，只要能克服第一遍阅读时冲击而来的挫败感与错愕，第二遍阅读之时，博尔赫斯将带你走进迷宫，在虚实之间感受无限。而在第三遍阅读之后，你将重复第一遍阅读时的惊愕，然后默默伏地不起。百年文坛，唯有博尔赫斯能称得上是突破性的。
史太,4,2016-01-26 19:10:30,unknown,6,對於博粉，前兩篇大概在告訴你：您好，我是博爾赫斯——以一種溫和而滄桑的語氣。相比于詩歌，小說更不容易做整體把握，那種多個時空的線索和一種構建元小說的嘗試，促使讀者只能從細節開始——必須用讀詩的方式去讀，哪怕只是這幾個字：“三十冊書中間的一本裡面”。不論詩歌小說，博也總要告誡讀者：某些東西是混雜在一塊的，而你必須跳出我的小說。他的詩歌小說總是引向外部，而外部又回到小說內部。五年前，我過早的讀完了博全集，並發現往後的小說許多都是在重複和重疊，就像他自己那些不斷重複的意象一樣：迷宮、圖書館、塞萬提斯、萊布尼茨等等。總之，任何初讀者能夠感受到的很少，因為這些小說的誕生意味著它們是只能被重讀的作品。
大秦在逃兵马俑,5,2017-03-01 10:57:35,unknown,11,终篇之后有三页的空白，那也是我读后的感受。。我得静静。
寂地,5,2018-12-27 20:22:46,unknown,7,用文字制造一个星球，在记忆模糊的时候渐渐被摧毁。
宋雯婷,5,2019-07-19 23:39:01,unknown,7,博尔赫斯也没什么了不起的，只不过就是写出了无限。
向河梁回头万里,5,2018-07-11 01:02:56,unknown,5,岂是语言炼金术所能概括的？岂是无趣的学者们用玄学、形而上学所能概括的？岂是所有短评长评所能概括的？……呀！老博简直是被源始神秘拣选中的独一子嗣，环形废墟中孕育着下一朵火的幻影，在板结的日常语言的裂隙中腾挪旋舞出宇宙般的奥秘与诗性……同样可以这样祝祷呢，“它掀起的风暴并非起因于某个世纪，它来自远古，臻于完成，此一完成如同所有的完成一样，又归于远古。”
诺 诺,4,2017-05-03 16:40:15,unknown,5,我真前前后后读了三遍(̥́ˍ̀ू)…晕了好几次，像是走进了一个虚幻的迷宫，原来小说还可以这么写，佩服…博尔赫斯对于时间的诠释很独特：时间永远分叉，通向无数的未来。（读到最后一篇才明了：最庞大的谜底原来是时间。||最喜欢《环形废墟》&《小径分叉的花园》。《巴比伦彩票》至今还有点迷糊，寓意命运的不可捉摸随机偶然性？？———还会再重读。【博尔赫斯全集第二本】
象木耳朵,3,2020-02-01 14:15:27,unknown,9,就没人说实话，这本书真的不好看吗？故弄玄虚真的好吗？也许他的书本来就不是给别人看的。看不懂看不懂，我还是太浅薄了……
晓林子悦,4,2016-10-30 07:01:09,unknown,6,喜欢环形废墟、图书馆和花园三篇。对时间的诠释很奇妙，探讨书写的多种可能性。其他无感。
黄意,4,2021-04-07 08:49:25,unknown,7,博尔赫斯的文字像藤蔓一般在复杂的时空里生长、延绵。可能在大部分时间里，我们并没有读过博尔赫斯；在另一些时间里，我们又读过了博尔赫斯；再有一些时间里，我们既读过、又没读过博尔赫斯。
甘草披萨,5,2016-03-05 23:42:46,unknown,5,想象力与哲思交相辉映的作品，语言洗练机敏，独出机杼，细思诡谲，背脊发凉，隐隐觉着是好些科幻片的思想源头
ayi,5,2016-04-27 20:54:38,unknown,4,有四篇没读懂。对《小》已有倦意。
大奇特(Grinch),4,2019-12-24 15:02:45,unknown,3,环形废墟小径分岔的花园
artpopping42,5,2017-05-20 22:17:43,unknown,9,与一些故事相逢过早的后果是：我要么怀疑自己的智商，要么怀疑世界的基本构成
失意的孩子,3,2016-08-25 17:02:15,unknown,5,此集如此之短实乃始料未及，然而短中却构建了多个不同却又合为一体的博氏宇宙。其中最喜欢或者说只喜欢【环形废墟】与【小径分岔的花园】，时间不逝，圆圈不圆，如今已经烂大街，但在作者神秘的笔下却给人一种难以言喻的奇妙感觉，有如在思想的混沌里撒下魔法的作料。至于其他我越看越觉得没意思的文章里，唯【巴比伦彩票】和【通天塔图书馆】所构造的世界还算有点意思。
玻璃渣,5,2019-03-28 00:32:04,unknown,4,有的部分繁复神秘而美丽。但正如过于具体的拟声不是高级的作曲手法，博尔赫斯也如他小径分叉的花园中所说，在笨拙地绕过谜底。但把朴素的哲学观点投射的如此恢宏又精巧，真的非常震惊。第一次读博尔赫斯，觉得太早又太晚。
虾坨坨艺仔,3,2017-01-05 00:11:16,unknown,4,小径分叉的花园，彗星来的那一夜。
如意吉祥,3,2017-06-26 18:02:27,unknown,6,文学形式的重要性丝毫不亚于文学的内涵，就如李商隐的诗歌，就算你不知道他说什么，依然觉得其诗歌美得不可方物。博氏的小说相当晦涩难懂，我没感觉到美，也不想费力索解，只觉得文学不应如此枯燥的。幸好博氏的拥趸没有亦步亦趋，格非从中借鉴了时间交错、迷宫般的描述方法，在当代文学界也算独树一帜
玲自体,5,2020-05-06 15:56:07,unknown,3,时隔四年再读博尔赫斯，依然是震惊，除文本本身的无限，个人阅历也帮助它散发了魔力。啊，博尔赫斯，精致的阴森，冷酷的数学，时间：瞬间击毙。他是我认为少有的小说哲学化而完全谈不上卖弄和粗制滥造的。这就是发明和创造，哲学的理念和逻辑早于哲学这个学科而先行。当然这次快感以外还有有点沉重，因为要用文学批评分析博尔赫斯了。
歧木零,5,2016-01-22 02:28:24,unknown,3,博尔赫斯最著名的集子。所以篇章都已被读过无数遍。即使没有读过也会知晓，但即使知晓也应该读读的集子。反复可读的书。世上有些书太过有名不知是不是一种不幸，太多人提及和引用早已在读者心中构建起他们自己的原著。于是真看到原本的时候不知是怎样的破碎和涟漪。作者是个爱书人就足够了，想象不存在的历史记载在不存在的书上，无与伦比的包含一切但也是悖论的图书馆。有关动机的侦探小说确实够味，不过人们乐道的还是包含所有可能性的小说。某辞典的再热唤醒了互相做梦和建造星球的故事。不过彩票公司的权力有着太多公众喜好推举的偶然性，显得不够圆润，但也是巴比伦式混乱的一种奇妙的解释。
余颜,5,2017-12-31 18:35:47,unknown,3,虽然这么说很不好，不过我还是觉得《万寿寺》更好看。「我想象出一个由迷宫组成的迷宫。」
白眼,4,2018-01-12 00:39:36,unknown,3,在一段不明确的时间里，我觉得自己抽象地领悟了这个世界。
天才+英雄,5,2020-08-04 12:02:48,unknown,6,这不是小说吧，这是人类另一种极致思考的探索录。
zxdhuge,3,2015-10-14 22:20:52,unknown,12,一本正经地胡说八道，毫无美感，都是文字结合物理、哲学等其他领域的在思想上的雕虫小技。这么骂大师不知道会不会被喷，不过反正我就是不喜欢。
沈隱舟,5,2020-06-11 21:40:50,unknown,4,短短九十幾頁，可是讀完花了好久好久……因為每看一遍就要停下來想一想。《小徑分岔的花園》最著名，但其實是最通俗易懂的，博爾赫斯儘管沒有看過《紅樓夢》中文原文，但他依舊精準地捕捉到了《紅》裏最重要的主題:夢境，和最偉大的結構:迷宮。其餘我最喜歡《環形廢墟》，比起《巴比倫彩票》《通天塔圖書舘》之類思辨性很強的文本，《廢墟》顯得格外溫和……習慣了博爾赫斯通常表現出的冷靜而戲謔的形象，看到他在憐憫地使人物對抗虛無（儘管失敗了），有些被撼動心靈的感覺，而不是為智性喝彩。而且，《廢墟》寫的格外漂亮，不光是文字的美麗，莊周夢蝶的故事結構也很優雅（看來他是真的愛東方哲學）。
uannnn,5,2018-05-02 16:32:18,unknown,3,那几篇小说实在是太好看了，像侦探小说一样，拼凑线索，结尾巧妙升华。脑子里一直都是戴老师的非线性时间观。
