user_name,star,comment_time,geo_ip,vote,short
眠去,5,2007-02-08 11:16:40,unknown,8441,十几岁的时候渴慕着小王子，一天之间可以看四十四次日落。是在多久之后才明白，看四十四次日落的小王子，他有多么难过。
小岩井,NaN,2012-01-09 14:55:31,unknown,5922,读了好多年，终于读完了，但是实在共鸣不起来，虽然知道那些道理，但真的觉得没什么了不起啊，是我还太幼稚吗？
自在渍,5,2012-09-01 20:44:35,unknown,3573,我的玫瑰花儿，只有四个微不足道的刺，用来抵御这个世界。
黛安Diane,5,2009-12-22 11:36:19,unknown,2311,说实话我看不太懂但还是跟风给个5星吧以显示我也是有思想有学识之人
菱夏,3,2015-09-23 15:01:18,unknown,1313,虽然我实在幼稚，但我并不怎么喜欢孩童般的纯净，我只爱风浪过后的平静，流水打磨出的清亮，大雪纷飞时的安宁，沧桑看透的纯真，我爱眼冷心热的庄子，人究竟无所逃于天地之间，各适其性，做自己认为有意义的事就好了，无论是统治宇宙还是喝酒点灯，对他们来说，都比爱一朵玫瑰重要，这不是很好的么
北溟鱼,NaN,2007-12-15 20:27:27,unknown,856,不能理解的是，為什么它忽然紅成這樣？
陳蘇蘇二逼人生,5,2011-08-14 01:59:16,unknown,926,一边读一边很想哭。太寂寞了。人类真的太寂寞了。
萌塔 C-137,5,2010-04-29 09:38:38,unknown,1140,是你浪费在我身上的时间使我变得如此珍贵
momo,5,2012-11-15 23:45:25,unknown,865,如果你是小王子，我就是那捉鸡的狐狸，求你驯养了我，却又对你说要你回去对你的玫瑰花负责。还大方地以为只要看见了麦田就会想起你头发的颜色。我却永远无法随你回到B-612星球。现在觉得，我可能只是猴面包树而已。
蛇,4,2009-11-25 03:40:45,unknown,809,狐狸告诉小王子的秘密是：用心去看才看得清楚；是分离让小王子更思念他的玫瑰；爱就是责任。
杜边生,NaN,2007-12-09 03:10:28,unknown,661,我老觉得小狐狸跟小王子是在搞GAY
暴走系乙女药,4,2012-01-30 14:42:06,unknown,698,原来在我还不懂爱情的时候就爱上了你
Cassie,2,2015-10-07 23:59:34,unknown,569,痛苦迷茫不是因为成为了“可笑”的大人，而是成为大人却没有真正长大。所以回过头来想要从怀念童年中解脱缓解痛苦那是本末倒置的做法。如果你作为一个成年人觉得痛苦，原因不是因为你“成年”了，也不是因为是生而为“人”，而是“你”停止了思考停止了学习。
猫伯爵,5,2011-02-04 06:43:28,unknown,559,他像一颗树那样倒了下去
7酱™,5,2011-11-12 13:10:01,unknown,483,第一遍读时，我才4岁。等到真的读懂，才明白为什么这是一部“童话”。
一只麦麦,4,2011-11-04 09:19:34,unknown,486,Itisthetimeyouhavewastedforyourrosethatmakesyourrosesoimportant.
[已注销],5,2012-04-27 15:36:14,unknown,483,爱屋及乌，爱一个人会让周围的一切变得美好，连麦浪的金黄都会让人心醉。　　　　　　　　爱同样意味着责任。因为“你现在要对你驯服过的一切负责到底”。爱与被爱都有责任，每一段我们曾经付出过的感情，都必须为对方，为爱情负责，不是吗？　　　　　　　　爱很多时候又会面临失去。小王子离开的时候，对狐狸说“那么你什么好处也没得到”。狐狸回答：“由于麦子颜色的缘故，我还是得到了好处”。爱同样意味着宽容，意味着放弃，也许我们在面对渐行渐远的爱情，该抱着平和感激的心态，因为我们起码收获了麦浪的金黄！　　　　　　　　狐狸同样告诉小王子，“只有用心才能看得清。实质性的东西，用眼睛是看不见的”。只有这样，才能让我看清爱的本质。　　　　　　　　爱是什么？　　　　　　
晚回舟,5,2011-10-06 20:15:06,unknown,454,狐狸再好又有什么用，他还是爱玫瑰花
齐鲁矿业李德友,4,2015-10-16 22:24:58,unknown,359,你要非常有耐心，”狐狸说，“首先，你要在离我有点远的地方坐下，就像这样，坐在草地上。我会偷偷地看你，你不要说话。语言是误解的根源。但你每天都要坐得离我更近一点
E,5,2010-06-06 11:25:19,unknown,389,漫山遍野的玫瑰，但真的，我最喜欢最初的那一朵，带刺儿的那一朵。我能不能回去继续浇灌那朵玫瑰⋯⋯
彼方有荣光,5,2011-05-16 18:19:17,unknown,377,长这么大，读过次数最多的书就是《小王子》，我是那么的爱这本书，可是我都没有一本属于我的小王子，每次想读了就去图书馆借他，读过很多版本的小王子，但是每次读他，小王子在我心中都不一样。我在我的612星球等我的小王子回家，但有时候我也不确定我是玫瑰还是狐狸或是那条毒蛇，可能我也是小王子。
The 星星,3,2010-02-12 13:23:45,unknown,303,终于读了这本被捧上天的书，事实证明，以前没读就对了
用愛膚堅啦,NaN,2013-04-07 14:28:09,unknown,273,其實我覺得小王子自私不負責，沒有看懂玫瑰，而且被動地把小狐狸傷害了，小王子看懂很多人和事，卻到最後才明白愛情的本質。
璞石,5,2016-04-25 19:49:11,unknown,294,我说小王子死掉了，小表妹说他回到自己的星球了
八月·水语,5,2009-09-04 09:46:20,unknown,225,明明知道会受伤，还是义无反顾，人和狐狸一样，理智有时候睡着了
is4dog,2,2015-10-18 00:13:59,unknown,179,哎，虽然说对作品一人一种解读，可是《小王子》它本身的基础里，是没有纯洁的。描述的是诈骗和算计。智商低的人解读不出这种算计；没见过世面，美见得少、爱见得少的，灵魂里没有天生的宏大的年轻小朋友，拿着李鬼叫李逵而已。这也能代表爱情，真正的爱情要笑死了！……直说它法式矫情和法式智商低，一定会被围殴。哎。可是真的好想拆穿---这皇帝没穿新衣。
七十三,3,2011-01-07 19:10:01,unknown,209,我俗气不知道在讲什么。。。
路边小狗,3,2012-01-06 13:29:42,unknown,155,没别人说的那么神
安东,5,2015-10-07 18:37:14,unknown,154,可如果你驯服了我，那就好比是太阳又重新照亮我的生活。我会知道有个脚步声和其他所有的都不同。其他的脚步声会让我赶快躲进地下。而你的则会像音乐一样呼唤我出洞。
Miaou,5,2012-10-09 12:24:08,unknown,220,不知道第几次重读。每过一段时间再读，都有新的收获。心变得很柔软，脑里的迷雾被驱散。更多的关注他人，关心这个世界，自私是多么无趣的事情啊。我想，写一本能温暖人心，帮助困难的人们的书，比世界上很多事情都有意义。
楊不歡,4,2008-11-12 14:18:18,unknown,143,好东西，但不喜欢有些人把小王子抬得那么高，全是装逼
thea,5,2011-07-27 20:33:19,unknown,134,记得当年傅子一语，对文学稍有感觉的人，都会感动的一本书。
Moss大妖,4,2009-10-07 16:39:33,unknown,101,这个评分给我好大的压力……
春风不解意,5,2018-03-19 22:23:02,unknown,109,——如果你爱上了某个星球的一朵花。那么，只要在夜晚仰望星空，就会觉得漫天的繁星就像一朵朵盛开的花。长大了才看得懂的童话。
桃鸢去远方,4,2009-11-07 20:36:32,unknown,117,记得世上会有干净纯粹的小王子，记得世上亦有温驯而微薄的狐狸。
迪仔I编号223,5,2011-03-17 09:50:28,unknown,91,是你浪费在我身上的时间使我变得如此珍贵。
我不是盆栽啊,5,2008-07-12 21:13:15,unknown,87,我小的时候，没有看懂。现在想起来，竟然觉得这个故事冷。看了几遍都没有太看懂。直到有一天突然发现那种孤独。那种有很多星球可是只有你一个居民的孤独。精心呵护的玫瑰，路遇的小狐狸。所以才要和飞行员对话吧，因为太寂寞了。可是我们每个人，都是拥有一个星球的小王子。我学不会爱，学不会接受爱。
喵喵最丑,2,2018-03-19 11:38:02,unknown,78,不好看
小墨MO,3,2008-03-01 21:26:25,unknown,60,……我觉得很一般的故事……为什么这么多人喜欢……没明白。
xx,5,2018-03-19 08:35:03,unknown,87,以孩子的视角来观察想象成人的世界，用孩子的口吻来控拆社会的光怪陆离。
辄馨,NaN,2015-03-02 21:14:34,unknown,46,我以前一直以为小王子是王尔德写的。。。我勒个去
新西兰孙小社,5,2011-11-16 09:20:33,unknown,70,这是一本读给孩子听，但是触动的是大人的童话，是一本值得一生珍藏，甚至带着它躲避末日浩劫的作品。你能用怎样的话去评价它呢？怎样的话都显得多余，只能自己亲自读过后才能明白。推荐给所有觉得成长是种疲惫的人，让小王子告诉你，一朵长在你心里的玫瑰，胜过千万朵花圃里的那经济作物。
沉歌,5,2007-10-18 12:09:05,unknown,49,请给我画一只绵羊。
汐丶曦,4,2017-02-21 00:19:12,unknown,65,“由于麦子颜色的缘故，我还是得到了好处。”
死鬼,4,2018-03-19 12:21:36,unknown,68,一个人的成长抛却的是他自己的纯与真一个时代的成长丰裕的是物质消逝的是精神一本适合每个年龄段的书推荐这个版本翻译得更加好一点
小十三,4,2018-03-19 22:06:50,unknown,64,成人童话吧，小王子驯养了小狐狸，最终还是为了玫瑰离开了小狐狸，童话里的儿童完全是无敌的，纯真直接、单纯质朴，老生常谈，永远年轻，永远热泪盈眶
动机在杭州,5,2012-02-02 22:56:06,unknown,61,花40分钟读完了。为这本书的来历多加一颗星。单纯的童话，核心却是孤独、爱情、丧失和死亡。整个故事都透着淡淡的忧伤。童话的产生是为了满足现实中无法实现的愿望。借助童话，我们相信，那些渐行渐远，消失不见的人，一定也去了某个星球，在那儿继续幸福。
[已注销],5,2014-02-16 21:02:35,unknown,50,初读是高中，彼时朦朦胧胧，并无太多触动。长大了再读，却数次掩卷叹息。有些事，不经历就不会懂。譬如玫瑰傲娇的刺，麦子的颜色，星星上的笑声。小时候单纯地喜欢玫瑰因为觉得得到男主爱的就是女主，长大了却每次看到狐狸都会热泪盈眶。“由于麦子颜色的缘故，我还是得到了好处。”以前不明白，但现在懂了。我很开心，真的。
波波维奇,5,2018-03-21 08:34:46,unknown,67,读过很多遍，人生浅薄，不太敢评论。这几天又看了一遍，感谢这个故事带给我的幸福和孤独。其实还是希望自己不要读懂这本书最好。
星尘战场,5,2007-11-23 21:50:48,unknown,39,纯美。简单的竟然读不大懂。
j u n,5,2007-07-16 13:39:38,unknown,37,我爱极了小狐狸
不玩惹,5,2011-12-02 22:56:51,unknown,40,要是你喜欢一朵花儿，而她在一颗星星上。那你夜里看着天空。就会觉得很美。所有的星星都像~开满了花儿~……而这些~大人是不懂的-____-
巴喆,5,2015-09-11 22:00:33,unknown,32,今之浮躁和功利如我，内心早已难回宁静和纯真。有时候夜阅此书，会暗自怀念。
苏豆芽,5,2010-06-01 08:23:42,unknown,28,反复反复反复看的枕边书
四十四次日落,5,2012-12-24 21:31:03,unknown,24,平安夜，时隔八年之后，我把《小王子》认真重读了一遍。有些书真的是历久弥新，越是长大了读越有味。看到那句“只有你一个人，看见的是会笑的星星”，哭惨了-_-#
肥匪廢·老🐰,5,2011-05-22 16:55:47,unknown,23,全豆瓣读书频道“读过”最多的。
Nee,5,2009-09-29 12:41:12,unknown,27,这就象花一样。如果你爱上了一朵生长在一颗星星上的花，那么夜间，你看着天空就感到甜蜜愉快，所有的星星上都好象开着花。玫瑰花。酒鬼。行星与落日。
小娃娃,3,2017-05-23 21:31:16,unknown,39,看完书后时常想:小王子会不会在他的小行星里和他的玫瑰幸福的生活在一起，偶尔是否会想念那个被他驯服的狐狸?
饭夫斯基,5,2010-01-23 10:10:49,unknown,25,在大家都为狐狸与玫瑰醉心时，我却单单迷上了孤独看日落的小王子。
是灼灼,5,2012-06-07 21:42:34,unknown,30,真希望能成为他的玫瑰。
婷婷爱八卦,4,2018-03-10 07:06:12,unknown,47,虽然是儿童读物但成人看起来也很有趣
竹竿优酱,5,2012-12-20 19:14:50,unknown,25,接触到教育这专业后，开始看各国著名教育家的著作，看的第一本圣埃克苏佩里的书是《风、沙与星辰》，因为那时候很喜欢礼利奥.巴斯卡利亚，看了他的《lovelivinglearning》，里面就提到了《风、沙与星辰》，所以就去看了。接着接触到绘本，原来这么著名的绘本素材是圣埃克苏佩里的啊，各种惊呆。跟《窗边的小豆豆》一样，经久不衰唉。
rosa,5,2021-08-12 01:01:11,unknown,90,想要和别人产生羁绊，就要承受掉眼泪的风险
豆友36544164,5,2016-05-15 14:10:09,unknown,31,我们常称赞一个人很纯真，到底什么是纯真呢？大人的世界很奇怪，他们对眼前的美好视而不见转而去追逐虚无的东西。
就叫我麦兜吧,3,2008-09-11 17:40:50,unknown,20,没有传说中的厉害
水湄物语,5,2006-02-25 20:27:31,unknown,16,永远的偶像
孟冬,4,2015-09-04 20:15:51,unknown,32,人长大了，就越来越浮皮潦草了，看不见花开花谢，日升日落，四时更替，也听不见风过树梢，叶子的簌簌声...当我们的眼睛耳朵被五光十色的喧嚣遮住了堵塞了。就再也体会不了“如果你爱上了一朵生长在一颗星星上的花，那么夜间，你看着天空就感到甜蜜愉快，所有的星星上都好象开着花。”这样简单又甜蜜的快乐了。
啵酱,4,2018-03-23 00:50:52,unknown,40,中英法三个版本各看了一遍，从来最喜欢原版的我却神奇地偏好这版中译本。小王子的故事简单美好又让人心疼。这是世界上每一个孤独的人内心的折射
一起吃地瓜,5,2018-03-19 21:40:48,unknown,46,小时候妈妈买给我的，书里插画很漂亮，内容潦草的看了。后来再看才真正看懂，我长大了。
胡子,5,2012-05-09 21:59:25,unknown,21,白天因为下雨什么都没做，心里觉得慌张，上班前看了一部分，公车上又看一部分，上课又偷偷看了一部分，被这个温暖的小故事打动得不行。
思泉,5,2011-04-30 21:17:28,unknown,22,什么样的语言都表达不出，你的故事带给我的幸福和孤独。
末摘花,4,2018-04-15 01:46:55,unknown,18,朋友推荐给我看的
FA21002C,5,2018-03-23 08:23:37,unknown,47,肉眼看不见事务的本质，只有用心灵才能洞察一切。我们又何尝不是这样呢。
几个蛋宝宝,5,2020-08-22 20:41:34,unknown,27,当有一天突然读懂一本书的时候，剩下的只有无尽的泪水吧……
镜泉,5,2011-01-21 12:09:56,unknown,26,“帮我画一只戴口罩的绵羊吧，这样它就不会吃掉我的花儿了。”
linn,5,2011-06-22 07:46:58,unknown,29,由于麦子颜色的缘故我还是得到了好处。。。爱得有尊严！
木曜日一只,3,2011-02-08 15:21:03,unknown,23,我还没到那境界
脑菇,NaN,2011-04-29 22:35:56,unknown,16,小时候每周看那么多书可是因为是《小王子》不是《小公主》而没去翻过它
阿猴HOSEA,4,2008-12-07 17:04:34,unknown,22,它的意义不在于它本身而是可以无限延伸
东篱,5,2018-03-21 12:48:45,unknown,36,作者用童真童趣的语言传达出深刻的人生哲理，孩童的角度新奇而引人深思。
橘子味儿电线杆,5,2021-01-14 22:33:52,unknown,14,很喜欢这种通俗易懂又值得回味的故事我们不用在意小王子有没有死掉只要在意那个绵羊究竟有没有吃掉玫瑰花🌹
暴躁老鸽,5,2021-08-18 02:40:38,unknown,28,当大人开始解读其中的暗喻，就已经在呼应失去天真的悲哀，小时候自然读出的童话感现在变成了努力回归原初自我的刻意。
相逢何必不认识,4,2018-03-20 19:31:57,unknown,33,没看之前我以为这类童话都是大团圆，看完发现，这种孤独真的让人上瘾。
任公子,3,2020-11-13 14:29:35,unknown,38,可能因为我已经熟透了，我读这本书，没有任何情绪上的共鸣或波动。
吃🍉的小丸子,5,2017-05-23 20:29:34,unknown,25,漫山遍野的玫瑰花，可是小王子只爱那一朵。
李苦瓜,4,2015-10-25 20:40:39,unknown,20,借着孩子的名义，讲的其实是成年人的故事。这不也是成年人狡猾的地方之一吗。
t,4,2015-08-18 22:47:33,unknown,21,每个人是不是都是自大狂？守着狭小的星球自以为国王，殊不知在外人看来不过为豆丁大小的事日夜忙碌而不自知。小王子是幸福的，因为他忠于内心；狐狸是幸福的，因为他爱着；可是即使被爱，玫瑰是幸福的吗？我不知道，我只知道，我宁愿散落在宇宙的漩涡中连风雪夜归人都做不了，也不要过哪怕一天玻璃花罩中的日子。我还会离开，也还会归来，世界另一端还有个男孩子，和他弯弯带笑的眼睛，请再等等我，我想告诉他我爱他，想和他携手同行。
普拉,5,2007-02-27 09:15:50,unknown,12,我不怕爱错，只是真的好怕，没爱过
豆辛瓜辛,3,2018-02-23 23:20:06,unknown,36,我想我要重读几遍小王子，是太年轻了还是长大了。
汤玛士的小火车,3,2010-01-03 08:53:18,unknown,18,我不懂为什么大家都喜欢
桃兜兜,4,2011-10-20 16:52:26,unknown,14,当时看的时候没什么感觉后来在经历一些人事后脑里突然走过书中的句子很多东西就那样释怀了
商夏,5,2012-06-06 23:03:37,unknown,10,她是有灵魂的一朵便胜过其他千万
伊豆,5,2008-04-28 11:54:27,unknown,7,记得是大学时，从图书馆借来读的，书已经残破不堪，不仅泛黄，而且书角全都破了。但这真是我那时读过的最好的一本书了。
長閑,5,2015-10-18 14:37:56,unknown,21,这是我无法在童年时代看懂的童话，却在成年后一再想起。
豆友226911398,5,2021-08-06 23:13:27,unknown,9,如果你爱着一朵盛开在浩瀚星海里的花，那么，当你抬头仰望繁星时，便会感到心满意足。
bird,5,2012-12-30 07:21:14,unknown,10,我一生将读你几遍
七姐Claudia,2,2018-12-28 10:08:03,unknown,26,我可能是豆瓣上唯一对小王子无感的冷血机器
W之芮,4,2018-03-23 08:40:28,unknown,41,少时看不懂，当你懂时说明你已经长大了
yezzi,5,2008-03-26 16:59:06,unknown,16,我是狐狸，这是我的性格与命运。可是我自豪于我是狐狸。我以狐狸的方式去爱别人，也会有人爱狐狸。
闻君有白玉美人,NaN,2016-12-14 18:08:40,unknown,28,认真读过很多遍却不敢评论，似乎总有想法飘过却又抓不住，还是没法产生很大共鸣。写给成年人看的童话，满怀温情，像是在讲道理，我却抓不住要义。
粟冰箱,4,2018-05-02 11:45:35,unknown,5,驯养就是建立情感联系，对你驯养的东西你要永远负责。本质的美的东西则要用心看见。“你会高兴交上了我。”这句话翻译太奇怪了，违和感……另外一个版本翻译是“你就会因为认识了我而感到高兴。”换成“认识”或“结识”应该更好。
三七莲华,4,2008-06-24 19:36:02,unknown,9,其实被用滥了
二月鸟语,5,2016-02-26 00:59:06,unknown,21,也许世界上也有五千朵和你一模一样的花，但只有你是我独一无二的玫瑰。你在你的玫瑰花身上耗费的时间使得你的玫瑰花变得如此重要。如果你要驯服一个人，就要冒着掉眼泪的危险。一旦你驯服了什么，就要对她负责，永远的负责。
想起窗外一只鸟,5,2018-12-30 16:22:52,unknown,8,十四岁的时候在页边写满了关于人生追求的幼稚的感悟，十六岁的时候发现它们全都是与原文几无相关的自说自话，害臊地把它们全都擦掉，并在扉页添上了一句：读懂《小王子》时，便不再是孩子。
边城不浪,4,2010-11-14 21:40:17,unknown,8,选一颗吧，夜空里每一颗星星，你要哪一颗都行
孔龙,5,2016-12-19 19:24:03,unknown,7,如今再读一遍这本书，才觉得读懂了它，一边读一边感到人类真孤独，这种孤独的美感又令我感动。
琳Linner,5,2021-03-02 15:55:29,unknown,16,小的时候看小王子没有看懂他的寓意，将它当作一个爱情故事来看。再次重读《小王子》，才知道原来每一个星球，都是在讽刺/暗指一种社会现象：1—控制欲极强的大人；2—过于在乎面子的大人；3—做生意，只为了钱而活的人；4—爱喝酒的人；5—从未出过门的地理学家，靠着别人给他说外面的世界来绘制世界地图。象征纸上谈兵的书呆子；6—点灯人，日复一日重复一样的生活的机器人。来到地球，发现地球的人类缺乏想象力，只知像鹦鹉那样重复别人讲过的话。经过这些，小王子愈发想念自己的玫瑰，狐狸告诉它说：因为你对她投入了时间、心血，所以它说它是你的独一无二。
猪大勇,5,2018-11-17 23:34:03,unknown,9,我呐，一直以为自己会是你的小狐狸，到最后才明白，不是玫瑰，不是狐狸，也不是蛇，而是其实不算会画画的修机人。
hjffjkeryjvnnc,4,2018-03-23 08:51:22,unknown,19,内容丰富，适合小朋友
诸葛若见,5,2012-05-18 16:02:14,unknown,6,玫瑰玫瑰你在哪里？
静流,5,2008-08-23 19:00:14,unknown,5,永远最爱的童话之一。在我的生命里翻腾的意象群。
至秦,NaN,2018-01-13 06:30:13,unknown,3,这个下午，再一次厌倦美国当代短篇小说之后，再读了一遍《小王子》，真好
小狗七号,5,2021-04-23 21:52:35,unknown,6,我也想看一天里四十四次日落，我永远都不想一天里看四十四次日落。好孤独的故事啊——但是又很可爱。
孙智正,5,2017-01-10 10:07:40,unknown,5,二刷，争取背下来，每天给孩子讲一段。如此浅白深刻愤世嫉俗，如此孤独，如此优美深情。服气。
木由,5,2013-05-07 15:57:36,unknown,5,睡前故事么么嗒…总觉得小王子被蛇害死了…55555…话说再读一遍蓦然发现最后一段地表达是四娘学过的诶！
小鹿想念书,5,2012-05-30 16:08:32,unknown,11,像是一个呢喃的梦。小狐狸和玫瑰花都爱。
Sophie  Z,NaN,2007-12-10 18:53:52,unknown,4,我的玫瑰花，她们还好吧
shu,5,2007-12-11 22:13:18,unknown,8,我曾经是个孩子
乔峰,NaN,2008-09-30 16:56:11,unknown,6,这个版本好像买了十几本，送人。
朱尔赫斯,5,2012-06-04 15:40:13,unknown,6,越简单越复杂。对于世界，我们还是知之太少。结尾同《查令十字街84号》那样深情款款。
锐利修蕊,4,2009-11-30 22:04:47,unknown,2,成人童话
苔衣,3,2007-11-10 16:29:33,unknown,7,不明白为什么有那么多人疯狂的喜欢这个故事……
WT,5,2015-10-18 09:47:27,unknown,4,看了电影，再重温一遍，比起年少时看起来体会更多了。“要用心去感受，去看，重要的事物眼睛是看不见的”。更重要，这样的童话书，能让复杂的心绪变得简单，能让疯狂的欲望，得到舒缓，从而变得是个人，不是所谓精英意识社会里的一个数据罢了。
西小苓么么哒,5,2007-09-18 18:40:43,unknown,6,金色的麦浪让我想起了你，于是我就爱上了穿行麦浪的风声。。。。。
掉线,4,2015-11-03 17:58:10,unknown,4,不该先看电影。
金马洛BBKING,5,2007-12-16 18:07:04,unknown,3,每个人都不该错过的著作，无论你今年13岁还是30岁。
立乐,5,2013-03-09 01:40:19,unknown,3,说完拉下了裤链
AllenGY,3,2008-05-24 15:27:28,unknown,6,说实话，这很装B
AsuraHu,5,2011-06-07 06:08:44,unknown,6,世界上除了《圣经》之外被最多人阅读的书。小孩儿能看到美，成人能看到真。语言精致，想象瑰丽。圣艾利苏佩克创作最纯最牢固的爱情和信念，可惜自己终究不是。就和作者一样，这都是我们的理想。
边城玫女,5,2020-10-19 08:13:08,unknown,5,我是这个世界上，独一无二的玫瑰——这就是我的名字中“玫”字的来源。
月儿弯弯,4,2017-05-23 20:24:23,unknown,6,最早看过的读物，真的很好看
[已注销],5,2014-10-18 21:00:44,unknown,3,每天，你坐得靠我更近些……
账号已注销,5,2015-10-01 21:51:34,unknown,2,有多少孩子，长大后变成了一本正经、只会数数的红脸胖子？他们都忘了，最重要的东西是肉眼看不到的，只对你驯养的对象有意义。
粟熙,5,2008-03-22 16:38:34,unknown,3,因为这本书最近想败娇兰的“午夜飞行”
Eve,5,2018-01-18 13:34:10,unknown,9,你读懂这个故事的时候，很大可能已经被驯服。
悄悄,5,2021-06-28 23:41:18,unknown,7,可惜我们总是会在懵懂无知的时候遇到值得守护一生的人……
庄晓,4,2017-06-07 12:16:55,unknown,4,对于儿童读物缺乏赏识能力，也许愿意看电影的比愿意看这本书的人更多。但不能否认作者瑰丽的想象力，所以相当倾佩这些童书的作者。
我开心就好,5,2017-05-23 20:27:53,unknown,11,很感动寓意很深
不要焦虑浣熊妹,5,2008-06-14 21:22:02,unknown,4,总觉得自己是小狐狸，等待着小王子的到来
大头绿豆,5,2005-06-12 02:21:43,unknown,6,马老师译得好！
