user_name,star,comment_time,geo_ip,vote,short
九霄云NineNine,3,2013-01-01 13:40:37,unknown,1,三毛的確是很不錯的旅行作家，但我覺得她勝在了＂出名要趁早＂，那時候，網絡還不那麼發達。
蜜瓜面包,4,2011-03-06 17:14:59,unknown,0,初中时老师帮着借滴
BlueJophy,5,2012-05-18 18:42:35,unknown,0,读了不知道多少遍~
第五季,4,2017-07-10 15:24:14,unknown,0,2017.7.10在kindle看完的第一本书。阅读起来很轻松，原来三毛的文字这么平易近人啊。有几处非常惊心动魄，比如荷西整个人已经陷进沙漠一半了，三毛又差点被三个撒哈拉男人侵犯，她凭借自己的机智和坚强化险为夷；比如三毛中了很毒的蛊差点死掉。佩服她出走的勇气。不知此书有无小说成分
李孟冬,3,2013-10-20 10:36:20,unknown,0,我小时候在奥秘杂志上看到过沙漠里的人在海边灌肠的图片，当时很好奇。跟三毛看到的时候感觉一样。
莫小棉✿,5,2011-03-20 13:36:58,unknown,0,撒哈拉沙漠见证了荷西与三毛姐姐的爱情。
yrh,2,2013-05-31 00:35:13,unknown,0,呃……
宝来,5,2009-06-07 01:20:42,unknown,1,高中的时光，三毛和荷西谱写的美丽撒哈拉恋曲
南半球的老太太,5,2011-08-26 13:24:57,unknown,0,有愛的地方就有家。
azurebleu,4,2020-03-15 15:45:51,unknown,0,“她对我说话时我就不吸气。”
小羊皮,3,2006-11-06 15:54:29,unknown,0,很多人都喜欢三毛，但我一直都不很感冒，即使读了她大部分作品．也许我和她并不是一个时代的．
海的小酒馆♣,5,2014-03-05 19:45:37,unknown,0,有趣的故事和有情趣的生活。
悠悠河,NaN,2009-03-13 16:19:07,unknown,0,流浪情怀
劳勃·拜拉席恩,4,2012-11-26 14:36:10,unknown,0,挺好玩的~
小喔有盏小橘灯,5,2011-03-13 00:03:45,unknown,0,第一次看三毛的书，看完就很爱这个人爱荷西爱哑奴。
日帆,4,2010-01-20 15:08:46,unknown,0,那段萦绕在异域的岁月总是在记忆里飘摇，年少时的我总被里面的悲欢离合所感动。高中的时候经常一起吃饭的女生对我说三毛是个自恋狂，在书中极力美化自己，因此不喜欢她；但现在想来，无论故事是缔造也好，人物被美化也罢，那个是作者自己的选择与追求，若要沉入她的岁月，就得先承认她的美丽~
小M,5,2007-06-14 12:14:18,unknown,0,让人着迷
小小,5,2010-12-07 18:46:36,unknown,0,看三毛的第一本书。流浪到天明。
时雨,3,2012-05-07 20:47:39,unknown,1,也许早些时候读，许多事情都会不一样了，但这种事情怎么能肯定呢，我真是庸人自扰啊。
Lothlorien,NaN,2009-06-07 19:58:08,unknown,0,看的第一部三毛~~当时笑死了
Utinni!,4,2011-10-11 12:19:13,unknown,0,好故事。但还是更喜欢“哭泣的骆驼”中的许多故事，以及她在加那利群岛的游记。
流沙陷,5,2008-07-06 10:32:35,unknown,0,最动人的文字因为它真实
船长,4,2012-10-04 10:53:28,unknown,0,记得之前翻过一本考据三毛生活的书，书的主旨是荷西是虚构的，三毛写的生活都是她编的。其实这都无所谓啦，当小说读也挺有趣。
刘文二,5,2009-05-11 23:05:43,unknown,0,初中。
N多松鼠,5,2008-03-28 23:34:56,unknown,0,文字如此真实
川貝,5,2010-02-01 23:11:42,unknown,0,信、达、趣。
阅微草堂,5,2012-01-14 05:45:44,unknown,0,喜欢里面的味道，什么味道呢？自由和小女生的俏皮喜欢三毛
Chip 'n' Dale,NaN,2010-03-31 13:18:32,unknown,0,现在想，咋能写得这么酸，这么不靠谱
Eclipse,4,2020-12-20 11:32:41,unknown,1,当初你谈起这书，我答应会看。一晃过了六年半。
阿妍妍妍妍妍,5,2020-03-31 21:42:57,unknown,1,俏皮活泼的文字、洒脱自由的真性情，三毛的灵魂是流浪的，是独特的。我爱她的博爱，站在现代文明的视角对待落后未开化的民族的包容，对待被压迫悲惨哑奴的善良，对待一切弱小者的同情。书中几度读到撒哈拉人对她占便宜，作为读者的我都气的很（尽管有虚构成分），她却一笑而过。她的人生态度是不可复制的，任何人去学都只是东施效颦。//我做不成三毛，但还是想遇见我的荷西。
叮铃铃当铃铃,4,2021-01-03 23:18:10,unknown,1,沙漠中公共女浴室那段描述终生难忘
花间道,4,2021-08-27 20:44:20,unknown,1,省图初体验，这种快餐式的书籍还是比较适合借阅的，尤其看到书后的空白页有它的历任“小读者”的感悟留言，越发觉出书籍的生命的意义或许也有这一部分。给我的感觉，流浪是三毛的标签，而被城市社会逐渐“城镇化”的我会越发不能去通感于这种流浪生活了，或许我已经不再是“野味”而只有流水线上人工饲养的味道了。
艾斯黛拉,5,2014-06-09 11:53:55,unknown,0,真性情的女子谁不爱？
熊不要爱情,5,2010-11-14 14:05:44,unknown,0,挚爱
胡桃夹子,5,2011-11-13 19:19:40,unknown,0,看看你怎么给沙漠图上彩色！
孙三亩,5,2010-11-05 20:43:09,unknown,0,两人的世界很美好，即便是在条件那么恶劣的撒哈拉还是要尽量快乐。但是看完书，想到两人的结局又很唏嘘。。
山中的Annie,4,2017-04-25 21:49:40,unknown,1,一天的时间跟三毛经历了撒哈拉沙漠生活的种种。宠她懂她爱她陪她一起在沙漠探险的荷西，婚后白手起家的艰难，假期开车出去露营捕鱼，陷入沼泽被困，只有十岁的娃娃新娘，可怕的巫术，考驾照的经历，救人接生……一个女人和一个男人经历过这一切才算真真切切地活着吧！2017.4.25
鲍瘀喜,4,2020-12-31 18:38:45,unknown,1,澡堂搓澡至今印象深刻
Darth Vader,5,2011-05-20 00:05:45,unknown,0,我的青春岁月在阅读三毛中走过了。
疏雨时,5,2021-04-16 16:08:52,unknown,1,唉可怜的沙依达。2021.4.16
吴越春秋,5,2021-08-10 21:21:22,unknown,1,20210317（我读的是另一个版本）这是我认认真真地看完三毛的第一本书。果然，三毛是一个非凡的奇女子！打开书本自第一篇开始就引人入胜，一发不可收拾了！她的文笔平和流畅，清新隽永，又诙谐幽默，她率性洒脱，情深意重，爱憎分明，聪慧好学，又自由不羁。很多句子都非常经典，每个故事都让人回味无穷！也许人真的是一种很作且十分矛盾的动物，放着舒坦的好日子不过，非要在尝尽了人世间的千辛万苦、精疲力竭之后才能体会那种酣畅淋漓的幸福感觉，并且心甘情愿，无怨无悔。这本书里并没有这段话：“每想你一次，天上飘落一粒沙，从此形成了撒哈拉。每想你一次，天上就掉下一滴水，于是形成了太平洋。”
千茶,5,2007-07-06 00:28:03,unknown,0,永爱。
随风而行,5,2012-03-03 19:59:31,unknown,0,想不到三毛的故事这么迷人，一看就要入迷最喜欢<撒哈拉的故事>，最喜欢这样的轻松风趣的随笔喜欢这个封面
牧野清风,4,2009-11-07 16:20:12,unknown,0,不为什么，只因为我想像三毛一样，勇敢的、自由的流浪
而已,4,2009-11-03 12:30:46,unknown,0,据说洗澡
鴨子先生,3,2011-01-29 20:54:36,unknown,1,当时觉得太好玩了，现在已经不喜欢了
Heidi X,4,2011-08-25 15:46:15,unknown,0,青春读物在青春期读再适合不过了
chiyo,4,2012-05-20 19:15:10,unknown,0,指甲油补牙。。。
扑满,5,2010-02-25 09:59:18,unknown,0,一下午让人难以忘怀的时光。
巴拉巴拉小魔仙,5,2010-05-19 22:04:23,unknown,0,的确老少咸宜
Leon,5,2012-05-23 23:05:30,unknown,0,死果那篇现在想想还惊魂未定
希哈。,5,2011-03-06 23:06:57,unknown,0,洗澡
阿辽沙,1,2013-08-21 21:05:00,unknown,2,蛇精病
司小马,5,2012-07-07 14:19:13,unknown,0,骆驼骆驼，为什么有个女孩子看完就哭成了泪人。我却连眼眶都没湿呢。
