user_name,star,comment_time,geo_ip,vote,short
夏一慕,5,2013-10-25 18:30:47,unknown,310,先阅读了书，然后看完了电影。书是典型的欧美人风格，一股脑儿的细节、细节、还是细节。可是不看书根本不能体会电影细节背后的因果。看完后首先居然是回忆起了父母对我的童年教育，看过电影之后充满感激。
Levin Lee,5,2009-03-13 18:14:31,unknown,253,这是第一本我能记清出场人物名字和关系的小说
盐lynn,3,2009-11-28 00:15:37,unknown,55,看的txt翻译的实在太不好了，里面居然还夹杂着好多政治参考书的片段！一直听到的说法是小说远不如电影云云，影片把叙事中散乱的线头并拢，重火力的展现了一种形式感的冷酷，而其实小说在对人的理解上其实更为深刻，me很震撼。
大島,4,2015-11-08 11:40:19,unknown,35,和电影不是一回事啊
大秦在逃兵马俑,5,2013-05-02 23:29:54,unknown,21,我们的生活在蒙着的古里面，不要不承认这一个事实。读书很大的好处之一，就是，可以借助作者的眼，更加看得清晰我们自己的所处之地。
天蝎小猪,5,2011-03-03 11:49:06,unknown,16,紳士般有禮、淑女般溫柔地殺死你！
小木心熊,4,2011-11-17 18:06:39,unknown,13,有一套自己的原则靠这套原则征服一群在你身边誓死效忠的人明白底线是什么明白要爱的人是谁最后君子报仇要狠但是十年不晚。
夜照亮了夜,5,2012-01-30 14:22:35,unknown,14,这是一本邪恶的圣经，如果不想被欺骗，还是要读的
废柴一个,5,2011-11-25 16:52:39,unknown,5,过瘾。
愚公,5,2018-07-10 18:16:03,unknown,4,马里奥·普佐，美国作家，《教父》是其代表作。这部小说描绘了一位从西西里偷渡到美国，从小店员逐渐成为黑帮教父唐·考利昂的一生。故事从考利昂的女儿结婚开始，描绘了意大利社区的风俗，转手一笔写到黑帮之间的交易，考利昂因而受到枪击，从而引发黑社会之间的火并。从而引出另外一个人物，考利昂的小儿子迈克尔，因为出生在美国，受到美国教育，想要独立于家族，但是受到父亲枪击的影响，将枪击父亲的幕后黑手处刑，流亡西西里。在这个过程中，考利昂的大儿子被陷害致死，二儿子被流放到维加斯。考利昂想尽办法把小儿子重新带回国，进行权力交接以及复仇行动。这个故事虽然不长，但是描绘的西西里、纽约、维加斯等地方的风情与政治非常的细致。当然，故事中也穿插迈克尔与凯的爱情故事，但是只是作为故事的支线情节穿插于其中，结尾处凯也接受了命运
成知默,NaN,2013-11-30 13:54:31,unknown,3,补标，大学里读的，近日刚读过古龙的《流星蝴蝶剑》，于此书借鉴不少，倒是想重读一遍或者再重温下电影。
那可,NaN,2007-01-19 21:38:33,unknown,3,经典
礼士路西岛秀俊,4,2009-05-25 13:23:05,unknown,4,可惜短了点
老黄天生神力,5,2012-06-03 01:24:12,unknown,4,老头子的教诲的确让人成熟了不少
维塞西,5,2012-03-08 03:29:52,unknown,5,大学时候从图书馆借的。不知道为什么大儿子的那句电梯是死亡的陷阱让我尤其记忆深刻
离香,5,2006-02-27 15:54:39,unknown,3,小说和电影同样精彩，具备所有畅销小说的元素。
Mr.Savage,NaN,2012-01-07 12:54:54,unknown,2,这书写得太一般了，翻译也很乡土。。。
流空破刃,5,2011-06-23 17:21:24,unknown,3,对比电影以忏悔为主线作为整个故事的原创后续的第三部，以迈克尔完成被父亲推卸的职责作为结束的原作，是一个更完整更自成体系的故事。另外讲，译林你们真的不行啊。
withinbeyond,4,2007-04-09 11:49:22,unknown,1,Behindeverygreatfortunethereisagreatcrime.
Yurii,5,2007-01-12 23:00:37,unknown,5,我看的英文版，过瘾
方東美,5,2009-07-18 21:08:19,unknown,0,2007年2月购于晓风。伴我度过07年的春天。
cincin,5,2008-09-02 03:41:07,unknown,1,经典
Vamei,3,2012-08-27 18:53:41,unknown,0,和电影教父第一部的情节一致，讲述黑帮家族。
宋阿慕,5,2008-02-19 16:07:39,unknown,0,经典的黑帮小说.电影也很好看.
一只Tomason,3,2011-05-20 21:07:47,unknown,1,没电影好。。译文笔调有点奇怪。。。
乔峰,NaN,2015-10-23 10:16:47,unknown,0,好看
MetalDudu,5,2015-04-12 23:04:59,unknown,0,电影是几年前看的，读完小说能回忆起一点影像，更多的是阅读时大脑里产生的场景。译文实在糟糕，幺儿、兵团司令……应该有新译本吧。20150412
森雲,3,2011-08-21 19:00:05,unknown,0,想看电影！！
我们都在树上,3,2021-08-02 21:50:51,unknown,1,3.5。四代教父：阿尔弗雷德•柯里昂。
小桃红君,4,2018-07-01 19:46:13,unknown,1,kindle-40为了电影看的小说，这是我看过最好的爽文了，喜欢迈克尔
moly,NaN,2008-03-28 10:02:22,unknown,1,别让仇恨影响了你的判断力
五星集中营,5,2009-03-10 12:49:02,unknown,1,|1459:924|
Hermione,5,2007-09-25 22:03:18,unknown,0,保留追究的权力
马孔多,5,2015-11-02 10:46:15,unknown,0,不解释
石卓灵,3,2006-05-10 11:34:26,unknown,0,我叔叔最喜欢的书。
朵,NaN,2008-02-27 09:51:05,unknown,0,重新来读
哥德尔命题,5,2010-01-28 21:37:57,unknown,0,男人的圣经
二十九斋,5,2011-11-24 21:26:18,unknown,0,教父级读物
西柚小姐,5,2008-10-12 22:31:11,unknown,0,比电影更全面这句话似乎是废话了……
弥次郎,4,2011-04-20 16:38:45,unknown,1,当年看的是tmd删节版.......(开头编辑还大骂一通资本主义腐朽)
Stigrex,5,2008-03-17 01:02:32,unknown,1,高中时读的，过瘾，也使我了解了另一种文化
风向未来吹去,5,2008-12-09 21:04:59,unknown,0,我认为是美国最经典的现代小说
查无此人,NaN,2011-08-15 20:25:55,unknown,0,无需多说
DingDang水叮铛,3,2007-05-30 15:34:08,unknown,0,搞不懂为何那么多男生迷恋《教父》，电影版
塔可夫斯基的镜子,4,2006-09-20 09:44:10,unknown,0,小时候。最早还是在一本杂志里读的连载。
酸奶,5,2013-01-02 08:12:37,unknown,0,当年送给某人的生日礼物
半點,3,2007-02-02 07:20:26,unknown,0,翻譯真的不怎麽好。人名譯得很奇怪，作者翻譯時沒按照標準翻嗎？取的字都奇奇怪怪的。不過還算可以啦。
lllllllllllllll,NaN,2011-03-17 16:13:18,unknown,0,这个书给我印象最深的，其结构奇特
Adeline,4,2011-07-21 12:24:01,unknown,0,比看电影更精彩
NoWhere,5,2015-07-20 22:20:57,unknown,0,好精彩~~
慕容狐仙,NaN,2007-03-20 15:27:59,unknown,0,版本不祥。
刘宇敌,5,2013-11-07 22:04:59,unknown,0,鸟儿的嘴尖尖的
Martyrer,NaN,2006-05-15 15:05:18,unknown,0,牛！
英俊的双眼,5,2013-06-30 22:02:41,unknown,0,酷
[已注销],NaN,2009-03-10 17:18:27,unknown,0,小说在前，电影反而没有感觉。
水白色,NaN,2009-03-18 21:52:42,unknown,1,一个人只有一个命运
八部半,4,2008-09-22 14:23:18,unknown,0,优秀的书，经典的电影。
湖畔,4,2007-09-05 16:53:31,unknown,0,借别人的书看的
KURURU,NaN,2009-12-11 12:15:07,unknown,0,高中年级主任强烈推荐的真是一本好书
二桃呀,5,2010-06-30 18:17:33,unknown,2,这个翻译真是纠结啊。把教父一家子弄得跟村里人一样。
莜麦,4,2007-10-30 17:05:13,unknown,0,看了太久忘了太多
Edward,5,2007-09-02 09:14:03,unknown,0,高三看得如痴如醉从此爱上黑帮题材
天蓝泥巴,4,2016-05-15 20:31:33,unknown,0,好看，要再去看遍电影
苏小西,5,2008-07-25 00:37:48,unknown,1,看着书，脑海中却总是浮现出白兰度~很精彩，不如电影沉重
大猫,3,2013-05-28 23:34:30,unknown,0,两年前就看完了电影版的，现在看了小说的，唉
有时,4,2016-02-09 21:41:58,unknown,0,意外的翻译的很流畅。
王神爱,5,2010-05-22 18:11:12,unknown,0,不解释！
伊娃,5,2013-07-31 01:04:23,unknown,0,从粑粑的老书柜翻出来那个时候这本书才2块多。蛮厚的。这黑帮的写的太神了！决定马上下载电影再看！
Sophie,NaN,2009-06-15 13:41:35,unknown,1,重来
千鹤寻,4,2012-02-24 15:05:53,unknown,0,人物丰富，有些刻画得很好
许懂事儿,5,2013-09-29 13:52:19,unknown,0,老头子。
wizard,4,2012-03-26 21:09:58,unknown,0,高潮不是很给力
予秋,NaN,2016-04-15 11:37:29,unknown,2,男人的圣经，一切智慧的总和，所有问题的答案
心夜,4,2014-03-22 14:52:53,unknown,0,第22章是大败笔！！！！！！！！！！！
重玖.,5,2012-06-18 11:49:55,unknown,0,一个人只有一个命运。不要让别人知道你的想法。
三年之后又三年,5,2013-03-15 07:02:09,unknown,0,翻译的有一股四川味。男人确实应该看看，学着如何对待家人、朋友、对手以及如何更好的在这个社会生存。
Rhinover,5,2009-12-15 17:17:26,unknown,0,好看
昵称,5,2014-09-26 20:40:13,unknown,0,2014第67书。《教父》，经典中的经典，读时如电影重放，马龙白兰度，阿尔帕西诺，重现眼前。
magnus,4,2015-07-29 11:06:23,unknown,0,http://www.ximalaya.com//album/337337
光与影,5,2009-01-30 17:04:25,unknown,0,什么？别告诉我你没有看过
voldemort,5,2008-05-12 19:54:09,unknown,0,简直太爱这部电影了！！
路西法尔,3,2014-09-02 01:05:04,unknown,0,芝加哥黑手党被其他地方的黑手党各种嫌弃，大风城是有多可怕……
浩子菌,5,2014-12-25 00:24:58,unknown,0,看完电影再去看，另有一番感受。
刻奇坊主那那酱,5,2012-10-01 00:10:33,unknown,0,谨守他的教诲。
Ecthelion,5,2013-01-23 08:03:37,unknown,0,我要没记错，这版本有删节。
流沙陷,NaN,2013-06-09 20:33:53,unknown,0,大哥形象更内涵了，电影改编的是真心赞
短发,5,2010-03-24 15:43:59,unknown,0,我爹已经看过数遍
octopus,5,2009-06-05 02:42:12,unknown,0,经典！
不可撤销,5,2015-10-26 21:02:21,unknown,1,让人成长
N多松鼠,3,2008-03-04 04:44:57,unknown,0,生活的表面和隐藏其中万种的联系
阅微草堂,5,2012-02-04 01:38:10,unknown,0,很喜欢的电影，很喜欢的书籍----本科时候发现的东西。我喜欢这样的风格，
加可木南,4,2005-10-12 20:07:34,unknown,0,书和电影一样。马龙·白兰度，风采依旧！
Enjoy🌈Rachel,4,2012-08-09 20:55:28,unknown,0,书比电影更详细但是没有电影那么扣人心弦科波拉不愧是大师
wall-e,5,2010-01-04 19:16:00,unknown,0,太好看了。高中看了一星期解决了。
AOLA,5,2008-04-20 10:56:53,unknown,0,在一家小书店意外买到。原来只是为了打发时间，后来变成枕边读物。
未尛央,NaN,2009-01-16 22:01:04,unknown,1,男人的圣经女人了解男人世界的百科全书
雁城,4,2012-11-24 17:51:57,unknown,1,前言中说这是一部现实主义作品，这评论显然是年代的产物，不敢苟同。干净利落的描写，浮现出黑暗中的众生之相。人物的悲与喜被美国式地处理，变得毫不拖泥带水。依照自己的规则行事，他们是被主流价值观否认的人。这一座地下之城，只有祈祷中的主可以洗刷他们。不过他们自身恐怕否认需要救赎。
sylvia晓霄小小,5,2015-03-10 09:17:42,unknown,0,好久没有读一本如此畅快的小说了
李有上道,5,2019-11-19 22:19:39,unknown,1,《教父》小说里关于性的描写真的绝了，尤其约翰尼视角的好莱坞part.感想就是做男人，做有权有势又有魅力的万人迷男人也没什么意思.因为能得到的漂亮女人／男人们也没什么意思.美丽的肉体到处都是，但你知道这些东西不过是权力的附属品，也只能在奴役和被奴役中寻欢作乐。这小说给我最大的惊喜就是性爱的描写，就挺有意思.
大禹,NaN,2007-07-05 01:36:23,unknown,0,翻译的土死了
清泉,NaN,2008-11-30 23:30:22,unknown,0,在三伏天里看教父，学会了平和
域名不能改？,4,2007-08-11 00:21:09,unknown,0,txt传奇
Jessica,5,2010-06-22 00:25:32,unknown,0,不错，非常不错。不仅好看，黑帮中的某些谈判技巧也是值得学习的社会经验。
__美乐狄嗯嗯,5,2011-08-20 20:52:11,unknown,0,和电影平分秋色。
Beatrice,5,2009-01-30 18:27:24,unknown,0,我不知道什么样的人可以自由穿越与光明和黑暗。
FF0000,5,2008-04-16 13:14:22,unknown,0,2008-04-03~2008-04-16凌晨
ensoleillé,NaN,2012-10-21 09:37:50,unknown,0,善与恶的相互渗透乃是宇宙的自然法则中的常规现象.ps裘里斯医生也很impressive哦。。
GloriaX,4,2008-12-08 12:34:46,unknown,0,我是怪胎，觉得书比电影好看得多
42,5,2011-10-30 18:23:10,unknown,0,不管怎样，流行的总是很生动，哪怕生动地不是很精致
海衣苍朵十,5,2007-11-11 15:48:25,unknown,0,值得反复品味的作品。正义永远是值得争议的名词。
默默,3,2010-05-06 23:56:00,unknown,0,╮(╯▽╰)╭翻译啊
Kan,5,2009-01-29 16:53:37,unknown,0,说实话翻译的真的不怎么样
Armaiti,4,2013-05-27 18:15:08,unknown,0,看电影时候总忘不了老教父蓦然老去的样子我曾经问过一个喜欢的人关于电影里我看不懂的一个问题他是给我唯一信服答案的人
oN onE,5,2010-03-19 19:00:29,unknown,0,当时对开头大儿子搞伴娘最。。。
木须龙,5,2010-03-08 13:53:23,unknown,0,当年先读的小说，后看的电影，一样精彩。
大小姐,5,2012-01-03 12:59:57,unknown,0,比电影好看
蹲着,NaN,2010-07-12 20:42:56,unknown,0,看了一半电影里的迈克更魅力3是纯粹叙写也算安慰
moi,4,2007-08-09 16:17:22,unknown,0,永远的经典
姜戈,5,2008-03-12 13:40:16,unknown,0,男人的智慧
达尔文2,NaN,2008-05-27 23:04:54,unknown,0,相比较来说，电影拍得够烂
多摩君PC,NaN,2008-06-28 11:52:31,unknown,0,比电影更精彩的小说。这个翻译的版本比较老，连圣诞节都有解释……
shallow ally,2,2008-12-28 18:10:03,unknown,0,妈妈从地摊上买的译者序里把此书定义为充满暴力和色情的资本主义产物
马瑞里安,4,2009-07-29 16:42:29,unknown,0,男人当如此
小猫小姐,4,2013-05-06 09:28:14,unknown,0,全然不记得2013年就已经看过这一本，看完电影再来看书果然印象深刻多了
Raindog,3,2011-10-09 01:40:52,unknown,0,翻译得一塌糊涂。
吃土少女的忧郁,5,2012-01-27 23:03:20,unknown,0,绝大多数人看的都是这个版本啊……记得最清楚的是最后那句话。在这个世界上，只有你和你的两个孩子才是他不忍伤害的。总觉得有点念想。
Starry N.,5,2009-06-25 15:49:46,unknown,0,社会的错综复杂，绝不可能用单纯的险恶或单纯的宽容加以解释。
酱油白菜,5,2009-06-18 16:01:38,unknown,0,一部经典，延续了到如今这个年代
章之德麻,5,2009-06-28 09:49:14,unknown,0,经典，熬夜火车硬座的最佳伴侣
大阿布,4,2009-08-24 22:52:17,unknown,0,我是先看书才看电影的，看了电影才知道书写得有多好
夕山,5,2011-01-11 11:26:13,unknown,0,大二还是大三暑假，从图书馆找了本原版啃完了，没怎么查字典，大概读懂了。
荒芜到岸,5,2007-02-01 13:20:48,unknown,0,每个男人都应该读
林林林林林小姐,NaN,2007-12-22 21:27:07,unknown,0,喜欢！！！
Eighteen2Die,5,2010-12-16 12:41:48,unknown,0,书店的两个下午
hoorace,NaN,2008-03-20 17:13:08,unknown,0,男人必看的书籍
炸毛Mo,5,2008-07-02 20:04:35,unknown,0,又被电影美化了
魔菇,4,2012-02-25 00:30:35,unknown,0,少8经世的偶以为这里写的都是真的~
白玉京,5,2015-05-30 17:09:57,unknown,0,他不仅仅是一个黑帮头子，更重要的是，他是一位领导者。
萝卜斯特宇治,5,2012-02-23 18:56:43,unknown,0,虽然对翻译很无语…
🔥🪵,5,2006-07-29 13:38:29,unknown,0,初中时最喜欢的书
生活在别处,5,2008-02-28 00:48:11,unknown,0,高中时，看到我在读这本，安彦珠老师就说，这书还不错，但他很不喜欢…是不是因为情节描述太露骨了呢？嘿嘿
阿米可翡翠,3,2007-11-08 22:53:59,unknown,0,老版
行板,5,2015-01-17 01:31:52,unknown,0,男子汉养成手册！
Wongwongwong,5,2012-04-23 02:00:29,unknown,0,2003；我怎么都集中在高三看小说啊魂淡？！！
mogwai,5,2010-07-15 18:24:23,unknown,0,初中时候看的，纯爷们儿，很赞
从小爱科学,4,2007-06-13 19:59:36,unknown,0,初中时候想了解一下外国黑社会什么样子，看了之后感觉这不比国内的原始多了？？
粟人,5,2009-03-21 13:54:57,unknown,0,经典。正看第二遍。
江小鱼燕尾蝶,3,2009-07-06 10:15:08,unknown,0,高一看的，于是明白除了古惑仔之外还有另一种黑社会
飛天紅豬俠,5,2008-08-07 23:03:15,unknown,0,除了翻译的和已经在我心中根深蒂固的电影版不同以外，没有缺陷
willow,5,2011-11-12 00:27:10,unknown,0,马克。初二小女生的跟风。。。
陪戎校尉,5,2011-05-17 09:02:32,unknown,0,政府失职时，非合法的黑帮就代替行使公共权力。
Cholmes,5,2009-12-27 14:27:23,unknown,0,小说觉得很好，电影太长懒得看
媌,4,2012-10-16 17:39:03,unknown,0,气质啊，要不怎么是教父呢。但是大神也会死。
白色不黑熊,4,2008-10-31 22:20:32,unknown,0,本来很好的一部小说结局全乱套了
生铁牙签,5,2008-04-26 08:22:28,unknown,0,翻译的不好，很多词不够到位
尔尔,4,2010-05-28 11:52:23,unknown,1,因为此书，第一次有了想做黑帮老大情妇的愿望。
黎黎小叶子,5,2007-04-01 22:49:10,unknown,0,老头子
山风止氪,5,2013-07-10 14:32:59,unknown,0,真么说来我也看过呢
小麻花花花,5,2010-03-05 16:37:56,unknown,0,平时不露锋芒，隐藏得很巧妙，生怕把自己的真正实力暴露在光天化日之下；紧守着老头子的训诲，那就是，让朋友们低估你的优点，让敌人高估你的缺点。
fan's,5,2018-03-27 01:58:30,unknown,0,叙事手法比电影要好很多
卜平,5,2009-11-10 18:55:47,unknown,0,maybemyfavorite...
HolyC,5,2013-12-15 18:34:01,unknown,0,丢了
卷阿,4,2013-05-22 23:40:42,unknown,0,在网上随便down了个txt看了下，觉得乡土气息好重，很多词根本不对味。才发现竟然是译林版的，竟然还再版了。（我觉得中国知识界的一大悲剧就是因为历史的不幸而能力平平的一代人占据的各个重要位置，而好些优秀的年轻人却苦无出头之日）
带泥巴味的大熊,2,2010-10-02 20:26:36,unknown,0,个人认为小说很低级
莱因哈特,4,2011-07-08 06:41:29,unknown,0,翻译是硬伤啊。。。
小屋乌,5,2008-04-30 16:31:28,unknown,0,“不要仇恨你的敌人，因为那会影响你的判断。”
微喵的兔姑娘,4,2011-11-26 18:58:16,unknown,0,黑手党首领丰富独特的性格记忆犹新~
chichil,5,2007-12-28 12:21:02,unknown,0,第一次接触的教父，之后一下子迷上了TheGodFather这个词```
Chessy L,4,2014-11-17 17:09:16,unknown,0,难得的，电影比书精彩很多
hullomoon,5,2010-08-11 22:38:20,unknown,0,虽然也是周汉林的译本，但是贵州出版社的质量实在是不怎么样，故事内容叹为观止，要看看电影“人只有一个命运”
吴大帅,NaN,2007-08-26 13:22:09,unknown,0,黑帮为什么总是有吸引里呢?
江云舒,5,2012-10-18 15:31:20,unknown,0,让朋友低估你的优点，让敌人高估你的缺点
剑飞,4,2015-11-24 10:22:01,unknown,0,书籍比电影好看。
Helen,5,2010-10-01 18:44:19,unknown,1,教父是天蝎座的？
momo,5,2009-06-10 04:14:43,unknown,0,不得不说这书很经典
BRAVEHEART,4,2006-03-18 02:50:27,unknown,0,高中时候读第一遍，一口气读完，后来又反复读了很多遍
summer,5,2012-07-17 20:44:49,unknown,0,人生导师！
长腿叔叔,NaN,2013-01-27 12:09:39,unknown,0,先看的电影，再看的书
Jo,NaN,2015-03-14 16:14:17,unknown,1,谁说《教父》是三流的小说一流的电影？我说是一流的小说，一流的电影。
无力的番茄,5,2014-08-31 07:57:30,unknown,0,读之前想着，当厚黑学读应该挺好，顺便回味电影；读了之后发现，还有情怀，男人味的
jackie,4,2009-12-12 20:46:30,unknown,0,这本书读得非常早，隔了很久才看过的电影。当时读的时候感觉太帅了，对于黑帮书籍着实痴迷一段时间。
角端端,NaN,2008-04-24 11:59:16,unknown,0,教父
Violet,4,2011-03-18 23:08:34,unknown,0,电影也是经典。
cy,3,2010-01-12 20:24:48,unknown,0,其实是一本通俗读物。据说作者原本写纯文学不成功，随后改写通俗文学《教父》却大获成功。可见这是一个多么俗的世界啊。
降霰概率,3,2008-02-04 12:45:59,unknown,0,看的时候还太小现在都忘了
PUMA,NaN,2008-07-02 14:54:32,unknown,0,中学时代读的
芭蕉桑,3,2010-06-14 12:53:38,unknown,0,先看的电影后看的书
Vendetta Child,5,2008-11-08 18:22:43,unknown,0,电影的教父三部曲，其实不过是小说的忠实演绎而已
烏滌非,5,2009-03-12 23:29:29,unknown,0,这种经典还需要附注吗？
溯夜,5,2009-05-05 10:09:37,unknown,0,虽然我是古龙饭也得承认流星蝴蝶剑对教父的“借鉴”有点过~
石頭,5,2012-12-04 17:03:37,unknown,0,经典黑帮
米莎没有死,4,2009-09-14 10:58:31,unknown,0,好看
禁莞,5,2008-08-13 00:16:50,unknown,0,我家有本很老的教父。但绝对不是这封面。找不到……
kate,5,2010-03-26 11:14:49,unknown,0,大学时候看的
LtheFish,5,2008-06-08 09:41:51,unknown,0,电影看过好几遍，还不过瘾
木子,4,2011-04-18 12:01:38,unknown,0,精彩！
脑袋决定口袋,5,2007-01-20 19:36:39,unknown,0,美国小说很煽情的
响箭,4,2010-08-31 19:04:10,unknown,0,毕竟是读中译本，有种隔靴搔痒的感觉，至今还没看过电影版的三部曲。
花卷馒头,5,2015-01-13 10:28:36,unknown,0,翻的不行
🐼🐼🐼,4,2011-09-27 22:45:58,unknown,0,应该是这个版本，译于1981？注释太有趣，如果以骏骏的眼光来看，简直可以写篇文
Vizier,4,2009-10-08 01:31:27,unknown,0,一个人只有一个命运
小薄荷,NaN,2010-03-30 13:42:46,unknown,0,其中有些处事方式，值学。
草禾刀,5,2008-12-01 21:30:01,unknown,0,fabulous
venjet,5,2015-12-10 17:26:41,unknown,0,坚守缄默原则的他们是另一个社会
多丽丝,3,2012-07-05 10:58:04,unknown,0,大学恶补名著之一，应该是男人看的故事，一点也不喜欢这种故事，也不喜欢这里面的男人。
Penguin,4,2015-09-11 20:32:38,unknown,1,猝不及防的结局了
Vivie,5,2015-03-24 17:05:38,unknown,0,男人的必修课。Start，2015年3月10日；Done，2015年3月24日
Thea,4,2008-05-31 19:27:26,unknown,0,，
秋刀少年,5,2008-02-03 20:58:39,unknown,0,老头子死得很不壮烈.
花椰菜西兰花,5,2007-12-20 19:17:24,unknown,0,好呀
老实人,5,2013-08-28 17:01:42,unknown,0,男人的第二本《圣经》
依米,NaN,2011-03-21 17:29:14,unknown,0,教父的生存哲学，你知道吗？
Emily,4,2007-12-19 23:08:30,unknown,0,电影经典肃穆，小说酣畅淋漓
赵大白,5,2009-11-12 13:59:26,unknown,0,学到很多
豆友4890949,4,2010-12-20 19:37:25,unknown,0,冤冤相报何时了啊
颜,5,2006-08-08 12:59:17,unknown,0,更喜欢电影
林浦东,5,2011-03-31 22:00:47,unknown,0,写读后感写得最情愿的书之一
莱尼圆,4,2011-05-22 00:32:39,unknown,0,电影比书好看是有原因的
東郷柏,5,2013-12-23 15:51:48,unknown,0,圣经读一遍是不够的对一个男人来说
西瓜,5,2014-12-11 10:52:15,unknown,0,三天看完，让我看到了有魅力的坏蛋，也让我知道，对于有些大众的准则不可尽信。要有自己的自我意志。
