user_name,star,comment_time,geo_ip,vote,short
1624,5,2018-05-07 13:07:46,unknown,1,人的才气真是不可觊觎令人艳羡的存在初读卡尔维诺完完全全被惊艳了这是一种能让人从浮躁的情绪沉浸下来的文字要囤积再次回味的文字轻盈的哲思在语言结构中嵌入连绵而悠长的补足对脑海中原先存在的范本城市抑或不是)LIST:开始存钱买卡尔维诺全集了还有他的基友罗兰巴特嗷嗷嗷
抹茶懒猫,5,2016-10-22 18:57:01,unknown,1,最近的睡前读物，被作者的想象力与文笔深深惊艳。
豆友156181590,2,2021-07-11 18:07:36,unknown,1,清书架141想象力笔记，我不喜欢。除了目录编排，没有可取之处。
余小呆,5,2020-10-28 12:56:18,unknown,1,第一次读卡尔维诺的作品，看这本书的总体感觉是晕晕的，不知所云。。读完这本凑巧又看唐诺的《阅读的故事》也有提到。已把此书加入重读队列。
时光里，光年外,5,2016-11-24 09:57:24,unknown,2,在地铁上看完，越往后读越吸引人。不得不说，这是我迄今看过最有逼格的一本了。合上书就想起来自己所在的城市——看不见的西安，今天的这个雾霾啊……
韩雨洛,5,2019-03-10 21:31:39,unknown,1,最喜欢城市的欲望五这篇，这座城市叫作佐贝伊德。许多男人们做了同一个梦，梦见在一座陌生的城市中追逐着一个女人。女人突然消失了，梦也醒了。为了能再见到那个女人，大家决定按照梦里那般建造出那座陌生的城市。当你试图去描述一座城市，所描述出的这座城市想必不再是原本那座城市。这是一本适合在旅行途中看的书——卡尔维诺把脑海中的城市转化为文字，她不是任何一座城市，却有任何一座城市的影子。看不见的城市只存在想象中，只存在梦境中……
根斯巴克连续体,5,2020-04-24 12:02:45,unknown,1,形态，秩序，距离，路径并不重要，因为他们都大抵相仿。贯穿世界的通透感，我们生活的世界四周都是壁龛，元素组合与符号的拼接才是永恒。用城市的不同视角来塑造她的提纲，用不同形状填充她的全貌，世界本应混沌，我们用自身的品质将地狱割裂开来，好唯心，啧啧称奇
kxxk_,5,2018-06-12 20:56:38,unknown,2,果然是卡尔维诺没拿诺贝尔是诺贝尔的损失不是卡尔维诺吃了王小波的安利道长的引导来的算是我读过最“难读”读起来最累的书了必需一字一句用心读草草读就会完全不知其味几乎每一篇都可以开整篇的人类课题是城市是人是行为是文明是世界是这世间万象卡尔维诺就如此化为篇篇短文与想象举重若轻他即没有完全的肯定也没有完全的否定是无数的negative下的positive又是无数positive中的negative令人惊喜的是最后卡尔维诺竟然还提出了“方法论”：“免遭痛苦的办法有两种，对于许多人，第一种很容易：接受地狱，成为它的一部分，直至感觉不到它的存在；第二种有风险，要求持久的警惕和学习：在地狱里寻找非地狱的人和物，学会辨别他们，使他们存在下去，赋予他们空间。”如此温柔
浪客猫,5,2021-08-18 22:30:46,unknown,1,我可能无法游历尽这世界，但我会一遍又一遍地重读这本书。
sunrise圈圈,5,2018-06-03 16:33:52,unknown,1,几年前初读时完全无感，现在二刷却非常喜欢。充满了哲思的城市意象，关于欲望、追逐、巨大的繁盛与失落。
寥一,5,2017-10-14 14:38:48,unknown,1,大学时买的卡尔维诺全套，被其惊人的脑洞和复杂的故事震惊，怀疑这人智商爆表。遂与博尔赫斯并列，成为心中不朽男神。可笑过去了几年，却距离这两位大师越来越远，现在看自己的作品，恨不得统统付之一炬，恨死我了~早知道不认识你们就好。好气。
Līlā🪐,5,2016-07-20 15:45:48,unknown,2,实在太有趣了，脑洞打开，挑战想象力和思辨力，不仅想反复读，还想抄下来背下来。
晶,5,2021-06-04 15:23:33,unknown,1,记得2018年在亚丁的牛奶海，拿出来卡尔维诺的的看不见的城市一篇文章读起来。这页文字被亚丁山上的雨水浸湿，纸张皱了起来。这是看不见的城市存在的证明。
elf,5,2020-09-03 15:57:53,unknown,1,重温，阅读。看到一句评论“这不是散文诗歌，不是哲学，是宗教”。阅读也成了如此奇幻的体验，没有任何正常人性的态度偏见刻薄嘲讽，就像上帝视角观察一个微观的自己生存的世界
孟藻,5,2014-05-01 13:48:43,unknown,1,太赞，这是一本可以看很多很多遍的书。
本間ミチル,5,2020-11-27 09:07:14,unknown,1,这本书淌进生活，就像某种奇异材料，柔软地变形、释放，填补那些无所想象的等待中的空洞。喜欢每一座轻盈的城市和死者的城市。“有时候，我觉得你的声音来自远处，而我自己是一个浮华且难以居留的现实的囚徒，所有人类共存的形态都已经到了周期的极端处，无法想象他们会取怎样的新的形态。我从你的声音里听到了使城市得以存活的无形理由，也许通过这些理由，它们还会在死亡之后再复活。”
Pratimocsa,5,2021-05-09 21:31:45,unknown,1,55555卡尔维诺也太会写虚幻了一切皆空但是结尾怎么能写得这么好啊
绮齐,4,2019-06-12 12:22:43,unknown,1,生活是一盒巧克力，书也是。不亲自打开这本书，你永远不知道它会赠予你怎样的惊喜和想象力。
第①印象,5,2017-04-08 12:59:39,unknown,1,这实在是挖掘叙述的无限可能——你很想在心中去描摹书中的城市，但无论如何也做不到。整体风格是朦胧缥缈的，可以说是什么也没有读到，也可以说是读到了自己所有的欲望与记忆。城市不过是一些意象，一些符号，它代表着那时的我们，就如我们不能两次踏进同一条河流，我们亦不能两次走进同一座城市，两次阅读这本充满着无限可能的书。
董冬.,5,2019-07-28 22:23:13,unknown,1,很快就翻完了，意犹未尽，有一种堪称梦幻的感觉。卡尔维诺的想象力真.令我折服……摘一句话吧，“掌控故事的不是声音，而是耳朵。”
pingqaqa,5,2017-09-03 00:35:20,unknown,1,有种看科幻小说的感觉…不过，每个城市都有历史的投影吧…
秋岛狂徒,5,2020-04-14 16:25:57,unknown,1,天才般的想象力
Aurora,4,2020-04-11 22:12:32,unknown,1,像是集哲理和禪意於一體的不分行的詩，又像具有某種神秘色彩的童話傳說。閱讀中會有電光火石的悸動。（第15週）
暮归渔舟,5,2019-11-16 20:44:05,unknown,1,比起阅读这本书本身，阅读时唤起的关于自己生活过城市的印象与未知城市的想象更有乐趣。摩登都市、乡村小镇、海港码头……一切都来源于对生活、对世界最原初的爱。
还是偶尔想伟大,4,2012-08-13 13:10:49,unknown,0,写小说的诗人
🌵,5,2013-05-02 18:20:48,unknown,0,好棒！谢谢韩杰！
拜女神的卷毛琐,NaN,2013-08-15 13:57:23,unknown,0,超强即视感
精神少女王绥👧,5,2019-06-30 19:40:40,unknown,0,描述了这么多的城市的样子，本质上却是在描述人类。
四十二,5,2013-01-29 23:37:49,unknown,1,卡尔维诺描绘了几十个并不真实存在的城市，你却能在每个城市中找到每个真实城市的影子。城市是虚妄的存在，是把动物赶尽杀绝，做成标本陈列于博物馆供人学习的矛盾体。隐晦的预言都已被证实，选择随其欲望膨胀或不合时宜地独善其身是永远的难题。孤独的东方可汗和洞悉一切的威尼斯商人仍在下棋，棋盘上的每个方格都是一座城市。黑白逐渐消融，所有事物最终都会别无二致。
鸢都依然,5,2012-10-12 19:05:37,unknown,0,第一次有这样的阅读体验，像漂浮在其中，去看不存在的城市。想起来，卡尔维诺在美国讲稿中一章专门讲“轻盈”，他自己用的真是出神入化了。
还没吃饭呢,NaN,2015-10-03 16:40:02,unknown,0,比老版本少了些韵味，但也解答了一些看老版本产生的含混。
省钱回家吃面条,4,2012-05-21 10:31:50,unknown,0,作者也许是不可知论者吧……
azure,5,2013-08-18 13:54:03,unknown,0,一口气看完觉得好孤独好失落是怎么回事我一定是年纪大了
