user_name,star,comment_time,geo_ip,vote,short
开在尘里的花,4,2022-02-04 19:47:36,unknown,0,通俗易懂，给小白科普正合适～更多的联想到企业管理，都是一样，如果没有制度保障，通过人性道德良心来推动发展，多少有点靠运气的成分，但是反过来说，再完善的制度也总会有缺陷，所以，emmm，书里讲到，实践是检验真理的唯一标准，但是，也不能用一种成功的实践就去否定另外一种失败～
已注销,4,2022-04-04 11:24:21,unknown,0,当前我国经济方面两大问题：1.内部经济结构失衡：重生产、重投资，相对轻民生、轻消费，导致与巨大的产能相比，国内消费不足，消化不了的产品只能对外输出。这就带来了2：国外需求的不稳定和贸易冲突。国内经济结构失衡主要就是居民消费不足（GDP三大部分消费、投资、净出口（出口减进口），其中（居民）消费占比过低），原因是居民收入份额低+储蓄率高。要提高收入就要：1.继续推进城市化+服务业（因为制造业机器自动化后无法吸纳更多就业），服务业的大发展，只能发生在人口密集的城市中。2.地方政府增加民生支出（教育、医疗、社保、养老等）。3.扩宽居民的财产性收入，发展各种直接融资渠道，让更多人有机会分享经济增长的果实，这就涉及金融体系和资本市场的改革。总之，“生产投资型政府”要向“服务型政府”转型。
最后的青豆,4,2022-04-04 15:55:58,unknown,0,未来几十年将由投资型政府转型为服务性政府的中国发展计划，由此立点将与你我相关。
北岛音,5,2022-04-04 16:36:36,unknown,0,生活过得好一点，比大多数宏伟更宏伟。
闲人,5,2022-04-04 22:23:07,unknown,0,阅读体验如此之丝滑，很多经济问题几页就能解读通透，经济一定是在时时刻刻变化着，制度也必然随之变动，进而影响经济，坚定看多中国，相信中国一定会更好。
