user_name,star,comment_time,geo_ip,vote,short
伊伊,5,2013-06-01 22:36:38,unknown,1,我不知道一个人在那样绝望的处境中还能泰然处之，他总是抬头挺胸，脚步轻快，优雅的好像走在回家的路上一样，而家里有香喷喷的晚饭和好女人在等着他，而不是只有食之无味的蔬菜、马铃薯泥和一两块肥肉......安迪有一种特质，一种内心的宁静，甚至是一种坚定不移的信念，认为漫长的噩梦终有一天会结束。或只是一种自由的感觉，即使被关在这堵该死的灰墙之内，他仍然有一种发自内心的光芒。最后当他终于冲破牢笼的一刻，整个灵魂都要震撼了！
独自等待,3,2011-03-12 18:42:45,unknown,0,纳粹高徒那篇不容错过，很强悍的情节推进！！
mR.差不多,4,2011-07-07 09:59:30,unknown,0,我喜欢看小说的感觉，但我更喜欢电影里的结局。
AsuraHu,5,2011-06-07 06:37:09,unknown,0,《肖申克的救赎》，说不出特别在哪里，但是给人的震撼确是不可思议的。构筑在“不可能”和“不公平”上的“可能”是一种惊异，“放弃公平”或者说“自己创造自己的公平”是一种现实结构的悲喜。
温差,5,2013-04-21 20:12:03,unknown,0,安迪向往自由所以淡定心存希望才有希望
小风扇,4,2016-06-01 09:14:43,unknown,0,后半部分很好看，出狱后对外面世界的不适应、习惯的养成等相关描述也令人印象深刻
佛罗伦萨小年糕,4,2013-10-25 05:03:01,unknown,0,只要为最坏的结果预先做好准备，那么抱着乐观的期望就没关系。
千年,4,2014-10-08 08:59:32,unknown,1,2014/09
€(= ¿ =),5,2014-11-16 23:56:59,unknown,0,电影比小说温和。小说肆无忌惮。相当相当好看，下了好几顿饭。
#Capella#,4,2009-05-16 22:01:45,unknown,0,前两篇值5星，总体来说只有4星
熏源依Adele,NaN,2011-03-15 17:27:48,unknown,0,比起安迪，更喜欢第一人称的真实
suet,4,2010-07-06 08:19:59,unknown,0,想看他别的书。
肆零肆,NaN,2011-04-15 16:04:34,unknown,0,读完信，我把头埋进臂湾哭泣。你们也是
爱吃的人都幸福,4,2010-07-25 11:29:24,unknown,0,看过电影再看小说便觉得不复那种震撼力，但亦补足了一些细节部分.作者的功力非凡
PEP,5,2007-12-28 19:58:18,unknown,0,原著
FF0000,5,2008-02-05 19:03:25,unknown,0,2008-02-04晚aloneathome
哔-----！,5,2008-04-05 22:35:28,unknown,0,只看了第一篇
tjalang,4,2008-04-23 19:47:58,unknown,0,电影果然不如原著好看！
Ioannes,5,2011-08-10 19:14:50,unknown,0,电影跟书不是一个档次的而且其实我更喜欢thebody这篇
嘉陵,5,2012-03-22 17:00:13,unknown,0,能忍，简直都成忍者神龟了
红叶漫天,5,2011-11-22 21:27:57,unknown,0,谁特么说他的书里木油文学，，，，
方洛洛,5,2012-11-09 10:52:12,unknown,1,斯蒂芬·金写的小说就是用来让我这样热衷写小说的爱好者绝望的啊！在《纳粹高徒》这部中篇小说里，斯蒂芬·金埋伏了五、六把不同的枪，结尾的时候，所有的枪一起开火了。这种布局能力，真像神一样啊！而他的《肖申克的救赎》更是让我觉得一个人一辈子只要写一部这样的小说就够本了！
南水,3,2015-02-12 01:18:55,unknown,0,第二個故事太嚇人了
旧城,5,2015-02-05 16:20:58,unknown,0,不喜欢恐怖或惊悚类小说，所以没读过斯蒂芬金，但本书是个例外。没有错过如此精湛的杰作，真是幸运。
Imoko,5,2008-12-20 19:13:51,unknown,0,超喜欢纳粹高徒的
Colin Mahler,5,2017-03-31 21:51:04,unknown,0,激动人心的一部书！
蒲,4,2015-10-20 01:16:19,unknown,0,读书多了更多的想象空间。确实是好故事，看完忍不住把电影又找出来看了一遍。
v.,3,2010-06-21 10:45:47,unknown,0,收到的一份生日礼物
夜露死苦,5,2007-11-25 11:40:49,unknown,0,安迪才是世界上最伟大的人
177同学,4,2008-06-19 20:20:34,unknown,0,有希望是好事，甚至是这个世界上最好的事情。
伊内斯,4,2011-08-05 18:21:31,unknown,0,像鲁滨逊一样，告诉我们要一路向前。不像KING的风格
书山疏影,3,2008-10-02 23:27:08,unknown,0,头末很好，中间一般。虽然据说尸体是史蒂芬金的自传。
坐地而行,NaN,2008-10-20 19:06:19,unknown,0,要是只印肖申克的这一篇就好了。
zack,5,2011-06-21 22:58:23,unknown,0,越狱的经典之作。
玄芝,4,2013-08-19 15:49:03,unknown,0,一边读，一边在脑子里闪着摩根弗里曼的旁白。
布恩布恩,5,2011-01-25 22:57:11,unknown,0,一口气看完神马的，纳粹高徒吓死我了……
mosquito惟,4,2012-05-26 00:06:21,unknown,0,电影比小说要精彩...文字气质跟影片中摩根弗里曼的画外音完全搭
Felven,5,2015-02-15 20:48:30,unknown,0,想不到肖申克的救赎只是这本书的第一章而已
尹智龙,5,2010-04-18 12:05:22,unknown,0,手机电子书
