user_name,star,comment_time,geo_ip,vote,short
庄叔的小跟班儿,5,2013-09-22 19:22:28,unknown,1,哭成傻逼了，幸亏在锦州参加婚礼时还没看到后半部分，不然丢人就丢大发了。
kissdemon,4,2020-01-27 13:39:22,unknown,1,2020No.1很喜欢前半本，陆焉识这个男人真带感，富家少爷也好，犯人老几也罢，对所有凑上来的亲密都“不识抬举”地疏离，尽力晚一点失去他的清高和独立，满腹学识沉淀下来的骨子里的那点清高让人着迷，也难怪婉喻一眼万年了。老年的部分反倒没这么多唏嘘了，大概预期到了他们的结局。只是忍不住感慨，这样立体多面的人生，到头来在相隔数十年的晚辈眼里，只是这样简单平面的形象。年轻时你是少年天才，你是学者，你是陆教授，你是政治犯，你一生波澜起伏，到老了，你就只是个老头。ps.喜欢梁葫芦，他死的时候我刷刷地掉眼泪。
Kris,5,2014-06-24 00:45:27,unknown,1,“身体保重好，将来看见的时候不至于太不敢认。”
ce?!?!?ce,4,2014-08-23 18:11:09,unknown,1,一个时代的悲哀。
is4dog,4,2012-03-17 13:32:09,unknown,0,好小说……再矫情也是好小说……个人风格像北京的沙尘暴一样别无二店，那些只属于她的点太准了……严阿姨在我心目中>王安忆阿姨了……（王阿姨好像某个阶段之后没有成长？）哎呀，要赞美严阿姨真别扭
J,5,2017-07-21 07:16:48,unknown,1,等待中的变化与升华，一个人的史诗由另一人来点睛，团圆之后那几年写的太抓人了。不时带调侃打趣意味的丰富细节很讨人喜欢。
方小孬,5,2014-05-21 19:31:07,unknown,0,不敢去看电影怕哭惨了
jiaon,4,2012-02-05 17:01:00,unknown,0,过瘾
阖昔,5,2016-02-06 17:46:11,unknown,0,永远记得老几这样的人物，这样美丽的情感
bookbug,4,2014-01-13 21:40:02,unknown,0,严歌苓近年来少有的力作，张艺谋改编的电影今年上半年上映
机-丹尼尔-玛格,4,2012-09-24 22:47:20,unknown,1,不知为什么前面看引言的时候很想撕书，因为受不了形容形容形容形容，绕着弯的着字，幸好正文越来越流畅，老几终于被释放，婉喻却好久都不回信，我以为老几带着一肚子的忏悔等了那么多年，婉喻是不是死了.结果不是，最悲哀的是她得了老年痴呆，永远记得自己在一辈子等焉识，却不认得他，直到死.
但說風月,5,2016-05-21 01:35:32,unknown,2,最近几年读到的唯一一本让我泪流满面的小说。。。电影改编的太弱太肤浅了。。。
Titiany,4,2014-12-18 10:40:06,unknown,2,跟张爱玲当然有差距，世上大约再没有人能似张爱玲那样凉薄又有情。即便如此人物形象也是栩栩如生，平平无奇中透着冷峻的残酷~只是我在想，世上会否真有人如同冯婉喻，那样被冷遇仍如对待偶像一样爱待陆焉识。
晚安疯子,5,2014-05-05 00:09:26,unknown,2,都是好句！
君,5,2019-08-22 22:14:06,unknown,2,陆焉识后来成为了陆犯焉识。其实他那之前二十年就一直是陆犯焉识，只是时间长了，大家也就忘了，只是老几老几得叫。最最后，陆焉识果然去那片高原当老犯了，那是他自由的选择。这书绝妙之处甚多，其一就是陆焉识的自由，那是大草原上生命的自由，或许他1964年越狱在草原上吃淀粉草的时候就体会到了这种自由。不过因为婉喻，这种自由一直弱弱的。他终于爱上婉喻！可能上天也看不惯焉识了，于是他用时代、儿女、甚至婉喻来这折磨他。但越是折磨，陆焉识越顶天立地。没用场的人混合上一股混不吝气息，焉识愈发自由了。严歌苓手笔真是老辣，我本以为焉识回上海后那么长的篇幅会是败笔，哪想到她就把比悬在那，吊着你——吊死你。学锋啊学锋，你可是学到点你祖父的文笔啦！我想，学锋在祖父情书处支吾其词，大概是明白，她的手笔实在无法和祖父比吧
"Orange,",5,2012-05-07 23:46:36,unknown,1,第一次读严歌苓的书是因为看了赵薇演的电视剧，后来闲着无聊就上网搜跟她有关的消息，冲着“好莱坞编剧”几个字，在卓越上买了她的一本短篇集，读了《少女小渔》，再接着就几乎把她绝大部分的书都看过了一遍。长篇还好，很多短篇到现在讲了什么已经记不清了。唯一记忆犹新的是她每本书里所写的那些女人，她们大多都不是为了自己活着，而是为了她们爱的男人，或是为了守护自己需要用一辈子去守护的，被她们看得比自己生命还要重要的东西。这本书里的婉瑜也一样，她爱的男人在最开始并不爱她，或许说是并没发现自己爱她。一生里先是因为恩娘，后来是因为政治，到老因为记忆丢失，她和陆焉识始终被这些东西隔开，她临终的时候说，路很远的，也是为了袒护自己在生命最后阶段所等的人，即使她无法理解最后几年，她想要的已经得到了，她等的人也已经回来了。
圣无常,5,2019-01-05 00:04:29,unknown,3,在这个国度，不管什么时代，要当个清高的自由的文化人，太难太难了，还不如装个结巴。
冬惊,5,2014-05-29 14:29:24,unknown,1,震撼
叶全真分叶,NaN,2014-12-31 14:15:05,unknown,0,那一抹见不得人的艳情
EvieAli,5,2014-08-20 12:11:31,unknown,1,严歌苓真的是太会写“戏”，太会讲故事。鉴定完毕。
筱晗,3,2014-06-01 20:55:21,unknown,0,感觉力道不够。
夏雨路,4,2013-07-19 23:55:19,unknown,0,依然是强悍的女人与强悍的爱情。看了一上午……
草香石冷,4,2011-12-09 22:26:26,unknown,0,是新的长篇吗？
Rosy_Yu,4,2018-01-03 19:00:55,unknown,0,读得好辛苦好吃力的一本书，严老师内心太沧桑了
花皮瓜,3,2013-05-07 11:27:16,unknown,0,严歌苓依旧充满了想象力和戏剧性的激情，但这个故事似乎单薄了些，缺了些什么。
草々,4,2014-07-18 00:11:26,unknown,1,在喜马拉雅听的。
Oldman,5,2016-03-17 23:08:32,unknown,1,当焉识意识到自己是爱婉喻的而下决心逃跑，因为怕晚一点自己就“老了，爱不动了。”被戳泪点，以及最后婉喻走时，和焉识说的悄悄话，也是无比感动。
玛玛玛法达,3,2014-06-15 16:16:11,unknown,0,通俗小说里有手笔和有野心的作品，但是全知全能得不到位，对于主角缺乏一贯且流畅的叙述，人物欠活气，对角色有任何看法或者无看法都好，但总是提线木偶一样欠笔力
SUE∮,4,2012-03-16 10:14:14,unknown,2,书很轻，情感很重。我们只不过是一粒被历史碾过的沙子。自己掂量起来很重，在漫长的历史中却很轻。
微笑迦朵,4,2013-10-18 09:03:24,unknown,1,0.99元电子版。这类小说看得少，所以看起来觉得蛮有意思的。
feimo,4,2014-06-18 16:50:49,unknown,0,至少比电影主题丰富
一夜暴富找乐子,3,2015-08-16 04:58:18,unknown,1,没劲，不是说看不下去，是看完没感觉
王强尼乐百事,5,2014-06-18 11:04:25,unknown,0,推荐！
Sh.S.敖登托雅,3,2012-02-29 22:31:55,unknown,0,既没惊喜也不失望，永远都是这样的严歌苓。但终究是我阅读的她最后一本书了。
👋,5,2013-12-12 02:30:50,unknown,0,连读带记地终于读完了，看得我好生难过。像是心里被掏了个大洞，不疼但是嗖嗖地往里进冷风的那种难过。
baobaodu,4,2014-02-17 15:39:59,unknown,0,归来
雅典娜,5,2014-05-10 22:54:10,unknown,1,放在kindle里很久了，听说男主是明叔演的，即使是张艺谋的片子也打算去影院看了。这一周用零散时间把整本书读完，各种感慨此起彼伏【…我觉得电影决不可能拍得有书这么好了……
Harvey,5,2019-05-29 11:24:02,unknown,4,这书绝对严歌苓的巅峰，无法超越的巅峰。
waking王小心,4,2018-03-18 14:29:31,unknown,0,还是写自己最熟悉的人和事有感染力。
伊卡螺丝,5,2019-07-26 20:07:17,unknown,3,2019.45“中国是个什么地方？做学问做三分，做人做七分，外国人要紧是发明这种机器那种机器，中国人呢，要紧的是你跟我搞，我跟你斗。你不懂这些，就是个没用场的人。”于是国与国斗，家与家斗，人和人斗，大家全是牺牲品，一股怨气互相撒。想来人世间最豁达的态度便是与自己的经历和解，而非与社会与人和解，陆焉识是这样的，大草原劳改犯的日子他都能熬过来，因了那份迟来的理解与牵绊，但那牵绊所附带的沉重枷锁最终让他回到那个给了他和他的家庭毕生苦难的地方，学术、爱情、亲情、权利、面子、世俗的生活，他抛了大半，没有什么可以阻挡一个无牵无挂的人。
老脸,5,2014-04-06 18:21:16,unknown,1,我最欣赏的是严对某些容易激化读者情绪的部分，叙述直白但不失隐忍。电影不知道会是什么样，大部分东西都是没法拍的，不好拿捏，而且还有这么操蛋的电审。
36.4℃,4,2014-10-08 23:12:30,unknown,0,一直没有看过严歌苓，连那么多改编而成的电影都被巧妙避过。。。直到不久前看了一篇她讲自己写作方式的文字，还有上映却依然没有看的《归来》，才想要把这部找来看看~
沈昆默,3,2014-05-13 10:00:08,unknown,3,张艺谋选择了全书最精彩的部分，眼光蛮毒.
清秋雨薇MOMO,4,2013-07-12 09:26:29,unknown,0,爱的路千万里
Ex,4,2014-03-21 01:14:15,unknown,0,读的第一本严歌苓，很震撼！许多种爱情，许多种死亡，许多种隐忍，许多种爆发，许多种惊喜，许多种绝望，许多种理解，许多种困惑，这些需要岁月的历练才能读懂，需要充满温情与敬意的才情去书方能触动人心。20140321，01：13读毕。
逸林露酒小店,4,2013-11-26 22:46:04,unknown,1,十分擅长将大化小，抗战、内战、建国、土改、反右、文革，种种泼天大事在严笔下就小化为陆焉识的便秘、挨饿、受冻、指甲脏----这是她的本事，也是她的不足。PS：书名是很文艺的
lalala三只小猪,4,2017-12-12 15:09:26,unknown,2,“政府特赦你也没跟你道歉，没有跟你承认错误，承认当初捉你进去是捉错了人，谁知道明年或者后年会不会又请你进去。”虽然估计很多人都不会喜欢陆焉识市侩的儿子，但他说的这句话真的让人感慨，谁不愿意挺直腰杆做人，世道如此，一个普通人又能怎样?小说的尾端归来时弱了点，总体还是很不错的。
獨孤島主,4,2014-05-20 12:54:34,unknown,2,处处工于心计，猖狂进犯狂飙的年代，到了后来，文字流畅到少看一眼都觉可惜，那种虽然用力过猛但仍属上海女人独有的洞察力，是无论如何改不进电影去的
MetalDudu,4,2015-10-17 16:01:11,unknown,0,错过媒体炒作的时期，读这本书可能更适合，读完也不打算看电影了。小说以“我”的视角推进，时间切换都是技巧，我以为并不必要但挺有心。两个深刻的方面：第一是大历史背景下的人物命运，虽然是小处着眼；第二是无法相见的爱，深沉并且毫无道理，每个人背负的命运之恶。结尾一部分岔开写子女争抢房产，似无必要，结局甚佳。20151014
白色的蓝,4,2014-06-15 05:26:51,unknown,1,火车站那个场景书里依然感人
小天使😇,5,2021-01-27 02:34:41,unknown,3,有点难过……人物塑造的太复杂了，但好像每个人都活在悲剧里，永远努力找一点光。我不懂婉喻天真又坚定的爱，我不懂邓指如何从丑陋变得心善，我不懂丹钰和冯子烨明明一起成长为什么一个充满感情一个那么残忍冷漠。最最悲剧还是陆焉识叭，所有的天才都没发挥作用，最好的时光错过了爱人，几十年过着非人的生活，拼上所有去忏悔却还是没来及，永远也没能摆脱罪犯的身份和习惯。他是如何觉得自己幸福呢。在看遍温暖残酷经历过大少爷般的和猪狗不如的生活好后，他还能体会到情绪的变换么。
_____月满西楼,5,2019-12-30 19:58:59,unknown,2,“一般来说，‘没用场’的人都有一身本事，误以为本事可以让他们凌驾于人让他们有求于他们的本事，在榨取他们本事的同时，至少可以容他们清高，容他们可以独立自由地过完一生。但是他们从来不懂，他们的本事孤立起来很少派得上用场，本事被榨干也没人会饶过他们，不知如何自身陷入一堆卑琐，已经参与了勾结和纷争，失去了他们最看重的独立和自由。
庆祝无意义,5,2021-08-26 16:56:16,unknown,1,“哦，路很远的”她的焉识永远有她来维护，连生命里的最后一句话都是，她的青春尊严金钱房产身体体面子女都是爱他的工具。虽然这个一生守一人的完美妇女形象太过男性视角，用现在的观念来看很难不打拳，但文学的魅力就是可以让你跨越任何时代，成为任何人。我相信那个非人的年代能够催生这样坚韧的感情，结局或许更糟，许多焉识和婉喻隔着山川大漠、枯骨残骸、遗憾悔恨，此生不复相见。办公室摸鱼的时候看完的，还好空调很低假装着凉将擤鼻涕动静弄的很大好盖住哭的声音。
Jim's Bean,5,2015-04-09 09:25:12,unknown,1,等待是一座牢无论是对好事坏事的等待，婉瑜和焉识的隔是被时代动乱嚼碎泡软成为最柔软的地带。就像最后焉识最后说的，自己其实也是有福的。严歌苓对他手握珍宝而不惜的痛恶到极点，而对他的棱角又某程度的赞赏，这半世的颠沛流离是作者对他悲悯的鞭挞
不良生,5,2019-01-26 11:34:11,unknown,2,《归来》已经足够凄婉悱恻了，却原来也不过只才从《陆犯焉识》扯下一块布料，缝制成一小块绢帕而已。读时脑补陈道明的陆焉识，巩俐的冯婉喻，而恩娘，直接跳出何赛飞的脸孔腰身，想着十分贴切。从前喜欢严歌苓，更多当她是个写电影、电视剧的，这本至此，终觉得她是厉害的作家，称它是她“集大成之作”是有理的，读罢既难受又慈悲，既疼痛又愈合，仿佛跟主人公们也打过了照面似的。
彭—庄影,4,2020-06-30 21:03:05,unknown,2,悲伤的故事。
宋倩文,5,2014-03-21 21:47:40,unknown,1,在深夜为你流泪。
DianeZ,4,2020-08-24 14:31:47,unknown,1,比起生生死死，印象更深刻的倒是“淡淡的无耻”。就连叙述者的语气也不时带着“淡淡的无耻”，半是戏仿半是认真
一点都不酷,5,2020-08-27 00:21:43,unknown,1,前半生，我因躲避你厌你而逃，后半生，我因想见你爱你而逃。这一辈子，我们之间隔了太多：大西洋，恩娘，监牢，记忆，但是在这最后，请让我带着你的骨灰去大西北流浪。
凌霄,5,2014-08-05 11:11:47,unknown,1,这是一个不一样的知识份子，比方鸿渐更有真才实学，更正直，但也一样喜欢犯一些迂腐的错误，也一样会表现出懦弱，但陆焉识更有骨气更坚持更少劣根性，身上有一种传统知识份子的贵族气质。让人心酸的是人是故事，但更心酸的是传统中国。对故事的结局，起初很不甘心，很希望能有一个甜蜜美好的大结局，但这个结局更真实更耐人寻味也一样很温馨，冯惋喻爱的是那个传统而单纯的陆焉识，再回来的始终不是同一个人了，但那个陆焉识始终存在，在她的内心深入，无人可以取代。
俞岭,5,2019-05-30 06:59:30,unknown,1,我认为，这时严歌苓写得最好的一本。cc说，严歌苓的写作把个体与时代结合得很好，我同意。陆犯焉识几乎可以改名《伤逝之后》，知识分子的一点骨气被她写得几乎称得上凄切悲壮了。她书中的人物都苦，苦且自知，于是更苦，读得我心里发闷。
梅梅,4,2020-06-30 20:57:34,unknown,2,哀大莫过于心死，心死莫过于一笑。
哀矜勿喜,5,2020-06-24 18:42:13,unknown,1,严歌苓文笔很绝，很多写法从来没见过，并且特色十足。璞玉浑金。
Pluto&Piaget,5,2021-03-19 21:57:13,unknown,2,陆焉识知道很多事，冯婉喻只知道一件大事。//冲破天罗地网，去成为那彻底没用场的人，逃跑就是对世界的触犯，所以“陆犯”。//七年前在火车站买到，读了无数遍，最难忘奶油蛋糕、珍珠耳环、蓝宝石领带夹、两件马甲、冷掉的烟熏鱼、捂热的巧克力、修好的欧米茄、望达的头发、丹琼的眼泪、恩娘的彩扇子、婉喻印在旗袍上的脊柱。今又重读，这是男版包法利夫人、国版生命不可承受之轻，初读不知书中意，再读已是书中人，老子就是陆焉识。
日光倾城,4,2014-04-21 10:36:29,unknown,0,有画面感。时间跨度驾驭得很了得。期待老谋子的电影版
虫虫,5,2018-03-07 09:17:33,unknown,1,看到最后想起了百年孤独，同样是白发苍苍，持续了将近半个世纪的爱情，虽然经历不同，但是那份爱却是千锤百炼而成。
蜡笔不小心,3,2020-01-20 23:23:20,unknown,2,一个简单的故事没必要拖那么老长…主线本身就不太有意思就不要穿插那么多别的东西了，像老奶奶的裹脚布……读不下去，尤其是严歌苓这段她很骄傲（？）的回忆老是在她的其他文章里面提到，就让我感觉在炒冷饭
Curtains.,4,2016-10-11 09:02:51,unknown,1,心太软的人快乐是不容易的，别人伤害她或她伤害别人都让她在心里病一场。
flypig,5,2021-02-04 23:47:01,unknown,1,从头到尾窥探了陆焉识和冯婉喻几十年的爱情生涯，心里五味杂陈。虽说浪子回头金不换，可是在时代的洪流下，小人物爱情的辛酸苦辣显得是如此卑微。恩娘说得好啊，陆焉识其实一辈子就是个“没用处”的人，可婉喻呢，就是爱他的“没用处吧”。
Ash粒粒甜,NaN,2013-08-05 20:59:33,unknown,0,就看过的严歌苓的小说来说算是很上乘的作品了。不过蒙太奇多是好的，但是有些让人读的混乱，在这一点处理上真的不如白先勇
子衿,4,2013-08-16 09:42:21,unknown,0,值得一看
海上花开,4,2014-06-06 09:15:30,unknown,0,男性的坚持在于作为知识分子的操守。女性的坚持在于真挚的爱。两者相遇，何其动容壮观。总之严歌苓就是也太会写了。然后也写的越来越适合改编影视了。
薇薇Veronica,3,2014-09-08 23:57:34,unknown,1,因为外公读完了全书，却无比遗憾整体故事骨架的缺失，从戏剧矛盾冲突而言，电影远胜过书。中秋正好看罢此书，也算是缘
laputa,5,2014-06-04 01:34:28,unknown,0,这个爱情故事写的很好
liz,4,2014-06-09 14:00:30,unknown,0,文字功力四星，逻辑无法接受。
中年少女糕圆圆,3,2014-06-08 15:24:59,unknown,0,跟风读。人物小传尚好，彼此联系突兀。
日烟火,4,2014-04-25 11:49:40,unknown,0,严歌苓太知道怎么让人难过，轻车熟路捅人心窝子。这是成功，但多了就是失败了。
月光下私语,5,2013-02-01 21:29:31,unknown,0,历时这么久，终于看完。只为一个情字，跨越五十年，跨越五千里。
晚回舟,4,2015-03-20 15:45:14,unknown,0,近期看过两本牢狱之书，更喜欢上海生死劫一些，可能因为这本太长了，另外这种两段式写法其实很考验读者耐性啊。看书和写作一样，都是前期没什么动力看完，但是过了一半的样子，才终于入戏，兴致浓厚起来，这本书我前半看了个把月，后半看了两三天。
地中海的鱼,5,2014-05-19 15:55:01,unknown,0,太好看~！
卡列宁的微笑,4,2014-06-22 04:10:48,unknown,0,至少前面大半本是很好的小说。主要人物塑造得很丰满，配角也各有鲜明的个性。陆焉识这个人物反映了中国现代知识分子的典型困境。很多地方大段描写充满色彩。只有陆焉识回家之后那一段略显琐碎，势头有所下滑。改编成电影的恰好是这一段。从小说到电影的改编反映了当局审查的敏感点在哪里，值得分析。
黑色的国王,5,2014-04-18 03:47:38,unknown,0,今天的上班读物是《陆犯焉识》，算是目前为止我看过的严歌苓的小说里我最喜欢的一部了。因为有才情所以傲气，天才的清醒和天真永远是混在一起的。排除其他不提说，我最敬佩陆焉识这一生从未放弃追求自由的念头。真正的知识分子看似脆弱，但因其精神强大，可以成为世界上最强大的反叛者。不禁想到poi里的finch也是这样的人。我希望做这样的人。
VVVVVivian,4,2014-05-21 10:10:45,unknown,0,对我印象最深的是这一段话：一般此类“没用场的人”都有一身本事，误以为本事可以让他们凌驾于人，让人们有求于他们的本事，在榨取他们本事的同时，至少可以容他们清高，容他们独立自由地过完一生。但是他们从来不懂，他们的本事孤立起来很少派得上用场，本事被榨干也没人会饶过他们，不知如何自身已陷入一堆卑琐，已经参与了勾结和纷争，失去了他们最看重的独立自由。
Shyn,3,2014-05-22 15:56:46,unknown,0,有点失望，不确定是失望在严歌苓的文笔，还是失望在故事本身的孱弱。对《归来》也放弃了幻想。知识分子的精神史是我更感兴趣的部分，但是总是欠缺一点更沉着的东西。剥离的时代背景的阅读注定很隔膜，尤其是其中的价值观容易被解读为……低级……但是这个国土居然真的如此低级过。这才是讽刺。
swing,5,2013-12-23 11:12:04,unknown,0,以再一次的逃跑为结束，非常聪明
小道士青烟,3,2012-08-25 15:10:41,unknown,0,0824未读之前，这个书名十分费解，读第一页的时候才知道不过是说一个叫陆焉识的犯人。对这类题材的小说我实在无法忍受了，过于艰苦的环境使人做出许多没有下限的事情，梁葫芦被马拖着跑，一地头皮毛发。。。所罗列例子不是骇人听闻，就是令人下意识反胃恶心。不否认她写得不差，但真的不想读了。
归去来兮,4,2014-06-18 12:45:56,unknown,0,旧上海的繁华，夹边沟的黑暗，无论如何努力，她始终离这一切隔得有些远
阿肉肉肉,5,2012-02-18 12:57:31,unknown,0,严至少用出了八成真力，周六一大早起来看结局看得大哭。其实结尾我并不是太满意，不过也只能这样处理了。
藻。,5,2014-05-24 09:09:12,unknown,0,断断续续读了有半个月了，昨晚读到后面的章节，他终于被释放，回到她的身边，她却已经不记得他了。如果按我这么一句话说就挺俗的，可是置放在时代的大背景下，作者文字功力的渲染，让人没法不被感动。所以，我哭了很久很久。一直到今天早上，我一翻开书想读接下来的内容，还是会被牵动情绪落下泪了。我不得不说，这是我近期看过的让我感受最深的一本小说。
谦谦,5,2015-07-27 15:45:34,unknown,0,一直在慢慢的看，开始的三分之一几乎看了两个月，而剩下的部分基本上是借着感冒在家躺着三天就看完了。看到大半夜的哭湿了枕头睡不着觉，经常心里冒出丝丝的疼。归来基本上没有展现出原作的美。有些东西，文字比视觉更容易传达
纪月航,4,2014-06-23 18:35:24,unknown,0,断断续续读了两遍此书其实是在解释一个名词知识分子。。。
米鲁,4,2012-07-16 21:31:15,unknown,0,最近开始读些中文写作的小说，本不喜欢文革类的题材，但严歌苓的新书意外的流畅好读，一口气就读完了。
..Rita,5,2013-10-31 19:32:16,unknown,0,焉识和婉瑜才是活出了艺术人生…
逆光,NaN,2015-07-31 11:02:29,unknown,0,非常反感陆焉识这种所谓的“爱”。婉喻写得美，是那种他人凝视之下的美。倒是后半老年痴呆看得心惊肉跳
肥鼠叔,5,2014-10-10 08:10:28,unknown,0,终究是一个时代和个人性格的结果，造就了这场难以言说的人生。大时代下人性的泯灭和爱情的矢志不渝让他们成为身边的传奇慨叹
冯伊,5,2014-04-22 18:45:27,unknown,0,不去祸害人间，不去祸害你。
李子鲤|Lilith,3,2013-10-26 22:33:59,unknown,3,第一次读严歌苓的小说。书本身不错，最终没有滑向苦情的大团圆。读完后内心平静，总觉得少了点什么，似乎就是这少了的一点什么，让这本书缺乏伟大的震慑人心的力量。坚贞，隐忍，温柔，持重，暗含风情，这不是中国男人理想中最完满的妻子吗？可陆焉识从头到尾，包括爱上婉喻之后，有过想要和婉喻进行人与人之间平等的精神交流的愿望吗？似乎在他放弃了对自由的奢望和向往之后，他才开始爱上婉喻的。
石小po,5,2014-04-02 01:57:43,unknown,0,真是他妈的一本好书！
lindsay郭小柔,3,2014-06-19 09:24:13,unknown,0,...................
九色鹿,4,2014-06-20 10:34:38,unknown,0,严歌苓的书永远都是那个套路，并且她的书中男女主角的子女永远都那么的不是东西。
shelley,4,2012-01-14 21:52:07,unknown,0,她的每一部小说都适合拍成影视作品
sos,4,2014-09-02 16:49:46,unknown,0,怎么说呢，如果看完电影再看书就会觉得叙述好别扭。很可怜，电影改编会影响很多原著的阅读。
Chrysalis,4,2015-04-24 23:00:54,unknown,0,写得真好。
Vernunft,4,2013-02-15 23:51:30,unknown,0,很适合拍成电影。
何小乐,5,2015-03-11 15:11:10,unknown,0,作者笔触太细腻了，让我身临其境一般，那段历史应该让全中国人铭记
