user_name,star,comment_time,geo_ip,vote,short
风雪夜归人,5,2012-02-17 14:35:39,unknown,0,不堪回首，可一起看《夹边沟记事》《定西孤儿院纪事》
不玩刀剑,3,2015-05-28 22:55:48,unknown,1,这样的笔法以及叙事方式，看着真心累。
NIKI,5,2015-08-31 15:23:52,unknown,0,聪明，善良，优雅
迷藏,3,2018-11-06 09:55:59,unknown,0,还是被感动，只不过对严歌苓的文笔和叙事手法不敢恭维。
文武,4,2013-03-04 17:13:43,unknown,0,严歌苓算是当代华文女作家的翘楚了吧，写得不错，销得不错，长得不错。不过那个年代的故事读完容易让人产生一种难以言状的痛苦感，所以不能用心读，何况那样聪明帅气又出身大家的公子，就当他做是虚构的吧～
红韭不怕虫,2,2014-06-20 23:22:12,unknown,1,文笔太轻薄。一点张贤亮，再加一点张爱玲，说到底有股挥之不去的海派气。
Judy,5,2014-09-18 10:51:58,unknown,0,严歌苓一向调度言语手腕高明但不免有时匠气浓重。此书自然得多，好。
喵,4,2014-05-16 18:12:18,unknown,0,读完满脑子都响着上海话。。。
莫西,NaN,2015-01-11 14:39:26,unknown,1,1块9毛9
两朵花,5,2012-02-16 19:22:27,unknown,0,她的目光是孩子的，那么多的信任在里面，谁也不会欺骗拥有这副目光的人。
小忍怀居,5,2014-05-23 14:19:09,unknown,0,好久没有读个通宵了。
瓦瓦,4,2014-05-29 10:01:45,unknown,0,严歌苓的文字真的是给女人看的
小翠鸟🐦,4,2014-05-31 22:18:00,unknown,0,本书人权都没有，所以更不用谈女权。所以也不用纠结严歌苓的小说女性角色的局限性。但是依然扣一星。
木棉半夏,5,2013-04-30 00:00:54,unknown,0,严歌苓的独到之处太多，最重要的是鲜活的细节与多角度镜头般的画面感，特别是能用平行蒙太奇来讲故事又不显凌乱，实在难得。大历史中的小人物就是一个时代最好的代言人，娓娓道来的历程一点点撕破人心，悲怆可泣，感人肺腑。陆焉识的性格、爱情与抗争，史诗一般令人一遍遍感慨叹息。作为小说，文学性历史性与可读性都可以达到五星。
鹿男,5,2013-03-12 10:30:51,unknown,0,！！！！！！！
何足道,4,2014-07-14 18:42:22,unknown,0,1.说一个悲催的故事，技巧太好，总会减弱其力量。2.作者那种世家子弟知识分子的自得掩盖了这个时代的故事是每个人的悲剧，略不爽。3.这是我看的作者的第一本书，总的来说还是很好看的！
lotusblue,5,2012-11-11 00:54:33,unknown,0,这部书让我从头哭到了尾。人，家，国的命运维系在一起，谁又造就了谁的悲剧？
西小疯™,5,2014-04-01 23:33:59,unknown,0,2014年3月31日珠三角大雨被困于机场读完
婆婆,4,2012-09-11 11:57:01,unknown,0,严歌苓似乎很是偏好这种柳暗花明，原来是你的情节...她不如张爱玲，不是文笔不够，而是对生命的了解还远不如张的深远与豁达，所以下笔再怎么流畅都少了那么一点点的鲜活劲儿.中国女作家中我还是蛮喜欢她的，但是这一部，实在是让人惊艳不起来。
闲情小娜,4,2012-02-13 15:45:30,unknown,0,一切终究已成过往，无论当时多么风光自在时代改变了他的命运，却让他惊醒自己的过错，没有爱的婚姻延续到老，却发现情感一直都在，颠沛流离的生活，忍辱负重，用血来铺就回家的路。可惜，一切都已变样，她的等待和他的归来尴尬的磨合，却无法圆满。语言生动，文字干练，是一本丰富的人生剧。
pearl保护色,4,2014-08-16 20:19:41,unknown,0,中国人的“不自由”
abby,4,2014-03-05 08:46:21,unknown,0,年前读完忘了添加。其实对于故事中的感情部分不太喜欢，这个民族几千年来似乎都在唱颂“守得云开见月明”的调调，但其实这样受虐型的情感人生值吗？对于那段非人的历史倒是有句话说得不错。“凶暴是会让人醉的，正如各种高尚的情绪会让人醺醺然。”
隋混混,3,2013-10-07 01:10:09,unknown,0,有悲伤但并不煽情，却也不够暗自肝肠寸断，多是离散的无奈，对倏忽而过人生的错愕。不看好改变电影的商业价值，但若挖得足够深获一堆奖当时没问题的。
大哥的女人,5,2014-05-30 18:22:07,unknown,0,为了赶时髦而读书是可耻的
没安排的圣诞,5,2014-07-25 11:54:28,unknown,0,虐哭數次。
昴,3,2013-02-02 14:41:41,unknown,0,和早期的中短篇比起来，处理长篇结构明显力不从心。20世纪中国的个人史应该精彩好看得多。越往后恐怕越笔力不济。不理解评分为什么那么高。
Icarus2022,2,2014-07-29 01:13:50,unknown,0,文笔好差
小米,5,2012-06-18 14:38:58,unknown,0,陆犯焉识好，把严老对很多事情的观察悲悯，包括她惯用的几种写作手法，都熔到一起去了。到小姨多鹤为止，个人觉得用词还称得上“精”，陆犯用词是“狠”的，像张奶奶那个狠法儿
王大胡子,4,2014-06-03 17:49:52,unknown,0,果然要看过书才更能理解电影的。
momo,5,2016-05-06 23:17:16,unknown,0,拖了好久终于看完了。好唏嘘
