user_name,star,comment_time,geo_ip,vote,short
波波维奇,5,2018-11-29 21:06:43,unknown,4,这本书说的是爱情吗？经过长久的等待终于俩人在一起了，但等待的过程俩人各自精彩。
小封,5,2013-11-29 14:00:47,unknown,3,终极点评：啥！男人永远都觉得身体的不忠不等于背叛爱情！即使上了600个女人，也敢说我的心里只有你！有一句话觉得译得不好，说是不解风情的市长拨了公墓里的玫瑰，居然是“一位不具民间智慧之现实性的市长”
芯片子,3,2021-07-14 22:15:20,unknown,5,没看到有爱情只有见光死和活久见你以为的霍乱时期的爱情最后只是百年孤独
绿小野马,5,2019-10-01 01:25:30,unknown,4,没有一刻不感到惊喜和痛楚，马尔克斯像上帝一般把你的人生写尽了。爱情这个难以言说的黑洞和它所携带的巨大能指，在这里覆灭而永恒。如果有一天我鼓足勇气结婚了，希望拿这本书起誓。
Cambrian,3,2017-08-06 13:35:08,unknown,3,医生为什么要被黑，萌妹为什么会因为一个老头而爱并嫉妒，这都是马尔克斯自己内心的投射吧。俗套的地方也很多，不是指对爱情小说的戏仿，结局本身就很俗套啊。重读减星。
大甜甜~~,5,2012-10-20 16:42:58,unknown,4,一次并不算长的火车旅途，却因为这部小说而变得像故事里的一生那样漫长。马尔克斯讲了一个刻骨铭心的爱情故事，而且把这个故事讲到这般从容不迫。钱钟书说，老人谈上恋爱，就像老房子着火，救不了的。
mOco,5,2019-10-22 10:20:38,unknown,5,用如今的话说就是太多金句，太多犀利而准确的描述。尤其喜欢阿里萨在半个世纪后与费尔明娜的相处，即使并不认可阿里萨自认的忠贞，但也被结尾那该死的浪漫所打动。
雪深蓝,4,2013-12-01 23:16:01,unknown,7,现在的世界不可能有多少人拿出勇气在垂垂暮年履行年轻时与某人的约定，到了一定岁数爱情就变成了不得不藏着掖着的可悲之物，直到带着它走进坟墓。书中悲伤热烈的爱情已经死在不可追的古典年代了。在那里，爱情本身就是一场霍乱，不问其何时而始，不知其何时而终。只是让人心甘情愿地沦陷，付出一生。
韦思嘉,5,2020-05-26 23:25:20,unknown,7,初恋靠幻想维系的爱，为现实低头的爱，被婚姻消磨的爱，由欲望引发的爱，太多感情里的晕眩与无奈时刻都被马尔克斯刻画的入木三分，相比于他一贯的魔幻现实题材，这本书显得异常平淡，放在百年后的今天看也异常真实。
史太,NaN,2015-02-25 20:29:44,unknown,4,我学到的是关于爱情的真理而非爱情的道理。
Shào Nián,3,2016-05-04 13:28:08,unknown,6,文字本身的魅力很大可我一点都不喜欢这个故事
七月,5,2018-02-25 23:41:43,unknown,7,重新读了一遍，才发现现在的自己和两年前的自己有很多改变。同一本书，之于我的感受因为时间的变化而变得不同了。
惘然,4,2012-10-04 01:00:47,unknown,5,原来人年老之后也并没有因为经历过而不轻慢年轻人⋯⋯
年高,4,2013-04-25 11:34:45,unknown,3,慢慢读好了
大人,5,2012-10-20 15:49:00,unknown,2,原本以为《百年孤独》是最爱，多年后发现这本才是啊！
没有米面也行,3,2020-02-05 22:16:57,unknown,4,“得不到的永远在骚动，被偏爱的总有恃无恐……我以为马尔克斯这本书写的是霍乱时期催人泪下的爱情故事，结果却读得无比煎熬，如果非要说跟霍乱有什么关系的话，或许就是爱情的病态吧。
白眼,4,2013-03-19 14:53:28,unknown,6,精华都在细节。
鹿君,5,2013-01-08 15:07:34,unknown,4,结尾比开头精彩百倍。爱情不是恒久远的钻石，它不过在帮助我们发现如何与自己共处，以及如何在满身的皱纹和腐烂的气味里鼓起勇气活下去。
胡不喜²⁰²³ ™,5,2013-06-06 02:59:25,unknown,3,一言难尽。
非虛構,4,2017-08-15 12:59:00,unknown,3,当一个女人决定和一个男人睡觉时，就没有她跃不过去的围墙，没有她推不倒的堡垒，也没有她抛不下的道德顾虑，事实上没有能管得住她的上帝。
黑伞,5,2019-09-03 22:19:53,unknown,8,书很长，完整读只读过一遍，后作为回味又零散读过些章节，但琢磨却琢磨了好几年，琢磨自己的阅读感受。其实这感受非常简单，就俩字：和谐。我觉得老马对男女主人公的所有安排都相当合理，或者这么说，它让你觉得这个世界上的男人女人的爱情状态就应该是这样的。这种和谐关乎时间，却超越时间，甚至把遗憾也包含在内了。但因此不得不承认，这种和谐的前提在乎两性之间的不同。同样爱，男人必须要能摸到他爱的女人才行，对男人来说，爱必须包括占有，如果不能，他就会转向别的女人去占有，但这并不意味着他就不再爱他占有不了（或已经失去）的那一个。女人却不同，她可以在完全不占有男人的前提下爱他。所以纪德在《窄门》里会这么安排，换一下性别可以吗？就没那么合乎逻辑。也许我武断了，因为将性别类型化总归不好，但这种和谐却是美的。
再会朗西🐝,5,2013-08-08 01:35:47,unknown,6,那本来就是一场霍乱，给每个人脑后都来了温柔的一枪。
Saul,5,2021-06-25 23:22:48,unknown,4,太喜欢了，吸毒般带来的快感，为爱而生，孤独的狂欢。
Tong,5,2021-06-03 16:50:07,unknown,3,值得多年后重读的封神之作，一本书写尽了爱情，似有结尾其实没有结果，所有的不过是过程和经历。如果真的要分析这本书，大概还需要再写一本书才够。
安东妮,5,2014-08-23 19:41:38,unknown,2,重读
懒画眉,5,2018-06-23 11:11:12,unknown,5,“他们之间的感觉并不像新婚燕尔的夫妇，更不像相聚恨晚的情人。他们仿佛一举越过了漫长艰辛的夫妻生活，义无反顾地直达爱情的核心。他们像一对经历了生活磨炼的老夫老妻，在宁静中超越了激情的陷阱，超越了幻想的无情嘲弄和醒悟的海市蜃楼，超越了爱情。”《霍乱时期的爱情》写的根本不是爱情，是孤独和信仰，一个男人睡过600多个女人的孤独，一个女人和丈夫度过五十年安稳婚姻的孤独，而霍乱般迷狂不散持续半个世纪的爱终于让这孤独烟消云散，这根本不是爱情，是信仰。唯有信仰拥有战胜死亡和孤独的力量，无论它被冠以什么样的名号。
原醉,4,2012-10-07 22:04:47,unknown,2,译者谦逊美丽，水平也很高。
kylegun,3,2012-10-24 16:29:49,unknown,8,一个痴情了七十多年的南美唐璜，一个现实了七十多年的精神贵妇。在本书最后十页，才点题道出了霍乱爱情的实质：一艘用于逃避现实的愚人船。个人觉得明显没有《百年孤独》那么深邃有趣，更像老年作家描写家庭生活及情感心声的颤抖宣言，南美狗血戏剧成分远大于魔幻现实元素，历史也不过是爱情的第三者
唐小万,5,2012-12-31 22:07:38,unknown,2,关于爱情的一切。当然，更多的是关于生活的真相。
安静吐糟自己,4,2020-12-30 23:40:17,unknown,12,我的脑海里只有一个巨大的问号❓看完是一脸懵逼的，如果不是作者文笔在那里压着，这本书简直是狗血不堪，在长达五十三的等待中，除了他一直在重复着自己是在等待之外，还有什么是值得相信的，在那么多不同的肉体交缠中他并非没有心仪之人，却要提醒自己在等一个人成为寡妇，尤其是最后那个小姑娘，他引诱了她最后抛弃了她，令她自杀身亡，他的所谓忠贞不渝的爱情上面染着他人的鲜血。最后一段是喜欢的，一个人只有出现在正确时间才是最正确的那个人，不管是出于感激，或是出于寂寞，或是重新找回自我，当一个女人决定和一个男人睡觉，都应只出于她的本心，而无关其它。
陈灼,5,2013-07-04 21:44:55,unknown,2,走过一生的爱情。
我先想想叫啥名,5,2021-08-29 21:52:28,unknown,14,并未让我复苏定要寻求爱情的冲动，却带给我一种对衰老的感同和敬畏。
ムラサキの夜,2,2020-03-01 04:48:38,unknown,14,想想还是两星吧。标题和通篇在讲爱情，其实那都不是爱情…
庄蝶庵,NaN,2013-05-13 21:05:57,unknown,4,无与伦比的纯洁。
Iris-L,4,2012-11-15 07:21:20,unknown,4,"一种对理想爱情老式情怀的反复申述.金句特别多的一本书，最喜欢的三句：""爱情首先是一种本能，要么生下来就会，要么永远不会""；""好奇心也是爱情的种种伪装之一""；""我去旅行，是因为我决定了要去，并不是因为对风景的兴趣""."
颠三儿不能明白,5,2020-03-18 15:29:32,unknown,2,一本讨论什么是爱情的书。执念是吗？占有欲是吗？陪伴是吗？习惯是吗？虚荣是吗？情欲是吗？每一段关系都虚伪而破碎不堪，我一再否认，想排除它们而找到纯粹的核心，最终却相信残缺的也是爱情。读的过程中越来越同情起这所有陷在爱情中疯狂幼稚不由自主的人（以及自怜），不过最后的部分真是作者的仁心，这故事本可能在任何地方结束的，没有安慰。
如,5,2014-05-06 12:02:09,unknown,7,个人感受：非常愉悦的阅读体验；虽然叫做爱情但是全书没有感受到爱意。精致的布局、凛冽细腻的细节很见大师风韵。最后星座迷信滴加一句：马尔克斯不愧是双鱼座……
示播列,5,2012-11-28 18:41:08,unknown,3,直到多年以后，他才发现一本好的小说是他一拿起就不愿再放下的
王奕,NaN,2017-12-03 12:02:37,unknown,3,回想起高中曾一口咬定这就是老马最佳时的情景，再想到这次读竟无任何触动––如今的我也怕是对其免疫了；本以为应该是越来越靠近，最后看我这一年从准马尔克斯粉到渐离渐远的过程，不禁有点感慨。
Nar·co·lep·sy,4,2021-03-21 08:49:17,unknown,3,我们都不曾理解过爱情
霏昀,4,2018-01-01 21:59:24,unknown,3,好的作家写出细节饱满丰富的情感，让人们阅读、体会，留下投射自身的通路。训练过度的读者则用「屌丝逆袭」、「渣男配贱女」这样的标签，把作品削平成故事套路。这是写爱情的难处。（另，这个本子翻译真好）
料峭,1,2020-06-12 20:55:12,unknown,15,感觉很一般，不喜欢男主这样的人设，磨磨唧唧，一根儿筋；整篇叙事也是啰啰嗦嗦，不知这本书的名气为什么这么大……
Heaven's Door,5,2021-08-11 21:59:44,unknown,3,谁不爱马尔克斯呢
艾栗子,5,2014-08-17 13:23:37,unknown,3,描写了各个时期、各种形态、各种属性的爱情，但是都是爱情。其中最重要的还是阿里萨对费尔米娜的基于幻觉之上毫无基础却能跨越时空的永恒的爱情。魔幻现实主义在这本书的体现，大概就是那种跨越世纪的长久而深沉的爱，历经了整个人生却还是生命力不减，简直是最大的奇迹好吗。
阿朽,5,2013-04-21 19:38:01,unknown,2,看《百年孤独》时就已觉得这货写小说的功底是顶尖了。昨天下午开了个头，今天下午就一气呵成。几年前看过的电影情节全浮上来（是一部改的不错的电影！尽管男女主角都很丑），潮湿的空气、莫名其妙而又一生牵连的爱情。
