user_name,star,comment_time,geo_ip,vote,short
烟花,4,2014-10-04 10:22:06,unknown,29,感觉这本书里所谓的爱情，都莫名其妙，而且乱糟糟的。这可不算是爱情小说，讲述的是追逐爱欲，被其玩弄的一生。讲的是爱情有多戏谑和不靠谱。讲的是我们在虚假的爱情之下联结的亲密关系，我们靠这种关系来对抗令人绝望的生活
毒妇脸少女心。,3,2018-04-17 09:33:14,unknown,15,如果两人能及时明白，比起婚姻的巨大灾难，日常的琐碎烦恼更加难以躲避，或许他们的生活完全会是另一副样子。
黄雷蕾Linali,5,2018-06-10 17:50:10,unknown,26,最纯粹的爱最可能发生在少年时期和暮年时期。
韧勉,3,2017-11-18 00:28:01,unknown,10,对主题无感
容安,4,2012-10-04 21:07:35,unknown,23,看完仍没弄明白爱情是什么，不过确定了什么不是爱情。
aprilg,3,2019-08-10 11:30:23,unknown,31,这本豆瓣9分所谓被誉为“人类有史以来最伟大的爱情小说”的书说实话十年间我两次阅读但是两次放弃，昨晚终于一夜没睡全部读完试图说服自己融入9分的打分群体但是依然做不到，有可能是出于对拉美的历史文化了解不多所以缺乏十足的共情，有可能我带入了太多当代女性的思维方式去给书中主角们的行为makesense但无论如何我不觉得马尔克斯是在歌颂爱情，他只是讲述了人生中贯穿的自我挣扎
Adiósardour,4,2012-08-30 23:30:32,unknown,11,跨越半世纪的爱情故事。叙述分为两个层次：一是连贯性的概括叙述，一是片断性的详细叙述。概述宏阔粗朗，但人物的情感起伏窈窕可见，马尔克斯的叙述基点不是事件而是情感。详叙绵密有致，情感微妙处的放大，其中矛盾毕显的张力与诗意俱呈，那种稍纵即逝的人物心理也被马尔克斯用心灵摄像机加以定格了。
虫虫,5,2017-04-08 18:42:23,unknown,16,爱情故事可以写得如此震撼人心，这本书里面包含了所有形式的爱情，书中好多语句几乎就是人生哲学。（女人对问题的隐秘比对问题本身想的更多）
石小栖,4,2021-07-26 00:55:37,unknown,41,这本书真的是…文字让我极其喜欢，情节却让我愤怒讨厌。我并不觉得阿拉萨那是爱，他所谓的五十年守候给我的感觉就是我爱你爱到死但不妨碍我睡了六百多个女人，很多时候我都想跟他说我求求你了你放过费尔明娜吧。他害死了养鸽女和引诱那个14岁的小女孩那里是最让我愤怒的，一个有道德的成年人无论如何都不应为了自己的欲望诱骗未成年人，将她拖进堕落的地狱，并且完全可以说他毁了那个小女孩原本灿烂的一生。但是，虽然我不喜欢这本书的情节但我还是被结尾浪漫到了：把世俗的感情偏见累赘通通丢到岸上，在船上的旅行度过余生，还有什么比这更浪漫的事情吗？
社会青年专业户,5,2015-11-03 18:44:32,unknown,17,一本爱情百科全书。霍乱也是爱情病。俗套的爱情破裂都是父母阻拦没有钱和另有新欢，伟大的爱情破裂却是悄无声息，却又给人以长久的震动。他们没能结婚是因为他们太年轻，他们没能结婚是因为太年老，然而，满载爱情的霍乱之船还是驶向了“永生永世”。
阿树,3,2013-02-28 00:11:46,unknown,20,加西亚有很大野心像书中男主一样写一本两性大全穷尽一切爱情可能性，但猥琐文艺男的男性视角实在让人恶心到不行。虽然加西亚对道德的解构是一贯的，但渣男男主和胡兰成有甚区别？用这张嘴来说什么灵肉分离为你保持童贞啦真爱啦只能说好吧你不懂爱情。爱情就是爱情，不需要被阐释解读和价值评判
肖浑,4,2017-08-30 13:00:14,unknown,19,情节密度大概只有《百年孤独》的百分之一，但语言密度巨大，层层叠叠的繁复细节，就讲了个简简单单的纯爱故事。
瘦竹,4,2012-09-26 09:04:06,unknown,13,什么都好，就是结尾太假了，整得和好莱坞大片似的.
眠去,5,2012-11-27 09:23:40,unknown,10,我好怀念过去那几块钱一本的小册子
木由,5,2014-04-04 11:37:46,unknown,17,凌晨看完，做了一晚上关于那个瘦小而忧郁的在夜里根据风向拉琴少年的梦。真好。这是我想到的关于爱情最完美的结局了。
censored dump,5,2016-11-24 23:27:57,unknown,16,马尔克斯把那些隐秘、卑琐和苟且之事写得如此浪漫、纯粹和迷人，与其说他写的是爱情，不如说是以爱之名支撑生命的一切东西，不管那是欲望、幻想还是瘾，在别人这里可能是耗尽生命的毒药，在老马这里妙笔生花，成为了鸟语花香、叫人神魂颠倒的乐园。正是这样的爱情，不仅让生命焕发出了神采，也被生命本身的深度反哺了超越生死的力量，至少，在那可能的一刻，爱情超越了一切，借由文字抵达不朽。“距离死亡越近，爱情越浓郁。”书中提到了柯尔托、卡萨尔斯和蒂博的三重奏，还提到了幻肢痛，在书中重逢这些真是叫人感慨。
艾弗砷,5,2012-09-13 22:24:55,unknown,15,七十多岁时再读的话会有什么感受呢？读到最后捂着嘴屏着呼吸，怕这些文字流着流着就都流到右手边去了，好久没有这么神经质的体验了。
豆友35496190,5,2013-05-18 22:42:04,unknown,12,等过了人生唯一一个五十年。，
长乐,4,2021-07-25 20:47:01,unknown,22,我认为马尔克斯对于爱情是悲观的。年轻时候的爱情，人们怦然心动的是爱情本身，是青春的荷尔蒙，是对于爱情的幻想，是某个瞬间你遇见的某个人，也许可以是那个瞬间你碰到的任何一个人，真实的对象并不是那么重要。逐渐老去的我们，怀念初恋，怀念不是某个具体的人，而是逝去的爱情幻想本身。幻想破灭后的爱情，或者说婚姻，是建立在长久的陪伴、互相忍受、扶持，心灵或肉体的背叛，和谎言身上的。这种爱情因为深入到了生活本身，是每个日日夜夜，会变得难以割舍，终结于其中一个人的离去。中年时的爱情，或者说稳定平静的生活之外的爱情，更多的是性吸引，是肉欲，是很容易被舍弃的。至于一生一世的爱情，那是建立在幻想之上的，是脱离于现实的，是不存在的。
欧定谔的猫,3,2014-04-28 16:42:27,unknown,11,在马尔克斯逝世之际，读这本风靡的作品，打动我之处却寥寥。
爱地人,5,2013-02-25 03:07:58,unknown,13,“距离死亡越近，爱就越浓郁”……已豆列。
Anders,5,2021-01-11 14:36:24,unknown,16,这本书陆续花了两个月看完了，最大的感受有三点：1/作者不断的致力于描述生活中的各种细节，达到了不厌其烦的地步，感觉作者试图讲生活细节话，拉美的作家很少讲大道理。2/感觉拉美的作家很多都是宿命论者，感觉到书里的每个人物都在和某些东西抗争，从出生开始，至死方休。3/作者其实试图讨论什么是爱情，用了一本书，整整400多页的篇幅。但其实爱情就是时间，就是这一刻你选择跟谁在一起。
Aaa,5,2015-07-06 21:43:53,unknown,13,”但凡未得到，但凡是过去，总是最登对。”对于什么是爱情，越看越迷惘。对于衰老，一身冷汗。
不如归去莫思量,5,2021-02-16 10:32:54,unknown,17,在你之后我遇见的每个人都是在追寻你的影子
蓝色旅人D,3,2021-06-10 20:35:54,unknown,13,爱情不过是一场高烧，思念是紧跟着好不了的咳。不是霍乱时期的爱情，是爱情更像一场霍乱。我的感冒好得彻底，无法共情，看得囫囵吞枣
虚弱橙,5,2016-11-28 02:13:22,unknown,11,华丽的诗句在肮脏的历史中穿行，如入无人之境。
商夏,3,2013-02-03 20:15:02,unknown,6,翻译可能比较准确但是不是好的汉语，有些生硬不流畅，还有我果然无法看第二遍。
🧡勞小姐🧡,4,2018-07-07 08:43:32,unknown,18,-_-重讀。發現馬爾克斯寫的不是愛情，而是一群被孤独忽悠的男女。為擺脫孤獨，他們嘗試了愛情和婚姻。佛洛倫蒂諾了代表一個男人領悟愛情的心路歷程。他一生追求愛，並通過性來識別愛。他清楚愛欲是性欲的催化劑，性欲卻不一定源於愛。因為喜歡是本能，愛則是超越本能。烏爾比諾是佛洛倫蒂諾的鏡像：表面好好先生，背後出軌成渣。他告訴我們男人看待婚姻的態度：愛情和婚姻是兩回事。愛情源於激情，會過時會消失。婚姻則是穩定的，由婚內親情與婚外激情共同維系。他可以娶愛的人，也可以娶不愛的人。最傻的人是費爾明娜。既不懂愛情，也不懂婚姻。少女時期的愛是幻覺，婚後，愛是穩定，是利益，是體面。老年喪偶後，愛是依賴，陪伴，和逃避孤獨的手段。愛情沒有對錯，婚姻只是選擇。可它們都不能令人擺脫孤獨。所以不要因為感到孤獨就隨便去愛或結婚。
Ada,5,2012-12-16 20:35:25,unknown,14,“但她的决定却像打开了一道门缝，足以让整个世界通过”，而后，穷尽一生所体验的痛苦、愤懑、悔恨与放荡不羁，只为垂暮之年的相伴而行，这就是一生一世，这就是爱情。>>>看得我泪流满面，此译本很好，值得收藏。
Summer,NaN,2018-01-25 23:31:56,unknown,6,马尔克斯最终还是一个美好的烂漫主义者
黄青蕉,5,2019-10-13 14:20:36,unknown,10,他们像一对经历了生活磨练的老夫老妻，在宁静中超越了激情的陷阱，超越了幻想的无情嘲弄和醒悟的海市蜃楼：超越了爱情。因为他们已经在一起生活了足够长时间，足以发现无论何时何地，爱情始终是爱情，只不过距离死亡越近，爱就越浓郁。
倾内,5,2013-08-19 02:03:24,unknown,14,“在五十三年七个月零十一天以来的日日夜夜，弗洛伦蒂诺•阿里萨一直都准备好了答案。‘一生一世。’他说。”再也不要轻易地说是否相信爱情。
Akihi,3,2021-02-06 23:16:26,unknown,12,有趣，但难以苟同
Rhodesia,5,2013-01-13 23:46:12,unknown,8,20岁的躁动不是爱情，是某种美丽而高贵的东西。40岁的理智大概也不是爱情，是控制厌恶维持稳定生活的战斗。绝对的爱情只在70岁那艘挂起霍乱黄旗的船上，在辽阔的生命中驶向死亡和永恒。
瑾朵朵,NaN,2015-10-01 16:20:43,unknown,6,一个被爱的人，死去时应当把一切都带走
徐若风,5,2013-03-23 13:40:04,unknown,14,打字机情书与暮年的白玫瑰。
Mr. Infamous,5,2013-03-24 22:18:28,unknown,11,9月24到3月24，竟然恰好看了整整半年。看完一本书的感觉如此美好，而我许久未尝享用过。马尔克斯最诱惑我的是那种斑斓的物象，琳琅满目，眼花缭乱，带着一种湿答答热烘烘的热带气息，令人立身于曼妙的异国情怀，不断体会那些荒诞不经却又老实巴交的情节与情愫。极爱这样的故事，动如脱兔，静若处子，在各种爱情被特殊的年月盘剥剖析完毕后，那种毕生的长情用不完美的姿势指向了一个完美的答案。
谚子,5,2021-05-28 22:06:37,unknown,13,写得太好了。我们不能用道德评判他们的对与不对，它只是在叙述或者探讨人性的复杂以及爱与婚姻之间的多种可能和联系。他在性中寻找爱的可能性，以摆脱爱而不得的孤独，或者说以弥补这种爱而不得的孤独，但如果他一开始就得到了她的爱，他还会因孤独去寻找性的刺激吗，难说。另一个他因为体面选择无爱的婚姻，在多年以后遇到了心灵为之一颤的“爱”以后来了一场性与灵的释放，但还是因为婚姻的约束回归家庭。她因孤独糊里糊涂地爱恋，很快厌倦放弃，又因体面而糊里糊涂地结婚，最后因为孤独又重新牵起故人的手。他们经历了种种终于找到了属于他们的“爱情”。因爱而婚是否就一定能抵御内心的孤独和欲望呢？人生来就是孤独的，欲望也是没有止境的，婚姻也不是非黑即白的……怎么成就属于自己的爱情，我也在寻找答案。
那个巫婆,5,2012-11-26 00:47:04,unknown,14,就是想要一口气看完。最好的是关于老去的描写。可是我并不希望最后是那样的，我希望他们永远没得到。
吵,4,2016-11-04 19:15:24,unknown,9,爱情是淅淅沥沥的小雨，文字却是暴雨疾风
Soo Yung,5,2013-01-10 16:10:13,unknown,9,他们说读马尔克斯一定要快，否则隔上几天再翻开时就又忘记了。依旧是神作的无可挑剔，却依旧难以给出五星。那些细腻的粗犷、那些喜悦的忧愁、那些绝决的挣扎，一切“所谓”的爱情都在凡俗的霍乱中挥洒殆尽，况且霍乱的何止是疾病呢，更是人心的隔墙吧。不是字字箴言，也不想用冯唐的那句“爱你一辈子，草别人过余生”来武断那些人、乌尔比诺、费尔明娜达萨、弗洛伦蒂诺阿里萨和情妇，那些情、爱情、亲情、依赖、放纵、相守和一生一世。对于这些过于精细的描写，总会让我迟疑、一个人的脑海是怎样构想和包容那么广阔的世界，太过于伟大了。“可以同时爱上几个人，爱你带着同样的痛苦爱着她们所有人，不背叛其中任何一个”“世上没有比爱更艰难的事了”读完以后，就如欧洲、巴黎的幻影，情感、人生的缩印一样，只想让人道一句：“浮华而已.”Brown
甘草披萨,5,2016-09-06 19:40:57,unknown,9,爱如久治不愈的瘟疫，爱是因缘错失情深缘浅，五十三年绝非蹉跎，而是成就浩荡爱情的组成部分；男人与女人之间的探戈游戏最精辟犀利的写照，两性对待爱情的本质区别，最现实最残酷的婚姻真相，却同时也是最浪漫最永恒的爱情，结尾真是太完美了，生命爱情如川流不息的长河，流过岁月与世俗偏见，永远的茉莉芬芳，如此的荡气回肠
布卤,4,2018-05-22 16:23:47,unknown,11,本书的前395页，就像吃着黄瓜就着白开水一样无聊，但是从395页到最后的401页，我看哭了。并推翻了一切之前的想法，我想不会有哪个女人不喜欢书中的爱情。
独立行走的猫,3,2021-03-16 22:36:23,unknown,11,可能是我不太能理解书中人物的爱情，也不太能认同作者通过角色表达的部分爱情观。这书看到最后，让我索然无味。如果我先看的是这本书，可能就不会想看百年孤独。幸好我先看的是百年孤独。
秉存,3,2018-03-19 17:30:21,unknown,10,“爱情，首先是一种本能，要么生下来就会，要么永远都不会。”我不能理解为什么这本书的评价会高过《百年孤独》，可能是因为我对爱情的苦杏仁味道，一无所知。
Fickler,4,2019-08-17 17:51:17,unknown,8,阿里萨对达萨的爱是一种自我成全，乌尔比诺与达萨的婚姻也是如此。也许达萨真的一生都生活在爱里面，可是不是直到垂垂老矣，她才在耳鸣背痛松懈的肌肤和短暂的性爱之中感受到了。“我们之间有那么多争执，以至于回想起来我都不能确定这到底是不是爱。”不过那并不重要，毕竟爱情只是一个名字，我们可以管任何一种心理的反应，脑波的起伏叫爱情。重要的是我们相信那是。就如同阿里萨坚持着心灵的童贞与现实无数位女性的风流韵事并不违背一般。这里的爱情可以有性可以无性，可以是对一个人也可以是对一些人，可以是稍纵即逝也可以是持续一生。也许它并不真实——而这正是我阅读小说的原因所在，虚虚实实真真假假之中我可以放纵自己在想象之中下沉，就好像经历了无数场霍乱与爱情。
凉公子,5,2020-01-13 08:40:23,unknown,17,有多少种人，就有多少种爱情。也许你并不认同这种深情而混乱、专一却又放荡的爱，但不符合你的期望不等于是错的。
,1,2020-03-04 01:47:33,unknown,23,2020.3.4凌晨，书是葡萄还在金宝贝上课时打开的，而后放下了，最近枉我熬了几个凌晨。不打一星不足以表达我对男主角的厌恶，无论是年轻时写抒情诗、拉小夜曲的他还是年老时用打字机写信、送白玫瑰的他，他的一生让我作呕。通篇我最能体会的就是见光死那一句“天呐，可怜的人”。有600+情人没问题，但诱骗幼女、突袭女仆，还说“保持童贞”让我深深感到心理不适。女主角的高傲人设真是碎了一地。PS.海牛那一段眼泪差点掉下来。
有橘,5,2018-12-13 21:50:34,unknown,15,那天跟朋友说起霍乱时期的爱情，我坚持认为阿里萨是个变态，那种极度自我陶醉的狂热凭什么被歌颂为伟大的爱情？他的精神独占法幼稚又病态，我当然会喜欢乌尔比诺医生了，费尔明娜选择医生再正确不过了不是吗？这不就是现世法则吗？现世，对，联想到现世的一瞬间，我突然意识到幼稚的是我，被现世规则圈禁，与大众审美共沉沦的人是我啊。费尔明娜是阿里萨爱情中的主角，但也应该是整部作品精神的配角才对，费尔明娜抗拒与接纳是她逐渐衰老的证据，而在这超越半个世纪的爱情追逐中，阿里萨才是那个永远年轻的人。
小人鱼,4,2021-07-17 08:57:19,unknown,8,和53年爱情一样漫长的故事，详尽到似乎看到了二人衰老的过程。马尔克斯用延续一生的故事来说明爱情可以坚持半个世纪，但并不是我们想象中的那样神圣。
#Pekingcat#,4,2013-08-17 19:02:52,unknown,9,我想马尔克斯经历过热切的情感，经历过混乱的心动，经历过婚姻的消磨，但他一定没有经历过以50年的尺度等待一个活人的经历，也许从来便没有人经历过。不过我至少知道马尔克斯懂得爱情，懂得收放自如的爱情，这也就够了。
碑,5,2021-01-24 08:45:43,unknown,8,爱情的无数种模样。
-,4,2020-05-24 06:39:47,unknown,7,事实上我从头到尾都没有读到爱情，只读到漫长执拗矛盾又复杂的人生。
熊大茸,5,2018-06-08 12:46:43,unknown,6,身体在游离，心灵保持贞洁。爱和爱的幻想被时间打磨，走过颠簸在骡子背上的路、涉过两岸尚且繁盛的河流、穿过霍乱和战争的阴影，谦卑地迎来老年的冷静顿悟和对死亡迫近的体验，剥离了表象的激情，用一生思考的沉淀让心灵联结。我不知道爱情本身会不会衰朽，但穿过迷雾、心灵相通带来的满足与平静感是不会枯萎的。
森雲,5,2012-10-03 11:22:01,unknown,7,当她一吐为快，有人把月亮关闭了。
张老实,4,2013-05-06 11:46:10,unknown,4,写得真好，文字好，形式好，故事也好。不过除去各种繁杂之后就会发现，其实这是一个屌丝逆袭的故事。
明珠一颗孙小美,5,2015-03-08 02:51:04,unknown,6,寒冷的窗外，温暖的屋内，忽然想起，就又读了一遍。
木马,3,2020-08-15 22:22:33,unknown,15,男主是个人渣，这样的爱情居然这么多人吹捧，是我的三观有问题？
馋猫麦昆,5,2021-05-03 23:52:43,unknown,9,只有弗洛伦蒂诺·阿里萨能理解弗洛伦蒂诺·阿里萨，但弗洛伦蒂诺·阿里萨又会痛恨弗洛伦蒂诺·阿里萨。这个故事的史诗感不在于恢弘的背景或者时间的跨度，而在于这个故事本身的永恒轮回，不断发生。这是霍乱的本质，也是爱情的本质。
trogan,5,2021-06-03 07:41:54,unknown,5,一个简单的爱情故事，加上了时间，便演绎了一段旷古般漫长而深邃的爱情！
撕撕撕,3,2015-09-20 01:29:56,unknown,17,具有惊人流畅的语感和天赋异禀的洞察力，这我服气。也不是直男癌，写女性的精神层面还是正常的，估计是一个管不住自己鸡巴的男人，一写女人的肉体层面就暴露智商——审美层面上挺王家卫／张嘉佳的，也就是说挺洗脑的。自己睡不到的都写成了零缺点政治正确圣母（婊），能睡到的都写成了活该被操的荡妇，觉得自己的鸡巴能净化/救赎这些荡妇真是直男世界里最大的错觉之一。天赋太好的人又太相信自己一气呵成的笔杆子，读到那些欠推敲的敷衍句段真是浑身难受，处女座上身。有很多写作技巧值得学习，看完写小说欲暴涨。但是结尾居然抖了个包袱我也是无语，我把你当马尔克斯，你把自己当创意微电影？2015-08-13
鸟枪换炮,5,2016-04-30 12:22:17,unknown,7,如果你相信那是爱情，那的确就是。如果你矢志不渝，那就是永生永世。
kissdemon,3,2018-02-11 23:11:52,unknown,6,2018第五本。并没有悟到什么所谓爱情的全部答案，里面的每一种爱情都不是我想要的。费尔明娜年轻时的爱是被青春期的幻想美化的虚影，中年的爱是正派地活在社会阶层尊严下的虚荣；佛罗伦蒂诺年轻时的爱是惊鸿一瞥的惊艳，中年的爱是怀着白月光的妄想与逃避。他们只有老年的爱才这么坦诚这么勇敢。喜欢儿媳妇的话，老人也可以拥有爱情，爱情在任何年龄都不可耻。
Vincentas,3,2015-09-15 15:23:32,unknown,6,看了开头，读起来酣畅淋漓，我以为会是一本巨牛逼的书，结果当然是和人生中大多数的事一样，略有失望咯
小椿山,4,2013-02-17 11:48:31,unknown,3,每个细节都是花团，心满意足
五生,3,2018-07-05 17:46:23,unknown,11,读到后面，感觉越来越俗。
发财葵吉庆有余,NaN,2012-08-22 11:52:14,unknown,7,生病的时候，窝在床上慢慢品读，开始相信自己只是不幸运，而不是这世界上没有他。
miracle,4,2021-05-03 10:49:08,unknown,6,全书的精华就是最后的海上航行，一生一世的放纵的执着的炙热的爱意。前面的故事还是更喜欢乌尔比诺医生。
Scallet,5,2014-05-10 00:13:24,unknown,4,每一行都是用激情写就
去你爹的,4,2017-01-09 23:32:38,unknown,5,结尾处理得极好（以及可能是你马最好读的一本书
infinIcocon,5,2021-04-02 21:19:51,unknown,4,日复一日平稳而重复的婚姻像极了笼里的鹦鹉。乌尔比诺想抓住鹦鹉，却命丧于此，乌尔比诺一生都在制止霍乱的蔓延，却没能阻止一生一世的黄色旗帜。爱是为一座海市蜃楼走进一场沙尘暴。追逐漫无目的，放任善疑善妒，是忽然想起却毫无意义。
小仙,5,2015-09-09 22:11:17,unknown,4,。。。呃，可以反复来读。。。。。女主角算是人生赢家？哈，大家都要锻炼身体呀
板门店博尔赫斯,5,2017-12-30 16:36:27,unknown,3,谁能够拒绝漂在河上无止尽交配的爱情呢
TISA,5,2018-07-01 01:17:46,unknown,3,不得不承认这个世界上没有完美的爱情形态，但是知道是一回事，忍受却又是另一回事。
红拂夜奔,5,2013-07-20 22:45:44,unknown,6,奇书么。圣洁和放荡一线之隔哇。我要是说王小波书里也总有这个意思会不会觉得我抹黑马大师？
违天择,4,2014-07-21 09:12:22,unknown,3,好像要把爱情的组分一一萃取出来。
胡澈,5,2012-11-03 22:37:21,unknown,3,没啥可说的。自从离开大学后，看过这许多书，都带着一丝丝功利之心，唯独此，花费我两个晚上时间亦是无憾。小说所带来的Flow质感或许是唯一可以与游戏匹敌的吧。
有心打扰,4,2013-01-12 01:52:57,unknown,3,等你一生，爱情。
野草,3,2018-08-16 15:55:44,unknown,7,太热门了就看一看。之前开了个头，在出差的火车上正式开看。看到三分之一觉得我并不喜欢啊，絮絮叨叨让人昏昏欲睡，我为什么非要看完呢（大概是强迫症吧）。看名字以为是小清新的爱情，没想到是重口味。只是看看风土人情挺有趣，至于爱情，感觉就是普普通通，并没那么值得一写。生命中的各种小寡妇小闺女（才14岁！）就被男主几乎毫无负罪感的牺牲掉，遗忘掉，否定掉，用来成全他幻觉中的一直对女主的爱——这猥琐的人啊，这破烂不堪的爱情。一共6章，每章巨长。4.4小时。20180803-16
Fiona,4,2013-09-25 22:55:27,unknown,7,和百年孤独一样的节奏，到最后一刻才觉得是浪漫。
蘑無菇,5,2014-01-23 20:55:11,unknown,4,相思病的症状与霍乱相似(阿里萨，@陆北大，你以为以爱的名义就能遮蔽你们花心的本质吗？）
晚春,5,2021-02-18 21:18:46,unknown,5,读一本好的小说就像看一部佳片一样，越到最后越心潮澎湃。(其价值不在于他们准确的含义，而在于那种令人头晕目眩的力量)
安蓝·怪伯爵𓆝𓆟𓆜,3,2018-02-28 23:59:15,unknown,2,那些爱的懵懂和执拗，发自内心的拧劲儿，事与愿违的作答和决定，到底出自什么？如果可以解释，弗洛伦蒂诺的爱也许不会被数不清的情人瓜分，如果可以第一时间感知，费尔明娜的爱也许会给那个懂她的人。只可惜一切都没有答案……
鬼马,5,2012-10-18 16:24:03,unknown,7,写得真好，让我恶心又感动。
恶夫,NaN,2020-01-25 21:03:30,unknown,6,买了好几年，因为现在的疫情所以拿出来看，结果跟霍乱没啥关系。。。。
小米=qdmimi,5,2013-05-09 00:17:46,unknown,2,重看新版。才发现这是个多么精致、有野心、妄图包容一切的、爱情一般飘乎又永恒的故事啊。不过如果把它当作教科书可能会掉进陷阱。
. Hypnos .,NaN,2014-01-09 09:20:09,unknown,4,只是覺得裏面的人物愛的很有尊嚴。
