user_name,star,comment_time,geo_ip,vote,short
Steve&Ham,4,2021-04-23 00:06:23,,2,如今看来，画面已经没了惊艳感，实在可惜。一直在想象，如果是20年前在电影院看到如此宏大的场景，该是何种震撼。也庆幸最初在电视上看到时并不感兴趣，反而心里一直默念着：这种电影得去影院看。这可能也决定了后来《变形金刚》上的时候去影院看了3遍，看了《阿凡达》的IMAX版，也一直挂念着没有看成的《英雄》。这几年，这种类型的史诗片已经退化(或者也是一种进化)为复联这种娱乐狂欢片和李安的技术狂欢片。但它即使丧失了画面的优势，配乐和音效也足以把人按在影院的座位上，沉浸于一个或许有些俗套的奇幻故事。当一个个耳熟的名字终于对号入座，当我真正看到甘道夫吼出”Youshallnotpass“的名场面，我终于确信《指环王》早已不只是一部电影，是和许多经典艺术作品一样要记载在人类文明史的一笔。对我个人而言，我也确信许多遗憾终将影响一生。
拐子流星锤,5,2018-08-22 16:35:05,,3,这回看主要是感概几个方面，一是更相信正邪势不两立了，二是贪欲腐蚀人心的力量确实大，不服不行，三是邪恶之火不会自己熄灭，要和他斗到底
下辈子再努力吧,5,2010-07-21 18:19:36,,5,至今还未过时的特效！！我服！！！当年没发现奥兰多竟然是黑眉出演白毛太瞎了还有男主以前也觉得很好看的现在看好一般外加其实有点丑==||||
Holden🌈,3,2021-04-24 23:56:40,,3,把每个情节都掰开了揉碎了讲三个小时真的大可不必😅尝试了三次才终于在电影院强迫自己看完了WishIchoseashorterfilmformydate🙃
我也不在乎,2,2021-04-18 23:27:41,,2,搁到2021来看真的是食之无味，这种故事套路早就被玩滥了，就各色人物组队冒险穿插人物个性背景牺牲友情等等。努力投入看了一个多小时还是决定走了，还是对魔幻喜欢不起来，摄影剪辑借位啥的也挺没劲的。挺好，省了小说还有六部巨长的电影。中土经典设定和角色造型得作为常识学习一下。
马也,3,2023-09-03 11:12:38,福建,5,食之无味，许多剧情实在是很尴尬，漏洞百出，不过场景，音乐布置确实有史诗感，但也仅此而已了
徐若风,5,2013-02-03 14:50:54,,56,看的是228分钟(蓝光加长版)。视觉撑起一切。/2021重看。社会是座黑森林，上路的，只能是你一个人。
桃子,3,2021-04-18 01:31:05,,2,IMAX重看。发现摄影真是好！IanMcKellen真是好！ViggoMortensen很有魅力。只是这莫名其妙的组队和莫名其妙的不跟随到底是怎么回事儿啊？而且队员也太让人捉急了！越看越想赫敏和罗恩。费尽千辛万苦去扔魔戒，总让我想起最近逆向操作的“三星堆”。（初20060113）
Merindigo,4,2012-12-06 03:43:59,,3,和期待相比真的差太多，没看过书，对电影的感觉除了景色服装和氛围很令人愉悦之外再无其他，整个故事水准就像各种小说网上随处可见的奇幻武侠加神话传奇，故事转折还不讲逻辑，而人物水准则和总拿来比较的HP差一大截，几个主人公简直可说没有个性。唯一值得称道之处在于其影像化中展现的神奇土地吧。
四个春天,5,2021-04-17 02:13:57,,13,这两天重映刚看完夜场，太尼玛爽了
旧书君,5,2007-06-18 15:29:39,,1,陪老婆重看魔戒。不知不觉也17年了啊。还看出了不少槽点哈哈哈哈。比如当年的动作设计现在看挺菜，和后来技术纯熟的霍比特人不能比。但是那种无法撼动的返璞归真太有力量了。17年后还是会被凯兰崔尔美到震颤，会为豆叔死落泪，会为山姆的痴情整得哭笑不得。爱一辈子。
张苑希,3,2017-07-04 19:32:13,,1,魔幻史诗开篇。不过没有预期中的那么的精彩，228分钟加长版，剧情丝丝入扣，画面雄伟瑰丽，人物色彩分明，音乐大气恢弘。精灵族真是本片颜值高峰，当年的奥兰多布鲁姆真·惊为天人。
独行侠杀手阿何,5,2013-12-09 23:54:23,,0,2021/4/22影院补看重评：和在电脑上看的感觉完全不一样！Aragon从跃马客栈出现的那一刻仿佛在我心中射了一支箭！简直梦！中！情！人！我的嫁！！！！脸蛋稚嫩满满胶原蛋白，双眸湛蓝有神的ElijahWood超级精灵可爱惹人爱！和酷似邓布利多的甘道夫组合让人不禁穿越到《哈利·波特》。精灵自带柔和圣光，LivTyler的Arwen公主柔婉动人美到朦胧，和人皇多点亲亲亲赶紧结婚！！！遗憾两人的感情戏来得毫无铺垫。小叶子可爱有劲，敏捷飘逸，当年的开花真是白月光啊！不过我还是更喜欢人皇哈哈~。Orc恶心得作呕不忍直视，四位霍比特人酷爱作死，老是添麻烦给人家且战斗力又差。自幼便存留于我脑海中的旋律《ConcerningHobbits》真那个悠扬隽美，诗情画意！第一次在电影院听到的主题曲《MayItBe》悠扬空灵，荡涤心怀，如沐圣境。
马西嘿嘿嘿,5,2009-08-01 21:35:11,,3,托尔金的这部有着数十种语言的著作改编成电影已经实属不易，彼德杰克逊的场面调度亦颇显功力，丛林追逐厮杀戏镜头繁多却不感到丝毫混乱，虽然也是外界力量与内心诱惑的双重敌人的故事，但是却不由得让人惊叹如此险象环生。PS:NewZealandisthewonderland..
Lady Raven,5,2010-05-06 11:22:54,,1,2021.4.20重映IMAX院线版的节奏真的太紧凑了，没有任何多余的剧情。这次重映注意到一个以前没发现的细节，萨茹曼唤醒红角峰用的咒语是昆雅，甘道夫用辛达林果然斗不过
筷喜旺,5,2013-02-05 21:57:40,,3,制作什么的屌爆了卧槽故事也牛逼大发了冒险题材一生推嘛弓箭手什么果然还是要小精灵来做><霍比特人的友谊震惊到我了
花渡,4,2021-04-18 16:25:51,,2,2021.04.18人类所吟诵的史诗大抵都跳脱不出欲望的告诫，可我们依旧沉沦在欲望的轮回之中。至尊戒不只挂在弗罗多的脖颈之上，它藏在他人的生活里，你内心的贪欲里，它无时无刻地诱使你迷失自我。只要我们永远不要忘记，幸福的生活不是我们去拼命追逐某种我们向往的现有模式，而是应该在我们的现有生活中品尝每一次偶遇的琐碎。就像二十年后还能有机会在银幕上遇见曾经美到让人落泪的凯特·布兰切特。2015.01.18或许是因为先接触了《霍比特人》，或许是因为电影技术的发展，或许是因为期望的太大，总是感觉《指环王》在某种程度上比不过《霍比特人》。或许正如PeterJackson所说，《指环王》更注重的是那波澜壮阔的情节与更加丰满的人物形象与广袤无边的中土世界，而《霍比特人》更注重的是进步飞速的特效场面。
林||我们谈什么都像谈死！,4,2012-11-20 22:57:09,,2,再次看魔戒发现以前确实没看懂，的确是部伟大的作品。护戒之路其实也是试炼之路，最初说不会走的路后来全都走了。想要抵制欲望是可以的，只要你愿意。身高决定了地位，但让人瞧不起的霍比特人和矮人却展现出了非凡的品质。
袭人继续收破烂,5,2007-10-08 21:42:34,,14,其实是三部曲里制作得最精细的一部。
热心市民,5,2021-04-19 22:44:56,,4,10年后大银幕重看。补交电影票//2021.05.08大银幕x2IMAX2D
湛卢,5,2008-01-29 13:43:54,,4,一定要有个看过书的人在旁边讲故事^^
.捉摸透了姑娘.,3,2020-02-06 20:09:05,,8,到精灵这里都是自动磨皮加柔光😂
路人彦小二,5,2021-02-11 23:39:39,,2,我一个无感西方魔幻的人，也真香了这部20多年前的老电影那个时候的特效放到现在看，也很有看头。而且可以看到很多电影借鉴了它，不愧是西方魔幻的开山鼻祖如果说《哈利波特》打造了一个让人向往的魔法世界，那《指环王》则是一部魔幻史诗，看了后，终于理解《哈利波特》只是一本儿童书，《指环王》无论世界观，还是内核都太深度了前半部分搭建世界观，后半部分魔戒护卫队集结一同前往摧毁至尊魔戒精灵莱戈拉斯的神颜实在是太吸精了，关注点都在他的脸上游侠阿拉贡的勇敢，巫师甘道夫精神领袖一般的存在，矮人金雳，还有早早领盒饭的宰相之子博罗米尔，这些人物各有闪光点，群像9人都让人记忆深刻大型RPG游戏既视感，9大主角刷地图做副本任务，加满技能点，成长升华
tikey,5,2009-11-09 19:14:30,,0,09.11.09第一次看罢，叹为观止，五体投地，当时蜷缩在宿舍角落的我怎么能想到有一天可以在IMAX影厅里再次看到这部传奇史诗呢？12年过去了，特效的发展突飞猛进，《指环王》带给人的震撼却依旧不减，绝美的想象、精致的布景、出色的演绎、动人的配乐……一切都彰显着优秀作品的魅力。10.0。
崇柏露,3,2022-11-23 11:39:10,陕西,7,特效很牛，四星；剧情拉跨水的一批，二星。看了很多热门评论，什么经典啊、这届观众不配这么好的电影啊、好影片被观众拖累之类的fnmdp，就一个01年的商业片而已，搞得有很高大上的思想情绪一样。在许多大佬的的伴随下，还能有愚蠢的哈比人捣乱。你可以蠢，但是你不能蠢事一而再再而三啊。许多剧情就是为了宏大的场景而拖沓，任务性格、剧情就因此出现扭曲帅是真帅，水也是真水
葱油饼,3,2011-07-17 05:29:16,,2,可能有不同的解释，但是基本情节仍然是好与坏的斗争，最后好战胜坏.Adam不会游泳，却最后硬要游泳，这种勉强的牺牲情节只是为了突出那个兄弟之手.这样的情节显得很造作.
陈渊,5,2021-04-23 01:47:36,,5,这还不好看，那什么好看？现在的小孩子到底在想什么（怒）。这tm可是二十年前的电影，比你们现在看的那些垃圾强得多得多。阿拉贡好帅！开花年轻时真的有点东西！但我更加想在大荧幕上见佩佩555，可惜第一部精灵王子爸爸还没出现。大魔王真的好适合这种带着无限圣光的角色；霍比特人小小一只真的好可爱！Pip问Whataboutsecondbreakfast真的太好笑了嘎嘎嘎。真的非常感谢前辈们创造了这样的经典，鞠躬！
豆友149131135,5,2018-03-12 12:53:53,,7,魔幻史诗开篇，冗长而壮美，天马行空的想象力，气势恢宏！剧情丝丝入扣，人物个性分明，配乐也好听。新西兰好美！不愧是经典中的经典！
Nikitaa,2,2013-03-08 14:25:17,,6,我果然还是不适合看这种。看睡三次，分三段看完
海贼拉面,3,2020-05-10 18:28:30,,1,哦是的我现在才开始看魔戒。霍比特人的生活真的好快乐哦，天真可爱的霍比特人不应该承受这么多XD。两个多小时几乎全是男人看得我有点烦。不是我腐眼看人基，是阿拉贡和小叶子真的有点东西，欸嘿嘿。
GoodWillHuntin,5,2010-03-12 09:27:24,,1,#指环王系列首登INAX#感谢不散观影团，时隔多年再看，依然觉得指环王系列是最伟大的史诗电影，没有之一，情节跌宕起伏，音乐大气恢弘。导演选角如有神助，伟大的演员们在自己最好的时光里演了最完美的电影。岁月流逝，然而伟大会永恒
Lycidas,3,2021-04-19 12:18:13,,2,重看。以前不行现在还是不行，PJ叙事能力真是糟糕透顶，不如专心搞b级。奇幻史诗题材与我无缘。以及这个所谓4K版也太糊了吧……
深邃,5,2021-04-25 03:30:38,,1,20210417IMAX重刷。这才发现第一部几乎全部是单线叙事，直到最后才分出线来，可能很难再有所谓史诗巨作会这么拍了。观影过程中一直想到伯格曼的《芬妮与亚历山大》。
豆友83908392,4,2021-04-26 11:00:42,,0,在静安DRC的杜比影院看了这部电影。因为剧情铺垫比较多，战争场面比较少，画面声效的优势并没有发挥出来，不过人物的角色很饱满，“魔戒”的象征也很有趣，最令人深刻的角色是博罗米尔，代表了人的七情六欲，而甘道夫掉下去的时候未免觉得难过。总的来说，《护戒使者》是一部比较传统的冒险故事，英雄集合的场景比较简单，和《十月围城》组成一个鲜明的对比。凯特·布兰切特的预言耐人寻味，Frodo和Sam的友谊也令人振奋。最后再配一段精彩的经典话语来总结，画龙点睛。(4/5)
AlanX,4,2021-04-21 19:02:44,,1,从夏尔那个欢快的少年到独自踏上末日火山的护戒者，世界在改变，历史在改变，人也在改变。人性与忠诚的故事总是轮番上演，但整个剧本体系宏大至如此，还是难得的魔幻史诗。（IMAX特效加持确实很震撼）
破,3,2021-04-18 02:02:17,,1,我终于看过指环王了，我不是一个奇怪的人了！但还是再次验证了：我畏惧架空史诗！可能这几年看过的大片是个位数（几年加起来），我现在对疯狂怼情绪theme音乐和频繁怼脸大特写非常害怕……名场面十几年后补上了youshallnotpass!以及大家都还年轻啊。再废话一下，对于史诗感的固有元素，命运/使命-征途-忠诚-以及必将有的蜕变，人到中年后觉得，人类还是需要这样的热血的？
好样的,3,2021-04-22 15:52:27,,5,重看，感觉除了情怀别的真都挺一般。剧情和场面处理都差点意思。能看出来很多戏都是往“小”了拍的。所谓小就是重要戏份里大量特写和快速剪辑替代场面调度，在宏大的世界观设定之下更显这种落差。这一部里仅有的“大”的地方全靠配乐和特效场面在支撑。
旁骛,3,2021-08-11 13:08:06,,3,Frodo的演员长相十分古典，是照着米开朗琪罗的大卫雕像找的么？实在是不喜欢如此目若朗星浩然正气就差把“英雄”两个字写在脸上的正面人物。HugoWeaving戏份太少令人难过。
daisy,5,2013-03-01 22:50:17,,4,终于咬咬牙一次性看完了，加长版真是伤不起，片尾曲就有27分钟。queen比hobbit里面老居然，跟弗罗多一样都是逆生长的吧！甘道夫只会物理攻击或者念念useless的咒语，对得起巫师称号么-.=不过死的时候还是狠狠哭了把，要不是知道他还会复生肯定哭的更惨。弗罗多个废柴啥都不会一直添乱还经常被魔戒控制
菠萝,3,2021-04-26 01:07:06,,4,肯定不能昧着良心说烂，但在我的观影体系里确实不好看，连着看两部在电影院坐了快六小时，第一次会如坐针毡的感觉不停看手机，哪怕北影节看艺术片都没这样过，如果第三部上映本着有始有终的原则肯定还会看，但也只是毕竟是当世经典有必要看看的心态，老片上映不都是惊喜啊，前阵子阿凡达的惊艳很难复制尤其这种主打视觉效果的奇幻类
草威,5,2017-01-09 22:11:38,,6,加长版真的爽炸了。三部里最喜欢第一部，世界是新的。
小海,5,2010-01-28 22:39:21,,9,重复看过十几遍的电影，每次都一个人窝在房里从早看到晚，每次一都感觉得到新的东西，这就是魔戒的魅力。
123456昵称,5,2017-01-18 02:28:28,,10,当年重看了很多遍，迷得不行了。
momo,5,2017-01-30 00:52:38,,4,电影场面恢弘，特效非常好，剧情正能量。高中英语课看了一半，部分画面有些残忍。最喜欢甘道夫。
apos,NaN,2021-04-21 19:38:41,,3,长大了，觉得精灵王子没多大意思了，阿拉贡好野好喜欢
逃之夭夭,5,2008-02-21 14:36:51,,1,不愧为大制作！今天（09.05.29）又重温了一遍，愈发觉得它是电影史上史诗般的存在，它的地位，是无法撼动的！！！这次复看，更多的被小哈比人山姆打动，一个承诺，让他不顾一切。也许，之于他，国仇家恨，大义大勇都比不上自己的一个承诺，这样的心怀，不一定好，却真真让我感动不已！
雲外憧憬,4,2019-09-28 23:57:24,,2,作为开篇，设定铺垫的太足，以至于造成观看疲劳，虽然佛罗多全程菜鸡OB，但他身上也确实闪烁着勇气的光芒，只能说，J·R·R·托尔金设定的背景故事太引人入胜了，就这样跟着甘道夫一同环游中土世界感觉也挺不错的，而这场旅途，才刚刚开始。（不知道什么时候看第二和第三部了）
NANA,2,2021-04-18 19:39:22,,5,剧情薄弱到连网络游戏的故事大纲都不如，男主和现代网剧的玛丽苏小说际遇同出一辙，唯一可圈可点的就是西方中世纪的宏大场面终于被写实刻画，作为20年前的电影的确可圈可点，但不禁一想，当年不是有黑客帝国了吗？
已注销,5,2018-06-24 13:18:40,,6,一部史诗画卷的展开，当年看的时候被开花惊艳得不行，一见钟情。
masa,1,2009-05-29 17:08:03,,10,就是不喜欢，打心底里反感！这种反感经过时光的打磨更加的难以撼动。
Yellow_OTL,5,2011-10-09 09:36:50,,0,当年在电视上看到莫利亚逃生片段惊为天人，于是买了译林的三部曲加前传小说外加DVD（当然是盗版），从此入坑。第一部主要是世界观介绍，属于慢热型电影，但我当时是看了《霍比特人》小说再看电影的，所以一开头也看得津津有味。另外70年代魔戒动画真是给本片提供了很大的启发，好多分镜、造型都是从那里借鉴过来的，整个故事脉络节奏也基本和动画吻合，算是前人栽树没栽完，彼得·杰克逊栽完顺便乘凉吧。
秦幽轩,5,2010-10-08 21:10:56,,0,场面当然很宏大，尤其是河口那两个石头巨人给我留下了深刻印象。不过还是更喜欢原著中这句话，“家已在后，世界在前”，更有气势！（2021.4二刷，三星改五星：看的imax4k，92元票价感觉很值！之前没给高分是因为上豆瓣追评的时候其实早已忘了影片内容，如今20年过去，各种特效大片已看了许多，再看本片却仍觉得精彩震撼毫不落伍，不明白当年我为何反而瞎了狗眼没看出好儿来。也不理解为何现在会有人嫌节奏慢，就先不说特效和场面了，剧情也完全是丝丝入扣高潮迭起啊！还有甘道夫对佛罗多的那段训导真是内涵深远，最后的牺牲也充满十足的英雄气爷们儿气，总之基本是要啥有啥的封神之作啊！
陆沉,5,2021-04-17 17:10:44,,2,最后看得我太难受了，一方面为了自己能跟这样伟大的作品诞生在同样的年代感到壮烈的荣幸，另一方面因为真实地感受到人生苦短，这样的荣幸一生可能只有屈指可数的几次，从而陷入深切的哀伤。
记忆错觉,5,2012-07-04 11:40:48,,0,2012-255.欧洲杯期间重看片目…第9次，不知还会重看多少次…
爱情海,4,2017-04-16 01:43:01,,5,魔戒第一部是巨作的奠基，新西兰风景超美的。
Mignon松弛地,5,2021-04-18 23:22:41,,2,2006.11.19第一次看，2021.4.18看第四遍，经典常看常新。这次看善恶选择和信仰的部分更有感触，审美也从精灵王子变成了人皇。弗罗多用不大的声音说了几次才让大家听见“我去送戒指”的时候，忍不住泪目。
杨大志°,4,2017-04-04 21:12:53,,7,很经典啊，超好看
kiriyama,3,2021-04-23 19:13:23,,5,比较无感。仅仅是宏大景观，并非是宏大叙事。
Neroat,5,2014-11-17 09:15:27,,2,莱戈拉斯的惊鸿一面，感觉陷入了初恋，看过小说之后再来复习电影，别有一番滋味。
蓝色的汉堡,5,2021-04-17 17:10:58,,1,"Imax重看。之前看了四五遍吧，传奇的开始。矿山那段真让我想到黑魂，还有一些梦里的rpg场景。。""Youshallnotpass!!"""
爱智慧,5,2011-12-17 22:27:29,,2,这才发现当年匆匆一瞥而过的自己错过的是怎样的一道盛宴，每个人都是那么个性鲜明，霍比特人的淳朴真挚，流浪王子的落拓不羁，精灵王子的英俊灵动，白发魔法师的睿智慈祥，魔戒远征队虽然有过内部分裂，但最终还是呈现了一个充满希望的开始，不管是场景、音乐、道具还是演技，绝对的一流水准，史诗大片
边城玫女,5,2019-10-09 17:22:45,,3,哇塞！电影居然还可以这样拍！哇塞！这视觉效果！哇塞！原来这就是半兽人的长相啊！天哪！精灵王子，我要嫁给你！……没错，这就是我和我的小伙伴，初遇《指环王》的最直接感观！这是一部史诗级电影，更是一部电影发展史上的史诗！不愧是三大现象级电影之一（另两部泰坦尼克号、阿凡达）。同期的哈利波特也很棒，但是和指环王比，呃，既生瑜何生亮……
mmhh,5,2014-05-01 17:58:34,,1,178min。经典，就是好长啊。护戒队九人出征，甘道夫坠崖，博罗米尔受诱惑但以死挽回。弗罗多与萨姆离开小队前进
浪漫主义狗,3,2021-04-20 18:19:08,,1,抱着中小学生必读经典的心态去看，感觉这个二十年前的运镜和剪辑也太诡异了，我甚至怀疑是当年的特效技术限制让它三分之二时间都是特写。巫师打架的样子仿佛“我欲成仙，快乐齐天”。后面阿拉贡出场了可真的太性感了！没洗头都那么帅！和我的狂野男孩贴贴！
你爹语重心长,5,2016-01-06 11:51:10,,3,史诗的开篇，揭开波澜壮阔的第一章。
tankdream,4,2012-06-25 14:30:04,,3,看了我200分钟…也太长了吧………奥兰多好有爱~~里面还有LOST的charlie，一看就认出来了…还有权力的游戏里的stark~
Joy,4,2011-07-13 03:58:38,,0,在电影拍之前小说就很出名了。小说是真的好看，否则我一个小屁孩如何通宵达旦克服那些我死命都记不住的名字看完了那三本厚到爆字小到爆的书？而电影出现后我的吐槽集中在咱们的精灵，我真心觉得那谁谁谁达不到小说所描写的百分之一美好。电影其实就是省脑力活的东西。
与碟私奔,5,2018-06-16 20:39:42,,1,【补標】指环王系列唯一哦电影院看过的——DVD收藏【2021-4-17卢米埃北京影城IMAX电影🎦再看】在IMAX效果下的中土世界，精灵国度，神墙，尤其海报画面的“阿公(亚苟)纳斯巨石像🗿”在IMAX巨幕下更加让观众叹为观止，它在电影情节只是点缀和稍纵即逝，但是在电影海报画面下的经典造型给影片带来了谜一般的感觉。影片的魔戒毁灭之路，也是人生的成长之路，既要抵御半兽人的围追堵截又要抵抗不被至尊魔戒本身的邪恶诱惑……好比在首部曲最后甘道夫对佛罗多(希望这一切从未发生时)谆谆教诲的:每个人遇到困难都会这么想(经历过困难的人都会这样想)，但是我们无法决定自己的命运(但现实并不以他们的意志为转移)，你只能在…该如何完成你被赋予的使命(我们所能做的就是在遇到困难时想办法去克服)。期待第二部再刷
Daniel,5,2012-12-31 15:26:18,,4,在魔戒里很多次都仿佛看到了哈利波特的影子，甚至连Frodo的眼睛都那么像Harry。这部电影真的是魔幻片里史诗一般的存在着，鸿篇巨制，制作精良，背景宏大。甘道夫爷爷坠桥的那一瞬间止不住眼泪，太悲伤了。OST也好棒。有生之年一定要去新西兰，看看hobbits的家乡。
小四不象,4,2010-04-22 22:33:11,,4,开场的烟花很绚烂；丽芙泰勒的出场则是惊艳全场；精灵主城很漂亮，主题颜色是淡金色的，就像魔兽的血精灵主城；影片给我们呈现出一个广袤的中土世界：矮人宏伟的地宫、绵延的雪山、精美绝伦的精灵城、梦幻般的黄金森林，印象最深的是被光芒笼罩的精灵们，以及她们美妙的吟唱，她们沉静、高贵，宛如仙子
HiNeNi,4,2011-08-01 16:08:00,,0,一个传奇的开始。风景如画的新西兰再现的中土世界，一群在信念和欲望中斗争的人类，一次次精彩绝伦的斗争场景。同时小说改编的电影使剧情有着很好的条理。
变形的文科生,4,2015-01-24 23:43:17,,2,再看一遍来告别，鸡皮疙瘩，这个系列对我而言完全超出电影本身（电影本身也是非常出色），完全是当年第一次的记忆，大学在寝室跟室友一起迷妹一般地聊它，恍如昨日，无法忘却的岁月，相信一切的年纪，一把老泪……
玉燃冰,5,2011-10-29 00:44:32,,1,史诗。凯特布兰切特。恍然间10年过去，重温随着我第一块硬盘离去的魔戒3部曲。还记得刚上大一在自习室外的宣传板上看名叫《砌体结构》的班刊，虚构了一个半兽、亡灵和人的世界和故事。对作者佩服得五体投地，就此留下了对魔幻种群的好奇和向往。后来才知道，这种世界和种族结构应该不是作者原创……
辣贝哈,4,2021-04-16 21:45:05,,4,看的重映，总的来说还是太长了哈。演Aragorn的竟然是绿皮书的男主角，一胖毁所有哈！
豆瓣酱,4,2022-03-03 21:04:34,,3,活这么大终于把大名鼎鼎的《指环王》第一部加长版看完了，结尾字幕居然有二十分钟！配乐和人物造型以及摄影是史诗级的，佛罗多的演员眼睛太清澈了，但是剧情有点缓慢，可能类似《沙丘》第一部只是个开头。
神游少年欣小欣,5,2008-02-26 12:49:16,,1,如果说星河舰队让我想起了星际争霸的话，那么魔戒让我想起了魔兽争霸..为什么电影总和游戏靠那么近?纳闷了..不过还是之经典..
