user_name,star,comment_time,geo_ip,vote,short
往事如烟,5,2010-05-04 09:24:53,,2,"Imadeapromise，Mr.Frodo.Apromise:""Don'tyouleavehim，SamwiseGamgee.""AndIdon'tmeanto.Idon'tmeanto.山姆爬上船之后说的几句话，是让我最感动的。为了承诺，为了朋友。"
xiaoiou,5,2013-10-13 23:42:49,,2,中学时期租碟回来看，竟然有三张啊，看到一半去吃饭就没看下去了，实在太长！过去这么久，一直找机会从头看一遍，没想到看的是蓝光加长版228分钟，一晚看完，实在好看！3个半小时也没感觉有任何的啰嗦之处，继续看完这个系列！20151207，看完霍比来翻煲。看懂好多细节台词和人物关系，堪称高潮迭起！
grace-xhu,3,2018-03-13 01:11:40,,30,科幻大片的感觉，主角光环太严重。特效还是很好的。
大河马,5,2010-06-07 08:34:29,,2,好吧，虽然我看这部电影睡着了，但是不是因为剧情无聊，而是电影太长了，不愧于史诗级的称号
wong2,4,2014-03-01 19:04:36,,3,看的3个半小时的；中间困了一会儿；不时的跟旁边的人说：我们有个服务器/项目的名字就叫xxx！
VincentP,5,2017-03-06 12:28:28,,2,我觉得魔戒系列(不包括后来的霍比特人)是史上最成功的史诗改编，即使放在15年后的今天看也没有一点过时。感谢托尔金精彩的原著，电影剧情上得到了保障，一个有血有肉的冒险故事有了一个精彩的开头。加上愈加成熟的电影特效基础，中土世界被完美的还原出来了。
H.,4,2021-04-17 18:03:40,,7,重温大银幕，整个故事剧情就是绿野仙踪的深化版。电影好在每个挑战的美术设计上，尤其是遇上火魔的那座断桥和渡河时的两座巨石像，利用纵深和配乐形成了电影的史诗感。可惜魔戒的力量太bug，主人公也算半个残废，一天到晚只会喊救命。
F,5,2021-04-19 22:29:06,,6,作为个人最爱的电影三部曲，此前已看过不止三遍，也曾想过有生之年能否在imax屏幕上重温，今天总算了却这桩十几年的心愿。虽是4k修复版，而且在北京最好的imax影院，但毕竟是二十年前的电影，画面精细度没那么完美。尽管如此，其恢弘的想象力、跌宕起伏的情节、美轮美奂的视效、气势磅礴的配乐，仍然令我叹为观止。此外，指环王三部曲魔幻史诗电影之所以伟大，更因为其对贪婪、背叛和沉沦的批判，对友情、理想和信念的歌颂，以及为自由勇敢奋斗、不惜牺牲一切的人性光芒。结尾Enya的声音响起，久违地颇觉意犹未尽，不忍离场。佛罗多一度后悔成为护戒使者，希望这一切从未发生，但甘道夫告诉他：凡是经历苦难的人都会这样想，可事实却不会因此改变。我们唯一能决定的就是在有限的时间里该有什么样的作为。这真是人生箴言啊！
汪金卫,4,2014-02-16 08:47:33,,1,【三部曲剧场版IMAX马拉松】是一部漫长史诗级魔幻公路片的开端，也是三部曲的引子。为观众塑造了一个宏大的中土世界观，介绍了各个角色的身世性格，为后续两部打下基础。没有后两部动辄千万人的战争大场面，但节奏也把控得当。
黛安不是黛安娜,3,2020-04-29 23:53:23,,2,一直说史诗什么的，抱了很高的期望…还挺失望的，风景和精灵好看，电影要仍然保持它的吸引力，就得靠人物和剧情了，可以说没有剧情可言，人物刻画也不饱满，这剧情拍三部还能这么长…还是西游记更有意思一些。一路傻打还有猪队友，感觉在看男生打无聊的游戏。菠萝蜜这个人物还算饱满，他去世我有点难过，后两部先放着吧，如果什么时候电影院重映可以看看
18280,4,2014-02-16 22:49:38,,0,看的是228分钟的版本，真的很长，故事情节也很不错，虽然不喜欢魔幻题材，其他不说了，虽然也不觉得有多史诗。
leonid,4,2012-07-04 00:57:57,,0,终于正经看完指环王三部曲，还是加长版...再回想第一部，当年的影迷盆友们谁能料到这个系列里最神奇的角色在第一部里就出场且挂了----长的像暗黑破坏神的炎魔...
阿作也不是很作,5,2008-12-21 10:35:44,,0,商业与艺术结合的典范！！！/没想到2021年居然有机会在大银幕上看指环王，我真的好爱第一部，各方面都是完美的类型片！可惜不是加长版，加长版才是yyds!
掉线,4,2012-10-20 20:42:50,,47,特效，剧情，配乐都是上乘，世界观设定也很宏大，但我实在找不到它值得我打五星的东西……期待太高了，4个小时的长度看的我头都快裂了，那两个霍比特人怎么看怎么都是一对基佬
小油飞,4,2012-09-01 01:55:18,,1,我真的是第一次看完。。DVD蓝光超长版啊。。尼玛真是好长啊。。要不是为了奥兰多布鲁姆。。
柠檬海盐,4,2017-05-14 12:43:34,,4,小时候看的了，看的时候被震撼到了。
内陆飞鱼,4,2021-06-12 22:13:53,,0,最早是在网吧看《魔戒》，断断续续，都快忘了内容。大银幕上看见奥兰多.布鲁姆、凯特大魔王的盛世美颜，就像做了一个梦。这集外景最美。
我到河北省来,5,2021-04-18 13:10:49,,3,★★魔戒迷七星，20周年重映影院四刷三部曲。此伟大系列小说认为远在冰火小说（你们的权游）之上，在宗教与哲学思辨中创造各种角色，以甘道夫传达其思想。最难影视化的《精灵宝钻》是了解托尔金世界最好途径。第一次看彼得大帝电影05年暑假。09年看小说《精灵宝钻》《努门诺尔》，最后三刷指环王三部曲2012年冬，快十年没再看。13年看小说《霍比特人》，17年买收藏版《精灵宝钻》《努门诺尔》，只为收藏。隐约记得，某天很多年前一个梦，指环王9月重映，没想到提前到4月！！
哥谭民风淳朴,5,2017-05-03 23:26:37,,3,小时候在电影频道看到咕噜挑拨关系那段留下了不好的印象，差点错过，心目中最好的魔幻电影，对于构架完整的异世界完全没有抵抗力
ZTH,5,2021-08-29 21:10:18,,1,史诗巨作。魔戒象征着什么？每个人心中邪恶的种子？而且往往越是能力强大的人，心中对于权力的欲望越是庞大，所以选择了对权力最没有需求的霍比特人作为持戒者，也算是一种最佳选择了。但可能是第一部，有太多的疑问还不能得到解答，但塑造出了非常庞大的世界观，以及最令人敬佩的勇气，非常具有吸引力。
夜摩刀,3,2012-04-26 23:02:33,,0,【specialextendededition：208min】
Vash,5,2014-02-02 15:45:03,,1,我一直觉得这种片子我应该不是很喜欢的--结果看完霍比特人发现还是相当吸引这才翻出来真正看了.十几年后特效神马的果断不如现在了，但是人物角色性格之类的反而丰富的多.至少比霍比特人1好><什么种族都要有戏份才好像真正的奇幻世界啊，果断找到了玩博得时候的感觉~
kid,5,2009-05-31 23:30:18,,1,指环王3部曲带我们来到另一个世界，场面宏大，故事有着丰富的历史背景，看完以后发现找不到同类型电影，真是遗憾，纳尼亚什么的实在太难看了
八擒八纵何卡卡,5,2021-04-19 22:15:25,,5,二刷跟小时候看出了完全不一样的感悟。一刷后完全不记得波洛密尔这个人物，这次却印象深刻：一个有抱负追求也有局限性的角色，一个普通人，两次湿了眼眶其中一次就是因为他。长大后知道了人与人之间关系的不易与无常，也对Sam的友谊、陪伴、和对承诺的坚守有了更深的appreciation.一刷看的是场面和史诗感，二刷看到了各个角色的人性。
鸭梨,5,2010-05-22 15:45:23,,1,看责任、承诺、友情、尊严、欲念、正义……PS：奥兰多果然几销魂。PPS：树叶胸针绿披风很漂亮啊！（灵活型的人类勇士、力量型的矮人力士、魔法型的巫师老头、远程攻击型的精灵弓箭手、加三两小兵配合，好个做任务的标准队形啊！雪山、地底洞穴、森林河流，好个打怪必经的标准地图啊！）
印第安纳波利斯,4,2009-02-19 13:36:34,,0,小说和电影哪个更好？我看了小说看了电影，很难回答，何必回答呢？
一贫,5,2009-01-02 03:41:13,,0,之前没感觉，但是今天电影院重刷，不知道为什么突然就让我有那种西方西游记的感觉了，哈哈哈。。。剧场版加长版DVDBD，不知道看过多少次了，再次在电影院看到三个小时都不觉得长还是毫无尿点，即使20年后对于当今一些大片也毫不逊色。。。
假面企鹅,5,2019-10-02 12:30:34,,1,每个遇到困难的人都会这么想但我们无法决定自己的命运我们所能决定的是在命运给予的时间内如何去做「Manythatlivedeservedeath.Somethatdiedeservelife.有很多活人本来就该死，也有些死人命不该绝Canyougiveittothem，Frodo?你能做这种判断吗，弗罗多？Donotbetooeagertodealoutdeathandjudgment.千万别轻易断定别人的生死Eventheverywisecannotseeallends.就连智者都无法决定命运」
风蚀蘑菇,4,2014-02-02 03:04:03,,3,萨鲁曼X甘道夫，山姆X佛罗多，all莱格拉斯。。。感觉托尔金还是挺遗憾的，没能亲自看到那些精灵、半兽人、游侠出现在眼前。PS莱格拉斯真真眉目如画
Muggle、佑。,4,2012-05-16 14:05:28,,0,--羞涩，事实上我似乎是看过很多遍的但是又好像没有完整的记住过。努力的补习着加长版。嫩的掐出水的奥兰多~~~亲一个来~╭(╯3╰)╮
瓦力,4,2021-04-22 23:34:14,,2,重温补标。四星半。第三遍看了，终于给中土大帝补了IMAX票。20年了，老比尔博和萨鲁曼都已谢幕，看着熟悉的情节，听着经典的旋律，特别特别感动，三个小时一下就过去了。
莎会长,5,2010-02-15 20:55:23,,1,以前别人在迷《魔戒三部曲》的时候，我在迷《骇客帝国》三部曲。然而他们说：“你如果没有看过魔戒，那就是一大遗憾”。我买的这套D9碟已经放了快三年了，一直没有勇气开始看，因为我知道将耗时巨大。但是今天，我终于看完了第一部，看得很激动。美丽的人物和画面，展现了传说中史诗般的奇幻。继续。
美女菜kun,4,2017-04-01 15:29:05,,2,书实在看不下去，拍成电影就是造福我这样的人吧。好剧本加上好特效，不错的！
yadiel,4,2008-06-02 21:34:20,,0,史诗级的电影，每部4小时左右，真的好恐怖。但是确实有些繁琐，最后一部大战结束了居然能又演了半小时，但基本上什么没演。跟魔兽确实很相似，期待魔兽出电影。
吃货少女萌萌哒,3,2018-03-15 17:26:57,,17,场面宏大，真实细致，视觉效果很棒，就是故事太长了，不过传递的正义和信仰引人深思
Anday,5,2012-02-18 22:11:58,,1,看完之后，心潮激荡，竟说不出话来。有很多想法等不及要涌出，十分默然，不知从哪里说起。于我。魔戒是不可逾越的史诗。
Q·ian·Sivan,5,2014-04-10 09:45:15,,2,「Youcannotpass!IamaservantoftheSecretFire，wielderoftheFlameofAnor.Thedarkfirewillnotavailyou，FlameofUdun!Gobacktotheshadow.Youshallnotpass!」「Eventhesmallestpersoncanchangethecourseofthefuture.」
吴邪,4,2017-06-01 17:29:15,,0,重看。开头说得清楚，历史变为传说，传说变为神话。世界的命运因为渺小角色偶然改变。堕入黑暗的是人类，有人拒绝诱惑，有人摇摆不定，江河日下的人类一族变得软弱，刚铎hasnokingandneednoking...阿拉贡泪眼婆娑地说我不会让人类陷落，转身就接受同盟计划失败，欢天喜地要去多抓几个奥克...伐木用来锻造兵器培育军队，把鲜血当粮食，过度开矿挖出的地下深渊...难得见到carpenter，sculptor，armourweapons，paint等新的staff类别。感慨的是指环王后来几乎成为新西兰的旅游支柱，不仅因为很好保留了取景地霍比屯，还有新西兰文化和霍比特人的众多相似，就像甘道夫说的，你可以花一个月了解他们，一百年后他们仍然surpriseyou
玄理,4,2012-03-03 13:07:55,,0,这电影还用介绍么？耳根子都快磨破了吧！魔幻史诗电影的不朽经典。不要被它的时长吓到，要知道看过它的人可是经常会拿出了反复欣赏的。彼得·杰克逊就凭这一部（准确的说是一系列）电影就足以名垂影史了。
兵部侍郎千夏,5,2021-04-20 13:00:55,,3,终于能通过电影院看了，这应该是我看的第六次了，还是那么好看，而且我选的是imax影厅，就几个人，虽然我喜欢单独看，但如果有很多的粉丝一起看就有趣多了，就跟当年《魔兽》上映一样。影厅音量拉满，简直是震耳欲聋，但太他妈爽了，尤其是萨茹曼和干豆腐在红角峰斗法，萨茹曼念咒语的声音真的震耳欲聋，让我感到一股莫名其妙的恐惧感，太真实了😢。还有炎魔那段的背景咏唱，鼓声密集，声音特大，你的心脏能感受得到DongDong的震撼感的，果然史诗电影还就得imax。另一个就是翻译和字幕问题，我还是喜欢批站的字幕和翻译，比不上的，看过都知道。终于补票了，更爽的是马上就可以补第二部，而不用等个几年😁😁😁。
多整点儿香菜,4,2011-10-20 19:36:15,,0,额，我刚意识到这不是科幻，这是魔幻片啊~歌华点播，趁着免费看了第一部--发现这还只是个开始，以为一部一个故事捏--坑啊！奥兰多布鲁姆帅毙了！那清澈的五官啊！
奋斗的大象🐘,5,2015-02-01 12:10:11,,1,大菠萝最后的死荡气回肠。人皇对他的承诺“Ipromisenottoletwhitecityfall，norourpeoplefailed.”也标志着他正式担当起人皇的责任。大菠萝临死前说的“myking”，也体现出他对人皇的信服。最后，他把剑紧紧地贴在胸前，以勇士、刚铎之子的身份光荣地死去了。还有，最后弗罗多的选择也特别动人，因为他本来不该担当这个责任，他也很怀疑自己，很害怕承担责任，但是当甘道夫的音容笑貌出现在他眼前的时候，他决定做出自己觉得对的选择，承担责任只身前行，太感人了，昨晚看完在地铁上哭了一路。我觉得之前我觉得不够好看的原因是我先看的2，知道甘道夫复活了。昨晚音乐会带着第一次看的心情，觉得简直绝妙，先把甘道夫睿智而可爱的形象塑造好，逃脱萨鲁曼让观众有失而复得的心情，让他的跌落成为对观众的会心一击。
SHAN,5,2013-01-01 09:59:31,,1,重温魔戒显得多么应景啊~长路漫漫，征程已经开始。有魔法师、精灵、矮人相助，也有猪一样的队友添乱，而最终还是得靠自己！像甘道夫说的，Allwehavetodecideiswhattodowiththetimethatisgiventous.
Enjoy🌈Rachel,5,2014-03-03 00:13:20,,1,（拖延症终于开始回头补）Orlando的精灵王子扮相真是帅哭无数次啊（其他扮相就很正常这个实在太戳）以及我脑洞太大真心觉得精灵王子和阿拉贡是西皮啊（萌裂！）甘道夫那段好戳泪QAQ最后吐槽一句蓝光加长版还真长。。。
支离破碎,3,2011-09-30 23:48:26,,1,啊，反正我对这个系列是极其不来感啦。大环境很大气可为什么总有小气的细节呢，比如带上几个除了添乱和当炮灰和解闷外完全没用的同伴上路……
李阿斗,5,2016-01-17 19:23:37,,3,最好就是一个人躺在被窝里，手边放着一杯热乎的咖啡，暖气正好，从华灯初上看到黎明破晓，整个中土世界，配蓝光加长版。
八十千,NaN,2011-08-31 22:04:10,,0,原来魔戒就是指环王啊。。。昨儿我看了整整一下午就愣是没看懂啊。。。。。。。。。。
植荷,4,2020-04-19 20:03:03,,3,典型的西方魔幻大片，恢宏的场面，丰富的人物塑造性格，特别是对人内心世界的描写简直是殿堂级别，绝对好片。
汲汲于尘,5,2011-04-03 19:31:55,,1,这是一个人类对抗欲望的故事。。。而这个对抗无论成功还是失败，究其残酷而勇敢的过程，每个人都是英雄。。。
小山生桂枝,5,2021-05-31 21:03:48,,0,善良的小人物，不经意间走进史诗传奇，他们虽然懵懂，却也下定决心一直往前走。今天的我，仍然为阿拉贡倾倒，也更能理解博罗米尔的犹豫与挣扎，同样佩服霍比特人的勇气。大银幕上看《指环王》，实在是一种美的享受，山河壮丽，场面宏大，角色都各有风采。4月18日于影院
nocturnedxx,5,2010-04-08 19:31:41,,1,用接近10小时的时间看完指环王加长版的激情仿佛已经是很久远的事儿了那时发呆闭上眼都见着甘道夫策马时的白袍翻飞耳边则是一直回响着enya悠远浑厚的mayitbe然后就一个人傻愣愣地想象高山草原……末了还要自我臭美下我也忒有艺术细胞了……
pinomax,5,2008-08-17 23:08:11,,0,可以说整个故事里九成的灾难都来自于皮聘的手欠嘴贱。在布理和风云顶引来戒灵，在莫里亚引来水中监视者半兽人和炎魔，又在刚铎触碰帕兰蒂魔石被索伦发现。
嘟小七,5,2007-01-17 21:34:03,,3,多好的龙与地下城结构，多好的影音效果。鄙视那些为了将他的IMDB分数降低而去恶评的人。新片就没有经典可言？非要低俗小说？我看你就挺低俗的
Tequila-sunset,5,2018-09-12 11:48:29,,1,重温中土六部曲。指环王真的比霍比特人要好看太多。美妙的画面，心醉的配乐，一场惊险的魔幻旅程。除了打戏因为时代的原因镜头跳跃感太强，特效如今看来不够流畅，所以观感不够好。当然只是与霍比特人相比是这样。指环王系列永远是西方魔幻文化的标杆，冒险(公路)电影的丰碑。
小方方爱小兰兰,4,2018-09-13 06:50:39,,5,感觉有好多小说都跟这个的结构差不多，什么矮人精灵什么的。
拾间集,4,2011-06-15 17:56:06,,0,我并不是个喜欢大片的人~但是这部算是不错的~但是面对大片这个题材~我还是不能说爱~魔幻题材本身就是秀宏观场景和制作感~帅哥美女也就不用说了~还有就是简单干脆的英雄题材~恩就这样..
木叶,3,2012-06-21 18:51:06,,0,邪恶的东西总是自我膨胀，而善良的东西实在脆弱。如果转成3D的效果应该不错的吧
обломов,4,2016-02-22 10:25:34,,1,传说一开始，胖子还没能太把握这个系列的精髓，支线设置的有点乱
宝康,NaN,2021-04-21 19:03:49,,2,一颗星！不能更多了！这种屁股歪了的电影：夏独分子佛罗多等人，伙同境外反洞势力甘道夫，以及封建复辟残渣余孽阿拉贡，对祖国统一大业阴谋破坏，百般阻挠！不要拿我们的瑰宝《西游记》和这种糟粕相提并论，西游记港啥了？伊港的是五个污点基层干部，一路检举揭发，最后考公上位的励志故事！这立意境界谁高谁低，但凡眼睛么瞎的都可以说是一目了然！懂的自然懂，不懂我也不多港了！
Balding,4,2013-01-16 09:25:09,,0,对于连贯故事的三部曲史诗，首部必然要对世界观做一个完整的阐释，而同《黑客帝国》首部曲不同的是，《魔戒再现》叙事显得较平，并没有达到颠覆的效果
蔚カリCassie.,4,2014-04-02 03:31:57,,1,经典的打怪之路~=。=只记得小时候看吓得都睡不着--场面超宏伟啊十多年前这种特效简直震撼哭重看的时候几乎光顾着看开花的脸了orz戏份好少我不高兴！
JiYang🌈,5,2021-04-18 21:43:06,,1,补完电影票重新标记。激光IMAX的效果确实非常好，尤其是声效，摩瑞亚矿坑的那场戏甚至可以明显感到座椅在震颤。4K版应该是重新调过色的，雪山背后的天空蓝得几乎耀眼，整体的色调也更加鲜明。非要挑毛病的话，就是打斗场面连着看下来有点晕，但这不是电影的问题，大概所有片子放上巨幕都是这个效果。12年过去，我已经记不得这是第20次还是第30次重看魔戒了，但神奇的是，几乎每次重温都有新的感动。很同意微博上的一个评论，“优雅、深沉、古典又现代，交织着浪漫主义与毫不夸张的英雄主义”，这就是魔戒最吸引我的地方，那一种早已逝去、消亡的人性光辉在电影中闪闪发亮。我想说的太多，我能说的太少，我学不出托老的语言来赞美这个系列，中土的的确确是我一辈子的精神故乡。
尼 这,3,2021-04-19 15:48:32,,3,指环王已经过时了，每一代人都有自己的青春，不要强迫别人喜欢。
梅文女王殿下,4,2010-12-16 02:49:43,,0,2010.12.14以前看过uncutDVD版，电影院看过2遍，再加上看书，以至于好多台词都记得了。自从修过一点电影课，对镜头拍摄特别挑剔。重温感觉没有当初那么好看了。特别是为了迁就hobbits身材，弄了很多超近摄，看得我很disoriented。
風立ちぬ,5,2012-08-03 15:52:54,,2,对得起“魔幻史诗巨作”这几个字。制作精美，场面浩大，充满魔幻气息，令人难以自拔。奥兰多就像个真正的精灵王子，太迷人了。
米米米妮,4,2012-05-20 19:31:28,,0,电影果然是要在对的时间看对的片，没去电影院看这部我弱爆了……电脑上要画面没画面，要剧情也不大有剧情……论魔幻，魔戒绝对是个中翘楚，我想我小时候肯定很爱看，现在想象力越来越不丰富，每次看到类似的片子都想大喊：berealistic……因为有看前传的打算就补起来了，且看二三部
已注销,3,2010-05-07 16:29:20,,0,两周内把指环王三部曲看完了，场面和特效异常精美，实景和美工各具特色，画面绝对无敌了。但是对人物血肉、战斗惊险以及政治（敌军）险恶的描写只能算是刚刚及格，甚至过于幼稚。倒是山姆和弗罗多之间的感情可圈可点，还算可看
该发财了惠烟烟,5,2021-04-17 20:22:03,,4,垃圾电影毁我青春，二十年了！为什么还是那么好看！！这什么道理啊！！！无论几次看到甘道夫被炎魔吞没都会哭成狗。无论是雄伟壮丽的中土世界，还是善良、勇敢、无畏、正直的高贵品质，这就是最好的电影
TiTi,5,2016-01-17 14:12:42,,1,每当我茫然失措的时候，我都想要看看，哈比人和精灵王的眼睛，明明毫无希望不是吗，明明我们自己都觉得是去送死不是吗，可是为什么却在一步步的前进，一次次磨难，一次次相遇中，看到了爱，善意和希望
开平彭于晏,4,2021-04-17 18:13:49,,6,「指环王1:护戒使者」20210417配乐画面和视效都好棒，居然是二十年前的电影，放现在都不过时，但可能是这类电影越来越多了吧，我也没能感受到有太多震撼，或许说，都是指环王玩儿过的了。
霍小雨,5,2021-04-22 23:24:14,,4,历史成为传奇，传奇成为神话，而神话就从此刻开始。作为三部曲的启航篇，除搭建整个故事的世界观，叙事集中于“护戒同盟”从成立到中途分散的故事，把魔戒蛊惑人心的特性写到极致，则主人公一行不仅在对抗有形力量的进攻，也在面对无形力量的侵蚀，精彩正在继续……
hhhh,2,2021-04-18 13:13:42,,10,人生中第一次看电影看到一半离开了电影院
Sabrina.He,5,2011-01-30 16:12:02,,1,ForGandalf，Gandorandthepeople，forBoromir，forthelittlepeople.
愚人之智,3,2021-04-18 16:59:57,,1,可能我需要看的是加长版except跳过所有打斗戏
镜听,5,2012-11-09 02:16:59,,3,总觉得是从这部片子开始，有了去影院一遍遍刷电影的习惯。当年看着魔多山谷战役中弯刀划过，奥克斯纷纷坠下绝壁的场景真是目眩神迷，日后的3DIMAX都不会让我有那样的惊奇之感……
严冬,5,2020-01-27 23:29:31,,0,豆瓣TOP250补标。228分钟版本。大约十年前甚至更久些，c6会在农历新年敲钟后播放《指环王》，我在二姑家报纸的电视节目预告里看到的。那时刚刚晓得守岁这个概念，孩子嘛，你懂的，新鲜玩意儿当宝贝。虽然记忆里从未在敲钟后看过一集完整的lordoftherings，也从未完整地守过一岁（夜），两者的粘连却从此而生，相伴相携，成为我一个人的年夜饭。这是故事。影片嘛，相当克制，价值有厚度且较纯净，虽立足西方神话及价值观，这一段魔幻史诗对现实的映照与启示却一点也不小器。
谭香山,NaN,2019-04-27 05:32:55,,4,好看！但甘道夫一个法师为什么整天肉搏？？？
小天狼星,NaN,2023-08-24 09:09:31,中国澳门,0,boromir死的时候比甘道夫掉下去还令我凄然他是最勇敢的战士不比霍比特人那纯白的灵魂他在心魔与正道前选择了守卫就像甘道夫说的“人在遇到困难的时候所能做的就是抉择”刚铎的号角响了它在唤你回家😭（精灵王子好帅！！！他咬一小口精灵口粮就能饱一天霍比特人吃了四大块顺带放了个屁…）
缘三,5,2010-10-15 21:01:32,,1,698。凡是带有魔性的东西，必定有人为其疯狂，有人为其疯狂，必定有人为其死亡。虽然依旧记不住九位主角的名字，但足足三个小时，几乎没有多余，梦幻的背景，宏大的场面，过程中雄壮的音乐，甘道夫死后悲壮的音乐，结尾美轮美奂的音乐，引人入胜，让人无法拒绝续集。
