user_name,star,comment_time,geo_ip,vote,short
Doreen,4,2017-09-13 15:23:08,,1,没有文字那么让人撕心裂肺，还原度十有八九吧。其实福贵的一生多多少少都有那个年代普遍大众的缩影，所以可想而知当年活着就是最好的宿命了。友庆和凤霞的离世让我久久不能平静，没想到余华的文字有如此强大的力量！另外电影的选角很成功，演员都很出彩
琪琪珂,5,2021-03-15 15:22:20,,21,和原著相比克制许多，不过几处改编倒是很别出心裁。活着本不就是痛苦与喜悦并存的吗？
Jokery,4,2010-06-13 23:06:26,,1,很喜欢葛优背儿子上学那个长镜头，张艺谋看看你老早拍的电影，再看看你最近几年拍的电影，赶紧早点回家吃饭。
Hey Johnny,5,2009-07-18 16:10:47,,1,已经相对原著做了些许妥协，但还是令人感慨人生无常，活着艰难，尤其在特定时代。但就像福贵说的“回去了，就得好好活着……”
Timon,5,2009-09-23 14:27:14,,0,一直感觉是中国内地最好的电影，我看过小说再看的电影，只能说老谋子还是有一定功底的。原著小说还是要好些。本片根据余华同名原著小说改编，以贴近生活的小人物通俗剧风格反映数十年来中国老百姓“好死不如赖活着”的生活观。
Y.15,4,2011-10-29 15:34:46,,2,虽然最后结局和书里的不一样但好歹没让人觉得和书里那么绝望我是觉得踏踏实实活着总归也是一种幸福甭管发生了什么葛优真是瘦浑身上下的精瘦肉这是我唯一觉得巩俐演技还不错的一个电影最后凤霞死的时候我突然想到我妈刚才给我打电话说你要是死了妈也没活头了==（为什么会想到这个啊
村长,3,2014-01-12 00:56:09,,5,我老在那儿点人头，想着死光了电影就完了，居然剩了俩。最不可饶恕的是有庆居然是被压死的。
小米=qdmimi,4,2015-11-04 13:02:20,,6,片子是费心拍出来的好片，只能说原作就不适合直接影像化
kerrysun,5,2012-08-31 12:00:59,,0,从电影里看出人生的无奈。在时代的洪流中，人的力量是如此渺小；在命运的安排下，逆天改命是痴人说梦。我们只能卑微的活着，没有任何选择的余地。这是底层人的悲哀，无人能改变的事实。
helloliu,5,2016-11-17 04:20:36,,5,好的电影一下子就把我带入那个曾经的时代，让我感叹人物的命运是跟随时代的命运的，人生起起伏伏，就是一个时代的缩影。我们每一个人，都在努力生活，经历生死离别。珍惜眼前的美好生活，热爱我们的祖国，如果他还不够好，就做出哪怕一点点的改变。
Morning,5,2014-10-20 15:48:57,,6,这几天，每天刷一小段，每天都觉得拍得真好，怎么这么会拍。
瞳,4,2012-04-17 18:38:35,,4,“小鸡长大了就变成了鹅，鹅长大了就变成了羊，羊长大了就变成了牛，牛长大了就是共产主义了。”这就是为什么大多数人还能这样安然地活着，活在中国。
fatlipsoul,5,2008-06-09 15:04:33,,0,之前憑著高中時看過得印象給了四顆星，今天看完我決定名正言順的給他五顆星，片名切題非常，很表象，也很抽象，多個層面，多種生命的樣貌，合出一個時代，卻永遠類似的戲，活著，難道跟你說活著苦多於樂，你就不想活了嗎?-2018是我最喜歡的十部電影之一但不會是我覺得最好的十部電影因為這部電影好的部分小說實在佔的比重大以至於他電影的好其實已經扣除了很多
大魔王,5,2011-03-22 01:16:47,,3,凄凄惨惨...虽然没有余华书表达的那么具体那么有深度，但是那种那个时代的荒谬，种种无奈，隔阂。让人无比动容，黄土高坡上，时代环境再怎么整你，也应该好好的活着。或许这是我们这代人，永远无法理解的无奈，但是在这个伟大的时代，好好活着，好好的做自己认为对的事，不枉此生啊！
慕詩,5,2017-05-08 09:36:36,,9,活着比什么都重要！
蒜了,4,2021-08-12 09:52:44,,1,看之前期望太高了……………想了想，功劳基本都归余华，唯一被电影抓住的，只有小、中、大三个凤霞的笑容。由于主题完成度不够，原本比《霸王别姬》更加深刻的题材被囫囵吞了下去，过舌而不知味，甚至不如有些用力过猛的《斗牛》。有些可惜错过了孟京辉的话剧啊。@2016-01-1403:17:55
传说,3,2006-04-04 19:47:24,,1,又名:ToLive导演:张艺谋(YimouZhang)主演:葛优(YouGe)/巩俐(LiGong)制片国家/地区:中国上映年度:1994语言:中文（普通话)imdb链接:tt0110081
东学西读,5,2010-10-29 08:31:17,,0,当我们徘徊在生死之间的时候，终于发现平安活着是一种幸福，没有时代的弄潮儿，没冲在前面的突击队，只求安稳的做好自己，过好自己的日子。真的是时候踏实下来，认真对待自己的生活了。
大头绿豆,4,2020-09-02 15:18:34,,7,最悲凉的莫过于，我在其中体会到了巨大的痛楚，但同时心里不断地被提醒着：与真实的苦难相比，这种程度的痛苦其实已经被或主观或客观地美化了。等了很久有庆赤脚跑来的镜头，「月光照在路上，像是撒满了盐」，没有等到。这才意识到，不去对照记忆中的原作，完全用新的眼光来评价的话，这也已经是一个非常高难度却完成得特别出色的作品了。
不是方先生,5,2010-02-10 23:35:20,,1,即使有人嫌张把它拍窄了拍进了政治的小框框里那也只是和原著比电影仍有可观何况它借钻进此框来搔国外评委的痒处你却可以自由出处于它看框里的它连带看见框外的世界于此这电影不失为一个标本除让你知道那个时代一个人如何活着还能看另一个时代电影/影人如何活
Andrea,5,2017-11-08 12:12:59,,2,苦命就能说明一切吗？我不会认同这样含糊其辞把责任抛出去的说法，有些事看似每个人都没有错，只是一环扣一环不知怎样就发生了，所谓的没有人错其实意味着每个人都错了。时代一定是在进步的，每个时代又有着自己独特的问题，多思考多做事，没有人谈什么命运不命运的时候人们才真正的向幸福迈进。
Captain_C,5,2022-06-06 23:56:56,,1,活下去，像牲口一样活下去。（还是更爱《芙蓉镇》）
迪奥,5,2008-08-19 19:07:32,,0,剧本太好，故事太好，导演的作用就小了很多，老谋子的作品，前后都无法超越这个。以后也不会再超越了。
小肥啾～,5,2010-04-26 18:28:09,,0,真的是让人震撼的一部电影！！！也许是原著本身的优秀，但是能够改编成这么出彩的电影，说明老谋子还是功力深厚的
Greenfall,5,2013-01-16 00:19:39,,0,老谋子还有这样的岁月，再看看现在的老谋子真是堕落坏了啊。。。虽然没看过原著，不过片子不错，演得也真是好。至于成了禁片，不正面地讲了这么多近几十年的历史，也不足为奇了。不靠帅哥美女卖肉也能讲好故事的片子都是好片子。
曼靑,3,2012-08-07 00:25:35,,2,張藝謀很喜歡翻拍名著也很會拍可惜妥協了那麼多仍未能公映。大到結局殘缺卻溫馨的三代同堂團圓飯小到福貴輸掉家産的數量幾乎原著里能夠改動的細節都被改動了但是故事照樣能照著一個目的地走並且比原著多添了幾分阿Q精神的姿色。
原木,5,2012-09-03 10:33:04,,0,值得赞扬的地方不用多说了。我觉得缺点在于，电影批判的角度还是略为刻意了一些，因此意境也就低了一些。
时光小偷,1,2014-06-01 21:37:43,,14,不知道是不是被禁的原因，使得片子的分数十分爆炸。但是抛开禁片的因素来看，片子里面的文革题材一点都不爆炸，打开维基的文革词条看看，这部电影其实并没有特别的题材限制突破，比这部电影批判文革更甚的电影实际上有不少。不知道是不是因为禁片的缘故导致这部电影被豆瓣推到如此高的地位。其实《活着》的原著，但从故事角度来说是一个挺SIMPLE的故事，就是一个地主最后全家死光的故事。写的比这个故事惨的电影实际上也是很多的，这些都并不能成为《活着》成为名著的原因。原著更多依靠的还是那种非传统叙述模式，可以更好的契合主题，这种模式的影像化，在《活着》的电视剧版《福贵》中反而能体会出来一些，这也使得实际上《福贵》是更接近原著。张艺谋的这个版本完全放弃了原著的叙述模式，而使用了原著特别不出彩的故事，完全不好看。
煮蓝,3,2013-09-15 16:54:30,,2,看之前又特意读了一遍小说，最终观感：书并非好书，电影也并非好电影。福贵从部队里面回来，在黑漆漆的街道上握住家珍的手，打翻的水壶流出汩汩热水。春生连夜来又连夜走，家珍在后面喊道你还欠我们家一条命，春生在光里面停了停脚，又继续往黑暗里去了。——人生是为了什么，才有这样凄凉的夜。
眼圈,4,2012-01-23 21:44:59,,0,原著和电影都很好看电影比小说多了温情和黑色幽默的一面小说比电影更加深刻悲凉不错老谋子年轻的时代
即短又平,5,2012-06-17 22:39:11,,2,特有天朝特色的一电影，不管是在哪个年代，活着也许是中国人唯一的信仰，无论是战乱，还是文革，到如今，14亿人口面对无论怎么样的困境，遭遇，都带着鸡变鹅。。。日子越来越好的希望苟活着罢了
Maggie啊啊啊,4,2011-04-21 00:34:22,,1,小鸡长大了就变成了鹅，鹅长大了就变成了羊，羊长大了就变成了牛，牛长大了就是共产主义了
冰山李,4,2011-01-18 23:20:40,,0,7.8；就困在那裡，不知道是不是導演刻意
###疼,5,2011-11-13 00:26:01,,2,只要还有家人，就有活着的意义，只要活着就有故事，活着就是最好的心意!!~~~~鸡长大之后就是鹅，鹅长大之后就是羊，羊长大之后就是牛，牛你长大之后呢?---------张艺谋电影!!!葛优巩俐，演技无可挑剔，演绎着福贵家珍两个充满了灵魂的人物.，一个愚昧.一个守旧，但默默地坚持活着是对那个时候的赤裸裸的讽刺
红男,4,2009-07-28 10:08:50,,0,书看过，电影也看过，还都不止一遍，每次都习惯性的对照，这大概会影响到客观判断。《活着》这么大牌的一个禁片，豆瓣已经有很多相当深刻的评论了，我只想说，好电影，实在是离不开一个好编剧，当然，本片有两个，呵呵，数量大也是优势嘛。
takyo,4,2021-05-01 22:32:10,,0,小时候我叔叔有不少电影vcd我时不时过去挑着看这部电影我应该拿起又放下很多次虽然只有几岁我都能感觉到太沉重了今天终于看完了这部恨不得20年前就有几面之缘的电影非常戏剧几处也很催人泪下可是我印象最深的不是福贵的那个鸡变成鹅的台词也不是几处命运弄人的无力而是电影四次拍摄的那个白石牌坊每次时代更迭那个牌坊都会出现有时候福贵在里面有时候不在仿佛在提醒我虽然这是福贵的电影导演真正想致意的却是那些经历了一样的造化弄人却连名字都不被任何人知晓的小人物其他那些在牌楼下走过的人
百因必有果,4,2017-10-26 12:02:54,,7,更喜欢这个结局，凤霞那一段真是太讽刺，太难接受了。
阴毛湿王,5,2009-04-05 13:51:09,,0,或许老谋子再也拍不出那么好的电影了此片过于真实我几乎找不到一点bugs压抑恐慌的大时代下带着温情幽默与对荒诞现实的调侃让我又重新开始思考活着到底是为了什么人本能的求生欲在极度艰难痛苦饥饿的环境下会选择卑微平庸的活着潜意识觉得活着就会有希望其实有很多时候活着就是遭罪死了又不甘心人类过了几个世纪很多人依旧是活着而且仅仅只是活着而已或许对我们来说活着就是一切存在即合理
Carla,4,2009-05-30 09:39:44,,0,我没看过余华的活着原著，但我看到张艺谋导演的编剧，政治历史的电影，堪称经典，起码我被那个时代所感动了..
24city,4,2014-04-16 19:37:03,,0,有很多情节和冲突是稍显刻意的，不过情感到位，倒也可以忽略，而在背景上，其实只是如实还原，并没有夹杂过多的情绪，并不会对人产生什么思想的引导性，被禁之说与内容关系不大。从结尾温情的长镜头可以看到，更多的还是在传递一种希望，大背景只是个渲染作用。
雲苍白浅影长,4,2010-10-15 15:24:57,,1,“小鸡长大了就变成了鹅，鹅长大了就变成了羊，羊长大了就变成了牛，牛长大了就是共产主义了。”虽然是现实题材的电影，比起小说来太温情了，实在看不出有什么可遭禁的。.
t.,5,2012-10-28 17:07:55,,1,迄今为止看的最好看的国产电影了，虽然不能公映，但不能阻止它成为经典，鸡长大了就变成了鹅，鹅长大了就变成了羊，羊长大了就变成了牛。不管是对儿子说还是外孙说，相隔了几十年，能做的也还是活着
小美人鱼,4,2011-12-24 15:36:37,,1,让你说不上来，就好像什么能不想说。因为没有人能将这样的人生与背景说得确切。
Y2K-nostalgia,3,2010-04-11 18:06:17,,7,张艺谋的这一部缺少对电影艺术本体的自觉，正如余华的小说在自己写作序列中也显得做作一样。把《活着》当成张艺谋的代表作，这显然是愚蠢的。
旺财sindy,3,2010-04-19 15:25:20,,2,感觉没有小说来的精彩~个人觉得最出彩的是龙二被拉上大街游行时，福贵受惊吓的那段。
D-Boy1900,4,2012-09-05 22:48:57,,0,如此温馨的结局，倒也理解，就权当是一场镜花水月吧。要是完全按照原著来拍，恐怕很少会有人能承受的住，这生命的张力。
Azeril,5,2014-01-12 22:29:37,,2,“人是為活著本身而活著的而不是為活著之外的任何事物所活著。”本片貴在對於過往的幾個時代的敘事雖然輕描勾畫依然見得幾分蒼莽之外的細膩。要將小說的慘烈揮灑到鏡頭之上的確也不忍。結局朝著陽光戛然而止雖然迥異卻也心念這般的尋常尋常多好哪怕有困境多少帶盼頭。
嗑樂貓,3,2012-08-18 22:33:43,,0,《霸王别姬》既视感，均是用一项手艺做线索的时代素描。不同的是一个悲剧一个喜剧，与其说这是部喜剧不如说剧本过于温和，此外《霸》的时代跨度更大。
流光溢彩`,5,2015-09-02 21:41:33,,0,“咱们可得活着回去啊！”、“回去了可得好好活啊……”每当你觉得生活终于要变好的时候，它就这么毫无征兆的给你一下，满怀希望时突然的大悲，是那么真实，真实的那么残忍。两位国内艺术界的巨匠，最好的余华碰上最好的张艺谋。巩俐好，简单一笑全是戏，葛优好，人生百态大浓缩。春生，镇长，二喜这些配角个个鲜活立体。结尾还是温暖了，没有像原著一样写的只剩一人一牛。对那个年代的刻画也是细致入微。个人崇拜，小鬼当家……那段动荡的历史确实太适合拍出这样的史诗片了，想想这些年来制度扼杀了多少佳作。
123456昵称,5,2017-03-30 22:52:43,,10,张导导的文艺片就是好。
韦恩斯坦_李,5,2008-03-14 15:49:42,,1,这是整整一部中国的近现代史啊，国家几度浮沉，人生几度秋凉，看完让人禁不住的抹泪和感慨。。。
sabrina,5,2011-01-26 17:46:08,,0,活着这两个字最简单也最沉重！那样动荡的年代，他们最大的幸福却只是能活着，哪怕苟延残喘，哪怕草木皆兵！人活着就好啊～～～～
Insommniac,5,2014-05-19 22:36:36,,1,《歸來》之後重溫了一遍《活著》，再次深深震撼。人啊，真得活得像個人，可不能像畜生，也不能跟家禽似的。你得知道，他們養著你，讓你吃飽穿暖不過是為了最終奴役和剝削你。獲得表面行為自由的代價是靈魂永不能逃離桎梏，你還樂在其中。仰望是因為你跪著，站直了就平等了。不要“活著”，要“生活”。
瓦力,4,2020-02-29 07:11:11,,2,解放前闯的祸成了解放后能活着的“福”，被时代推着活着，顺从的活着。小鸡放进老木箱是个很耐琢磨的隐喻。
HOHO,5,2010-11-25 21:41:55,,1,真正能够抓住人心的电影，说好看真是无法表现出看完后那种感觉。强烈地激起了我阅读原著小说的欲望。PS：真喜欢那时候的巩俐，演技真是入木三分。PSS：看完张艺谋如此完美的作品，再回头看什么黄金甲山楂树之类的，真是让人心酸。PSSS：相见恨晚，现在才看到这么好看的电影。
墨息墨息,5,2015-05-01 04:13:12,,6,余华作品的死亡率奇高，且非常残酷，轻描淡写，简直是宇宙视角在写人的存亡。电影更多表现细节和人在困境下的一种“盼头”意志。葛优真不错。
小饺卷,5,2012-05-06 19:19:10,,1,一个时代的悲哀淋漓尽致。看完真的只想爆粗口！现实社会这种悲哀还在继续，什么时候是个头啊！葛大爷演的真好。
炭烧八爪鱼,4,2014-04-28 20:11:18,,1,电影鉴赏选修课上看的，确实好看，看来还是要稍微揭底才有“看点”，那几段特殊历史时期的事儿真够讽刺的。整体演员表演都很棒，小凤霞看着真心疼。
默默仔是呆萌仔,5,2011-07-25 00:27:22,,1,只为应今天这样的景。再翻出来看着早年的片儿。无论生活如何，无论发生什么，最重要的是好好的活着。
猫,5,2011-10-02 19:00:03,,1,是部好片张艺谋再也不能拍出这种片子了原因是电审剧情没废话，看现在的国产，都是些废话拖时间都是拜xx所赐，吾皇万岁万万岁
那山那云那月,4,2011-08-07 17:36:50,,1,张艺谋最好的一部。获戛纳国际电影节评委会奖和男演员奖。根据余华小说改编，表现人在极端艰难的生存环境下可悲的顽强和坚韧，因诋毁社会主义法制，诋毁政党执政能力，迄今不能公映。
潇洒哥,5,2011-10-26 20:47:45,,2,“这钢铁能够造三颗炮弹，全都打到台湾去，一颗打在蒋介石的床上，一颗打在蒋介石的桌上，还有一颗打在蒋介石的茅坑里，让他睡不成觉，吃不成饭，还拉不了屎，台湾就解放了。”一部让人含着眼泪与辛酸而又忍禁不俊看完的电影，不愧为老谋子的巅峰之作吧~
Memoricry,4,2012-12-09 19:18:45,,0,老婆，今天下午我在宿舍看的，嗯，因为之前看过小说，所以在看电影的时候总是在对比小说，感觉没有小说批判性强烈，不过也还是拍出了一些东西，嗯，看的时候在想，或许再看一遍小说吧，嗯……老婆，抱抱！我想你了……
united-ac,3,2012-02-16 10:21:07,,0,即使套上大时代的外衣，主人公近乎一生的悲剧也仅仅是个体性的。---这是电影告诉我们的，找泪点、找骂点、找隐喻、批“《活着》后”的老谋子，都是属于意淫过度。（另外，1.葛优的唱腔让人眼前一亮。2.房子没了那段才是电影的高潮）
yuyikurt,5,2015-08-29 19:41:02,,1,心酸心碎的故事。同样是讲历经几十年的沧桑变故，对比霸王别姬，这部片子更着重于普通小百姓的磨难，而经历的惨痛更无以复加得令人心痛和无奈。目前个人最佳国产片前三。
菠萝蜜个隆冬强,5,2013-07-02 12:39:21,,0,活着，是为了更好的活着。走过了内战，迎来了大跃进，再到红卫兵，当时中国人民对毛主席的情结已经达到了一种病态。也许那时候的日子就是这样简简单单，在悲痛中过渡自己的人生，在口号中跟紧他人的脚步，看到富贵唱戏很容易让人想起霸王别姬，其实他们的命运都是一样被安排，只是富贵选择了活下去
阿罗海,4,2018-04-01 11:09:07,,5,葛优和巩俐的演技真的好！演出了沧桑的人生
豆友149131135,5,2018-06-02 10:54:38,,5,张艺谋导演的经典电影，中国式的黑色幽默片，葛优和巩俐的完美演绎，成功塑造了那个年代小人物的悲欢离合。
轩煜,4,2011-04-14 22:42:50,,0,没有很好的阐明“活着”深刻的含义，而仅仅浮于表面，两个孩子的死也过于戏剧化，与原著比起来想去深远，而老谋子的选择海外投资也是别有一番意义
viking,5,2007-11-24 11:57:34,,0,幸福总是短暂的一瞬间，改编的不错，葛优的演技真的牛逼，曾经的张艺谋和巩俐也都很牛逼
mahoo,5,2008-09-14 13:35:48,,0,"2008.8.8.17:11...和Lidia一起看的.第五遍.从中又懂得很多.想起了好多事儿.虽然是94年的片.但现在看还是那么牛逼.真实.感动.旧时人们的单纯与无知.一直都记得""牛以后.就是共产主义了""..."
大萌,5,2017-12-20 19:16:40,,4,我爸真是有病，六岁带我去看《摇啊摇摇到外婆桥》，再就是在家里反反复复放《活着》……
梁膩膩,5,2009-10-08 12:44:31,,0,看了小説后，相比這部電影的結局，讓我感到釋然，電影的結局是兩老一小還有一個女婿，就這麽活著，而小説最後就剩一個老頭那悲慘的結局，每次想到都讓人難過.或許電影想要詮釋的活著，就是在一波又一波的經歷后，還有餘下的小幸福，知足地活著.
fefe,4,2008-10-12 20:27:35,,0,获戛纳国际电影节评委会奖和男演员奖。根据余华小说改编，表现人在极端艰难的生存环境下可悲的顽强和坚韧，因诋毁社会主义法制，诋毁政党执政能力，迄今不能公映。
少年派的崛起,5,2013-09-24 15:43:06,,1,影片以皮影为线索通过讲述旧社会一个家庭的悲欢离合，展现了新中国建国初期大跃进的那段历史批判了当时的制度，张艺谋最好的电影，一个人的悲剧也是社会的悲剧
马普尔老姐,4,2010-04-27 20:50:11,,0,真的是太苦了……张艺谋企图的冷感最后还是把情感代入。但真是很棒的作品。
马克兔温,5,2013-03-12 15:19:56,,1,鸡长大了就变成了鹅，鹅长大了就变成了羊，羊长大了就变成了牛
Minta,5,2014-10-20 20:30:56,,5,改编自余华同名小说，国师的片子里个人最喜欢的一部。电影改编了不少，包括结局，总的来说，少了原著满篇弥漫的生活的惨烈，不过就这样赖活着不惨烈也悲惨吧？国师的改编有很多不得不为之的考虑（可惜还是被禁映），不过，改动后的故事仍然讲得很好。
彦夕,4,2007-10-23 21:50:31,,0,蛮有喜感的一名作，女朋友之前看过一遍，这次看的时候一直抱怨结局改的太多，力度缺失.果然还是逃不出改编电影的宿命吧.不过但从影片来看还是张导的上乘之作.
loneLY,5,2010-09-18 19:42:05,,0,张艺谋前期拍的片子真不是盖得。这个题材的还有《芙蓉镇》反正都是文革那些事。想想那时摧残了多少人啊。不过福贵也真是个爷们儿，知错能改。我真的很喜欢以前的巩俐大姐！！PS觉得姜武比姜文的演技好一万倍！！
JASON.WEN.,5,2011-12-13 21:10:53,,0,多么有力度的片子!残酷的太像现实。社会主义社会中越被封杀的电影就一定越是好的片子。《活着》无疑是国产电影登峰造极的表现。这可惜此时的张艺谋已非彼时的张艺谋了
噩梦枕头,5,2016-02-12 21:12:06,,2,在时代风暴的撕扯之下，每个人都犹如风筝一般无助。被扭曲的人性，造就了黑色幽默一般却又无比真实的存在。那些经历了非理性年代的人们，光是活着就已经拼尽全力了。
黑川小百合,NaN,2010-04-05 22:57:28,,0,发生的事太他妈的荒唐了。葛大爷有点过，巩俐不错，小凤霞笑的真好看，我真的以为有庆会长成一个小混蛋呢，姜武我爱你们两兄弟阿阿阿…看得我难受不知道评几分的片子恩
Bill,5,2010-09-22 23:13:05,,0,小人物的史诗片，真正的“以小见大”。年代的跨度加上众多人物的倾力演出，成就了张艺谋的艺术颠峰。生活就是一部愈加沧桑的年代剧。
Eskimoan,5,2008-03-09 08:50:00,,0,作为一个二十出头的无名角色，我很难说自己对那段历史会有什么明确的判断。但是，当你丢下一切看似沉重的负担，活着，才是最重要的。其实这就是张艺谋的道路，或许理解张之后对商业化的执著。
猫苦艾。,5,2014-05-13 16:13:52,,0,人还活着的理由不是因为他想或与否，只是因为时机未到，一切都是天注定，人难以拥有自我。
甦醒 Nostalgia,4,2020-01-02 09:23:58,,0,每一次悲剧发生富贵都自责是自己原因，但究其根本都是当属那个时代。如果不输光房子，全家都要倒霉，这是荒诞。孩子累的睡不着觉还有去讨好区长，这是低微。凤霞大出血死去，没有医生能救这是悲哀。而这一切的悲剧都是时代导致的，人在此之下不过如皮影。自然在这个语境下电影不能刻意的批判太多，用极其生活化的场景勾连起每一部分内容，富贵夫妇的一生就是中国大部分劳苦群众的缩影，善良但却无能为力，所以活着就是一个最存底的现实。私以为这是国内最好的家庭片了，因为他做到了包含着的时代的印记，不仅仅是家庭的变迁也是时代的转变，张艺谋用最简单的手法拍出最诚挚的情感，这是在成为国师之前最好的张艺谋了。
