user_name,star,comment_time,geo_ip,vote,short
Comel,4,2012-02-12 04:42:36,,0,我总是情不自禁地跟小说对比。其实剧本改编得不错，老谋子的镜头也相当有张力，几个画面就可以表达许多内容，部分蒙太奇的使用也渲染得很棒。不过由于浓缩，剧情氛围的渲染及过渡都做得不够，故事本身之外的隐喻也做了妥协做了修改或删减而没做得更好，不过医院部分拍得很棒，结尾更是意味深长。
戴泰德,5,2011-05-09 20:49:05,,0,当初看余华的这本书就看得眼泪停不住，电影更是直截地冲击着泪点。
Mia,5,2010-05-20 10:57:08,,0,小说-活着有时什么都不为，就为了活着。活着本身就是种强大的屈服又不屈辱的力量。电影-命运多舛，只要有相互扶持的温暖。原作更具令人震撼的张力。加的一星给葛优。尤其开始的演技。
帕布莉卡,5,2012-01-28 19:31:51,,4,其实要谢谢电影手下留情，在极度压抑苦闷中还残存希望。
十一伏特,5,2013-09-25 18:32:15,,0,明明是足以令人悲叹的生活，却又时时透着一种淡淡的讥讽，就好像是站在远处抱着手冷眼旁观、嘴角向上弯起带着无奈的笑意。舒缓的叙事节奏更加冲淡了一切，伏笔插得足够明显，时而转折得又显陡峭。饰演凤霞的几位小演员扮相都特别可爱。（2021年重看，咂摸出不一样的滋味了，能苦中作乐，坚持活着就已经很不容易了。）
🌵🌵,4,2015-07-11 00:11:33,,2,鸡长大了变成鹅鹅长大了变成羊羊长大了变成牛。。。日子会变得越来越好
刘虫虫,5,2011-11-27 19:04:14,,0,说实话，最不喜欢看的就是解放到文革背景的东西，余华的书看了很多每次都说不清道不明的各应。凤霞结婚我就猜她的难产死哎。。。最揪心不是看一个小人物悲惨的死了，而是看的活着经历了所有的悲惨，真揪心。。。
Table,5,2014-10-07 21:35:30,,1,谁说中国没有黑色幽默那时中国人生活中的每一出都是戏谑
小麦,4,2010-08-31 15:27:47,,0,鸡长大了变成鹅；鹅大了羊；羊大了是牛；那牛大了呢？牛大了是共产主义了。。。
没心没肺.,3,2021-08-18 11:28:24,,4,我太不喜欢这样的改编了。读过原著再来看电影我迟迟进不去电影所营造的境地，削减太多无法突出悲剧的批判性。这等情节也能称为禁片我属实没想到的，起先以为按照原著那般走向那笃定是禁片了，可没想到把贫苦家庭上升成能自给自足还会一手皮影戏的普通家庭，那年代能有自行车和能拍照能穷苦吗？并不能，所以当悲剧一次次发生在富贵一家的头上时候，并不如原著那般令人痛心。更令人可惜的是对凤霞与有庆的塑造并不够充实，那般听话懂事又能理解父母的特质并没有彰显得到，在原文我最深刻的就是有庆那股善良的心，每天为了给羊喂食，都跑着去学校。至于凤霞，并不是聋哑了，只是哑了，想起她这位面容姣好本该是大户人家的孩子，却每天下地给家里干活，吃不上饭唯值得称道的就是医院那一改编的相当完美，批判文革的同时合理了凤霞的死因。
颜颜,5,2010-07-15 06:45:14,,0,先看的电影后在杂志上看的书　　小学看的　仍然觉得是好片子　福贵他在女儿坟前关于馒头的一段讨论。。听的我真是。。唉。。
锐...,5,2011-02-07 18:58:14,,0,蝼蚁尚且偷生，有什么过不去的坎。“春生，你记着，你还欠我们家一条命呢，你得好好活着。”
七里八里,4,2009-11-12 00:52:13,,0,为什么这片子我不能给五颗星……我也不清楚，有时候你看一本书觉得好，可能就是那么一句话打动了你，我不觉得能有整本书所有的字都能让人觉得感动的，所以这部电影就是少了那么一句话让我觉得这片子妙，就是这样。不过也许这也正好应了这个名字。
霁然,5,2010-01-26 20:58:55,,0,余华的小说成就了张艺谋的神作，葛优与巩俐的演技在此片中才真正体现出来，基本上在我心中和凯歌的《霸王别姬》一样，让我遗憾为什么就没有此类神作再现，随谈也清楚一些不能说太细的原因
叉叉小箭猪,5,2010-01-11 09:15:16,,0,不管这部电影多么靠余华原著的烘托，作品本身终归是非常好的
L.C.,5,2020-10-15 13:38:06,,2,把文革时期以最轻松的方式带过了，却还是能感到那种荒唐和压抑。拍历史这三十年把握好度挺不容易的。倪大红差点没认出来，巩俐演技自然真挚，郭涛和现在比也很有惊喜。最难得的还是建国三十年历史的众生相，结婚名场面简直开眼了，这以后就是活生生的历史资料，真希望他们这一代导演多拍这时期历史内容，等他们这代百年以后，可就没人能拍那段历史这么真实了。
庹博雅,5,2011-02-09 08:51:22,,0,年轻的时候太瘦了，还是老了好。。。老一辈都活着，小的们都死了
白鲸,3,2018-08-09 18:15:11,,1,创作这部电影的故事本身就是一部现实主义作品吧，虽然删改了很多，但张艺谋拍出了原著里人对于时代浪潮的无力与顺从的窒息感，能看得出很多桥段里妥协的影子，但大部分情节设置还是神来之笔，比如龙二被押送刑场与福贵擦肩而过喊了些什么。德西卡新现实主义在中国最好的一部继承者。
易先先森,5,2011-07-02 15:42:15,,0,非常质朴。一股股的乡土气息。张艺谋还是以前拍的电影好。还是更喜欢原著。葛大爷等几个演员演的小人物，很神。
萌发奇想,4,2017-10-01 21:44:56,,0,电影有很多改动，结尾没有像原作那样残酷，除了福贵，家珍、苦根（馒头）、还有那个深爱凤霞的男人都还活着，降低了悲剧性给予了一种希望，但又缺乏原作的深刻和冲击力！我觉得最棒的改动是凤霞生孩子那块，讽刺的力度更大更令人唏嘘。
半袖,3,2009-06-28 01:56:34,,1,又是公车上IPOD间歇性观影的产物，，评分可能有失偏颇。只觉得演的还好，但是跨度太大，太长了（不知道是不是我看了几个月的缘故，也连累觉得片子长了）。《蓝风筝》也给我这种感觉，年代一拖得长，就好像每段都不够突出了。
L'automne,3,2011-01-09 03:41:33,,0,我没看完。我记得小说很Boring，我是耐着性子看完的。这个故事会不会编得有点离谱，所有不幸都集中在一个人物的身上，反而有点脱离现实的感觉吧。
Laura,5,2012-02-28 00:33:55,,1,谢谢编剧导演合理的篡改了原著没让大家看着电影就心如死灰，余华太狠了。当年三十几岁的葛优和二十多岁的巩俐，现在看也是万里挑一。
我头像超萌,5,2018-06-11 09:46:02,,6,很讽刺很悲惨的电影，时代弄人。
斑斑,5,2011-02-16 12:55:36,,0,很早以前看的电影，看电影前看过余华的原著，电影的情节有所保留，小说更为绝惨
空白格,5,2014-01-14 20:01:52,,0,近代新中国千千万万悲惨家庭中还算幸福的一个。看完之后，心中矛头直指毛泽东的错误领导，这样想的原因，应该是因为我的无知而看不到他的伟大和贡献。
已注销,5,2012-04-01 21:41:52,,1,对小说的记忆已经很模糊了，可是明显感觉到种种差别，感觉真真是改编啊。其实挺喜欢的，可是真不喜欢让人发笑的桥段和结尾。嘛，死也要活下去o(≧v≦)o~
Zeki,4,2011-05-31 01:10:54,,0,意想不到的充满希望的结局，整个基调似乎也不像原作那么痛苦了，虽然也充满了辛酸，但生命中难得的温暖依旧支撑着人们，好好地活着！
阿Q,5,2012-07-20 04:22:03,,0,大炼钢铁，三年自然灾害，文化大革命，人性在那个疯狂的年代被疯狂的挤压。虽未曾亲历那如“人吃人”的旧社会，但透过镜头仍旧看的瑟瑟发抖。#《霸王别姬》《活着》《蓝风筝》《芙蓉镇》《阳光灿烂的日子》《太阳照常升起》#
老猫卡,5,2011-05-05 23:20:22,,0,啥也不说必须满分小说就很喜欢电影拍的有滋有味那时候的老谋子不一般啊
Daniel,5,2009-02-05 22:24:34,,0,生，容易；活，容易；生活，不容易。看了之后我觉得，生和活，也都不容易。张艺谋，巩俐，葛优，我向你们致敬。
螺丝இ,5,2012-07-01 04:16:59,,0,有时候活着真不如死了，跟导演本人一样，跟这部电影本身一样，愈是妥协便愈是卑微。20年前的葛大爷就浑身是戏！
屎霸,5,2011-11-11 16:18:30,,0,改编了小说中前期的故事最后的长镜头使影片没有过于凄凉之感就小说改编的电影来说算是一流的也的确很会抓住原著的重点张艺谋也在里面加入得一看了较多自己对当时社会的想法葛优前段表现优异后段略显平庸但这部的巩俐无疑给自己定下了一个以后基本无法逾越的高峰
STAYREAL,5,2022-09-29 22:44:39,北京,1,《活着》，我看英译是《ToLive》，结合这个翻译理解，我觉得活着不是指一种活着的状态，而是在苦难下仍坚韧地去活着的目标方向，不是麻木苟活，而是具有韧性地挺直腰杆，向前看，一步一步走。这部电影算是全网下架吧，毕竟资源都很难找。因为涉及的历史元素多而沉重，其实福贵的两个孩子都是在历史洪流的裹挟下，无助地被卷走，而福贵夫妇身在其中观望，只能伸出手盲目徒劳地抓着。看完之后想说：①福贵的妻子应该算是最刻板最模范的中华民族宜室宜家的妻子了吧，一辈子都在操劳，但绝对任劳任怨；②生孩子绝对不是吸气呼气用力的流畅过程，每个女孩子都应该吸烟刻肺，而每一位母亲都必须严谨不回避地向女儿告诫这个过程，与其相信科技的发达，不如尊重生命的脆弱。
celestebook,4,2011-06-05 17:47:20,,0,大三还不是大四看的话说张艺谋的片子我最喜欢的竟然是摇啊摇摇到外婆桥
yanggzz,4,2012-03-22 22:00:38,,0,多好的电影！多好的导演、演员、剧本！可惜的是找了两个北京的男演员，没演出西北的味！
子 。非年,3,2009-04-07 06:22:55,,0,活着就是承受苦难只为了感受偶尔幸福的香甜。影片就那样，没有很打动我，就当看了一部历史剧，也承认也许真的我们这一代幸运许多。或许再悲惨点会更有震撼力，不像它那样不疼不痒的。
妈渴-瞪啃,4,2011-02-23 21:16:11,,0,电影本身就很不错，演员演的也很到位；不过大家居然都说小说更好看，没办法啦只能自己读一下了
元坎,5,2012-06-17 04:40:12,,0,同樣在1994年，同樣是這麼風風雨雨幾十年的人生，同樣跨越了最動盪變化的歷史時期，人物同樣渺小無奈！看《活著》自然想到《霸王別姬》。不同的是一個普通平凡，一個驚豔絕世。或許這才是老謀子最好的作品了！！
克雷蒙,4,2018-07-29 00:00:46,,2,《活着》的局限就是张艺谋和金棕榈的距离。
王小北,5,2012-02-19 19:55:50,,0,首先，想起已故的初中语文老师谢老师上课为我们朗读活着；其次，排除了原著前半段的黑色幽默，还改了结局；最后，这段历史，悲哀至极。
飞聆墨,5,2021-02-27 17:22:22,,1,"相距读原著已过了近二十年，印象中的情节与人物早已变得模糊，可再苦再悲凉都要受着把日子过下去的那股劲却还牢牢占据心头。不知经历过大风大浪，待到两鬓斑白忆往昔时，会是不堪回首，是""也无风雨也无晴""，是也能品出些许回甘，还是什么呢……每个人都在写着自己的剧本，都会给出各不相同的回答。""活着""就像是我们各自用生命写下的一本书，一生的唯一。孩子则会是另一本，不是续集，而是汲取了来自其他书籍养分的""独立装""。电影中，对家珍向春生说过的两回""你欠我们家一条命，你记着""印象深刻。第一回是他意外撞死她唯一的儿，她将恨意裹在这话中狠狠直戳向他；第二回则是听闻他在政治风波中快撑不下去而想自我了断时，用这话在挽留他活下。我欣赏从家珍的""书""里读到的果决自强、坚忍善良又敢爱敢恨，还有她对孩子的脉脉温情和深深的懂得。"
unsheath,5,2009-08-12 23:45:22,,0,个人认为，这部影片和奥运会开幕式是谋导最棒的作品。相比原作，影片在某些情节上作了一些改动，但与原著一样精彩。
Anderson,5,2010-09-25 17:30:39,,1,葛优在最后说，鸡长大了会变成牛，孩子问，牛长大了呢？葛优没有像给儿子说“牛长大后就是共产主义了”告诉孙子，他犹豫了。
Rapunzel,4,2009-08-11 17:54:38,,0,余华的经典作品，配上经典的导演，经典的演员，再差又能差到哪里去？只是可怜的中国人啊，永远不能通过“合法”渠道看上这部电影~
非正常人类,5,2008-09-24 23:38:06,,0,没有小说来得残酷，所以原本小说要体现的在大环境跌宕中小人物悲惨命运的原旨就轻了些~~~就电影而言，演员个个出彩，电影气氛不断在冷酷和希望中变幻~~~
天天把豆豆来豆,4,2019-12-09 21:20:35,,4,在外受着别人的欺凌，在家又须调节不合的气氛，还要暗中付出本应接受爱的心灵。
Particle,4,2014-09-18 15:55:02,,2,演员个个出彩，简直像为小说量身打造。唯独在政治色彩上稍感用力过猛，这样拍更像中国版《阿甘正传》，但总觉刻意。这是张艺谋的野心挡了余华的才，私心还是更爱小说，不言之言。
猫令,5,2009-02-22 15:36:37,,0,-福贵咱们可得活着回去-回去了可得好好活活着这回事不是你一人说得算的就算在那时候
缺角大齐,5,2018-07-15 14:42:29,,1,好，真好，戳到心坎里去了。不管好的坏的，都是滚滚的历史车轮碾过的时代缩影；不管顺境逆境，都是平凡的人生品出的五味杂陈。在时代洪流中的平凡人生，这就是活着。这就是老百姓的追求，这就是老百姓的电影。好好活着，过安生日子，踏踏实实的，比什么都好。电影的最后，日子呐，总会越来越好的，虽然现在不够好，以后可能还是不够好，但总归是越来越好的。无可挑剔的实打实的5星，献给所有好好活着的老百姓！！PS：巩俐年轻时真美，演技真好，用现在的话说资源也是好得不行啊，什么是殿堂级，这就是殿堂级。PPS：我也老大不小了，真的想找个知心人，好好过日子。
Castro,5,2012-05-06 11:26:53,,1,余华：昨晚暨大演讲，有同学问我《活着》改编电影时什么事情印象深刻？我说这是18年前的事了，还记得当时张艺谋常说原作里的什么细节要改动，审查才能通过。看他胸有成竹的模样，心想他如此了解gcd，对他十分钦佩。可张艺谋拍摄完成电影后，审查还是没有通过。我不再钦佩张艺谋，我钦佩gcd了。
Clyde,5,2009-12-08 13:39:38,,1,第二次看。虽然不如小说残酷，也不如小说有冲击力，却实实在在展现了那个年代的荒诞，与之相比，《归来》连隔靴搔痒都算不上。
coco果果,5,2011-08-18 08:59:57,,0,对中国社会的种种黑暗和可笑之处通过福贵一家有力地揭示出来~~老谋子那会儿可以啊
柚子葵,5,2012-10-14 21:46:13,,0,电影没有小说那么残忍，但实属是难得的经典！每次当你觉得活不下去了，生活总会再次给你希望和暂时的美好，然后就这么轮回，轮回。
刀刀,5,2012-09-03 23:03:37,,0,相比小说，电影简单了好多。巩俐的演技出神入化。我是巩俐的脑残粉。。
Gullah,5,2012-11-15 20:03:06,,0,从整个剧本改编来看是很棒的，虽然我更喜欢原著内容。本来以为葛大爷这个贱样只适合富贵时的富贵，但是落魄时的富贵也恰到好处，但是巩俐实在与家珍不搭。不管是小说电影还是话剧，我都最可怜凤霞。
浮生若梦,5,2011-01-15 22:34:17,,0,这钢铁能造三颗炮弹，全部打到台湾去，一颗打在蒋介石床上，一颗打在蒋介石吃饭的桌上，一颗打在蒋介石的茅坑里，叫他睡不着觉，吃不上饭，拉不了屎，台湾就解放了！
邦辰（SOLO中,5,2011-04-11 19:51:49,,0,越来越不忍心往下看了。道尽了一代人的心酸啊。。。张艺谋那个时候的电影是多么的淳朴。不禁在想，如果山楂树之恋按照那个时候他的手法来拍，会有多大的不一样。
小湮婉姝,4,2010-10-01 22:20:15,,0,在书里家珍死的早，二喜死了，馒头也死了，最后只剩下富贵耕着地和一头垂死的老牛相依为命，然后那就叫活着了。因为书的震撼太大，所以电影的感触就少了些。
Bork,3,2020-05-01 06:59:48,,1,從小說到電影，《活著》裡的福貴一家就像是塊試驗田，所有歷史事件都要在其上一一犁過，令其輪番經歷現當代中國的諸種“死亡”的形式，並以此講述和反諷作為中國人的“國民性”之一的“忍耐”。本片包括《霸王別姬》中對建國後政治運動的敘事，為貫徹反思和批判的視角，編導往往有意將主人公描述為與眾不同的、位處大眾浪潮以外的游離、旁觀者，其之參與運動，則被刻畫為被動的（被裹挾/捲入的）、心理上拒斥的。對程蝶衣和段小樓行此處理或可接受，而福貴一家大概並沒有如此特出於眾人的“思想覺悟”。政治運動應被理解為一個時代的集體性的情感結構，它滿足了一代人的某種普遍性的社會心理，以後設視角觀之固然荒唐或可笑，但這未免也是缺乏對歷史真實的“同情之了解”？2006年12月承蘭志軍老師借閱；2019年8月5日、2020年4月29日於海甸島家庭影院。
Kai,4,2011-03-02 20:06:14,,0,很毛很主席(都是葛优惹的祸1嗜赌把祖房搞没了2叫几天没睡的有庆上学结果意外地给车撞塌的墙压死了3给王大夫买馒头吃吃后又拿水给他喝结果7个馒头变49个王大夫不行了女儿凤霞大出血死了哎你说葛优你就一杯具)
typacm,4,2016-07-17 01:23:18,,1,电影对比小说做出了太多的妥协，尤其是最后大团圆的结局对比小说直接让我减了一星，小说才能真的体现大悲大喜到最后麻木的活着，电影拍的没有那么沉重，也差了些感觉。当然芦苇在删减、改动那么大的情况下，仍写出高水准剧本，很不容易。发现张艺谋和雷德利·斯科特一样，剧本质量决定其电影质量
windyxp,5,2007-11-17 21:28:01,,0,葛优和巩俐的表演一开始有些紧绷着，到最后只能用无懈可击来形容；平淡的故事有平淡的讲法，只是观者会有不平淡的感受。
疾走,4,2009-01-18 13:00:27,,0,小时候看的书电影很好但是没有书中那种绝望的悲哀
微分流形,3,2013-11-18 19:23:28,,5,最被高估的中国电影，平庸的电影语言，糟糕的改编，即使放在张艺谋的电影队列里也只能算一般
N 先生,5,2012-06-26 16:18:45,,0,虽然和原著有着蛮大的出入，但是张艺谋、巩俐、葛优这个铁三角还是把这部经典的小说演绎的出神入化...只可惜这部全世界获得各项好评的作品在内地却是部禁片，我想...无论是个人、团队甚至国家，在面对过去历史的时候无论好坏都要坦然面对，逃避只会让自己的未来的路举步维艰
18280,4,2014-03-22 21:53:32,,0,看的是131分钟版本，是部好电影，不过不是太优秀，断断续续看完了
bird,4,2012-11-12 08:43:57,,5,妥协下的中国人，想生活却最后发现只是活着。
𝙎𝙥𝙖𝙧𝙠𝙮 | ✟,5,2015-05-13 01:42:24,,1,他还不想死，可挣扎又怎么能等于活着，最终他还是活成了它，而它吃的每个饺子里都包了一头猪。
drunkenstain,5,2010-11-21 19:59:43,,0,“好死不如烂活着”原来活着比死去更难。惊！发现小时候就看过了，还是感冒的时候看的。对“馒头”的记忆特别深刻。
德拉库拉拉,5,2008-03-30 21:09:23,,0,2008-3-3021:08:419/8.1(4387)寒心
嘿嘿嘿,5,2016-05-23 11:46:20,,1,没有书惨，但是这半个世纪的中国被描述出来了，是一个史诗般的作品。有些地方荒唐的可笑，但是那是不久前真实的中国啊。你说这片都能禁播，还怪现在年轻一辈忘却了文革。
大海里的针,5,2019-03-13 17:28:17,,3,经常听长辈们提起那个时代，跟电影里一模一样。葛优瘦的不像滥赌的，像抽大烟的；巩俐的演技太棒了，演少奶奶和演农妇都那么像。
青兮,5,2017-01-09 17:14:54,,3,语文老师在教室里给我们全班放的，余华的活着这本书也看过。电影告诉我们无论命运怎样安排你遇到什么事，我们都要默默承受着。好好的活着
悯笈,5,2012-11-17 11:30:46,,1,陈凯歌的霸王别姬，张艺谋的活着，真有点异曲同工！！
泊衡,5,2008-08-06 10:56:22,,0,医院那段改得不错，结局没有那么残忍。挺不错的剧本修改，还是给个5星。毕竟还是书写得好
阿别给我打电话,4,2017-05-03 12:42:39,,4,电影和余华的书一样，让人看了之后很久都不能走出来。活着，怎样活着，其实人呐无论是骄奢淫逸的生活还是清贫如苦的日子都能过下去，没有什么不同
画瞳,5,2012-03-17 00:29:13,,3,看看张艺谋现在的电影，在看看这些，哎，这世界到底是肿么了。谋爷这几年是想开了还是吃错药了。这一个活着的历程看着真的心颤呢，家变，国变，意识形态都变了，这种背景和经历让活着显得好纯粹啊。我们这代人多少还从父母那里耳闻过这些经历，90后或者00后会怎么样啊，这应该作为一种教材。
巧克力可丽饼,4,2017-12-22 20:21:16,,0,很真实，很质朴，不过原著的结局更凄凉一些（只剩下男主和一头老黄牛），电影版在儿子有庆被车子撞倒的砖头压死了，女儿凤霞产后大出血以后，就以男主与妻子、女婿、外孙其乐融融的吃着饺子结束了。电影改了变得苦中有乐，而原著是彻头彻尾的好死不如赖活着。
我爱德芙,5,2009-09-23 21:31:46,,0,葛优凭这部电影拿下戛纳影帝，不是运气。几个电影人的巅峰之作。
Gwenhwyfar🍒,5,2007-07-21 23:22:14,,0,"终于看了<活着>!太他妈的好了!终于明白了高中时候历史老师为什么向我们推荐这部电影了---这片子简直可以作为中国近代史的教材了!体现的太生动了!好多人，都说这部电影体现了中国人""好死不如赖活着""的本质.但我到是觉得，中国人无论遇到什么样的灾难都会永远的，坚强的活下去!福贵是个在卑微不过的小人物了，但是他却比任何人都要坚强!因为，他无论遇什么，都没想过要死!他一直都在心里坚定的活着，一直想日子会越来越好的...看完这电影后，我想到了张艺谋.看他在以前拍了这么好的电影，现在却...哎!感伤啊~~莫非他也是"
Aubrey,4,2010-07-17 21:14:26,,0,对于老谋子来说，回头他自己看看这些电影会不会觉得惭愧！！！
风中摇曳霸王花,5,2010-03-13 16:03:10,,0,有庆那么可爱懂事的小男孩，看到他死的时候，我的心和葛优巩利一起哭了
杨药师,1,2022-03-01 01:38:20,,4,作为小说活着的改编，不能还原活着就是很差的，影片结束在了富贵一家还算幸福团聚的时刻，我想也是为了表达希望？不过之后的内容才是最精彩的，为什么张艺谋的电影总会缺些东西呢？我知道拍出来很残酷，可我情愿这一巴掌打在每个人的脸上，因为这才是这类电影应该传达给我们的
大雄,5,2012-03-20 20:48:45,,0,时代的悲哀与人性的美好。在那个无法选择的年代，唯一的选择就是活着。
樱桃小阮子,NaN,2010-11-15 15:20:10,,1,单独把它作为一部电影看，真的不错，内涵够厚，表达也很结实，值得多看几遍。但是，珠玉在前，尤其是《活着》这小说在我心目中一直是属于江南的，这么个黄土味我真吃不消。当然，这纯粹是个人原因。ps：老谋子离开了好剧本根本不能活
海 盗 砰 恰 恰,4,2012-03-03 01:19:03,,0,台湾的导游小哥说这部电影在大陆禁播，怀着无比古怪的心情看完，原来没有色情的禁播片也很有吸引力。这才是张一毛！
张翔森,5,2021-09-12 11:29:38,,6,活着就是受罪，活着就是劳累，活着就是互相折磨，活着就是不对；活着就是受罪，活着就是劳累，活着还得互相安慰，活着就会憔悴；活着就是受罪，活着就是劳累，活着就得拼命挣扎，活着就得干脆。
451½°F™,4,2021-02-02 15:11:50,,1,在关于中国当代史的电影叙述环境中，「富贵」反而是一个「幸运的旁观者」，他的家庭悲剧在整个时代中甚至算不上「连带伤害」，几乎与原著文本相差极大的电影改编依旧有非常「人文关怀」在内，某种观点会认为是缺乏「批判性」，却更加能够经受时间的考验与反思。
Moka,4,2018-06-06 14:24:37,,1,两小时的篇幅限制，故事时间跨度大，导致许多剧情讲得不深，剪辑上也不够自然。电影整体温情很多，修改了一些情节，看完不如小说触动深，余华的文字更冷酷节制。不过经典文学改编成影像作品难度太大，毕竟想象是无垠的，电影却是有限的，也不必苛求了。
