user_name,star,comment_time,geo_ip,vote,short
Scorpion,4,2011-12-19 21:43:16,,0,发生在特殊年代的事件，感人至深，是有多大的信念支撑
Puff,5,2009-05-28 22:17:28,,0,你始终站在对的一面么?是的.
我只是只懒羊羊,4,2014-04-25 17:47:54,,0,很好的大片，但是除了结尾，少了点感触~
River,5,2012-05-26 00:49:14,,0,绝赞！主角的每一个表情、动作都是那么的淋漓尽致。
octopus,5,2011-01-12 02:17:40,,0,最后的一个镜头触动了所有的感情升华的太完美
大魔王,4,2012-04-23 20:24:45,,0,很戏剧的一部片子。听让人反思的可怕的政治斗争
瞪鞋派,4,2009-05-13 03:43:15,,0,我需要有一个人来陪我看电影···这片儿有空得再看一遍··
watly,5,2008-08-18 09:20:27,,0,真适合中国人看
森暮,5,2011-12-26 16:17:09,,0,中文翻译真浮夸
君宝同学,5,2011-11-06 06:34:47,,0,情节和表演那细腻…啧啧，德国电影对xx主义的反思确实完爆其他所有国家。看完想起了《浪潮》，同为近两年德国电影代表作，探讨的主题相似，连最后定格在主角复杂表情上的手法都一样，大爱！浪潮表现人性恶的一面，更震撼；本片表现善的一面，更让人动容。
果,5,2010-05-04 20:35:20,,0,真是满纸屏蔽词，一把辛酸泪。让我想到当今的中国。
Out Man,5,2007-12-03 21:46:00,,0,一部被宣传片所误导的好片。
西决,5,2013-09-10 18:03:14,,0,赞
Bigteeth,5,2007-02-04 23:47:23,,0,Perfect.
子安,4,2010-06-06 22:41:35,,0,算得上精彩不过多少带着点知识分子的天真劲
L.L,5,2011-02-07 02:37:36,,0,“这本小说谨献给HGWXX/7致上最深的感激”内敛含蓄，无可挑剔。记得曾经说“电影越看越多，喜欢的却越来越少。”原来，看电影也要耐得住寂寞，等待总会带给你更深层次的惊喜和更丰满的精神！久违的感动，让我想起了3F，想起了小小家，想起了那个充满了电影的屋子。
Reminiscent,4,2010-04-13 11:23:50,,0,他们有着不同的信仰，却带着不同的信仰走向不同的道路，有人为钱，有人为利，有人为了革命，有人只是为了做个好人。
|Dime|,5,2010-05-30 14:21:04,,0,东德天朝人民心连心
我爱看电影,3,2011-07-09 13:34:56,,0,感觉很枯燥啊看不下去
Left2,4,2011-11-02 18:40:53,,0,
ADC,5,2010-11-12 20:21:03,,0,TT
木馬114,5,2009-02-21 21:26:44,,0,本子很好故事很好
榴莲王子,5,2012-12-10 23:45:15,,1,看了一九四二才想起来这个还没标记过虽然威斯勒的存在是个美好的幻觉但国内导演真该学学什么叫举重若轻
Squidward,5,2013-04-13 09:23:30,,0,之前一直因为这名字总能联想到各种不喜的港片所以一直不想看，事实证明尼玛狗翻译害我不是两三年啊。跟1984有点像，不同的是比1984更走温馨路线，特别是结尾放柔调子有爱的很
菜炸炸,5,2018-07-08 20:13:43,,2,冰冷专治极权下的人性觉醒，最后一幕眼泪哗啦啦的流啊！这个片子应该打十星，柏林墙都已经倒了近30年，我们却还生活在乔治奥威尔的1984年。
马西嘿嘿嘿,5,2009-07-18 22:54:52,,0,看到一切即什么也无从知晓。庆幸有这么一部电影能够将被我们遗忘的历史重新呈现在眼前。我没有压抑，也没有感受到沉闷，从细节知晓这段历史或许更好。不需要唯美的镜头动人的爱情故事夸张的剪辑花哨的叙事，好电影就是这么存留下来并将永久为后人敬仰。
Peggie,5,2010-11-18 21:56:29,,0,无论在怎样灭绝人性的制度里，总有坚守良心的好人。
未卜,4,2011-06-07 11:44:56,,0,窃听可为为好可以为怀
浑浊儿,4,2011-07-18 20:42:34,,0,车祸的时候忍不住翻了个白眼
Stephen Chao,5,2011-08-07 21:34:00,,0,拍的太屌了
Iker,3,2011-08-21 12:41:35,,1,只是觉得铺垫得不足，这样的窃听人员竟这么轻易被打动？
Vita Kei。,5,2011-07-14 15:14:49,,0,献给有罪或无辜，迷失于茫茫尘世，随波逐流，不曾意气风发的人。献给一贯保持希望的人。尽管面对悲伤，四周冰冷。献给独立寻找自由的人。献给变得枯燥，掌中之物从指间溜走，总是在结束后抵达的人。
低熵体,5,2011-08-21 16:33:58,,0,“你这样的人竟操弄了整个国家！”体制内的人表示深有感触
fight for you,4,2011-08-30 13:51:35,,0,当好人的代价太大了
arens,5,2013-02-18 16:30:05,,0,阿伦特在TheHumanCondition一书中写道：“人类不可能获得自由，除非他知道自己是受制于必然性的，因为把自己从必然性解放出来的努力虽然不可能是完全成功的，但正是在这个过程中，他赢得了自由。”
樂啊樂,5,2017-05-30 17:19:58,,2,"""不，给我自己的"""
coco果果,5,2013-03-10 23:08:24,,0,献给好人的奏鸣曲，黑暗中的人性之光。静静的叙述一样可以震撼人心。
想被丧尸咬一口,4,2009-06-14 01:32:55,,0,演得真好看完才知道是奥佳
半边番茄,5,2011-06-05 14:36:39,,0,最后五分钟取掉会更好
阿美,5,2011-08-25 21:52:13,,0,这部电影亦是，献给好人的奏鸣曲。
沉默的若亚,5,2012-04-29 19:55:28,,0,献给好人的奏鸣曲。再强的压迫下也会有反抗，也会有未泯灭的人性。看到中间明明隐约知道卫斯勒的结局，可最后真正看到结局的时候还是被深深震撼了。
茴香微微,5,2012-11-25 17:10:15,,0,收藏多年绝对好看的一部电影，对自由的追求，对国家机器的思考，高压统治绝望下的希望与温情。从“墙塌了”到“先给好人的奏鸣曲”满是感动与泪点。适合安静地一个人看的电影
三叠纪的猫,5,2013-02-22 18:21:49,,0,之前竟然没添加让人感动的好片
水脉,3,2010-10-17 20:45:40,,1,毫无悬念的两个小时，一遍播放着电影一边做各种各样的事
我要默默玩豆瓣,4,2012-06-19 04:12:22,,0,给人希望的电影。最后一幕，他说，这是给我的，那蓝色的双眸让人感动。
HGW XX-7,5,2007-01-18 12:58:49,,0,非常好的影片！
MiaH,5,2010-08-11 01:23:10,,2,这片在社会主义的中国需要普及
[已注销],5,2011-09-16 01:27:26,,0,良知
晓口袋,5,2016-07-20 16:35:50,,2,一名高级斯塔西成员悦纳了来自艺术家的，音乐和诗歌的熏陶，成功写出了一部拯救艺术家的舞台剧。最后的镜头，买书赠给自己，简直是妙不可言的犒赏。
ballcool lee,4,2009-09-29 23:27:57,,0,喜欢这个短评：看得时候老想在我们的影院里看这样电影的时候，我们得多少岁了
MaxHorowits,5,2021-05-01 21:50:45,,2,磕CP，怼黑粉，背黑锅，这才是真正的为爱豆撑腰啊。
bugz,5,2009-02-03 22:13:08,,1,看了三遍了...还是很喜欢...
oui,5,2012-02-09 01:47:30,,0,关乎人性。。。究竟谁是好人？其实谁都不是。。
hiphop,4,2007-01-18 13:52:48,,0,毫无人性的社会主义国家安全部门，虽然不愿意相信，但不免让我感觉背脊发凉
[已注销],5,2011-10-20 20:24:13,,0,不知道谁说过人与动物最大的区别是人创造了艺术！很棒的电影，向保护艺术家的那人致敬！
赵天霸,5,2012-08-23 23:40:48,,0,东德的苦难结束了，我们的苦难什么时候才能结束呢？
XUE,4,2008-08-03 14:08:29,,0,我突然想到一个词dasschwersteGewicht——最沉重的负担分裂过，又统一的德国总是一个很容易触碰内心深处柔弱之处的国家。表面上看起来深沉的德国人内心总是出奇的柔软。默默地，我们都是好人，我们向往和平。
你绝对想不到因为这也出乎我意料,4,2008-06-28 20:41:35,,0,我就知道他会去救，必然会去的，我就看到他一路小跑了。女主死了有点可惜，同样可惜的是她悲哀的出卖了双重的自己
胡小猴,5,2020-03-09 22:36:34,,5,黑夜深处的一豆烛火，格外的明亮和温暖。柏林墙注定是要倒掉的。
Damselfly.,4,2012-10-17 07:05:42,,0,可能是期望太高了。在这种洗脑下主人公的政治信仰转变得太突兀了。尤其是女伶车祸那段真不是狗血爱情剧么！还有生平最恨的就是＂X年后＂这种没素养的东西，当初就是那段屎烂尾硬生生把朗读者拽出了我的五星榜，这种俗气的催泪弹省省吧。不过最后拖着个掉书袋送信的一幕还是要男默女泪一下。
神游少年欣小欣,5,2010-04-22 20:15:38,,0,不是一两句能表达清楚这场电影给人的感触...总之..在当今的现在...让人充满共鸣...HGWxx/7..thx
大漠孤烟,4,2011-01-03 16:32:36,,0,韩寒君推荐
Haru,5,2011-01-14 23:57:35,,0,印象深刻。
Neo,3,2011-07-03 19:59:59,,0,intheendweremember，notthewordsofourenemies，butthesilenceofourfriends.
Fan,4,2010-09-06 10:18:09,,0,这男人帅的好冷静~~
.H,5,2012-02-10 00:45:26,,0,歌颂那些从未发生过的
stknight,5,2010-03-04 10:10:26,,1,感觉现在奥斯卡的最佳外语片要比最佳影片强不少啊
Why,5,2012-08-12 13:35:38,,0,很久没有看到这样的电影了
