user_name,star,comment_time,geo_ip,vote,short
毛毛毛读作cuì,5,2011-04-22 12:53:01,,8388,饰演魏斯乐入木三分的名演员穆荷自己，在两德统一后去察看自己的“忠诚资料”，发现有长达六年的时间，每天向秘密警察报告他的言行举止的，正是他自己的妻子。
sogdiana,5,2007-08-01 10:49:55,,3888,两条线，两个男人，两个故事，两个互相打捞的故事。丢了一个，彼此的人生都会沉入海底。当剧作家在街头，看到行走在人行道上的特工时，他本可以上前喊住他的。但是终于是没有。就像哈代所言，呼唤的人与被呼唤的很少能互相答应。他们最终选择了沉默地相互记录。
seeme | 北北,5,2011-02-08 21:07:48,,3681,2006年最佳奥斯卡外语提名。用自己的后半生成全了理想，沉默又坚定的男人，最后只得到“献给好人的奏鸣曲”。有时选择坚持自己的路，是用幸福去交换的。
南笙,5,2013-01-24 23:48:34,,3559,最后一句，不，这是给我的。一语双关，瞬间落泪。这种利落的结尾，漂亮。
黑刀,5,2007-09-11 19:22:42,,3118,结尾让人叹为观止，感慨万千。
林小熏,4,2010-12-11 22:24:48,,8219,国安局血的教训：千万别请文艺青年做秘密警察～
今天小熊不吃糖,5,2010-09-29 07:08:38,,2465,看到结尾到底还是忍不住泪奔了
杨子虚,5,2012-11-03 21:36:52,,1932,这个故事告诉我们，女人是靠不住的，好基友才是一辈子的！
桃桃林林,3,2006-12-18 09:34:39,,408,远没有期待的好，一般而已
影志,5,2015-11-15 19:07:37,,1672,“你还站在正确的一方吗？”……惊艳于“做点变通”，惊诧于“重要的不是成绩而是成败”，惊呆于口误后的抓手动作，惊愕于搜索后可获损失赔偿，惊叹于女主的悲剧，惊奇于小人物改变的大历史，惊喜于“这是给我的！”
握不住的灵魂,4,2012-02-12 14:10:03,,7428,东诺士马克的电影用了很多当初东德的机关大楼实地拍摄，但是监狱博物馆的馆长却拒绝了他拍摄的请求。原因？馆长说，因为东诺士马克的剧本不符合史实:整个东德历史，像魏斯乐那样“良心发现”的秘密警察，对不起，一个都没有。
御姐控_光崽,5,2009-11-15 20:37:33,,1685,你还记不记得他听歌流泪的样子，倾斜在椅子上陶醉的样子？
私享史,5,2007-02-28 00:52:22,,1637,真的很赞，尤其是演员的表演！淡化意识形态的典范之作！故事本身也很精彩！20191031重温了这部电影，说一个你们肯定没注意到的细节：本片结尾告诉魏斯曼柏林墙倒掉的那个拆信员，就是那个在餐厅里讲大领导笑话的军官！而耳机里播送柏林墙倒掉新闻的，是导演本人……
萝拉,4,2007-04-02 10:49:08,,4965,有个大漏洞，按理第一次被搜查，无论是谁都会把打字机马上处理掉
缈沨,5,2009-09-01 04:38:03,,733,en，1984的背景，看到1989年11月9日那段突然哭点大爆发。。。电影节奏很好，音乐大赞。。。
Ying,5,2011-11-26 16:01:46,,756,重看仍无比感动。为什么INTJ最适合做情报人员？因为他理性近乎无情却会被艺术和梦想打动、执行毫不犹豫却勇于质疑自己不沦为机器、孤僻独行却又珍惜与他人的温情。他是最聪明的，却是最不能被掌控的。
小油飞,5,2015-11-28 04:01:07,,673,窃听普通人二十年都没感觉，窃听个艺术家没几天就被策反了……极权政府恐惧艺术还真是有道理啊……
shu,5,2013-01-09 11:42:39,,699,这里每天发生的事儿，都是现场加强版的《窃听风暴》；只是weibo能不能有点心，偶尔做回HGWXX/7。
MK凉凉,5,2013-02-14 23:23:51,,557,最后一星给在“艺术家没有去与HGWXX/7跟相认”。
大头绿豆,4,2007-01-10 00:27:54,,2484,专制意味着有些人可以做另一些人的主人。
Fal Conde,5,2010-03-24 16:59:23,,485,现实中没有这样的人一个也没有
兔礼帽,5,2020-09-01 15:52:55,,373,惊讶于这部片子竟然可以看，随后悲哀于自己的惊讶。
江绪林,5,2012-03-03 21:33:27,,339,深度慢慢地流淌而出，告诉我，无论世事是多么地艰难、荒谬甚至肮脏，心灵也能因不放弃真诚和正义而动人，并带给生命以尊严、优雅和希望。
暖鱼,5,2008-04-04 22:41:24,,382,什么才能打动石头？又是什么让我们坚持？再是什么让我们出卖？
❤ Chemical,5,2009-12-21 20:51:06,,459,如果可以的话，我想给10星
OnJel.,NaN,2007-08-27 12:07:45,,482,看哭了==
Lan~die,4,2009-12-22 21:00:26,,989,“献给好人的奏鸣曲。”人得想办法成全自己。
何生生,4,2008-01-04 06:22:31,,365,女演员被车撞死真是一个太过明显的瑕疵
起床，吃饭,5,2011-08-12 04:05:53,,311,我愿意，心怀安宁和岑寂的喜悦，缄默一生，直至岁月不再尾随我。
欢乐分裂,4,2013-10-17 20:31:06,,349,四星半，被结尾感动得湿了眼睛；即使有瑕疵，仍愿相信这等荒凉中一抹温暖人性的存在；布莱希特的文字、贝多芬的音乐，让这个严谨刻板的审讯者慢慢融化，这真是一个太理想化的故事，也是一个太残酷的故事；长久的信赖并不安全，黑暗中的惺惺相惜日后定能绽放微光。
F,5,2009-11-22 11:42:32,,365,只有德国人才能拍出这样的片。
Luke,5,2012-10-13 12:07:11,,319,伟大的电影。极权主义政治的无耻，人性的光辉。
可可爱爱郭麒麟,5,2011-11-05 21:51:46,,286,冰冷的国家机器是战胜不了人性的。极权主义是最彻底的暴政。
巴喆,5,2012-06-29 21:55:13,,158,(四删我评论，补记)少壮不努力，一生在某地。9.2
杨迪,5,2012-05-01 21:42:11,,182,用文章来代替相见的方式让我几乎泪奔！“NO!THISISFORME.”
张老实,5,2014-11-19 17:32:19,,158,豆瓣审核员会被打动吗？
泽帆,4,2010-02-22 15:32:18,,337,这本小说谨献给HGWXX/7，致以最深的感激。
方枪枪,5,2011-01-06 12:00:10,,124,专制、意识形态、1984、老大哥，这一个个名词，不时浮现脑海。然而，导演却如此这般轻车熟路的将电影本身驾驭的恰到好处；两个男人之间惺惺相惜的情感表达也相当出色，不掩饰，也不夸张。结局那一刻，当“这是给我的”那句台词脱口而出之时，这样的场景，含蓄却不失张力，刹那间内心感慨万千。
瑾朵朵,5,2017-12-28 21:42:17,,220,他把枪口，抬高了一寸……最后两个被改变一生的人并未相认，一切尽在不言中，太浪漫了
五月,5,2017-07-21 23:25:46,,157,是国人重温这部电影的时候了。
木卫二,4,2006-12-03 13:30:49,,217,以前常开玩笑...
罗弘霉素,5,2010-04-15 10:23:16,,195,“用包起来吗？”“no，thisisforme.”全文唯一一句英文出现在最后一句，这本书是买给我自己，又说明是德莱曼写给我的，还捎带悄悄点明，随同英语进来的，还有自由和民主。Nein，esistfürmich.，最后一句是德语，发音像英语，来自于10年后的指正，感谢@DIFAN
到底凡人,5,2008-03-18 06:05:48,,171,偶然能改变整个体制么？
🫀Psyche,5,2015-08-16 00:38:55,,122,德国人是某种植物，在风平浪静的时候不摇不摆，有时安静地像个机械。一旦他们的心灵被艺术敲醒，某种疯狂的力量开始疯狂的摇摆，吞吃那个已经死去的外壳，直到内里重生，而后被猛烈的冬雪封存，生命静止。#剧情节奏之神#
眠去,5,2007-02-27 19:46:26,,67,"""nein，dasistfuermich.""btw，inearlymistakenforKevinSpacey"
影子的影子,4,2009-08-23 16:08:38,,194,我也不明白为什么我要给四星，也许就是因为最后那本书吧，扉页上的字让我心底一震。说句题外话，里面有的演员我在德国学生的短片里见过，话说外国学生的条件真是好，可以请到专业演员演出学生作品，中国学生作业啥时候能到这个待遇？
国王KING,2,2015-08-05 20:02:18,,169,看着一堆一堆的好评让我忍不住困惑起来，难道我的评价鉴赏能力变差了么？的确觉得不好看，开头实在是异常的沉闷，让人难以忍受的节奏推进，除了开头的审问和窃听器安装，其他都乏善可陈。它絮絮叨叨地拍了一个小时，但我还是难以入戏。哎，人各有所爱。只能这样跟自己说了。
卢十四,5,2013-10-04 21:58:29,,131,想了想，为那份沉稳、不滥煽情撒狗血的气质，打五星。
荒也,5,2012-11-17 01:27:55,,88,“29块8分，要包起来送人吗？”“不用了，这是给我的。”
奇爱博士,4,2010-11-13 20:01:37,,80,剧情很狗血，细节很深刻
尺棰,5,2021-03-28 21:53:40,,68,被片名耽误的电影
shininglove,5,2010-03-08 22:40:22,,55,补胶片版，结尾仍然看得浑身颤抖。
Quo Vadis,5,2022-05-21 02:56:11,,76,“我是个作家，我将你的名字写在书的第一页，让你的故事广为流传，永垂不朽。”结尾封神～然而现实却是如此——导演说本来想去东德档案馆实拍场景，却遭到馆长拒绝，理由是剧本内容不切合史实。馆长表示，“这样的好人东德一个都没有”。
ζωήιδ,4,2010-01-14 14:10:10,,94,几乎猜到了一切：猜到他会喜欢她，会羡慕他们的生活，会喜欢诗人的诗，甚至猜到他和她都会牺牲自己去保全爱人。对此类题材太过熟悉以至于没有悬念？TNND羞愤！
米粒,5,2009-11-19 19:46:57,,83,非常感人，也有非常震撼的结局，在重压之下，该如何保持信仰？
水田英松,5,2014-06-05 21:43:17,,64,中文译名太差，我当年一听这名字以为是什么四流动作片，所以没看
Vamei,5,2013-01-16 07:02:17,,64,体制的重压下，许多人都会迷失。某个人的善意在体制下显得微不足道。或许能拯救生命，或许来不及拯救。但无论如何，对于这个人来说，他以个人之力反抗了整个体制。他总可以说，我是为自己活着，而不是为了一个冷酷的体制浪费了自己的生命。
Su,5,2010-02-03 11:05:24,,73,希望有天能看到我们自己的电影。
游牧人·芳汀,5,2010-12-17 20:12:02,,43,剧情自始至终张力十足，我的心也始终悬着。而且很意外的为结尾那句对话“要我把这本书包起来送人吗？”“不用了，这是给我的。”感动得泪流满面。好久没有为一部电影流泪了。虽然看了不少讽刺SHZY的电影但这一部还是很有泪点
咩,5,2023-04-17 17:35:33,广东,51,就冲最后一幕给5星，这个结局太好了，比我想象中的结局两个人相视相拥可好太多了，这是拉兹洛给恩人最好的礼物。
后自愈,4,2016-06-15 23:01:23,,56,冷静沉着。极权主义下的艺术之歌，窃听和被窃听的人，你很难说到底是谁失去了自由。细节里见真章，生活里显人性，在一点一滴的窃听中唤回了本属于自己的良知，在电线波里遇到未曾谋面的惺惺相惜。还好，还好柏林墙倒塌了，还好它禁锢不住思想。献给好人的鸣奏曲，献给HGWXX/7，无言感动。
Jiangdada,5,2016-06-08 07:51:05,,59,试图发现别人隐私的同时发现内心善良的自己
大-燕-威-王,5,2015-03-07 22:54:28,,33,片中留下的伏笔，是我观影到现在最好的之一。
U 兔,5,2016-01-29 09:36:05,,56,穆埃的表演太惊人，似乎都是同样的表情和动作，却看得出完全不同的心情和气质，眼神透露出细微的变化和心理的翻天覆地。当然，一定也是电影语言讲得比较到位。节奏跟色调一样冷峻，艺术家的屋子是暖色。艺术终于温暖了最冷的理性。让人感动的是没有为做了正确的事而有丝毫后悔。“这是给我的”泪爆
琴酒,5,2011-04-26 00:05:25,,27,再次表示热爱MartinaGedeck。再次表示热爱这种略带神经质的很硬的男人，连拆信封的姿势都是那么让人喜欢。再次表示听这种语速进行的德语祈使命令句好舒服。再次表示我的听力碰到日常对话就是废的，吞音根本听不出来啊！
Alain,5,2016-08-08 15:04:02,,41,仔细感受卫斯勒一步步转变的过程，是从被国家机器培养的冷酷无情的秘密警察，变成人性觉醒的一个人，甚至是好人。当他开始冒着叛国的危险伪造假证据帮助作家，我已经无法控制泪腺。这是一首献给好人的奏鸣曲。一个能真正用心感受音乐、感受文学的人，不会是坏人，对吧？
焱返,5,2020-08-13 23:43:00,,41,我书写你的故事，你书写我的故事。窃听充斥声音，而两个人之间只有沉默的交流。
[己注销],5,2009-06-15 00:36:03,,27,其实我想给的是四星半。就柏林墙电影而言，我觉得《再见列宁》更出色一点
Ocap,5,2016-07-05 01:15:14,,31,16.5.2观时思如泉涌、心如弦动，观后扼腕长叹、归于无言。禁网期间并列最深撼动与最大收获，感慨万千。之前就给归网后的自己下达了强令，要拉片写一篇对得起自己观感的长评，年底总结找个时间吧。
不要秃头,5,2022-12-24 22:53:41,浙江,46,艺术离不开自由的土壤，所以极权害怕艺术
阿尔吉侬,4,2023-05-23 17:39:54,广东,26,据说，当导演要求去前东德监狱博物馆拍摄时，馆长拒绝了他的拍摄要求，理由是“剧本不符合事实”。因为他说“整个东德历史，像维斯勒这样的警察，一个都没有。”
陀螺凡达可,5,2011-12-28 05:04:22,,29,震撼精彩
X,5,2017-05-13 23:17:25,,46,历史的车轮碾压下的人性就像一棵草
原来是西门大嫂,5,2011-12-08 20:34:11,,31,在与1984相似的概念中要情怀温柔的多，这是一个artist比笔杆子战士该有的诗意吧。《他人的生活》是一个很好的名字。
davekozg,5,2012-02-21 12:34:23,,42,《窃听风暴》拍摄期间，导演为还原历史原貌，打算使用原监狱大楼，被现在的监狱博物馆馆长拒绝。馆长的理由很简单：你的剧本根本不符合史实，因为，冷战期间，整个东德的秘密警察中，象男主角卫斯勒这样“良心发现”的人，对不起，一个都没有！
艾晨,5,2008-11-16 21:10:18,,15,片中出现的歌曲也很好听。
六壁坂,5,2015-10-11 21:42:16,,43,下不为例，我的朋友
张猫大,5,2022-05-17 14:58:11,,34,自信而有力的审讯，严厉而直当的教学，沉稳不变的步伐，同时拥有非凡的判断力，你的所有小心思在他眼前一览无余，而他自己在面对任何人时都不会透露任何情绪，他让你了解到的关于他的一切仿佛只有冷酷无情。虽然那张面无表情的脸贯穿了始终，但他其实也只是个普通人，会贪恋应召女郎的温存，会因某位艺术家的自杀而落泪，甚至会假装成粉丝，上前鼓舞在堕落边缘徘徊的可怜人。他的所现和所为处处矛盾，可一旦有机会让他抉择，他坚定地“站在对的一方”，无畏会落得如何下场。听到围墙倒时我就哭了，明明是个历史小白，仅仅是觉得这样一来，好像他所付出的一切都有了意义。而当最后“献给HGWXX/7”浮现时，在黑暗中牺牲而孤独的灵魂啊，终于被世人所识。他值得被赋予任何意义。
西楼尘,4,2015-04-30 12:45:04,,66,人与人的关系本来就非常微妙，而倘若放置在社会大环境下，彼此的猜忌、秘密、背叛，将人逼入绝境。在一个极度亢奋的社会背景下，所有的人权、尊重、自由都显得毫无生机。当社会的权柄被部分人肆意操纵和利用，旁观者看到的是深深的悲哀，而身在其中的人却不能自拔。魏斯曼心态细微的转变，是全片关键。
悄瞧巧俏,5,2022-12-04 13:46:22,浙江,21,全影片最后一句It'sforme一语双关，感人至深。
薇羅尼卡,4,2017-10-21 15:23:43,,47,比电影更残酷的，是现实本身。这个温存好人的梦，也只能在银幕中实现。
Eika,5,2022-09-01 23:11:21,瑞典,27,之前正好刚刚读完一九八四，连着看这部，效果简直了。最后HGW走进书店，翻开几年都没有创作的德莱曼新书《献给好人的奏鸣曲》扉页写着献给HGW...眼泪一下绷不住了，结账时，店员询问是否是礼物要不要包装，那句“No，it'sforme”简直一语双关。
xiaohanyu,5,2011-07-31 03:32:20,,36,石头虽然坚硬，可蛋才是生命
袁长庚,3,2011-04-25 00:25:25,,100,不是说片子不够好，只是韦斯勒先生的转变毫无征兆确实是个败笔。一个秘密警察的头子怎么忽然从冷血到悲悯。处理这样的历史素材，最好还是慎重为好。奥斯卡的小金人完全是冲着1984式的寓言过去的
铲铲,5,2015-02-17 21:38:06,,24,大名鼎鼎，今日终于看到，果然不负胜名。“这本书是给我的。”泪流满面。
bloodice,5,2022-11-30 22:35:58,广东,17,在东德片里寻找同样的历史。
美女菜kun,4,2017-04-02 16:25:36,,66,作为一个专制的病人，应该拿什么来拯救自己的灵魂。看完真的泪崩！
请保持高冷,5,2016-09-04 15:19:51,,16,喜欢这个故事
芥末蘸酱,5,2010-07-01 21:11:59,,12,每一次OOXX，都是对专制的一次反抗.
托尼·王大拿,5,2011-10-05 04:22:53,,11,一首献给好人的奏鸣曲
噗子,5,2022-01-09 01:17:40,,25,無數的人們含著熱淚看完了這部影片
xsent,5,2022-11-14 14:05:24,浙江,19,两人有种默契，互相被改变了一生却从没有直接的交流。这样冷静的地方很喜欢
曼仔,4,2020-08-12 01:38:33,,36,结尾真是利落又有力量，瞬间泪目。整个故事其实是有点理想主义的，一个化身为体制螺丝钉的人，真的会因为布莱希特的诗句、贝多芬的音符而被唤起内心深处的良知吗？要知道当年的高级纳粹军官很多都有很好的教育背景，很多日本军官也是，文学艺术他们所知所学不在少数，但“美”很多时候也可以不与“善”发生联系。
连城易脆,5,2014-01-08 12:33:02,,8,我希望也有人将来会送我一本《好人奏鸣曲》...
林溪,5,2021-04-19 21:26:12,,18,很优秀的一部影片。震撼！
米尔,5,2022-03-12 20:06:52,,43,希望历史不要开倒车。
玻璃海苔,5,2023-02-26 13:26:54,江苏,31,献给好人的奏鸣曲；很久没见过这么含蓄漂亮有余韵的结尾了
朝阳区陆依萍,5,2015-12-12 21:51:43,,20,电影资料馆14排17座。原来真得好看到爆炸，都看哭了！！！查一下资料，男主离世了，又哭了好一阵子.....
余小岛,4,2012-11-19 22:18:50,,35,看完电影仔细想想总会觉得有一点不值得——用自己的下半生去帮助一个不相识的陌生人最后只得到一本书。
汪金卫,5,2009-11-06 22:56:03,,15,【中国电影资料馆展映】6年零9天前，在被窝里小MP4上看这部片子的我不会想到今天能在（一个同样极权的国度中的）大银幕上再次欣赏到这部经典电影。即使是体制内的机器（《1984》《我们》），同样能闪耀人性的光辉。诚然，电影是很理想主义，现实的东德并无这种事。但它能够唤醒每人心中的良知！
芥末蘸酱,5,2010-07-01 21:11:59,,12,每一次OOXX，都是对专制的一次反抗.
托尼·王大拿,5,2011-10-05 04:22:53,,11,一首献给好人的奏鸣曲
噗子,5,2022-01-09 01:17:40,,25,無數的人們含著熱淚看完了這部影片
xsent,5,2022-11-14 14:05:24,浙江,19,两人有种默契，互相被改变了一生却从没有直接的交流。这样冷静的地方很喜欢
糖罐子.,4,2018-06-29 15:27:28,,15,那双深邃的蓝眼睛后面，藏着一个德国人静静的温柔;虽然他头发不多个子不高，怎么都不出众，虽然整部电影里他都是那般严肃不苟言笑，虽然现在这个演员已经不在人世，我却深深被他吸引，被影片里他所展示的良知与慈悲所感动着。献给HGW；个人的过去在国家的历史中终究化为尘埃。
Doublebitch,4,2010-08-14 10:35:31,,19,没有想象中那么震撼，但确实是部无法挑剔的电影，意料之中的结尾
Roronoa,4,2022-11-15 22:31:05,上海,21,不知道现在看这本片，感动的人还和十几年前一样多吗？我觉得这是一部童话，现实中的可能性就像网络sc会放你一马一样低。一个干了好多年的资深老员工兼教师，为什么突然福至心灵，被艺术感动做起了慈善？童话是美好的，现实是残酷的，看过就好了，我没有发自内心感动到，因为我不相信它成立。披着严肃的zz批判外衣，里面是一厢情愿的天真。最惨的是女演员，她要是不死，那几个倒霉蛋都得完。一开始教室里的有人性学生和老师最后一起拆信，有点好笑
连城易脆,5,2014-01-08 12:33:02,,8,我希望也有人将来会送我一本《好人奏鸣曲》...
林溪,5,2021-04-19 21:26:12,,18,很优秀的一部影片。震撼！
米尔,5,2022-03-12 20:06:52,,43,希望历史不要开倒车。
玻璃海苔,5,2023-02-26 13:26:54,江苏,31,献给好人的奏鸣曲；很久没见过这么含蓄漂亮有余韵的结尾了
朝阳区陆依萍,5,2015-12-12 21:51:43,,20,电影资料馆14排17座。原来真得好看到爆炸，都看哭了！！！查一下资料，男主离世了，又哭了好一阵子.....
汪金卫,5,2009-11-06 22:56:03,,15,【中国电影资料馆展映】6年零9天前，在被窝里小MP4上看这部片子的我不会想到今天能在（一个同样极权的国度中的）大银幕上再次欣赏到这部经典电影。即使是体制内的机器（《1984》《我们》），同样能闪耀人性的光辉。诚然，电影是很理想主义，现实的东德并无这种事。但它能够唤醒每人心中的良知！
福原躁象,5,2020-08-24 22:31:38,,17,给五星，为了最后一幕的鼻头一酸。情感表达得很克制，没有过分丑化，也没有过分煽情。维斯曼好孤独啊，孑然一身，只能偶尔叫个妓女发泄下个人欲望。他不想再当扼杀别人的机器了，而那本他拿走的诗集，流淌出的美妙词语，让他感受到自己坚定的价值观出现了崩塌。以前觉得扉页上写的“献给某某某”实在无聊，现在能够理解它的分量了。（PS：柏林墙倒塌后，柏林突然就这么开放了吗？德莱曼居然能随意查阅监听记录。）
冰红深蓝,4,2013-08-01 19:57:46,,7,很感人，极权主义下的众生百相。人性、爱与背叛、欲望和自由
腻歪,4,2022-10-15 09:21:51,天津,14,女性的命运太惨了。被侵犯、被捉弄，连成为英雄的机会都没有。
固力猫,4,2022-12-29 19:24:29,北京,12,经过漫长的三年，已经无法以平常心看待这部电影。但凡集权体制内尚存哪怕一个良心未泯之人，现实都会变成童话。
五花肉,2,2011-11-13 14:59:59,,20,这个特工也太没职业道德了典型的叛徒
SELVEN,5,2016-11-06 13:25:13,,8,85/100勇敢的去做对的事情，即便是在一个看不到光明的社会里。
翻滚吧！蛋堡,5,2011-08-24 00:06:02,,12,在巨大国家机器下沉沦，压抑、却又能闪烁着人性和自由的希望，献给好人的奏鸣曲，HGWXX/7演的好好！
帅X,5,2023-03-26 13:54:18,美国,19,“这本书献给那个荒谬的年代，献给我最亲爱的导师，雅斯卡，献给那个次次救我于水火而从未谋面的你，我的朋友。”
陆钓雪de飘飘,5,2020-09-05 12:30:30,,12,《他者的生活》，我喜欢静默中的真理与沉闷中的真情。
柠檬海盐,4,2017-05-15 23:00:49,,8,很不错，一级棒，推荐，好看，棒棒哒
张大水,5,2012-12-07 13:57:37,,136,看到最后一幕书的扉页写着献给HGWXX/7就落泪了。
17950,5,2007-01-09 20:53:25,,3,表演9分，导演8分，音乐和镜头的配合绝赞，9分！！OriginalMusicbyStéphaneMouchaGabrielYared
做兔子还是做人,4,2021-12-09 21:47:42,,11,美国棱镜计划里有没有如此良心的窃听者？
思路乐,5,2019-02-07 20:55:49,,8,【A－】可以说是一部温情暖心版的《1984》了，一份电报，一本书籍，代表了两人之间胜过千言万语的那种情谊。但不得不承认，这样一个看上去无比真实的故事，却是虚构的。不知道这样到底是为了安慰，还是为了讽刺。
AAA二流观众,4,2018-10-24 01:54:19,,6,自杀是对一个黑暗时代的最后抵抗。
momo,5,2016-12-03 12:19:31,,9,电影立意深刻，直指政治，发人深省。男主的演技我是服气的，但艺术家夫妇的表演让我很出戏。前半部分的节奏有点慢，画面的美感还需加强。
有心打扰,5,2010-11-28 19:34:33,,6,友谊，有时候超越生死，难能可贵的力量。
曾于里,5,2011-08-11 08:39:22,,13,2007年奥斯卡最佳外语片。献给好人的奏鸣曲。主演大叔2007年便去世了，太可惜。
乌鸦火堂,5,2009-07-29 03:10:53,,17,个人看过最好的片子之一
一只麦麦,4,2010-07-13 15:43:43,,5,极权之下人性的觉醒与挣扎
悲辛無盡獨行夜,5,2012-11-09 13:10:30,,4,SomedayYou'llBeaStory，《德国史》作者认为《窃听风暴》过于冗长煽情，刻意强调夸张斯塔西在东德的地位，不明历史真相的观众容易被可怖故事所蒙骗，以为这就是大多数东德人的日常生活写照，又说不熟悉历史但理解力正常的观众也能看出情节漏洞，而最大漏洞是男主所起作用严重缺乏历史真实性，据说监狱博物馆馆长拒绝了导演拍摄请求，因为剧本不符合史实：整个东德历史，像男主那样“良心发现”的斯塔西秘密警察一个都没有，
时以星,5,2014-08-30 21:59:32,,7,十年前一部《再见列宁》，现看一部《他人的生活》，都同样被撼动到无法言语。大爱这深沉醒觉，胜过千言万语。
