user_name,star,comment_time,geo_ip,vote,short
Tom Hanks,5,2016-11-24 09:05:45,,4,“国家，证人所说的国家到底是什么？大韩民国宪法第一条第二项，大韩民国主权属于国家，所有的权力都由国民产生，国家即国民。但是证人毫无法律依据，一味强调国家安保，就把国家镇压践踏在了脚下，证人所说的国家只是强制取得政权的一小部分。难道不是吗？你是让善良无罪的国家生病的蛆虫。”
美好时光只为你,4,2017-04-25 22:15:23,,4,这是一部基于真实人物而改编的影片，拍的很真实，引人深思有代入感。
🐖🐖🐖🐖🐖🐖,5,2014-12-06 22:41:12,,2,这才叫燃吧。
Pluto,3,2020-05-06 21:27:48,,4,剧本不太行，整个故事推进都莫名其妙，贪财的律师怎么忽然转变成了维护民主主义的正义使者，即使是宋康昊大叔的演技也不能够说服我。前半个小时都是废戏，对主体叙事毫无帮助，调查真相法庭辩论这部分节奏又太乱，大叔与被告的关系太刻意，人物不是纸片人就是工具人，根本撑不起来。如果不是最后一幕，如果不是社会意义重大，三颗星都不值。豆瓣250这个高分着实太虚（其实这个排名放1987更合适）。
Yeoman,3,2018-09-05 14:12:53,,5,前半段卢武铉的个人奋斗史感觉拍的不错，等到后半段抗议、法庭审判就太多套路，过于平庸了。
yuki,5,2014-03-20 15:45:39,,2,看完以后心底是一片荒凉
杨三恨,5,2014-07-19 02:33:47,,4,看过之后突然想有个信仰，毕竟这是电影，现实中我们的正腐让人绝望，无力感太强，只有信仰是精神上救命的稻草
栗子拿铁,5,2018-07-08 23:26:58,,5,“能独立地表达自己的观点，却不傲慢，对政治表示服从，却不卑躬屈膝。能积极地参与国家政策，看到弱者知道同情，看到邪恶知道愤怒，这才算是一个真正的公民。”
一碗冰粉,5,2022-11-30 10:55:51,上海,23,因为真实，所以动人。因为敢于直面历史，所以钦佩。那时的韩国和此时此刻的我国，又有什么差别呢？
对儿勾,4,2017-09-24 23:05:26,,2,题材高于内容，内容高于形式，形式高于演技，立意很好，辛苦了
皮皮的皮神,4,2015-02-15 21:29:43,,15,女生一般对政治不怎么感兴趣，但看完之后，竟然泪流满面，心怀大义。不得不越来越仰慕韩国对文化的开放程度，什么时候我们国家也可以对艺术更加开放就好了
叶洲,3,2019-06-17 05:59:01,,2,内容本身还是个人英雄主义和煽情为主。题材高大上，其社会意义值得肯定。我们别只顾着对比，脚踏实地第一步，争取让从豆瓣消失的各国电影少一点。
大灰狼的兔,5,2016-07-23 01:39:00,,2,真人真事改编，杨宇硕导演处女作。处女作惊艳不稀奇，处女作有碰触禁忌的魄力、宽厚的思想和视野，才值得尊敬。向韩国最低学历前总统致敬（虽然其人生结尾令人叹息）。向所有为追求民主，义无反顾的坚定致敬。ps，政治最大的牺牲，永远是学生和平民。
凉,5,2019-03-16 21:17:55,,3,每个国家都有她的原罪，而我们何时可以正面直视它呢？
肥匪廢·老🐰,5,2014-09-12 10:02:45,,5,@abibdy推荐的根据前总统卢武铉生平改编的故事，影界良心，韩国电影的社会责任感让电影敢于担当与直面，足以让天朝现在的卖座大片羞愧。斗士精神永远激励人心，年度最佳韩国电影，非之一。
你的益达,4,2014-04-01 16:45:31,,5,唯利是图的丑陋律师被冲进来的警察打破太平梦，可怕的转折。到底这个国家我该怎么去爱他，难道移民出国就可以一了百了吗？给出的答案是唯有用热血与咆哮来捍卫。可怕地想一想，这个新晋中产如果没有那汤饭的情缘，可能就会一直犬儒下去，坐在电视前笑骂学生的无知。感谢这温暖的汤饭，正义是互馈的。
YoyoRan,5,2015-09-13 18:04:51,,4,以后再也不歧视棒子了.....
羽落,5,2023-04-19 23:16:34,山东,20,当鸡蛋碰石头的时候，要给鸡蛋打五星
泽帆,4,2014-04-27 21:51:03,,3,让人动容。韩国电影太牛。
13@甜梦里,5,2016-02-17 14:47:02,,4,最后一幕太燃了！！望向我天朝
电影狂魔,5,2018-07-08 13:35:31,,6,药神的主要抄袭对象
xx@百年孤独,4,2014-05-10 21:28:51,,3,Democracy从来不是跪着生长，也不是有钱人才能追求和享受的东西。每个人不从自身努力，它永无来到的一天，而你，永远活在未知的恐惧
Lonely,4,2017-10-16 19:51:01,,1,8.0/10分。初看，蓝光。本片基于韩国第16任总统卢武铉1980年代的经历改编。。。吴达洙可能是韩国影视界第一丑男了，脸上那2颗大大的黑痣，让宋康昊都变得好帅。。。
张腾森,3,2014-03-07 21:41:41,,4,即使岩石再坚硬也是死的，鸡蛋再脆弱也是活着的生命，岩石最终会碎成细沙，而鸡蛋终究会孵化越过岩石
最后一代沉树,5,2014-05-09 13:35:54,,3,真是應了那句話。人家有改變國家的電影，我們只有改編電影的國家。盧武鉉和阿扁，韓國和臺灣。不可以這麼過分啊……
自然天下雄,5,2023-01-14 20:06:11,河北,18,有些国人讥讽韩国人：“虽然喜欢拍电影揭露现实丑恶和社会问题，但是社会还是照旧，问题并未得到根治”，我觉得不然，就算这样的电影不能立刻改变现实，那也是燃起了一个火苗，放出了一点光明，迟早能够汇成巨火，焚烧邪恶，让这个社会变得美好一点。所以，能够拍出针砭时弊的电影，当然是值得佩服的，因为勇敢的发声指出错误，是改正的第一步！放眼世界来说，韩国的人种和文化跟我们相似，很多社会观念、个人理念也都相通，韩国电影这面镜子，本来是韩国电影人用来反应韩国社会的，但是我一个中国人见了，却也感同身受，心有戚戚焉，就好像那个镜中世界，是把我身边的某地某事某人摄了进去，剖开给我看。这么好的镜子上次看到还是高山下的花环。客观讲这部电影瑕疵不少，前半有些冗长啰嗦，后半又有些简单粗糙，真实水平就7分，可立意难得，加2分。
蒼間,4,2015-05-14 12:04:25,,4,国家到底是什么
陆钓雪de飘飘,5,2020-09-04 01:31:04,,5,第二天收了钱我们从北京离开在中山路下了车抽了一包中南海我说中南海的烟草真好抽像极了毛的雪茄你说是的
EVA_征服天堂,5,2016-07-14 03:17:23,,3,无需多言，满满戳中天朝子民的要点！
文森特九六,5,2014-03-09 19:13:38,,4,华语电影与韩国电影在创作勇气上的差距于本片中体现得淋漓尽致，宋康昊神演技全开，结尾煽情煽得恰到好处
粉皮儿,4,2016-01-30 19:21:32,,2,评分这么高，大概大家心里都有种望尘莫及的遗憾吧。
罡,5,2015-01-12 13:54:07,,2,“想让我的孩子们，还有你的孩子，不要生活在这种荒唐的时代。”这句话每次看到就有点眼红，因为我这辈子印象最深的一句台词几乎雷同：那是一部讲述广场的纪录片，记者采访白衣少年为什么走上街头，他回答“每每想到今后几十年，社会还是在这个状态下运行。就觉得有责任站出来！”....片名《血路》
荒野侦探,5,2017-10-11 22:44:14,,5,当你做完辩护人，你又去开起了出租车。
Reader,5,2014-10-18 15:36:22,,2,当时韩国是否采用对抗式刑事司法制度等等，不重要。重点是历史是对抗式的，大家竞争话语权。但政治案件的刑虐加害人，一旦失去权力，纵已移民海外，都是隐姓埋名，没人有胆量站出来辩解。因此，如果本片和其他可期待于未来的同类作品有夸张失实的毛病，那也是加害者害的，他们逃避历史，拒绝真相。
F.C.,5,2015-02-17 22:05:54,,2,纵使有以卵击石的勇气，也要有奋不顾身的行动啊。
李九弟Jody,4,2014-09-14 22:06:31,,5,剧情什么的都无可挑剔，就是觉得韩国电影的编剧都有点模式化...
做梦的猫,NaN,2015-01-31 09:58:26,,3,韩国的爱国主义教育片的拍摄技术也如此纯属了～
Vamei,3,2016-03-19 02:39:14,,3,感觉被人家拉下，用来做参考吧
夭八,4,2015-06-27 00:25:02,,2,能够同时生产韩国电影和韩国电视剧的韩国实在是一个博大的国家啊
寒江雪,3,2014-05-13 20:03:46,,1,饼脸叔的演技没的说，题材也相当有争议，虽然是根据真人真事改编，但动人之处一点都不含糊。不过前半断宋佑硕的经历，还真得有点像宋康昊演的《总统理发师》，有种人被命运推着走的感觉，但后面就完全打破这种感觉。
惘然,4,2017-10-13 14:12:13,,2,法庭的胜利不是胜利，只有真相的胜利才是胜利。
途经一个你,5,2017-07-21 21:46:43,,3,岩石再坚硬也是死的，鸡蛋再脆弱也是有生命的。石头最终会化为沙土，而鸡蛋孕育的生命总有一天会飞跃石头。
动作院线,5,2022-11-16 16:28:24,湖南,1,令我几度落泪，但最震撼的，并不是感人，而是通往光明的那条路。
周予樟,5,2017-06-13 21:47:11,,2,比《熔炉》还要《熔炉》。
大头绿豆,4,2018-07-10 00:18:39,,7,照了照镜子，自惭形秽。
烏滌非,5,2014-08-31 15:55:24,,2,哭到現在手還是抖的。宋原本是個聰明安全賺著錢的律師，讓家人過上更好的生活，民主運動只是大學生們的無用功。但終有一天野蠻的公權力之火燒著了他，蠻不講理的政權毀壞著國民和他家人的未來，他終於執起追求真相與公平的法。官司輸了，但他為這個國家贏得了更多肯為民主站出來的辯護人。
豆友35496190,5,2014-08-20 23:33:56,,4,羡慕又敬佩韩国的电影人，羡慕也敬佩允许这样电影出现的政府。一个敢于面对错误过去的政府，一个小我可以改变大法的国家。电影有震撼人心和发人深省的力量，我们的电影以及媒体应该学习他们。
暴富的女孩是我,5,2017-02-09 00:19:16,,2,想看看公义和强权最后谁能获胜。
kindsos,5,2014-04-05 18:48:57,,0,看完了。只能呵呵后了。
Sarcophagus,5,2014-08-10 00:51:31,,5,主旋律鸡血片。
马猴烧酒00,5,2022-03-31 20:57:43,,22,后半段比前半段精彩很多，我讨厌暴力机关的原因就是他们以为自己站在正义一边，实际上只是站在石头一边而己
Q·ian·Sivan,5,2016-12-15 05:21:19,,1,「岩石再硬也是死的，雞蛋再弱也是活的.岩石最終會碎成細沙，而雞蛋終究會孵化越過岩石.」「在民眾無法行使自己法律權力的時候，作為法務人員更應該走在最前面，這才是真正的法務人員的義務.」
hazy,5,2018-07-21 22:13:41,,4,南北韩，像一对双胞胎被不同的人家收养，相同的基因，走上不同的人生道路
Obtson,3,2014-03-07 12:49:24,,4,光州事件之后，六月民主运动之前，韩国政治民主涤荡期摹状貌。围绕个案去披露独裁公权力的恶，祭奠历史车轮下的伤口、鲜血与牺牲。这样的平反片韩影近些年并不少见，本片是作者转型处女作，难免更侧重文本构建的影像逻辑，而稍带出一丝情感刻意。当然，饼叔还是那么赞。
悟之道,4,2014-03-13 22:49:06,,0,勇气可佳，小人物耗动大事件
大艺术家,5,2017-01-01 18:42:20,,1,指示广电总局！
End、,5,2018-07-06 14:56:12,,7,看了我不是药神后，很自然的想起来之前看过的这部电影，韩国似乎一直很擅长拍这类电影，而正是这类电影推动着人们的思考，和社会的进程，也是中国电影人需要去做的责任。
Silly cat,4,2016-07-24 05:51:55,,1,主角刻画得特别赞，结尾也收得恰到好处。看完更相信正义的火苗依然存在于大多数普通人的心中，然而强权之下，只有极少数人愿意用它在黑暗中点亮火把，他们是这个世界的光。
把吴钩看了,5,2018-01-28 22:37:19,,2,满分是给电影以外的东西，尤其是21世纪已经过去近二十年，还发生了中大读书会事件，更令人唏嘘。庭审情节几度令人涕下，为黑暗中还坚韧发出微光的人们感动和赞美
又又,3,2014-06-15 13:42:37,,3,男主突然变得如此正义，转变太快，电影正反方对比太鲜明让人感觉简化了很多东西。不过韩国人能通过拍电影改变社会，真的挺牛逼的。
大高粱,5,2023-04-12 22:48:00,上海,2,那天还看了另一部电影，边看边哭。接下来的日子，都是历史。
★,5,2017-10-06 15:31:59,,1,最後一場戲，宋康昊認真眼神對著鏡頭的時候，就足夠滿分了。可以多看看電影背後的故事，朴槿惠讓宋康昊上了黑名單，宋康昊的原型是盧武鉉。政治這事兒吧，非敗即亡。
grqx,4,2019-09-22 07:27:04,,3,完全是平行宇宙的作品，啥都8说了。
鎮長,5,2018-01-18 09:28:55,,7,爭辯什麼是國家的時候都快哭了。任何意識形態，任意侵犯人權尊嚴，就是錯誤。要珍惜已到手的幸福。
哈,3,2016-02-10 18:13:30,,1,题材和表达的意义都很棒，可惜内容完全不对我胃口，煽情也太过头
榜上有名猫,4,2014-04-24 23:37:49,,2,前段铺垫累赘，后段激昂补足，平心而论电影不至于满分评价，但作为一个开放文明的国度敢于拍摄和上映敏感题材作品是值得赞赏的；他们肮脏的银幕是因为有洁净的环境，反衬我们光鲜银幕也掩盖不住背后的污垢。
对方,NaN,2018-02-14 22:56:26,,1,韩国总统个顶个奇人20200325重看法庭辩论的两种价值冲突让人难过谁是真正的爱国者？theyallpaidtheirlives这一个多月和父母的冲突也在其中
ycao,3,2017-09-13 14:49:21,,3,意淫片。就电影本身来说，也没什么特别出彩的。
莱尼圆,5,2014-11-01 23:32:44,,2,1981年釜林事件改编，人物原型卢武铉，个人挑战政府强权，题材的敏感程度让影片可看性极强。新锐导演杨宇锡用漫长的铺垫戏充分交代人物背景和性格，和之后摇身一变的民主辩护人形象形成鲜明反差，法庭激辩戏张力十足，还用了一个绚丽的长镜头。宋康昊一如既往，反抗极权呼吁民主正义的巨大勇气让人动容。我们从这个角色身上看到的是坦荡的人性和正义的光芒。
皮革业,3,2014-04-21 00:00:14,,4,看完只能感受到所谓的民族劣根了吧。
摸鱼居士,4,2018-03-21 18:47:31,,4,想起前天和舍友的一番谈话……在时代浪潮中我们的确做不了什么，但我们至少应该知道什么是对的，并为之而付出自己的努力。
jim,5,2014-04-28 21:46:01,,0,宋康昊
Se7en丶小七,5,2014-12-19 23:43:38,,2,至少你们还有庭辩的权利。
海扬尘,5,2015-01-06 22:49:36,,5,前半截拖沓，渐入佳境。努力吧！让韩国的今天成为我们的明天！
文白,3,2014-03-05 11:31:57,,1,思考再三，还是得给三星，狗血洒了一地是我喜欢的，但是，男主的艰难与影片关联实在不大，后来看花絮，知道这是卢武铉的经历，便明白为什么很少人对此有意见了，导演说不要对号入座，在我看来，这电影的出发点就是对号入座吧。
豆友130812889,5,2017-11-05 19:12:17,,5,几年前央视播了V字仇杀队，感觉好像什么东西要变好了，横向纵向对比看才知道是一厢情愿。村上村树“若要在坚硬的高墙与击石的鸡蛋之间作选择，我会永远选择站在鸡蛋那一边。”的隐喻虽然在某些特定场合会引人诟病，但是作为一种宏观的价值观很难不让人肃然起敬。宋康昊的演技表现了什么叫裂龇嚼齿。
一起吃地瓜,5,2018-08-01 13:34:54,,2,韩国电影真的是很敢拍了，这片子人性、法律啊都讲到了，胆子很大。
巽,5,2019-12-27 00:26:58,,5,从电影层面，只能给到3.5星。但是我给了5星，这显然是个态度问题。
听说桐岛要退部,4,2018-04-24 23:59:44,,3,论“敏感话题”电影，韩国真是业界的NO.1了
商夏,4,2014-10-02 21:19:31,,3,所有想要改变国家人的最后都会被国家改变，任何国家大概都是这样，国民即是国家。
淹然,4,2018-07-15 13:37:15,,1,一颗松动的螺丝钉，比如那个年轻的军医，就这样被碾压了……
无非,5,2014-08-07 11:52:36,,3,略煽情。编、导、演无可挑剔，再看卢武铉，令人唏嘘。
小晨,3,2014-08-01 19:26:18,,1,考虑周边，这是一部很了不起的电影，单从电影本身看，还好。我就是对韩国人小气的不行。
小蜜蜂嗡嗡嗡,5,2016-05-27 18:21:37,,5,韩国的禁书居然在书店可以随便买到。。赤色分子居然是可以公开审判的。。想说资本主义搞这种事情真是力不从心啊
猪头妖怪,4,2014-05-07 01:30:12,,3,是，比起当年的韩国，你更是武装到了牙齿，可是那又如何？墙垒得再高，也挡不住翅膀。眼闭得再紧，也遮不住黎明。
Irgendwann,5,2018-03-29 16:39:28,,1,很感动了。
齐自多,4,2018-10-18 17:07:07,,3,韩国电影里的民主，是整过容的民主。
小生影书,5,2021-06-06 22:48:06,,5,对社会的唤醒胜过了这场辩护本身的胜负
hitlike,3,2014-03-12 16:23:12,,2,当然你对影片强度会随着场面而不断增强欲望，但它总还不是令你十分满意，而且片头那句角色真实故事虚构的提醒还要给这种感受打折扣，理想主义。
故园飞鸟,5,2017-09-18 00:38:20,,3,比起韩影直接深入的挖掘，咱国产的那些隐晦表达全部弱爆了。
江声走,4,2019-05-04 00:21:00,,1,XX北定XX日，XX祭无忘拍出像这样（还有像TaxiDriver）的电影呀！
sirius_flower,4,2015-03-13 23:36:14,,1,韩国民主化过程的很多历史很值得学习，但对韩国电影美国化的这些尝试应该有更复杂的认识
RiverCheung,5,2015-07-22 12:36:30,,7,最后那个站立，让我想起了死亡诗社的最后一幕，虽然电影不同，主旨不同，但都代表了一种人格的站立，人性的站立，虽然前路艰险，但仍然怀有希望，饱含热泪。
泰坦,4,2014-05-10 22:17:25,,0,人们的执着和追求，令人动容。
沙漠中的西蒙,2,2014-03-04 19:42:17,,0,4分，太考验观众的耐心了。【分数范围4-5分】
老六,5,2014-08-17 12:29:32,,2,什么也不说了！什么也不用说了！每看一部韩国电影都会替我朝悲鸣一声
锅蒸之鱼,5,2015-06-05 16:52:14,,5,这部影片一经上映就在海内外引发极大反响，最终推动韩国政府正视历史。釜山地方法院于2014年2月13日对釜林事件进行了二审宣判，判决5名被告人无罪，距离一审判决时隔33年。影片最大的亮点就是结尾处法庭点名的长镜头，既克制又煽情。
qiannianyitan,5,2014-05-27 12:47:42,,1,羡慕韩国能够拍出这样的电影！！这是一部每个人想尽办法都要看的影片！！
黑樱桃摩卡,4,2014-04-05 19:03:04,,0,法庭戏虽然煽情但火候还好不至于让人厌烦，节奏张弛有度，饼叔又一次的完美演绎，郭道元是个很有个人魅力的演员~再再再再再一次的感叹韩国电影的审查制度~
王家祥悉达多,5,2015-03-24 13:50:10,,4,自由从来不是人家凭空给你的，你不可能等着他们自己醒悟，把自由交给你。自由从来是靠智慧、狡猾、想象力、耐心，经历残忍、漫长、不屈不挠的斗争，与那些保守的大家伙迂回、谈判、争执、吵闹，最后一点一点，从他们闭塞呆滞的手里，硬抠出来的。权利也是一样。
云城,5,2018-09-26 16:44:16,,1,历史下的个人，不能言说的痛苦与深渊中的希望
严箫玉,4,2016-07-05 14:35:54,,2,韩国电影总是能很神奇地把各种概念简化，追求民主简化成守护亲情，国家简化为国民。ps真是羡慕人家的审查制度啊，xx园都拍的那么隐晦了还被禁……
猫阿水,4,2014-05-09 08:44:29,,0,逆权大状！
脱氧核糖十三,4,2014-03-05 21:46:17,,0,跟預想不同，視角好正。
海通证券一泡污,5,2014-03-04 22:15:23,,0,太牛叉了，感动。
多情总被无情恼,3,2014-06-10 02:22:19,,0,结尾略长
小希写得完_,4,2022-11-28 15:36:12,上海,5,适合最近看的电影
默雨,5,2014-04-29 01:27:09,,3,《辩护人》，难得的好电影，此片陈述没有一项正义之业是从天而降；没有一桩正义之事是自然而来。非常喜欢这个结局，微此不足以彰显这般飞蛾扑火，投身饲虎的决绝之勇与坚韧之志。
字母君,3,2015-12-05 01:00:45,,1,优缺点都很韩式，可以作为韩片研究样本教材。
3❤22,3,2014-03-13 10:33:32,,0,结尾比较满意~。
虾米,4,2015-01-04 21:42:56,,4,法庭辩护拍得挺弱的，质证少而煽情多，是这部片子的软肋。
邪念,4,2014-03-06 00:54:34,,0,在煽动观众情绪这件事上，导演要粗暴得多。真羡慕韩国电影观众
conwei,5,2018-03-12 14:17:49,,3,我不要民主，但我要法治，要言论
终结者,5,2014-03-09 10:23:49,,2,工整的剧本，前一个小时铺垫，后一个小时升华。朴实的演技，诠释生活中曾经真实存在的一个人，不被其他非电影因素影响。听故事，看表演，电影的享受。
我不是天涯卧底,5,2014-05-07 23:37:25,,0,为自由
Danys ┇┇ 蓄须专用,3,2019-04-29 21:59:55,,1,须叔又游离文青之外了，看完没那么感动嘛[挤眼]以卢武铉为原型、对抗全斗焕反对政府的故事。律政戏，但前段写律师发迹太长了，没感觉不能压缩。后段政治斗争突出了矛盾，但对台戏远没想象中激烈、密集和伤筋动骨。最后男主还能好好地站台上演讲，已经很幸运了。要在我朝，政治斗争能这么便宜他？宋康昊演技是不错，几个配角也搭配，反派和被抓学生的戏也少，全落宋身上了
阿勒曼尼亚酋长,5,2014-12-18 22:44:47,,1,公平正义虽然总是来的晚一些，但是在良知面前永远不会迟到！
杜因克,5,2018-11-30 20:35:49,,3,神tm《历史是什么》是禁书，神tm卡尔是共产主义历史学家
深山夜读,5,2015-02-26 10:41:55,,2,几次看到热泪盈眶。。大饼脸大叔真是韩国标签
GS,4,2014-03-12 15:47:46,,0,又一反应80年代韩国军政政府时期的电影，以前总统卢武铉为版本，比起《华丽的休假》等以光州事件为背景，此片以“釜林事件”来诠释暴政下的人权与民主，虽没有枪炮下的惨烈，但法庭中被强权践踏的法律，反而令人感到另一种的悲凉与残酷。宋康昊的演技果然大赞，人物的几次转着把握的都非常好
徐老师写作课,5,2015-08-13 09:58:14,,3,饼叔演技爆棚，燃爆了。
hedgehog,5,2014-09-11 13:16:15,,3,没有想到催泪的最后一段竟然是这个样子的，泪奔啊。对信念和真善美的永不放弃
queenie,NaN,2014-08-15 00:46:59,,4,基本靠宋康昊一个人的演技撑起来的……想起《薄荷糖》里的80年代韩国政治案：薛景求演的转业小警察第一次刑讯政治犯，眼一闭死命砸下去，犯人失禁了，沾了一手屎。这时候初恋女友来找他了……
肚子咕噜够了没,5,2014-05-18 22:22:50,,0,演技就是演技。
Sofie,NaN,2014-08-17 05:53:13,,0,馬來西亞->吉達
Dr.Ray,4,2015-02-09 23:23:27,,2,基于真实事件的部分是令人动容的，而创作的部分在加工和煽情上有些过度，但总的来说仍是一部深刻入骨的好电影。值得称道的是前半部分对主角更真实平易近人的刻画，这里宋康昊的表演也功不可没。中间那个旋转长镜头屌爆了。依然要说里面发生的故事都差不多，我国啥时候也能有些这样的电影啊。。
饿霸地煮,4,2022-09-05 22:21:18,上海,3,重看有种人生如过旷野，大风怒吼的恍惚之感。人物设计上主角律师从一个既得利益者，社会规则得利方入手相当聪明。表面上市侩且利己主义，底层逻辑却是对建设公理正义世界的认可。而反派警察则从一开始就根本不相信国家的指令，但他又是一个爱国者，他的时间停留在朝鲜战争爆发时，一切都是战时状态。这场辩论指涉了东亚社会深刻的内在矛盾，无论是站哪方，有哪种思维你都会发现有深刻的共鸣声在生活的每一个角落响起。
Maverick,5,2014-07-27 02:06:38,,1,宋康昊演技不要太牛逼结尾不要太震撼哭了好吗（棒子政府真是弱爆了竟然还可以公审可以辩护可以有证人可以有外媒哈哈哈哈哈在某国直接吊起来打残读宣判书然后杀掉干净利索不留后患）
donkey,5,2020-08-01 00:03:12,,7,权利永远是争取来的，当你漠视身旁遭受践踏的人们时，总有一天你也会遭受同样的痛苦，希望有一天我不再是冷眼旁观的人，勇敢的站出来
国产凌凌期,5,2014-07-17 17:39:15,,2,总有一些人的处女作那么强悍。
豆瓣天后董小姐,5,2014-06-06 09:17:08,,4,斗争的越激烈，反思的越深刻。
曼靑,5,2014-03-10 19:37:52,,3,韓國人叫板政權的電影越玩越大。從永不放棄的律師夢想再到為民主主義而奮鬥的執著。並沒有被政治色彩渲染得昏昏欲睡宋康昊的演技簡直昰分分鐘都是在飚戲啊!!最喜歡最後一幕宋康昊因為策劃集體遊行而站在了被告席上法官宣讀辯護人的名單幾乎庭審現場都是律師多達99人也包括那些譏笑過他的律師。
密,3,2014-03-30 16:49:56,,1,“政治偶像片”
冰镇西瓜,5,2014-04-21 19:31:50,,0,有头有尾，触及某些敏感素材，收放合理
安蓝·怪伯爵𓆝𓆟𓆜,4,2017-01-25 23:26:29,,3,用良知呼唤觉醒是需要血和泪的历程。大饼脸系列豪华套餐之一
