user_name,star,comment_time,geo_ip,vote,short
drunkenstain,4,2021-08-26 22:36:58,,0,看卢武铉文字传记中。好多人说这部电影拍得有点啰嗦，第一幕过于冗长导致最后一幕的爆发无力，显得潦草，但要是我的话也会这么拍，因为这部电影拍的主体不是「事件」，而是「人」:本可以平稳康健地度过余生，这个前提一定要拍出来，因为它代表了大多人的选择。有了这个前提，才能让这个小概率的英雄主义更触发反思。片中发人深省的点：「国家」和「爱国主义」的定义（你是爱国；还是爱那冰冷的暴力机器）；鸡蛋和石头在对决中的胜负论；民主离我们有多近，有多远？这个电影背后的审片机制是值得研究的，珍惜它条目尚在的时候吧。或许每一个勇敢的人都被扣过「傻瓜」的帽子，英雄在成为英雄前并不知道自己是英雄，这才是他们真正伟大的地方。
唐澤雪穂,5,2016-05-31 02:25:38,,1,很好看的韓國電影值得再看--男主演技一流故事改編合理精彩完全沒有悶場多場法庭戲都很過癮深刻結尾相當感動光明(某程度來說我喜歡這種處理多於熔爐那灰暗悽慘的收尾)電影有一大亮點:男主的心路歷程描述細膩自然很有說服力我很欣賞~能拍出這種有著重大現實意義的電影真的很厲害
muzer,5,2014-09-08 18:13:53,,2,鉴于对当下极高的契合度，恨不得十星推荐
人気小圆头🔒,4,2015-01-03 21:51:36,,3,我们都走过相同的路，但却做出了错误的选择。
阿落,5,2014-05-23 00:53:15,,2,为改变书写一笔。
斑斓的花,5,2015-09-25 08:53:13,,6,是哪些人，燃烧起了你内心正义的火。
方Χ子,5,2014-03-21 02:03:08,,1,一部电影一首歌一本书一座雕像，如果仅仅是一部电影一首歌一本书一座雕像那他们便不会留存。为韩国能拍出并能公映这样的电影而欣喜，也为自己的国家不能拍出更不可能公映这样的电影感到羞惭。
光与影,4,2014-05-08 21:23:23,,0,看过JFK之后，其他的法庭戏都是小儿科……还有努力赚钱，以备不时之需！
Yuzu,4,2014-05-22 16:24:21,,0,前面剧情显得拖沓提前半小时进入剧情可能会更好好在后面一个小时节奏把控很好每次宋康昊在法庭厉声控诉我整个人都在起鸡皮疙瘩韩国近年拍了很多国内无法完成的敏感题材电影这一点就已经足够民主也足够让我们羡慕韩国导演敢于反思历史叩问真相检讨自身宽松的电影制作环境和审查制度是基础
小狼,5,2017-10-11 10:45:09,,0,看完出租车司机返回来看的这一部，都很震撼。
Leon Winters W,4,2021-03-13 01:35:06,,4,[辩护人]毫无争议是一部好的题材电影！但是很可惜并不是我看过最优秀的韩国电影。个人严格意义上和[寄生虫]比它只能拿四星。宋康昊老师在这部电影贡献了完美青筋暴起的演技，个人认为本部电影最精彩的辩论就是电影最后半个小时和警察局长两人博弈，对话台词堪称经典语录。但是说个缺点，个人认为相比[寄生虫]，[🚕]，[素媛]，[熔炉]这部电影稍微差点火候，这部电影主要缺乏大学生群体的形象塑造上。从影片一开头到结尾全部都是铺垫男主形象，他为什么要打这场官司，如何认识辩护对象，以及男主自己的角色弧内心转变。很可惜辩护对象老板娘和他儿子们形象稍微显得单薄。本部电影并不像[🚕]和[寄生虫]那样让配角也有血有肉，比如缺乏[寄生虫]那类富人家庭夫妇那种介于模糊的道德观念以及各种小人物自己的角色弧。
十三姨,5,2014-05-29 13:51:13,,0,导演的各种恰到好处加上演员的全情释放让整个片子温存又体现了价值。历史的呈现，棒子也可以做到不是催泪炮一样可以换来全五星的好评价。最后的点名结尾虽然刻意但是赞爆了！！！！
Ashes of time,5,2014-07-19 17:42:29,,3,石头虽然坚硬，但鸡蛋是活的！
夜第七章,5,2014-07-30 16:18:17,,4,最后一幕很感动！
韩非子——,5,2019-06-17 22:33:44,,1,原型是卢武铉光是卢武铉已经很帅了我们也不是没有相同题材的故事就是没法拍出来
叶酱,5,2017-05-19 21:12:55,,4,韩国这类电影真是太赞了，带劲
ken_zhang,4,2014-03-17 16:14:10,,0,再一次大赞韩国电影审查制度
苏句句,5,2014-05-17 13:40:03,,0,我们只能看着它意淫一下。
wakandawula,3,2014-07-24 20:11:45,,2,电影表面平庸，内在更是空虚，如此虚高的分数也许恰恰说明了国内单纯（yuchun）的有志青年们没有做好迎接真正民主的准备。近两年的韩国电影不尽人意，电影人更多的选择在题材上做文章，却忽略了电影本身的艺术和娱乐功能。2000年到2010年那种沉甸甸的佳作不见踪影。
乱,5,2014-04-30 00:13:46,,0,关于以卵击石的深刻解读。
膏膏,5,2014-04-28 22:57:59,,0,国家是一个非常恐怖的东西，因为你不知道它在什么时候压迫你。像朴镇宇，他只是一个再普通不过的平时只会参加读书会的害羞高中生，却突然在某个晚上被强行逮捕，毒刑拷打逼供被迫承认是反国家份子。这件事情能发生在他身上也会在未来某一天发生在我们身上。法庭戏有不少漏洞，但是前面的铺垫非常好看。
深蓝,3,2022-11-13 01:02:50,北京,2,本来预期非常之高，看完很失望，就这？主角傻白甜希望大家，感觉海瑞都比他机智一些，如此单纯能够与那迷人的反派角色斗智斗勇吗。革命不是请客吃饭，不是靠一腔热情就干成的，革命中最不缺乏的就是一腔热情。
陈大五,4,2014-11-15 16:29:57,,1,韩国人真是把类型片越拍越神了。
无为,5,2014-05-30 08:48:36,,0,正视历史才能拍出好电影，大赏，宋康昊代表了整个团队
桐斋,5,2017-10-14 20:26:41,,2,当之无愧的顶级韩国电影。东亚地区的政治文化，是否真能培育出运转良好且能有效促进经济社会发展的美式民主，至今众说纷纭，韩国目前的政治状况也难说已步入此列。但维持政府与社会的力量均衡，实现法治对公权力和社会力量的平等监管，应是文明社会的基本价值诉求之一。
无止境,3,2014-05-30 09:50:01,,0,韩国政治题材的电影越来越多，已经无感了。没有期待中那么好看，分数虚高。
卡列宁的微笑,5,2014-08-16 23:34:24,,2,导演只是做好了常规的叙事，但故事本身的力量实在强大。主角从一个只关心赚钱的中产阶级，到一个热心公共事务的人权律师的转变，对每一个专制国家中汲汲追求安稳生活的庸众，都能带来深刻的触动。他的变化是一种认知的断裂，是从自我设限、自我欺骗的个人生活圈子，走向更广阔更真实的现实世界。
小张,4,2017-03-11 16:37:59,,0,辩护人。
mariah,5,2014-05-14 21:12:40,,0,值了。
momo,4,2014-04-23 02:37:39,,0,在气氛营造上还是觉得不太够，宋康昊胖了←_←但是看完之后的羡慕嫉妒恨超越了电影本身，不仅要有拍的能力，还要有权力，现在我们先研究研究能力好啦。演妈的那位，每次见儿子时紧抿双唇目光坚定都好感人，果然妈妈是最伟大的后盾嘤嘤嘤。and电脑又该吹灰啦，给我个温柔的春假吧！
伊夏,4,2014-03-09 20:26:18,,3,孩子与政治的话题，很难不联想到另一种失语的境遇。【2014.03.10】
喜喜,4,2016-02-11 23:28:36,,5,以前我肯定会热血沸腾，现在不知道是不是真的到了“关我屁事”的阶段，到底历史上出现的这些人做的这些事，我不知道是对还是不对。
dd,4,2020-02-07 03:46:37,,6,看完之后刷到李文亮医生去世的消息。权力太傲慢，视人如草芥。
lydia,5,2014-05-26 22:44:09,,2,这片子好像是拍给我们看的，不是历史，还没有发生
heng,5,2014-05-10 00:03:09,,0,What'stheNationyoumentioned?Ifthisisnotthenationofthepeople，itbelongstoonlysomeonewhohaspower，violently.
Summerpie,4,2014-05-08 00:32:47,,0,能拍出这种电影并且能够上映并且最终改变判决（釜山地方法院于2014年2月13日对“釜林事件”进行了二审宣判，判决5名被告人无罪，距离一审判决时隔33年），而贵国连天注定都过不了审。
赟长成一棵树,5,2014-05-25 00:12:44,,0,敬畏那些真正有莫大勇气的斗士，敬畏可以自省历史的讲故事的人。
江湖遠人,4,2014-03-09 20:53:40,,0,法庭戏高能！#夯出奇迹#
次非,5,2014-06-10 11:01:19,,0,剧作好。
幼银,4,2017-10-12 23:16:59,,1,いつか、その日が来るまで。比出租车刻意煽情，最后的人海戏倒是一般，宋佑硕和盖世太保的对峙戏更戳泪点。その日、一体いつ来るだろう、長く待たせないように。
比多,5,2014-04-07 22:03:32,,0,又见大小眼。
蓝桥烧饼,5,2014-05-26 23:41:59,,0,是很好的啊
纯情小鹌鹑,5,2014-05-19 10:20:55,,0,一半時間憤怒一半時間傷心看完之後感動
十个斗的眼窝浅,5,2014-02-27 16:53:23,,1,自己当民工时建的房子，还能住进去，好励志。
温泽,5,2021-01-08 00:07:27,,1,这也是个成人童话吗？
Dipsy_Chan,4,2017-12-06 13:50:01,,2,现实的判决，有力的结尾。你为别人站出来了，以后才有人为你站出来。
鱼,5,2014-03-04 23:33:03,,0,戳中我点了TAT
Hushnore,4,2014-03-10 23:05:07,,1,很值得分析。
胡天柒月,5,2014-04-30 22:40:55,,0,这就是所谓改变国家的电影。
hyueeeee,4,2014-05-25 19:05:30,,0,鸡蛋碰石头，石头再硬也是死的，鸡蛋再弱也是活的，许久之后，石头化为细沙，而鸡蛋会孵出生命。
五十级皮神,4,2014-05-31 22:05:06,,0,又是一个悲伤的故事。
大脸,4,2014-03-16 08:45:05,,0,古美门来打这场官司就更好玩了
大旭,5,2022-01-20 20:27:28,,2,当一部电影里满满都是你的心里话时，你很难控制住眼泪，既为电影里的故事，也为这切身所处之地
doubankiz,5,2021-02-21 15:52:42,,2,鸡蛋会孵化然后越过石头，国家即国民，国安法是什么？
谁告诉你的,5,2014-03-27 18:57:43,,0,宋康昊可以拿奥斯卡影帝了
赵乘风他亲爹地,5,2014-04-26 20:48:00,,1,韩国总统卢武铉，我小时候听到过的名字
S﹫午夜飞行,5,2015-07-24 17:50:42,,2,一个人不需要倒下就能让更多的人站出来，这是最美好的结局。
yolanta,3,2014-05-29 23:49:16,,0,屡次看到中间就放弃了，韩国电影里，这很不寻常
DirtyCAT,3,2014-04-25 14:47:55,,0,前半段很好，后半段检察官是傻逼吧
轻轻飘雪,5,2017-10-19 14:28:36,,2,我衷心地敬佩，由衷羡慕能拍出这样的电影。泪目哽咽数次，感受到永不放弃的力量
nolike,4,2014-04-11 23:59:34,,0,挺在点上的，正义与信仰！韩国商业片越来越有美国味儿~
光年‖影视歌三栖民工,5,2014-07-10 23:02:20,,2,敢说话的韩国电影。主角最感动我的不是为故人之后打一场注定会输的官司，也不是顶着催泪瓦斯和飞奔过来的防暴警察声嘶力竭的民主分子形象，更不是片末点名声中主角不动如山的背影，而是主角买下房子后平常的说话和妻子抑制不住的意外。看到这有感而发，一个人哭得一塌糊涂
贝塔先生,3,2014-03-11 14:46:26,,0,总是戳到痛处。
阿吉娃娃,4,2014-04-17 23:29:55,,0,棒子国对此类司法影片可谓是驾轻就熟，只可惜《熔炉》珠玉在前。宋康昊果真是影帝，光站在那里就一身戏了。法庭辩论的几场戏挺过瘾，结局对宋大叔走上民权抗争的交代有点草率，没有字幕交代其中几个主要人物的结局有点小遗憾。
谢谢你们的鱼,3,2014-03-05 16:46:11,,1,前40分钟铺垫冗长，之后的庭审才是最大看点。总体来说不过不失，真实事件的震撼力与宋康昊的表演弥补了叙事的枯燥与节奏的缓慢，但并不算一部多优秀的电影。
无名氏,5,2014-05-18 00:08:25,,0,很赞，据说是以部分卢武铉的经历拍成的电影。。。超级喜欢主演，已成他脑残粉！
低端youyidifi,3,2014-03-05 13:09:32,,0,宋大叔演技不错
linsang,4,2014-05-01 19:15:57,,1,用结果判断过程我是不能接受的。成功的方式不止一种，岩石会随着时间流为细砂，生命会逝去，思想留存。这感性看电影最后的几场审判是个情感递增直至爆炸的过程；理性评电影法庭戏的力度是欠缺的，全靠宋大脸的独角戏，倒是前半段的铺垫做的很细腻，主人公情感上的成长与变化都顺理成章。
月半女史地板君,4,2017-11-29 23:37:36,,4,人物的转变和深度值得再细致一点，比如律师如何从一开始反对上街，到愿意成为辩护人。按照前面小人物奋斗史的叙事，这个伟光正的转变还是太突兀了。法庭戏也过于戏剧化。但还是得敬佩这样的韩国电影。
御膳廚房崔佛,5,2019-11-13 18:17:17,,3,非常熟悉因為就在眼前上演著
遇见彩虹🌈,5,2019-04-10 10:57:30,,2,从只顾赚钱的律师到维护国民正义的辩护人，觉醒的是良知。
小风一吹,4,2015-05-31 16:19:43,,1,再一次感叹韩国的电影审核真是宽！宋康昊在韩国演员里是没有敌手了吧。。故事很有感染力，如果正戏稍提前一点进就好了～
屿山,5,2014-03-04 21:47:12,,1,饼脸叔真的会挑戏，一个国民的自我修养，最后一刹那国家的翻云覆雨，最最后一刹那，百分之七十的律师到场辩护，人性大于天。真的非常好看。
暴走君,4,2014-03-14 00:34:53,,2,也可以取名叫“一个理想主义者的诞生”。会不会有下呢？“一个理想主义者的灭亡”
翻滚吧！蛋堡,4,2014-03-13 23:23:37,,1,宋康昊的脸太有戏了，从杀人回忆到这部的结局都是。二审的长镜头调度搞那么花哨干嘛！
三三,NaN,2014-04-10 17:56:26,,0,挺好的故事，过于煽情了
arlmy,5,2014-10-13 07:27:01,,0,10.12赞
付圣强,4,2014-03-16 21:45:06,,0,韩国电影《辩护人》根据前总统卢武铉真实故事改编，以釜林事件为蓝本来诠释暴政下的人权和民主，法庭上被强权肆意践踏的法律令人感到一种别样的悲凉与残酷。和《熔炉》想要传达的一样，以卵击石，不是写卵的脆弱，而是写卵的刚强。宋康昊力挽狂澜，奉献国宝级表演，最后一幕尤为动人。推荐给所有朋友。
维少,4,2014-04-12 18:31:14,,0,一部看完不知道说什么的电影。民主万岁。
时间煮雨,5,2014-04-13 15:43:00,,0,一天看两部这个韩国大叔的电影，百感交集。
NickyROி,3,2014-03-09 20:18:33,,2,客观的讲宋康昊是个好演员但又不能很客观的喜欢他的原因是：长的和我爸太像了！
少言,5,2014-03-22 23:57:54,,1,一切都那么熟悉，只是结局不同。不禁悲从中来。
幼獸,5,2018-02-19 16:39:06,,4,团结啊，同志们。团结才有未来啊。
ZLY,NaN,2014-04-19 14:44:44,,0,1、【牯岭街少年杀人事件】的结尾，广播里，一个个少年的名字。本片结尾，一个个律师的名字。有人死去，有人迎来光明。2、有些国家走过来了，可以拍法庭戏，告诉国民，你们可以为自己的权利，做的更多。有这样的电影，是国家强盛的标志。3、总得有人，做这样的事情，为后世，劈开红海。
tunight,5,2014-05-28 20:15:38,,0,这电影不专业，但是专不专业都不重要了
枯川满,3,2014-03-05 08:18:25,,0,以卵击石的斗士形象真实而悲壮，全力以赴孤注一掷，即便暂失自由，却似一盏黑暗中的孤灯一声死寂中的呐喊；为国为家为法，并最终是为人的尊严辩护。所以最后：“釜山全市142名律师中有99名为其辩护”，这是远比胜利更为重要的觉醒。宋康昊的法庭戏（镜头炫）太出彩了！与郭道元互飙演技也好看到爆！3+
peanutshuang,5,2022-11-05 13:57:05,美国,6,追求真理的道路往往是充滿荊棘的，所以堅持不懈的人才會讓人感佩。光榮在於平淡，艱巨在於漫長。同時還能看到惡的環境並不是一個人造就的，而是一群自認為抱著正確目的往正確方向行進或者不自知的人集體作惡形成的，同樣的正義也不是一個人就能達成的，片尾一眾律師為之辯護實在是太打動人心。但誰能說他們不是受到主角鼓舞而挺身而出的呢？所以勿以善小而不為，勿以惡小而為之。
夜空飞行的银鱼,3,2014-05-22 14:40:00,,0,7.0电影被高估、民主也被高估
蜜柑酱,5,2014-03-08 20:45:51,,0,前面的铺垫很励志，后面的辩护让人热泪盈眶。看完后去百度了一下卢武铉，只能说现实实在太残酷。
山鬼2046,5,2014-04-01 16:10:44,,1,偷偷抹了几次眼泪
davekozg,4,2014-04-12 14:57:02,,2,鸡蛋撞石头，任何时候我都支持鸡蛋#唉，天朝差距啊，sigh#
人淡如菊。无奈,3,2014-03-10 14:42:54,,0,题材好！饼脸影帝的表演倒是没得挑！就影片而言还是过于拖沓了，至少前半是太拖了！
SKY,5,2014-04-26 02:55:11,,2,他人经受的，我必经受。
思鄉の風,4,2014-05-24 18:15:30,,0,与时代与大环境抗争到底
林夕,5,2017-07-20 15:25:01,,2,德不孤必有邻，正义不寂寞
伞保护协会,5,2015-06-19 11:57:03,,2,看着难过。人家这一页已经揭过去了。。。
小雨,5,2015-01-04 00:54:44,,3,你国远不如高丽国
Eggplant,5,2014-04-11 10:16:14,,0,让人深思，对于一个至今还未过司考的人，好好反省民主和法治，国家和法律的关系。
温柔的小坏,3,2014-03-15 05:57:29,,0,骨子里还是一部为煽而煽的棒子电影，棒子对观众泪点的操纵已然炉火纯青；类似题材的智利电影《NO》显然就高明了许多；不管咋说，看到邻居家的小孩从及格线努力考了一百分，对不思进取的自家小孩就更加的恨铁不成钢了。
Lcy,4,2014-05-09 15:06:54,,0,最好少些煽动多些反思。
星季,3,2014-05-29 18:46:14,,0,前面墨迹剪了不少分，宋康浩牛逼。法庭戏看的热血沸腾，不过人物较多，话多字幕看不过来。不过不影响观影感受。羡慕人家
铅黄,5,2014-04-06 04:13:50,,0,关键时刻还得靠老外
Ghost,5,2014-03-31 18:14:17,,0,当个人与国家机器进行对抗，无异于以卵击石，但卢总统的经历给了这个命题一个截然不同的答案。撇去他日后的丑闻，早年的这段历史还是值得回味的。影片若非真实性的卖点，估计会鲜有亮点，宋康昊不愧为韩国第一影帝
meowmeowmeow,4,2014-03-19 19:00:52,,0,電影的現實意義大過電影本身
蓝霉沉皮,5,2014-06-07 19:55:38,,0,不管世俗，坚持最初的原则和正义总是没错的。宋康昊气场和灵魂演技完胜。
龙肥不buy,5,2014-03-08 01:18:32,,0,搞革命为人民不容易啊
偶然香芋,4,2014-07-28 15:48:51,,1,根据韩国前总统卢武铉的一段经历改编，电影一般，但是韩国在政治法治题材方面的开放让我们很羡慕。
路米內,4,2014-03-29 22:25:49,,0,对国人来说必定是一部奇特的片子：如不略知韩国民主化进程，很难从影片开场的隐晦琐碎中点明宋律个人视角抗争背后的时代深意；然而即便不了解光州，釜林等事件，一切的一切，我们都再熟悉不过，被迫退休的记者，吊销执照的律师。都说历史为胜利者所写，若人民胜利，就拍这样的电影，看这样的电影
桃豆无情哈拉哨,4,2017-02-03 11:49:48,,3,在满地六便士中，他抬头看见了月亮。
火星土猫,3,2014-06-07 23:30:21,,0,那些被催哭的理由，很理解。但是一切最终的答案，包装为一个精致的礼盒。打开之后呢。只是一个好故事吧。
中野独人,4,2014-03-10 12:04:18,,1,看到后来，不断的问自己，如果我是他会怎么办？
死亡食社,4,2021-04-08 12:21:16,,1,“在这种市民无法行使自己法律权利的时候作为法务人员应当身先士卒”胜在选材，演员演技也很有代入感。结尾莫名《七君子》😂得道多助失道寡助
吉诃德,5,2016-07-17 11:10:22,,1,太经典了，差点儿看哭，回去给妈妈分享下。即使岩石再坚硬也是死的，鸡蛋再脆弱也是活着的生命，岩石最终会碎成细沙，而鸡蛋终究会孵化越过岩石！所有学法律的都应该看下这部影片！
张翔森,3,2021-08-26 21:53:25,,1,对这种题材不感冒。不过，我还是喜欢郭道元的表演，不管他叫不叫郭道元。
零零后,5,2014-05-31 14:43:21,,0,看看人家韩国人拍的电影，再看看咱们拍的，你们这些拍电影的也好意思说自己拍的是电影……
Abby,5,2017-11-04 01:29:57,,1,还是要正义
木木大人,5,2014-03-08 20:35:30,,0,韩国前总统卢武铉故事改编。我去，竟然看的热泪盈眶
禾白,3,2014-04-27 22:53:50,,0,沉闷开篇，勇气激昂收尾，可能是看惯此类型剧的缘故总觉一般。羡慕韩国影人的无所顾忌。
tricky_V,3,2014-05-25 02:55:38,,0,过程不错。但这结局有点虎头蛇尾。
豆友1089826,5,2014-07-29 22:17:50,,0,当时韩国的法庭真是这种普通法风格吗？除此以外，每一个细节，我都能在我认识的维权律师们的经历里找到：被吊销执照、找不那么敏感的律师、被用技术原因拒绝会见当事人、黑监狱、被恐吓家人、被安排内部的人占满旁听席、无罪辩护或罪轻辩护的争论、组律师团，等等，每一个。所以我现在很难受。
Jus,4,2014-04-16 04:03:22,,1,“看到烂片会不满，能甄别出好坏，并愿意发出声音，这都是进步，在其他事情上也是同理。民主需要妥协，但同时允许有不同的声音。我们质疑，这是自由；我们苛求，是为了进步。一味归责于制度，不再抱任何希望去质疑去苛求的时候，就是我们亲手放弃了变得更好的可能性。”永远站在鸡蛋这边
touya,4,2014-03-21 19:32:14,,0,前半段宋律师如何起步描述的过于细致，进入主题显得有些温吞，倒也不失自然。宋康昊的演技在法庭上两个“大饼叔”对峙时显露无疑，激愤之下对国家的解释棒极了。这几年开始看一些韩国电影，思密达在现实主义题材上选择的勇敢度和接受度，我们需要多少年才能达到？
申由己,5,2019-05-17 23:18:02,,0,只想说，什么时候中国也能拍这样题材的电影，感觉有生之年都不会有。
拂袖斋客人,4,2014-06-04 09:35:31,,0,当我们为别人争取权益时，也是在守护自己的尊严；当我们关注他人的命运时，也是在保护自己的未来。
#RandomShuffle,4,2014-10-06 00:39:49,,1,真相太简单了，至于几次庭审的剧本都配不上厉害的调度。
孤鸿鸣,5,2015-07-28 19:10:30,,1,五分不够打的一部电影。
Creep,4,2014-05-31 16:07:13,,0,前一个小时太差了，典型的开头太啰嗦
塔拉胡,5,2020-05-24 20:42:09,,0,反向使用里面反派的一段话，来描述看完的感受，“正是有些人的战斗，让我们可以吃着热饭、伸直了腿睡觉”。而现实世界中，悲剧和故事都还在继续。#宋康昊演得真的好，每个人演得都真的好
齐柏林马车,NaN,2014-04-03 21:34:33,,0,很难不联想
要早睡啊minami,4,2014-08-27 19:10:06,,1,看完了，热血了流泪了。最难受的是，现在我们看着别国这样一部电影，看着影片里为了MZ而激战的那些别国民众，却觉得自己是当年晋惠帝询问“何不食肉糜”的那群饥民。
上将文丑丑,5,2014-07-17 00:20:22,,0,无比精彩，催人泪下
兔子暴暴蓝,5,2014-06-04 07:11:47,,0,太好看了
核桃佳子,5,2014-05-15 04:49:13,,0,从只顾着经营自己的生活赚着自己的钱的商人，变成一个忧国忧民的政客，仅靠亲情的力量是不够的～
口丕,4,2014-04-10 18:26:48,,0,法庭戏让人热血沸腾！最后的点名太太太煽情！
凤凰,4,2014-03-12 23:07:24,,0,宋康昊真是演活了以卢武铉为原型的“宋佑硕”啊！看这部电影很大一部分原因是因为宋康昊，但看完还是感觉这个故事很有劲头，虽说前段有些啰嗦，但还是因为宋康昊而从不感觉到烦，反而故事更加抓人了，一个有血有肉的主角还是很值得一看的。
豆友50809981,4,2014-04-11 09:14:56,,3,【B+】8.5.1.故事非常感人，结尾设计毫无抵抗力。2.宋康昊的表演非常精彩。3.人物设计上，主角情感及意识的转变是最引人深思及回味无穷的。而重要的是，这种转变在情节上铺下了无数次伏笔，丝毫不突兀。4.配角的表演特别出色，常看韩影韩剧的人都知道，里面很多人都是金牌配角。5.又一部类型佳作。
無需男人姐有手,5,2014-03-17 00:05:47,,0,越来越爱宋康昊了~
绿小野马,5,2014-08-20 22:36:48,,3,丝丝入扣的情节设计，每一处都很精心。看完像打了鸡血。改变韩国历史的电影，五星推荐。
邹逊,3,2014-03-15 20:15:35,,0,题材优势加宋康昊演技加持，使剧情上的生硬转变和新导演的稚嫩全都幸运的被掩盖了。用一个小时来建立宋康昊愿意当辩护人的可信度，却忽略了年代背景的阐释，，全片的法庭戏也只有宋康昊一人在撑，二次审理时的长镜头看似够炫实则多此一举，新证人的插入突兀十足，煽情也全靠结尾的面面相觑
了花,3,2014-03-08 16:40:12,,0,黑心激动不起来愤青快上
大旗,4,2014-05-10 20:02:36,,0,我们有改变电影的国家，他们有改变国家的电影。
MilkC★WOO,4,2016-09-26 17:26:18,,2,国家的安全是谁的安全？
