user_name,star,comment_time,geo_ip,vote,short
茗政,5,2021-02-28 18:20:09,,49,韩国政治惊悚剧真的牛逼！哪有万事胜意，人民怎么可能赢得了政府？看完只有震撼与感动，韩国电影就像膏药一样死死的缠着社会制度，把明面上的，大家都心知肚明的问题表现出来，让更多人知道，但同样也能立刻见效。素媛让韩国修正法律，熔炉让整个社会进行反思。片子里对于国安法的抗争，对于军事霸权的讽刺针针到位，这片子都能在韩国放映真的值得反思，可是想想，既然能公映，有没有可能又是财阀集团亦或是政府洗白所用。让大家以为自己民主，自己开放，自己敢于面对问题，敢于修改。可实际上依然是表面一套背后一套。电影是能反应现实揭示现实，甚至改变现实，可是仍然是资本的产物，刮痧罢了。「个人电影top10」
LORENZO 洛伦佐,4,2014-10-18 03:04:36,,4,很勇敢，个人很喜欢。
丁一,NaN,2018-07-23 20:54:04,,8,除了说话，别无所求——高银
seabisuit,4,2014-09-09 01:04:53,,7,明星推荐后分有些虚高，大脸叔也只是维持高水准，配角都很出色，新人导演惊艳，设定走向太明显无悬念。有许多国家类名词的科普，为了下一代这个说法很正，当然在我国也只能是键盘侠们逞威，看看你们是怎么看香港台湾的，环境都没敢自己去创造的也就不要再赖了，律师他们在微博里好多都是段子手或营销号。
東郷柏,4,2016-11-25 21:35:01,,6,8鸡蛋与石头；一部成文宪法对国民与国家的重要性
某四,4,2017-09-15 10:14:53,,6,大大地感动了一下，然后深深地悲哀起来。亲亲宋康昊的大胖脸。
美好生活,5,2016-11-10 15:31:26,,19,这是一部在努力淡化政治的电影。只要是韩国人都能看出来影片是以卢武铉作为原型创作的，但创作者刻意虚构了人物，将主角塑造成一个对政治漠不关心，一心挣钱的犬儒。
17950,4,2014-07-07 00:39:24,,7,“賺到點錢，你就覺得世事完美了！？”
Morning,4,2019-08-29 18:02:01,,8,写人物很值得参考的电影，宋佑硕这个角色和辛德勒一样，是以低处起家，靠着自己打拼到世俗的成功，而后在人类大事件中熠熠生辉，电影直到50分钟才真正的接手后来的赤色分子的案件，在前50分钟里，对于人物的塑造确实一个相当精彩的过程，用生动自然且不刻意的事例，完整的呈现出主角的变化和成功，更加把进入案件之前的性格做得有血有肉，铺排起来也相当自然，绝不是那种讲究场场戏分工明确的商业写作，而是像有无形针线一样巧妙的编织在一起，也因为如此，在后半段并不算复杂的法庭戏中，靠着宋康昊的表演与宋佑硕的角色光芒结合在一起，主宰了电影相当大的一部分成功。
科林,5,2014-06-04 23:50:26,,4,谨以此片献给所有想要、将要、即将、正在和已经通过司法考试的孩子们，加油！本人对于该片的评价是：满分！！！
圆首的秘书,3,2014-05-18 04:23:20,,8,这真的是一部很难评价的片子。人物十分单薄，剧情十分狗血，表演大喊大叫，煽情不遗余力，除了宋康昊本人，这个片子可谓一无是处。事实上，作者的“勇敢”根本谈不上，因为那些不仅是往事，而且是敌我矛盾，所以展现起来根本不费力。这就是一场除却暴力的革命，但它的仅有的一点魅力也恰恰就在于此。
阿德,3,2014-03-16 00:07:07,,5,居然是以卢武铉为原型，分过高我来拉低点
Leonor-dhjajp,5,2023-07-01 21:47:34,四川,19,“国家，证人所说的国家到底是什么？大韩民国宪法第一条第二项，大韩民国主权属于国家，所有的权力都由国民产生，国家即国民”
余小岛,4,2014-06-22 00:16:24,,14,每次看韩国这样的片子总是不由自主得联想天朝。。。
连城易脆,5,2014-08-01 22:53:07,,22,最后的结尾真的触动人心，令人头皮发麻，四肢颤抖。宋康昊的表演着实到位，人物塑造得极好，电影叙事节奏也相当出色。只可惜这样为民请命的卢武铉也被欲加之罪逼得只能跳崖身亡，然后多年后再由自己的好兄弟好助手帮忙报仇清算，但是背后的财阀却仍旧岿然不动。这就是韩国政治的悲哀，电影其实并不能改变国家，只能成为某种宣泄的工具，或者反过来成为政府用来开脱的借口和挡箭牌。
支离疏,3,2014-04-05 21:26:04,,11,很一般，评价虚高了，不能因为主题正点或者深契人心就给五星，从整体水准来看，三星足矣。
火娃,3,2017-08-06 03:45:05,,9,7/10。汤包饭贯穿了宋佑硕人生轨迹，即使再阔气、助手厌倦频繁光顾仍不忘老板娘的人情债，塑造出一个亲民又享乐主义(不认同大企业高层说的资产阶级革命论，与不敢开口的媒体同学冲突)的律师，阴蓝的审判屋(冤屈)与阳光下的法庭(真理)冷暖色调对比，结尾迎着烟雾冲到集会前面、白色囚服代表其圣人形象。
Fly  Away,5,2023-01-08 23:48:51,重庆,19,法庭戏太有感染力了，结局被震撼感动到失语，一涉及这种严肃历史，电影就拍得特别直击心灵，一场面向警察社会乃至国家的宣判，勇敢的是辩护人，黑暗的却是整个病态社会思想，其实电影背景在我国近代是发生过类似事件，但韩影确实厉害在于敢拍敢做，也不要说什么“拍了不改”，多少影视就已经改变了韩国法律，说回电影，无数次被宋康昊的台词所震撼，因为这场战争不仅是压迫反击的正义之战，更有一种以卵击石在黑暗中步步前行的激愤与宣泄感。“国家是什么？国家属于国民，所有的权利都由国民产生，国家即国民”，再次为国内电影充斥喜剧片感到悲哀
肖浑,4,2014-11-26 21:41:32,,7,开头再次忍受不了韩国片一贯的浮夸拍什么都像在拍喜剧，还好坚持看下去了，然后就被煽到了。镇宇的部分再丰富一点会更好。
阿巴厮,4,2014-03-09 12:01:21,,9,又被别人给拍了。
影随茵动,5,2014-05-12 09:42:22,,11,《熔炉》之后，又一部伟大的极具社会责任感的韩国电影。
番茄炒蛋不加蛋,5,2018-06-23 22:51:21,,6,感动于律师前后的转变，为平等和正义发声
李濛Lemon,4,2014-07-18 12:54:31,,6,几年前村上春树在耶路撒冷的获奖致辞中这样说道：“无论高墙是多么正确，鸡蛋是多么地错误，我永远站在鸡蛋这边。”这一次影片中关于鸡蛋和岩石的比喻再次令人触动。不谈影片质量，电影的态度和现实意义就已经超过了电影本身，韩国人的自省精神让人感动。
Jackie-26,5,2021-09-10 00:16:44,,15,如果有一天，在这里，也能...
焚紙樓,2,2014-09-28 03:09:48,,6,一部關於勇氣的電影：戲內劇情呈現了過去韓國鬥士的勇氣，戲外效應則反映了當今韓國影業的勇氣。戲裏戲外，皆有可觀。不過去除掉這種歷史評判的眼光，單看整部電影本身的劇情光輝，不得不說還是拍得略為冗長了。有些橋段設計的好例如飯堂大媽與結尾的全國律師大集結，串連這些好段子的部分卻太雜了。
琧婯,3,2014-07-20 15:02:17,,4,这样的社会不应当存在，可它就存在了从人类诞生开始就存在了，就是这样的社会让卢武铉最后跳崖了；对于普通人来说还是装糊涂吧，或者像宋佑硕身旁的律师会长那样偶尔爆发一下吧；这片子感觉一般般，煽情指数和表现力都不够，豆瓣的逗比无非是又可以指桑骂槐自high了
古尔浪洼,5,2014-08-27 15:46:12,,15,很喜欢这部电影。说实话，韩国近几年的电影水准提高的速度，让人侧目。这类题材，这样的深度，我们确实是很难拍出来的。
Helicopter,4,2014-05-10 15:37:10,,7,剧情浓缩了极权社会民主抗争故事的所有必备元素：洗脑、暴力逼供、镇压、威胁、污蔑vs.正义、良心、坚持、人心所向，但最让人羡慕嫉妒恨的是，「小小」邻国既在经济上大发展，也得到了民主。并在今天以多元化的文化及欧巴输出，证明前人的努力是多么值得。
HHG🥱,3,2014-03-09 14:47:36,,3,A.导演实在是不懂克制。试图用歇斯底里的镜头来触动观众真的是很坏的品味。B.还是犯了韩国这种现实主义类型电影的通病：过度煽情/不懂留白/人物高度脸谱化。C.对白实在是矫情。鸡蛋石头呵呵。_(:з」∠)_。D.跟特么民主主义有半点关系么，不要乱用词汇啊==|||E.结局加一星。
灰色堡垒,4,2015-01-14 13:38:01,,4,剧本不够扎实，男主角的转变过于突兀，法庭戏失之严谨和过于简单，整体节奏也有问题。其实这些都是被韩国的那部《熔炉》给惯坏了，里面对社会问题的展现绝对甩任何的华语片几条街。人家第一次做导演就拍出了完成度如此高的作品，这是整个制片工业的胜利。
LEMON,4,2018-07-08 12:28:38,,6,最后法庭上的激烈辩论片段应该是全片最燃的时刻，也引发了进一步深思，怎样才是真正的爱国。
mecca,4,2015-03-06 09:43:28,,6,3.4@鲤甬高铁坏：1.整体构架有失衡处(前1/4独立完结的倒叙塑造的老成有余的凤凰男，立场逆转到炸仅因熟人故不大有说服力)2.法庭戏对手戏份偏少。好：1.尚算冷静的言他结尾2.多侧面特写。给四星更多因为题材勇敢+处女作鼓励，推荐给我朝民众。
少年夏不安,5,2014-12-31 20:14:00,,9,拍的特别好，不仅仅是因为所谓的意识形态。
Granite_花花,4,2014-03-04 17:37:01,,21,如今的韩国电影越发的深入人心，不仅是其拍摄的熟练和制作的精良，更多的是对他们敢于拍摄多样化敏感题材的钦佩。本片的前奏略长，但是后半部分情节抓人，宋康昊的表演也令人动容~
木偶,5,2014-07-22 09:39:56,,8,国家良心
Mido,5,2017-12-21 20:40:48,,3,是啊，无法从技术上艺术上说有多么高级，人物辩护还全靠吼，可电影看的就是这吼，吼吼痛快，吼吼舒畅，虚拟世界的吼也是吼，至少让你还痛快两小时。
小药水,5,2014-05-26 00:52:59,,6,韩国前总统卢武铉的故事，以前对这位政治人物的认识仅仅是他和包哥打过星际争霸，还有因为亲友受贿丑闻而跳崖自尽的结局。通过一个律师的人生转变来折射韩国艰辛的民主斗争路程，世界上每个成熟的民主国家安稳的现状都是来之不易，韩国在拍这样的电影，韩国人在看这样的电影，我只能说太牛逼了
我和我的小毛衣,2,2019-08-18 12:33:54,,3,可以说得上是所有律法题材电影里看过最差的了，整没什么电影元素反正，叙事也很差东拍西拍的感觉，就是对着当权的人一通批判，最后还是要妥协。对主人公身世发展也要鸡汤一段也真的是做作，前后态度转变也没有什么感觉。然后就是韩国电影组成非常单一乏味，故事跟内涵拍不到一起去完全。
一期一会,4,2017-04-04 22:47:37,,8,这尽然是一部处女作。有瑕疵，但已经很棒了，思密达。被宋康昊那神演技弄得几度落泪，与其说是煽情，我倒觉得这就是演员发挥出来的功力见效了，入心。故事很有嚼头，真实事件改编，韩国军事独裁到宣扬民主的一个转折。结尾哭成傻逼了。另，韩影和韩剧真是出自同一个国家吗？Comeon...
Foriverwx,3,2020-08-17 16:59:54,,11,当强权碾压个体的时候，竟然总有人以为自己是置身事外的局外人；
赵启辰,4,2014-06-11 11:23:49,,8,故事进行到一半才进入正题，前面讲此律师的发迹史没有太多实质性的意义，皮太厚了，但后半还算好看
葵花卷,5,2014-06-08 00:02:24,,13,——你觉得自己是爱国者吗？你不是爱国者，你是让善良无罪的国家生病的蛆虫、军事政权肮脏的帮手而已。说出真相，那才是真的爱国！——闭嘴！你这个赤色分子！
罗弘霉素,5,2014-04-21 23:40:56,,9,"“今天起，是你把安稳的人生一脚踹了!""是真的伟大！"
老二,NaN,2016-09-30 14:27:36,,6,本以为拍的很好，看完才发现被有理想的人们忽悠了。
竹淡刻骨,5,2014-08-26 11:16:50,,4,想说的太多，长评吧。韩国电影，仅仅是电影，值得学习的太多。哪怕我十分厌恶这个国家的体育赛事表现、电视剧以及某些民族特性。
潇肖暮宇,5,2022-11-04 23:56:13,四川,22,现实意义大于电影本身
xxx,5,2014-08-17 01:28:18,,4,泡菜国连这种电影都可以拍有点改观了。国家，权利，人民，法制，读书少我真的不懂。男主是偶像，但也只能是偶像，无法成为我可以做到的人。现在为止我的三观还是随波逐流，识时务者为俊杰。以前总找喜剧，爱情片的我真是弱爆了。
海哥叫Robert,5,2017-06-03 02:50:51,,9,想起国内被抓的律师
Fleurs.哼哼,5,2014-03-08 00:16:39,,3,当人民不再沉默
玉娇龙,5,2022-11-27 19:13:33,陕西,12,很应景。所以五星。意义很大，演技很好。
判官,4,2017-11-25 16:33:04,,4,一想到卢武铉的结局就很丧
обломов,4,2014-03-07 00:24:24,,3,原来民主主义用韩语发音跟汉语差不多
喻鸣,4,2014-03-17 16:34:47,,6,在由税务律师向人权律师的转身中，釜林事件是激发卢武铉对政治感兴趣的转折点，以卵击石，问责权力体制，暂不论他此后极富争议的政治生涯，至少宋康昊诚挚地还原了他热血方刚的人生断面，饼叔自来水一样收放自如的方法派表演，不愧为韩国演技之神。林时完还是在《拥月》演古装美少年最让人想扑倒。
金刚大笑,5,2014-08-11 10:12:55,,4,我终于知道了什么叫目眦欲裂。这世界需要这样一种怒！
直胖,5,2014-09-10 14:09:34,,5,一部电影有这么大的现实意义，在其他方面又都没有硬伤，又是导演的处女作，不得不为它打5星。最后的点名情节，充满希望，太煽情了啊。
二阶糖富美,4,2014-05-19 13:22:32,,2,节奏不错，宋大叔演技拔群，虽然很感人，但还是想说比之天才，这是哪门子小儿科独裁啊。。。。爱国傻逼的嘴脸刻画的也蛮好的
晚不安,5,2017-09-27 21:04:14,,4,“拿鸡蛋碰石头，看似不堪一击，自取灭亡，但是鸡蛋是有生命的，石头是死的；鸡蛋打破了是生命，鸡蛋可以跃过石头！”由已故前总统卢武铉真实经历改编，“国民影帝”宋康昊实在是这个角色的不二人选。每年都会涌现这样的韩国电影，让我对这个邻国肃然起敬。
一條魚佔滿了河,4,2014-03-05 22:48:38,,6,兩個多小時的電影，看到結尾時被震撼出一身的雞皮疙瘩，也許對於正義的堅持換不回一個正義的審判，但是時間會證明一切，正義不會越來越羸弱，正義只會感染更多人，宋佑碩背後一一站起的99位律師就是明證，電影進行到這個時候，我和宋康昊一樣，嚴重包含著淚水卻沒有滑落。
Auu,4,2015-03-05 15:04:04,,4,何时能从容谈起一件事时那便是真正的不再恐惧
虚弱橙,3,2014-07-31 23:04:00,,6,题材讨巧，公民对抗公权力总是让人热血上涌，可惜一升华又变成星火燎原的俗套
元宝宝,4,2017-02-14 11:48:40,,5,韩国电影一向以感情细腻见长，这部片子同样很能打动人心。就连所谓的小鲜肉任时完的表演都酣畅淋漓感人至深。这个世界本就不公平，但绝不能缺少维护公义的人，哪怕仅仅是束微光也能让绝望的人们看到生的希望。同样在韩国电影中也能折射出中华文化的影子，宋大叔绝对是受人滴水之恩当涌泉相报的楷模。
渡口无边,4,2019-03-02 18:07:10,,12,他们的电影流淌着民主政治的热血，而我们的电影还停留在民族主义的鸡血。
王富贵,4,2014-08-13 13:26:20,,5,最让我惊讶的并不是它改编自卢武铉的亲身经历，也不是五分之一的韩国人为它走进影院，而是这样一部电影竟然是一个漫画家的处女作。韩国电影之强大令人叹为观止。
瓜。相信这个世界很变态。,4,2014-03-28 21:38:03,,4,重要的不是他还原了多少事实，而是起码他拥有还原事实的权利。只要路是对的，总会越来越多人走的。
居无间,4,2017-09-28 01:09:37,,4,韩国常见的社会意义大于质量本身的电影。当公权力对人民和正义进行迫害时，人们能拿起来的武器是法律与媒体。庭审的对招不错，结尾好，加一星，念名单想起了《鼓岭街》，是不同效果。并非常规三幕剧，议题进入慢，第三幕太短，辩护人的主客体变换是妙笔——传承，贯通现实。导演技法弱，比较依赖表演。
罗旋下降,5,2017-09-29 12:45:27,,3,“岩石再坚硬也是死的，鸡蛋再脆弱也是活的”
鯨,5,2015-02-18 22:14:20,,4,其实是因为看了我的友邻金天线写的文章才看这部电影的..QAQ@GoldFish
小游,4,2014-05-13 22:27:00,,11,人家都拍过去的故事啦，我们还活在过去中……
克林,5,2022-11-05 14:04:44,江苏,26,呜呜呜呜最惨的就是尹中尉他上法庭的那一刻就想哭了就知道他的结局肯定很惨总有人不怕死才能前进刚开始还不明白最后那么多辩护律师出来的原因我想这就是当时国安法没人愿意当辩护律师而到现在那么多辩护人体现的一小步吧韩国电影的真实啊结局不是学生被救再怎么反转也抵挡不住权力啊
发条饺子,4,2014-03-22 12:19:10,,4,单就电影情节而言，豆瓣评分略显过誉。影片情绪饱满，戏剧张力极强，但视角过于主观，纪实性被削弱，代入感不足，结尾《春风化雨》式的煽情，让人出戏。但较韩国影人的勇气与康浩大帝神级表演相比，这点小瑕疵几乎可以忽略不计。韩国影人借宋大帝之口拷问了我所剩无几的法律信仰。
岚康,5,2022-11-11 21:02:07,江苏,19,岩石再坚硬也是死的，鸡蛋再脆弱也是有生命的。石头最终会化为沙土，而鸡蛋孕育的生命总有一天会飞越石头
乐生于苦.,5,2020-08-02 16:10:52,,16,法律应是国家/国民的基石而不应是执政党的基石
三石一声,4,2015-04-21 09:47:37,,2,有温情、有震撼，便留给人惊诧，以及反思！结尾的点名戏太催泪！
蒋三寻,4,2014-07-17 16:51:40,,8,据说是根据真实事件改编，指鹿为马、暗无天日的政府官僚，有亚洲特有的政治氛围。整个都很真实，除了最后大光明的结局，改成更隐喻的暗涌会更写实。
许亿,NaN,2014-05-09 16:39:14,,7,虽然煽情得很韩国，但确实精彩，感人。终于轮到韩国人教育我们什么是正义了
Panda的影音,5,2014-03-09 03:07:02,,14,1.看到韩国近几年出现《熔炉》《素媛》《7号房的礼物》还有这部《辩护人》等关于司法题材的佳作，而中国只有《全民目击》《圣诞玫瑰》这样零星之火，心里挺不是滋味；2.个人感觉，韩国电影在21世纪制作水平和质量的提升速度名列世界前茅，尤其是最近几年，佳作不断；3.我想我真的喜欢上宋康昊大叔了；……P.S.：01:16:54-01:19:53的那个长镜头拍得太棒了！！——2021.11.18：时隔多年再次观影，个人观感“更上一层楼”了。“…因为国民不富裕，就不能受法律保护，不能享受民主主义，这种说法我是无法接受的。…说出真相，那才是真的爱国。…在市民无法行使自己法律权利的时候，作为法务人员，我更应该走在最前面，这才是真正的法务人员的义务。…”台词写得太好了！影片末尾的法庭戏一度把我看得流出眼泪。2013年的韩国豆瓣高分电影够多够给力的！
我来我征服,5,2014-05-09 15:45:14,,4,水木丁在谈到这部片子时说，韩国电影的进步真让人嫉妒。是的，我嫉妒得牙痒，嫉妒得堵心，嫉妒得凌晨流泪看完，早上洗漱时又好好地哭了一场。我们这片土地上，有佯装勇者的投机分子、有勇无谋的莽夫、鹰犬爪牙…而我们的宋佑硕在哪？
张老实,5,2014-06-12 20:53:06,,12,没有理由瞧不起韩国人啊
Neski.,4,2014-11-20 14:04:05,,6,前期铺垫太长，收尾又太草率，但是，韩国电影工业应该是现在亚洲最好的了吧
erotica,3,2022-09-07 17:30:35,四川,3,节奏太慢！而且就如影片里面所说，就算可以拍无数这种片子，但统治阶级不改变，屁民又能如何？看多了甚至怀疑这是韩国控制百姓的高级手段之一。让你们在影片里发泄情绪而已。
Fitzzzzzz,4,2014-06-03 15:04:31,,0,还挺...勇敢的啊
半个桃李林檎,3,2014-03-14 17:34:20,,1,反思历史的现实意义（特别是对于你国的借鉴意义）大过电影的艺术水平，但仍然值得尊敬。一个人的觉醒难以带来社会变革，除非民众都是盲目的。宋律师的角色类似于逼着尼克松在镜头前认错的Frost，对历史的推动作用都带有很大的偶然性，首先你要有完整的法制体系，首先你要停止麻木
舟菖蒲,5,2014-10-06 20:53:15,,3,对男主人公从世俗到神圣的转变和铺垫做的很好，所以哪怕只是煽情励志，也很好接受，很让人希望被感动。自己要是也能成为这样的人，就好了
igrɛkonze,4,2019-08-05 00:30:41,,3,到現在仍能回應時代至少在華語區仍然叫人激動和落淚的確是不折不扣的商業作品但這正是最可貴的地方人家商業片都拍這些而我們還在為了龍標奔走
宋雯婷,5,2017-01-08 22:01:48,,8,正义有时会迟到，但从不缺席。导演的分寸感还有演员的演技，真的让人服气。最主要的，还是审查尺度松啊。真是幸福。
虾坨坨艺仔,5,2014-05-08 15:45:45,,8,太好看，导演的处女作，并且真实地改变了事实。除了整个时代的民主斗争，还能看到一个眼里只有钱的小人物是怎样一步步改变自己，甚至改变国家。“即使岩石再坚硬也是死的，鸡蛋再脆弱也是活着的生命，岩石最终会碎成细沙，而鸡蛋终究会孵化越过岩石”。深深的感动。
诸葛若见,5,2019-10-26 15:54:44,,1,锋利的质问，有被刚接的情绪震到，张力太强，让人深思许久。
已注萧,5,2014-12-28 00:35:44,,3,「因为国民不富裕就不能受法律保护，就不能享受民主，这种说法我是无法接受的。」
王里奥,5,2022-11-09 20:59:02,浙江,12,作为自由派，我确实很吃这一套。法庭部分剧作比起艾伦索金还是差远了，主要给个情感分吧。韩国最黑暗时期都是公审+有外国记者的呢...
朱欢尘,5,2016-09-21 00:05:17,,8,不得了了，越来越对某国肃然起敬了…
bay135,4,2018-07-05 16:10:44,,2,影片分数如此之高多半归功其题材。但我还是得说，这种题材在哪个国家做出来都是需要勇气的。除此之外，人物饱满生动，剧情工整完整，关键的法庭戏也是激情澎湃。都在水平之上，年度佳作没有问题，只是离杰作还差很多。
jj73浅之,4,2014-03-06 10:23:26,,2,影片有最终这么好的质量，声讨民主人权的题材、前半部分的小人物温情励志以及七八十年代的韩国时代背景加起来占一半，另一半都来自宋叔的演技
你看起来很美味,5,2014-03-26 22:48:50,,4,看完最后一幕之后简直惊到......五星好评还有什么说的.......
胡蝶,5,2016-08-06 00:41:54,,9,“历史也许会以进两步、退一步的方式螺旋式前进，某代人可能会在那倒退的一步中度过倒霉的一生，但我相信在所有的专制者中，时间是最专制的那一个。很多时候，人类一不小心误会了自己，把自己想象得太过聪明，或者不够聪明，而时间总是不徐不疾地将误会澄清。”
STEbu,5,2022-08-28 23:49:55,青海,13,要不是了解了电影里的案件后续，不然又会憋屈死一回！《辩护人》13年上映，案件14年重审并且改判五名被告无罪！这部电影对于案件的重审无疑起到了推波助澜的作用！宋康昊的激情辩护和郑度沅的阴狠毒辣贡献了韩国影史最伟大的对手戏表演！
理想蔚藍,5,2014-05-20 13:02:23,,5,韩国的电影已经甩开了大陆10条街！这多亏了光腚总局的功劳，当然他们也是奉命行事。。。某党万岁！
烈焰红唇龙,5,2017-10-06 22:34:55,,3,上一次看国产类似题材还是背靠背和黑炮事件，这都快二十年了。
欣欣向荣,5,2018-08-01 12:40:09,,4,看过，韩国的电影都很敢拍
帖拉索伊朵,5,2014-08-30 17:48:21,,3,飞机上看的，这都能让我中途看哭好几回，好电影，牛逼。
TISA,5,2014-06-23 01:07:23,,7,这种政治敏感的电影在贵国人看来特别过瘾
不贰🙈🌈,5,2016-11-08 21:18:52,,6,“坏人做坏事不可怕，可怕的是好人不得不做坏事，”一个社会职场人的业界良知，很适合一个将要步入社会的大学生看。国家即国民，国民的尊严即国家的尊严。五星，无水
xīn,4,2015-01-01 16:20:16,,2,最感人之处是结尾律师共同体的统一信念（类似《死亡诗社》结尾学生们纷纷站上桌子），不同的个体以同样的姿态发声一方面具有形式上的崇高感，另一方面也提供了当代中国社会特别缺乏的关于共识的想象。其中的二元对立、正邪不两立太过清楚（过于剧情化），如果真的读共产主义书籍又如何呢？
