user_name,star,comment_time,geo_ip,vote,short
dormant,5,2014-03-05 22:13:55,,8932,一部改变现实的电影：釜山地方法院于2014年2月13日对“釜林事件”进行了二审宣判，判决5名被告人无罪，距离一审判决时隔33年。“因为国民不富裕就不能受法律保护，就不能享受民主，这种说法我是无法接受的。”——宋佑硕
柏林苍穹下,5,2014-03-10 02:16:21,,6710,“国家，证人所说的国家到底是什么？大韩民国宪法第一条第二项，大韩民国主权属于国家，所有的权力都由国民产生，国家即国民。但是证人毫无法律依据，一味强调国家安保，就把国家镇压践踏在了脚下······你是让善良无罪的国家生病的蛆虫，你是军事政权肮脏的帮手。”
一字,5,2014-03-04 20:56:54,,3453,不是很清楚卢武铉是个什么样的总统，不过电影是根据真实事件改编的，至少他做过这样的事情。韩国电影一直有在自省历史，令人敬佩。大脸影帝之一的宋康昊演的太好，法庭上完全被他带入了。最后一幕特别加分，得人心者得天下！
刘康康,5,2014-03-19 14:14:30,,3295,法律有时候也是国家暴力机器的一部分，但法律依然是个人能够对抗国家机器唯一的武器，当国家机器想要彻底摧毁一个人的尊严和权利时，它首先想要做到的就是践踏法律。而当法律被如此践踏时，即使是最逐利的律师，也会挺身而出来维护法律。如果要问法律为什么值得信仰，这大概就是我的理由吧。
西楼尘,5,2018-07-08 21:54:55,,1612,七年前这里吃的酱拌饭被呕了出来，一同呕出来的还有羞耻；后来这里的乌冬面被写了出来，一同写出来的还有谎言；而今这里的汤泡饭被吞了下去，一同吞下的还有不甘。这一爿小店，收容过落魄，接纳过缅怀，原宥过屈辱；那一方法庭，钳制过自由，欺瞒过道德，背叛过国民。应声而起的辩护人们，名字叫正义。
囧叔,5,2014-06-06 11:48:28,,1550,吃了《熔炉》的亏之后我长记性了，这次先看了完整的背景介绍，查了许多资料，就差连卢武铉的传记都看完了，才看这个电影，有效地防止了被窝囊死。
OX,5,2014-01-03 21:17:49,,1530,韩国失去像卢武铉这样的总统...真的是国之大丧..还有这个叫New的制片商真心让人眼前大亮~去年本人觉得不错的《新世界》、《监视者》《7号房的礼物》《捉迷藏》等电影都是New筹拍的而且都是启用了新人做导演
null,5,2014-08-10 19:29:19,,933,仅仅是能拍出来，这样的电影就值得五星；仅仅是能上映，这样的政府就值得尊敬；卢武铉，自杀。文在寅，复仇。
小油飞,5,2014-06-07 10:23:50,,758,整个观影过程中我们都在感叹原来韩国法治最黑暗的时期也还是能公开审理和请外媒记者的。。。==
PsychoBabble,4,2014-03-16 09:21:05,,3008,OMG，这尽然是一部处女作。瑕不掩瑜，已经很棒了。被宋康昊那神演技弄得几度落泪，与其说是煽情，我倒觉得这就是演员发挥出来的功力见效了，入心。故事很有嚼头，真实事件改编，韩国军事独裁到宣扬民主的一个转折。结尾哭成傻逼了。另，韩影和韩剧真是出自同一个国家吗？Comeon...
花开有声,5,2014-03-16 22:42:59,,655,很佩服韩国人正视民族历史的勇气，《辩护人》充分展现国家权力机器与国民之间的缓和与争锋。我也套用《熔炉》里面的台词“我们所做的，不是为了改变世界，而是为了不让世界改变我们“。我们每一个国民只不过是乔治·奥威尔《动物庄园》中的一个动物，我们所做的就是过清醒的人生，做自由的灵魂！
风间隼,5,2014-05-06 23:46:44,,313,石头虽然坚硬，可蛋才是生命。谁说穷人就不配享受公正？市民同志们，挺住！
陈哈,5,2014-05-15 20:19:46,,216,老看韩国人拍出这样的作品来，观感比较复杂。
我不会闭嘴,5,2022-11-28 07:24:08,英国,186,2022年的今天这部电影又有了不一样的意义
巴喆,5,2014-03-15 10:40:06,,312,愿生平能在某朝的正规大院线见到这样的电影。哎呀呀，韩国电影真是越发的了不起了！8.6
乔小囧,5,2014-07-12 03:02:36,,179,只有在一个受害者的国度，这样一部电影才会有如此高的评分。
好大一只猪儿虫,5,2022-02-12 20:55:16,,160,看的我很愤怒。他们发生了，但他们正视了
生生之美方东美,5,2022-12-11 22:56:31,湖北,105,除了中国和北朝鲜，世界上真的有互联网这个东西。
木卫二,4,2014-03-07 22:45:03,,1970,只有更卖力地骂内地院线片了。原来是改编了卢武铉的故事，法庭戏倒是一般，煽情没错，但合理性和逻辑性似乎不太够，结尾超级感人。宋康昊曾用那双大小眼注视着银幕观众，如今，又是直面冷血暴力机器，非常之动情
Ocap,4,2017-03-29 00:29:40,,1922,最难忘的一幕是，在逼供处刚逮到律师的反派警官意外听到远处国歌响起，马上就地立正行礼。他的反应是那么迅速，神态是那么严肃、深情，你能看到他的举止绝对发自内心，以至旁若无人。这一幕太震撼了，完美诠释了爱国与行恶的不矛盾性。如果说主角代表了理想，那么这个人就是我们身边大多数人的写照。
叶林檎,4,2013-12-21 21:02:32,,1311,无字幕就算了还全片釜山方言忍住这点痛苦看完了两个小时电影结束后跟朋友对视决定出字幕版时一定要再看一次怎么说都得搞清楚自己为什么哭了两次啊。。。
Doublebitch,5,2014-03-30 20:03:39,,172,“国家”是什么那一段太精彩了，饼叔赞！
zitsunari,3,2014-03-07 14:56:26,,456,王党鞭不要看什么星星了，看这个去吧
桃桃林林,3,2014-03-04 21:47:08,,388,煽情部分的话，其实回忆更感人。其实韩国的八十年代是很有看点的，这些年也有多部相关影片出现，从军政府到如今，卢武铉的经历恰好也可映射出韩国的民主进程。
Sophie  Z,NaN,2018-07-11 10:04:31,,196,许多年后，在卢武铉跳崖前，他会不会想到如果自己当初选的是另一条路的话，也许现在的他还是一个富有的律师，一个快乐的帆船手。
shininglove,3,2014-08-31 16:24:38,,114,分数偏高，或是因为题材的讨巧，而非技法的流畅。
起床，吃饭,5,2020-02-24 03:34:10,,112,药神应该借鉴了这部电影
欢乐分裂,3,2014-09-10 20:27:58,,66,题材的讨巧和话题性盖过电影本身，煽情太过，影像一般，前半段更好；庭戏的镜头那叫一个绚丽，都360度转圈了；没有真正的结尾，正如没有真正的所谓民主，有人之处就有极权。
虫虫,5,2017-09-17 20:52:20,,96,熔炉，素媛，辩护人……最起码在电影领域里，我们没有资格嘲笑韩国。
麻绳,5,2014-03-05 21:46:13,,161,今年韩国的超级卖座片，也是我愿意推荐给所有人看的电影。他们所曾经经历的公权之害，我们一直在经历，但是韩国人能把它拍成电影，让全体国民在影院里反省和缅怀。剧作实在太扎实了，宋康昊的表演无比强大，今年又要横扫各大奖了。
石墙,3,2014-12-31 23:58:07,,63,确实是“拍的内容”比较高级。不过类似内容在二三十年前的西德和东欧电影中就已经到处都是了，我朝为什么只有在面对韩国电影的时候才能发现自己的文艺工作有多落后？
周沐君,4,2014-10-13 12:16:54,,1068,法庭抗辩情节太一般了。但有一点把握得特别准确：一个生活优渥且一心想着赚钱的人，你跟他讲再多民主斗争的大道理，他都可能不为所动。突然有一天发现，哎，那个被抓进去受虐待的就是平时卖猪肉汤给我的大娘的老实巴交的儿子，认识的人。一瞬间就变民主斗士了。。。
白发生,4,2014-03-16 20:58:55,,974,依然可以找出不少瑕疵，却仍旧要感叹韩国电影工业的日趋成熟，似乎随便一位新人导演就能讲述出令人动容的故事，除了体制之外不得不承认创作态度的天壤之别。生逢乱世明哲保身往往只能是一种奢望，而很多时候恰恰是我们事不关己的冷漠态度在纵容着罪恶的发生。
艾小柯,4,2014-07-26 16:48:46,,287,表演太棒了，尤其前面的漫长铺垫。进入主节奏后在情绪的推动下庭审细节有点粗糙，个人英雄主义的渲染过分浓烈。作品在社会意义面前还是急躁了，但不妨碍它成为一部里程碑式的作品，由此来观察韩国社会及电影业二十年的飞速发展。
Gatsdy,5,2022-07-04 20:47:21,,82,《中华人民共和国宪法》第一章第二条　中华人民共和国的一切权力属于人民。第五条　中华人民共和国实行依法治国，建设社会主义法治国家。我永远热爱我伟大的祖国！
齐物秋水,5,2017-08-17 08:16:14,,70,能拍出这样的电影，韩国是个值得尊敬的国家。（或许我们不配拥有好电影）
仁直,2,2014-12-11 09:30:29,,36,人物没弄好，各种主义弄得再有话题，也只是空洞。
摩托喇嘛,4,2014-03-06 10:56:44,,135,比《恐怖直播》那种胡编乱造好很多。
柴斯卡,NaN,2016-02-07 01:41:27,,59,宋康昊很适合这种投机型但其实很正直的小聪明天才戏剧上突兀了可内容真的很好『社会怎么可能靠示威改变呢』『挣了点钱就开始觉得社会可笑了』『你的人生一直在前进现在不能踩刹车啊』『我是不想让我的孩子生活在因为这样的事就踩刹车的社会里你也不想吧』『我送儿子去留学』
悍客.罗,4,2014-06-10 15:16:35,,173,韩国电影的可贵之处，一是在于细节让人感动，不着痕迹；一是人物真实可信，有一堆毛病，却又正能量的令人敬佩。
bookbug,5,2018-02-05 13:57:12,,52,一直觉得韩影与韩剧是两个极端，前者可以重如泰山，后者足够轻若鸿毛，所以我始终是韩影拥趸。本片题材放在中国来是几乎无法评论的，只能说看的时候就像在照镜子一样，越照越显出对方的伟大和自我的扭曲。宋康昊自共同警备区一片引起我的注意，孝子洞理发师、杀人回忆、密阳等片一路走来，演技已臻化境
朝暮雪,4,2015-10-16 04:02:20,,127,鸡蛋碰石头，不一定会输。
北溟鱼,3,2014-05-22 09:53:33,,31,这片子一定是拍来黑税务律师的==做transactional的改行做litigation辣个毫无技巧可言简单粗暴的满法庭咆哮的crossing真是惨不忍睹。觉得拍得最好的是对宋律师的侧写：下定决心就千万人吾往矣的执着，一饭之恩当倾身相报的良知，以及对有了钱的中产阶级就会想报效国家的美好想象
风雨飘寒烟翠,5,2023-05-20 13:35:27,广东,55,简直就是现在的中国
渡边,3,2014-03-10 09:38:23,,24,开头部分与主线剧情略脱节，进入主线也过于仓促，对韩国那段历史不了解所以未有太深代入感，宋大叔演技依然，只是电影叙事整体略平淡。总之一旦涉及反政府题材豆瓣基数分就会偏高就对了。
冲浪小羊,4,2022-05-01 17:55:45,,99,不写了自己删比别人删体面点
元气少女郭德纲,5,2023-05-21 00:12:33,江苏,47,证人所说的国家只是强制取得政权的一小部分振聋发聩看完这个电影感觉世界好像没有变1980年发生的事情到了2020年还在发生
周杰伧的小粉丝,3,2014-04-07 18:29:55,,27,我怎么感觉这像是架空历史。。。军政府这么讲道理？！我便是不信呀！
徐若风,4,2014-08-10 21:00:09,,31,感动。不过还想感叹自由民主反政府的口号配上煽情，快成套路。幸好脱离了浮夸演技。视听语言还是很干。
恶魔的步调,4,2014-11-22 20:53:00,,66,咱们法庭见是西方人的文明游戏，咱东方人的衙门文明是开场先拉下去打五十大板，所以这是一场东西文明的理智与情感的明里暗斗，而开了这个头的，让一切浮出水面、上了台面的，让越来越多的本地化怒汉出现的，是十二怒汉，一个娱乐化产物，很久很久以后，他们被尊为OrignalTwelve……
粟冰箱,5,2017-04-21 22:10:06,,70,今日为人发声者，明天会有更多人为之发声。
昏金暗玉,3,2014-05-29 11:19:34,,18,大家给予高评价更多是因为它的胆识与自由，超越了电影本身的意义。因为我们没有，我们做不到，我们渴望，我们能感同身受却又手足自缚。至于所谓结尾的升华，comeon，那是老招。
kenny,4,2018-03-03 22:27:01,,72,演得可真好！一个不敢面对过去，不敢正视现状，不敢让人正常发声，只知道连任的大国，就有希望了吗。
左胸上的吸盘,3,2014-04-26 22:40:14,,9,可看度可以，很综合的一部片子，你能想起《孝子洞理发师》《南营洞1985》等一系列片子，故事也比较流畅，宋康昊演这种角色是真好看呀
红豆♥,5,2017-08-28 00:04:09,,71,看过的韩国电影几乎没有哪一部不愤怒。其实觉得海东建设富二代的说法是事实，世界就是不公正的，但是身而为人不能习惯和认同不公正。
薇羅尼卡,3,2017-04-04 23:58:18,,11,过去的中国，现在的中国，亦或是未来的中国。就片子而言，非常典型套路，不明白为什么分这么高，感觉比它出彩的韩国片随便就能数出几部。不过很庆幸韩国的电影人能拍这样题材的片子，韩国的民众能在电影院直接看到这样的片子，一部存在意义比艺术价值高很多的电影。PS：郭度沅演坏人演的太棒啦！
小岩井,4,2014-08-17 23:30:40,,40,让我想到明朝那些事里面常说的，天道！
杨迪,5,2015-01-02 00:15:36,,58,气节！
冲浪小子Z,NaN,2015-04-02 23:58:29,,31,其实勇敢有时候不是一个人的事
颜彦清,5,2014-05-20 23:23:05,,66,这个世界上总有一群人，他们拿鸡蛋碰石头，他们认为存在不都是合理，他们用抗争的方式在爱国，用自己生命在捍卫人权与尊严，他们受伤害是想让他们下一代不再受伤害。
Cenduruila,5,2022-03-27 23:45:50,,50,虽然案件以失败告终，但是主角以卵击石的勇气真的打动了我。邪恶的人还傲慢着，善良的人却为自己做的不够多而难过。
#Pekingcat#,5,2014-09-21 22:03:46,,57,无话可说，说出来每一个字都值得删除
至安,5,2020-10-01 23:30:10,,34,“因为国民不富裕就不能受法律保护，就不能享受民主，这种说法我是无法接受的。”
水木丁,4,2014-05-08 12:06:42,,39,这种题材其实不好排啊，真是非常不错……
撕撕撕,3,2014-05-29 21:16:27,,13,虽然自己24岁了，还在做没意义的事情，但这个世界肯定有很多事值得我们为之奋斗，而我已经被自己的欲望所累，被洗脑被物化，总有一天成为温水青蛙。
游牧人·芳汀,NaN,2018-10-18 02:59:42,,9,#1080p#吃了一对江水cp后的衍生品，毕竟是新人导演，拍摄手法不够娴熟，过场戏过于随意了前后衔接得不太好，但也正因为是新人导演，才有这种初生牛犊不怕虎的勇气去在当时卢武铉被万众diss的情况下拍出这部辩护人来为他翻案。翻了旧闻和《命运》才知道原来电影里最后99个律师出庭为男主角作证的名场面在现实中是文在寅一手主导的，真不愧是你家卢先生的头号粉头2333
小A,4,2014-08-31 16:43:52,,13,连续性和节奏感的矛盾在韩片里一直都是以重节奏轻连续为基调化解。当然这不算大错。本片的主旋律略狗血，前后情绪转换还是缺乏合理性，这就是艺术和现实的不同，就算卢武铉当年真的转变很快，电影也不能这么拍。片中的车恩在比本人更靓，作为次要角色仍然在表情细节上很认真。法庭长镜头不错。
momo,5,2016-12-21 00:05:00,,54,又是一部影响韩国社会的电影。虽然我不喜欢韩国这个国家，但一次次被韩国电影震撼。
吃姜不吃葱,5,2022-06-05 11:59:20,,61,每次看韩国现实题材电影都好像被砍了几刀，一边流血一边疼，被悲愤压的喘不过气。再一想咱自己，这种是要被禁的，就更想不开了。
恰恰,5,2018-02-07 15:13:56,,35,很难想象同为披挂着二战疮痍默默爬起的东亚国家，同一个动荡的八十年代，人韩国都拍出这种电影了，我们提及某两个数字的时候还要花样使用各种暗语。。。。。
悦然,3,2014-03-31 01:40:23,,16,又一部道德高分片。前半部分太长。人物转变仍显突兀。全靠宋的演技支撑。
抚琳琅,5,2022-01-29 12:23:15,,45,男主的好兄弟劝他不要管这个案子，宋康昊反问他如果让你的孩子活在这样的社会你安心吗？他的好兄弟说我可以让我的孩子移民！
CyberKnight电子骑士,4,2014-05-06 16:10:12,,19,前面铺垫得很好，节奏舒缓但吸引人。进入庭审段落之后有些跳跃和草率，热血激情有余，缺点明显显现：情节发展不够理性，缺乏控制力，太多直接的表达了。这方面比起《JFK》或《永不妥协》等都有所不及。不过韩国电影的血性、勇气和气度，包括对题材的处理能力以及三观等等真是足以让国产电影汗颜啊！
Q。,4,2014-05-21 21:11:51,,44,「因为国民不富裕就不能受法律保护，就不能享受民主，这种说法我是无法接受的。」题材加分，技巧一般，完全靠宋康昊一个人撑起来的戏。但电影本身能让世人所见到也必须在一个包容、大胆、开放的国家才能做到。韩国电影这几年一直在高速的发展与不断的反省。★★★★
LOOK,2,2014-05-10 22:31:19,,30,2.5手法还是简单粗糙了点，激起观众同情心悲悯之心似乎是唯一目的，比较明显的一个问题是，这宋佑硕说变就变也太假了吧，怎么也得有个心理转变的过程啊
曾于里,4,2014-03-29 23:44:11,,30,大饼脸宋康昊真是演什么是什么
👹天神的审判,4,2018-04-17 12:15:09,,17,想让我的孩子们不要生活在因这种荒唐的事踩刹车的时代。这是里面的台词，挺佩服韩国导演的，敢拍出来敢放映这就是值得鼓励的给四星。
小猪大侠,5,2014-08-14 06:50:37,,39,历史总有惊人的相似性。但韩国人却可以去还原它，让更多的年轻人知道发生过什么。有些国家却不可以。加一星给信念。
信心不逆熊先生,5,2014-12-31 12:54:47,,55,一些人在某些国家的某些年代因为读资本主义的书而被抓，而另外一些则因为读共产主义的书被抓。真是讽刺得很。
rivert,4,2017-01-28 22:37:19,,8,法庭长镜头，人格卢武铉
美女菜kun,5,2017-03-18 07:23:54,,31,现实的意义大于电影的本身，艺术也可以影响法律
有心打扰,4,2014-04-16 15:36:06,,20,1.法庭辩论真是燃爆了，民主、自由、政府、暴力、公权等等果然是成就一部好片的关键词，当世人平时不曾接触的、避而远之的、被压抑、被禁止的敏感事件被放在了电影里，便是让人趋之若鹜热血沸腾的好戏；2.宋康昊很棒，为自由民主而战、为普通世人而战。
Chong,5,2022-08-28 17:51:23,广东,61,故事的结局并不完美，大多数人期待的酣畅淋漓的胜利终究没有发生，甚至釜读会事件之后发生的律师由于集会被捕审判的事件，电影也没有交代结果。这就是现实，但比起一场审判的胜利，民众民主和法治意识的觉醒如星星之火，更加会让极权瑟瑟发抖。别人至少能拍出这样的电影，别人至少允许发声。
江寒园,4,2014-11-08 15:47:31,,12,1.转变观念的过程都来源于是身边最细微的小事；2.在国家公权力面前个人是如此渺小；3.这99名律师都是大韩民国的良心；4.by豆友：韩国电影和韩剧真的是出自一个国家吗？（笑）
私享史,5,2014-05-06 20:17:05,,25,刚才章子怡在微博推荐了本片，加上是宋胖子演的，就找来看了。单论内容有不足，几个配角的塑造带着程式化，叙事套路也并不新鲜。但这种基于真实事件的对抗强权与暴政，明知不可为而为之的人性光辉，怎么不叫人动容？片中借几人之口给出的不同社会背景的人对民主的不同观点做得很巧妙。【百老汇IFC】
火龙果不耐受者,4,2015-12-13 20:54:30,,28,韩国能拍出这种电影，而我们还在禁这禁那
松如,5,2021-08-14 20:48:11,,15,“證人所說的國家到底是什麼？”
丁一,NaN,2018-07-23 20:54:04,,8,除了说话，别无所求——高银
重忆小窗纱,5,2017-05-09 17:03:17,,17,今晚最适合重温的电影，大概明天一早就是文在寅大统领的就任仪式了。这不就写的是他和卢武铉当年的那些事嘛。
#瞬间收藏家#,5,2014-03-16 21:38:21,,24,国家是什么？“国家即国民”。|“异议思密达！”当发现国家有问题时候不同人的不同态度：改造、把孩子送到国外留学、我们太穷。五星不光是题材，完成度也很高，众多耐琢磨的台词。个别闪回有点乱，前段略拖沓，海报不知所云，但还是五星。2014.1.26想看
雨果,5,2016-11-24 14:20:49,,35,虽然我讨厌棒子，但是不得不说韩国电影人真的很有勇气，居然素材于现实揭露政治里的黑暗点，很难得。
冬瓜,5,2022-07-30 14:08:28,,23,什么样的电影会流芳百世，时间会给出答案。
Dr希鲁鲁克,5,2014-09-06 19:08:05,,24,能甩《归来》十条大街么
MaxHorowits,5,2016-10-03 16:54:30,,20,哭特么成狗了啊……为什么活在傻逼的世界里还要给傻逼谋福利，为什么人类不能安安稳稳的灭亡。
张苑希,5,2014-03-04 23:20:19,,23,他们有改变国家的电影，我们有改变电影的国家。
瓶子不能倒,4,2016-12-27 21:49:30,,26,根据总统卢武铉事件改编，是韩国改变法律的电影，他们的电影工作者不时地在电影中找角度抨击政府与当权者，而我们的电影审查制度仍然是一团乱麻。宋康昊大叔饰演的宋佑硕复习司法考试的那些场景还真是有些感同身受，赚钱投机是生活，为人权奋斗是理想，这份职业不容易。虽有套路，我亦甘之如饴。
草威,4,2014-05-02 12:52:32,,9,结构工整，很像美国人拍的。韩国电影让人觉得有尊严，羡慕。都挺好，但励志时突然变身学霸，有点儿……出戏
艾晨,5,2014-03-12 05:00:46,,14,一部有意义的电影，是客观公正，坚持真义的电影。是有话直说，说真话的电影。是严肃的，不畏权势的电影。电影长镜头也是为电影本身服务的，而不是为装逼炫耀而用的。
思考的猫,4,2014-11-08 11:01:13,,7,三观正，感情充沛，震撼人心，不过可能感情过于充沛了些，如果给控方多些戏份可能更好。最后，宋大叔威武！
魏神陌那,4,2014-07-27 07:07:01,,12,石虽坚利为死物，卵甚脆弱仍焕生。
思考的猫,4,2014-11-08 11:01:13,,7,三观正，感情充沛，震撼人心，不过可能感情过于充沛了些，如果给控方多些戏份可能更好。最后，宋大叔威武！
古尔齐亚,5,2017-05-10 14:36:56,,18,看完良久无语，令人钦佩的国家
朵夏以以,5,2022-07-16 10:00:51,,25,真的佩服韩国电影敢拍。开头轻松的BGM和进城感让我怀疑是不是开错了片，后续极大的反差让律师的形象立体了起来。周遭越是黑暗，越显现出人性的光辉，如果不是改编自真实事件简直让人怀疑是童话，正是有真实事件的加持才更动人。之后又补了卢武铉和文在寅的故事，不得不感慨人生如戏，现实甚至更曲折精彩。
魏神陌那,4,2014-07-27 07:07:01,,12,石虽坚利为死物，卵甚脆弱仍焕生。
朝阳区陆依萍,4,2014-03-06 00:28:05,,8,此片在韩国以破千万级的观影人数再次创造本土纪录，本片和《熔炉》《恐怖直播》很像，很难用电影的评判标准去衡量，题材远胜电影本身。法庭戏基本用撒狗血，配上宋康昊的歇斯底里，看的还算过瘾。可什么是国家？法律对于弱者到底意味着什么？
嘉言懿行,5,2021-11-29 14:07:25,,15,召集国外记者？这不是给境外势力递刀子吗
[己注销],4,2014-04-23 00:57:45,,14,（9/10）搬家后看的首部电影。本以为是普通案剧，没想是讲反对全斗焕政权独裁的故事…片提到的光州事件可查维基。看下介绍宋康昊起初其实拒绝出演本片，因为主角原型就是卢武铉总统，后经宋的请求把人物属性改成普通律师。感觉主角能作一定反抗是建立在全斗焕想立牌坊的基础上……
韩伯愚,4,2014-03-11 15:51:20,,10,这部电影没有什么了不起，然而这个故事所表现出来的精气神，即便似曾相识，仍然十分了不起，它反映了很多社会在前进过程中的奋斗和牺牲。在那些电影特意为观众安排的情绪高峰里，你会发现自己正在与主角同呼吸，尽管在结构上它并不完美，但是宋康昊将一个人权律师演绎得深沉而立体。
悦然,3,2014-03-31 01:40:23,,16,又一部道德高分片。前半部分太长。人物转变仍显突兀。全靠宋的演技支撑。
老袁,4,2014-03-09 11:41:49,,10,太煽情，要减掉两分，但是宋康昊，要加一分
武侠小王子,4,2014-04-04 00:09:36,,4,正视整个国家的历史，才能看到这个国家的未来。
