user_name,star,comment_time,geo_ip,vote,short
张苑希,4,2017-05-10 18:54:12,,3,美术、色彩、特效什么的太赞了，3D不能更爽。全程被小树人给萌cry，每个角色性格也更丰满，这部给人的感觉倒像是八点档家庭伦理剧了。男主在生父与养父之间的取舍，女主与妹妹的情仇爱恨，最感动莫过于勇度的葬礼，一整个宇宙中绚烂的烟火。
熊類爆弾,4,2017-05-16 11:11:51,,1,7.9/10劇情比第一部更有觀賞性，梗仍然很多，音樂依舊非常贊。StanLee的兩次出現都好可愛～史泰龍威風不減當年。
名字特别酷的人,4,2017-05-06 18:07:58,,1,这波“新兴团队主脑遇上画饼VC”我服
セシ♪,4,2017-05-10 21:38:14,,1,4.5大概是漫威宇宙中音乐品味最好的系列了
凹凸,3,2017-05-17 16:06:17,,2,谁能想到BradleyCooper的职业生涯演技巅峰竟然是一只浣熊的配音？
quai,4,2017-05-07 21:08:07,,1,四星半。本来我以为如果还是第一部那个感觉可能只会打三星半，但父子的议题和正经八百诠释了一把牺牲的意义和人与人之间的理解和共情还是甩了上一部漫威电影N条街。突然感觉这一部至少黑不了了（就是想吐槽劲歌金曲稍微密集了点）星爵帅又美，表白小浣熊，表白勇度！
sosovipp,5,2019-07-24 20:55:15,,0,挺搞笑的。小树人也很萌。
711|湯不餓,NaN,2017-05-07 01:13:43,,5,我系你花打啊仔……你整死我老母，老豆都冇面俾！！（为什么银河护卫队2不在父亲节上画……）
Chain,5,2017-05-05 23:07:06,,1,最近流行反派洗白？多个彩蛋。
一期一会,4,2017-05-05 18:15:54,,3,五个彩蛋。不用谢！
办公室甜心,5,2017-05-08 11:52:38,,3,\ZUNE/
思郁,4,2017-05-05 13:18:20,,2,几个男人的感情一点不投入
顿河,4,2017-05-06 01:30:23,,11,美国人真的很会做teenager的片子，银河护卫队2讲的就是杀死逼我做作业的好爸爸，和不爱管我的坏爸爸和解的故事，手足是先天带来的无法决绝累赘，朋友是后天选择的气味相投的手足。
海棠一生,5,2017-05-07 07:59:29,,1,星爵好帅，星爵好帅，星爵好帅；配乐好赞，配乐好赞，配乐好赞！重要的事说三遍
发条饺子,4,2017-05-07 23:49:20,,1,鸟枪换炮的华彩乐章。虽然相生相杀的内斗戏变成了相亲相爱的肉麻情，旋律也拨乱反正，但是各位主角独特的外形和性格依然是超英里最迷人的泥石流，树苗相对败笔，怀念他大块头时的反差呆萌。堪比绣花大盗的勇度被搞死了，只剩“宇宙电玩族”和伊格的咸蛋超人飞船讨喜。原声依然带品，值得二刷。
去你爹的,4,2018-02-03 23:36:55,,4,欢迎收看“金牌调解”，今天节目的主要内容是：养父逼子为盗拒绝生父究竟动机何在？姊妹相杀妹妹百般被辱为何最后放下仇恨？接下来请收看具体节目，银河卫视感谢您的支持！
daangel,4,2018-04-01 22:56:22,,1,再次人设套路：多年失踪的亲爹往往和后妈一路货色……
豆狒,5,2017-05-07 20:05:34,,9,保利天安门店，刚出片尾字幕的时候服务员跑过来说电影还有10分钟结束后面有五个彩蛋，结束后服务员说感谢大家对电影从业者的支持坚持到了最后一分钟。这么敬业的影院真是第一次遇到。
张腾森,4,2017-05-05 19:53:51,,4,以为去看逗比互损，结果看了感人父子情
The 星星,2,2017-05-13 17:54:45,,5,我的影院第一觉居然贡献给漫威了，歌难听片难看新人物人设不忍吐槽，除了树苗没有任何亮点
姜小白,4,2017-05-10 13:15:21,,4,男版维密秀大概就是这样的，牛逼哄哄的依仗配乐，装备精良的迈步出场，还能耍酷的摸摸裤裆，干~勇度吹着口哨团灭叛军也是帅炸了。
Cōsti,3,2017-05-06 20:26:51,,3,很多人说银护的原声挑得好，但在RichardCurtis拥趸的眼里这些都不值一提。
FrozenElsa,3,2017-05-05 22:52:33,,3,【6.5】我真的很喜欢第一部，但是这一部给我的感觉就是拍了一个很一般的开头，然后拍了个很emotional的结尾，然后中间就是各种我是你爹啊，我是你儿子啊，我和你同病相怜啊，我是你姐我爱你啊，我是你妹你为什么要这样对我啊，blablabla之类的东西。不过反正还是不错的爆米花
孤獨江湖虛名,2,2017-05-05 22:29:52,,5,看之前想，诶呀，我都忘了1讲什么了，看完发现，没关系，续集就是又讲了一遍第一部。金曲串烧，插科打诨，就计算着怎么让观众笑，而我却笑不出来。反派都缺爱，大boss就是要统治世界，死人才能鸡汤煽情，白眼翻出天际。听到fartherandson还是很惊喜！
Edward.Young,5,2017-05-05 23:42:18,,3,爆米花电影的最高境界。
Ada,5,2017-05-05 23:42:40,,5,估计这是目前市面上唯一一部能让所有人憋着尿坐到片尾字幕结束黑屏才起身离场的片子吧。
千寻亿选,3,2017-05-13 08:48:48,,2,1、总体失望，除了几首老歌2、片尾强行给小树人加戏，漫威都开始靠萌物打拼票房了，可悲。3、强行安排勇度死亡，强行安排了烟火大会4、勇度的继任者神似雷宇扬5、所有女性角色都丑
拔剑四顾心茫然,5,2023-07-28 21:20:45,河北,1,认贼做父，父相伤害，害能咋地？詹姆斯·古恩大概是最会打情怀牌的商业导演之一，英雄弑父的古典戏码愣是让他玩出新花样，怀旧金曲加上无数彩蛋，娱乐属性全面升级，招牌空战戏+近身搏斗戏+小鬼当家式的杀阵戏+超强催泪瓦斯，又燃又虐。作为主题乐园式电影，银护系列不扯没用的，尽量在把主线故事讲好的同时做到各个园区的风格化运营，不让游客在其中迷路，有限时间内呈现多层次的情绪体验，从演员表到彩蛋，用心看得见。勇度是漫威世界少见的富有人格魅力的配角，只用寥寥数笔，便轻巧刻画出一个嘴硬心软的帮派领袖、联盟叛徒、温柔慈父，这样细腻合理的人物刻画翻遍整个漫威剧本也屈指可数，他配得上这场精致唯美的葬礼。那些可爱的小玩偶与灿烂的烟花向我们诉说着：只要你的内心充满爱与温柔，无论到什么时候，都会有人感谢你，怀念你，铭记你。
K,3,2017-05-01 23:31:40,,9,精彩openingcredits後全程失望，一切都tryingtoohard，刻意將上集討喜元素過份放大，演變成上集的新鮮感及風趣幽默今次全變套路，連可愛的babygroot到最後都覺得愈來愈過度消費，音樂使用有點overthetop，rocket也像和星爵鬥咀而存在著，感動位亦不及上集令人動容及燃，節奏感比較弱，對故事及主題皆無感
Joywhen,2,2022-11-09 12:59:33,日本,3,基本盘没有丢，似曾相识的宇宙弑父情结，实在是共情不能。
辽西悍匪,2,2017-05-22 20:35:22,,5,无聊……
🐖🐖🐖🐖🐖🐖,4,2017-05-07 23:05:36,,3,莫名其妙的笑点太对我胃口了。
黑特-007,5,2017-05-07 16:49:38,,1,太好看惹!!!Groot超级萌的!这种音乐与剪辑混搭的手法真是百看不厌!不行要跑去补充歌单了!
PenL,4,2017-05-31 18:45:11,,1,7.6
一碗云吞,5,2017-05-04 10:47:46,,7,在村里看了个西语2D版，气死！
喵星人不吃鱼,4,2017-07-15 22:14:55,,1,又搞笑，又感动，还那么正能量。。。
胡二,3,2017-05-05 19:59:01,,4,劲歌热舞第二部，银河护卫队第二盘专辑，前半截笑点尴尬，全程靠树宝宝卖萌，小浣熊从好兄弟升级成奶爸了。。。估计下一部是青少年树了。。
Merov Mugatu!,2,2017-05-03 17:24:45,,8,瑞克与莫蒂，海贼王狂欢男爵，绿巨人都比这好看。整个漫威系列走高的只有美国队长了
hedgehog,4,2017-05-09 10:05:52,,1,其实跟速度与激情是一个路数啊，不过最好笑的是《欢乐满人间》那个梗
Indecent time,4,2017-05-05 21:36:34,,2,从第二阶段仿类型片到如今，十年了，漫威电影终于也变成类型片了。尬聊＋尬乐＋尬鸡汤＋斯坦李，一部出色的漫威类型片就出炉了
Nada,4,2017-04-30 23:38:43,,2,前面其实挺无聊了之后特效来硬撑了多的一星给fatherandson如此调动了观众的情绪
null,4,2017-05-05 13:00:10,,6,IamGroot.
丁卯,4,2017-05-07 14:54:45,,1,特效绚丽，视听盛宴，剧情和1似的看过就忘，勇度和浣熊的泪点忍不住
FUA,3,2017-05-05 22:53:34,,3,逼死《星际迷航》，气哭《星球大战》，有这么极品的爹，再也无法直视星爵了，笑点低的盆友pleaseenjoyyourself…
yyb,4,2017-05-06 22:25:24,,1,轻松幽默爆米花
隔壁家的桃太太,4,2017-05-06 08:30:21,,8,纯真风骚。比刚和老爸和解老爸就死了更惨的，是两个老爸都死了。
Favillae,4,2017-05-07 00:39:31,,1,我是你爸!I'mGroot，I'mGroot，I'mGroot……深夜看完电影回家路上和同去的妹子分道扬镳，我在街对面朝她大喊了一句“I'mGroot!”后又一路念着上楼直到迈进家门。最近抑郁，需要这么一部一言不合即干架、精神病与弱智儿童组团的银河秀逗片发散一下。
王写写,4,2017-05-06 16:26:42,,2,整体不如1，但还挺喜欢的，比奇异博士好。非常类型化的故事，有俗套也有小聪明。几个梗挺有意思，有漫画有游戏还有迪士尼的。笑点不够有趣，氛围还可以。大家评价不高是因为这类架空度太高的爆米花很容易审美疲劳，基本第二部新鲜感一没就完蛋。五个彩蛋都很让人失望！PS：抓走斯坦李的是观察者吗？
notrealdante,3,2017-05-01 07:00:02,,4,画面更胜，搞笑满篇，但总觉得比第一部缺了点什么，惊喜也不那么大。另外现在都流行洗白吗XD星云原来是傲娇小公主我好喜欢啊啊啊啊啊啊啊
学术个体户,4,2023-05-08 18:59:06,北京,1,银河护卫队系列一如既往地走心，本片延续了第一部的风格，却让人更为之动容。如果说第一部主打小伙伴们组队的友情的话，那么本部主打的就是亲情。本部的亲情情节有三，一个破裂，两个和解。星爵意外地找到自己的生父伊戈，这可能是比灭霸更可怕的狠角色。虽然星爵渴望父爱，但当他得知伊戈欺骗并害死自己的母亲，并在全宇宙反复实施这种手段，现在又要利用自己帮他毁灭宇宙时，他勇敢地消灭了生父。此外，星云讲出了与卡魔拉的纠葛，姐妹二人在打斗中冰释前嫌。最后，勇度在最后时刻用自己的死换来了星爵的生，还揭示了过去对星爵的虐待，其实是拯救了他，免于落入伊戈之手。说实话，我看完本片是很感动的，这里边有太多人性的流露，刻画得很生动。另外，我看的是汉译版，翻译和配音水准堪称一流，不仅通顺、口语化，还非常时髦、精准，这在平时很少见的
林药,4,2017-05-06 20:43:18,,1,好看啊，像银河系漫游指南一样无厘头。
Moonlight Bae,3,2017-05-23 01:37:43,,1,第二部分竟然还比第一部高？？Why？劇情有點俗套啊。。。就是树人挺萌（还有感觉剧组把钱都花到场景特效上。这化妆画的太敷衍了吧，涂个金/绿脸戴个美瞳就搞定了？特效化妆师给你们打零分！
桃子,3,2017-05-13 22:37:35,,3,漫威电影里最不懂的就是这个系列的笑点，大学宅男气十足，啰哩啰嗦，彩蛋风格也看出来了……实在不是我的菜。喜欢这部的新人物螳螂女。也喜欢毁灭者。勇度激光杀人法。宇宙葬礼。反派的理念挺酷的，但多星球的神什么的，还是会觉得太扯以至于产生反感心理。复古美术的美被假3D磨灭了。左右两位都睡了
MaxHorowits,4,2017-05-05 17:29:53,,3,babygroot真可爱，发现反派洗白永远比正派牺牲更得我心。
twotwo,5,2017-05-18 12:50:02,,2,很成功的工业电影，老歌拯救世界
繁花将尽,5,2017-12-30 17:37:28,,1,整部都燃爆了，GROOT卖萌，勇度煽情，中间那段一人箭穿一船的场景太炫酷了。结尾《FATHERANDSON》和礼花响起简直太催泪，哭成傻B，年末坐在电脑前补登今年看过的电影，这部是今年最喜欢的，没有之一。
翰小七,5,2017-05-09 10:37:08,,1,保洁阿姨辛苦了！
半弦月,1,2017-05-09 11:28:05,,3,只是觉得lakeshoredrive、whambamshang-a-lang两首不错
葵花卷,4,2018-04-18 16:21:49,,2,如果主角在电影1/2之前就找到他爹了，十有八九他爹是反派--（coco同理
会笑的昨天,3,2017-05-11 16:21:05,,8,姐妹线和父子线傻的发笑。
momo,3,2017-04-24 23:35:50,,5,Rocket告诉你什么叫手贱，手贱偷电池，手贱多造了个按钮，因此造成许多笑点......小树太萌了！开场的时候人物比较多，经常乱扫小树的身影。老爷子出场挺多的，还有小树长太快一下就青少年了。看预告一句Iamurdad有种星战即视感，没想到dad是这么来的。小树你耳朵在哪儿？
Kevser,NaN,2017-05-05 22:27:27,,1,啊啊啊！Nebula!!!<33333
scofieldd,3,2017-05-06 08:20:23,,2,babygroot真是激萌！万万没想到至今整个漫威系中最让人催泪的竟然是勇度这么个角色
玫瑰水母,3,2017-05-06 18:03:37,,1,在电影院看感觉有点冷场，而且笑点和其他人不一致略尴尬
发条橙,4,2019-04-18 16:54:27,,2,重温。劲爆金曲加诙谐幽默，难得拥有点儿作者性的漫威电影，但整体基本上是对第一部的重复，了无新意，可看度尚可。
华盛顿樱桃树,2,2017-05-05 22:42:01,,4,五个彩蛋一个比一个无聊，可想而知正片得多无聊，这是实在剪布处什么有意思的东西了。那些招式第一部都见识了，这一次就是纯copy，还没copy好。
飞客流依,5,2017-08-12 21:42:17,,1,一直不太喜欢银河护卫队这条线，但2直接让我黑转粉，全程无尿点，勇都口哨那段不能更帅，有笑有泪太精彩了
沈入忘🌟,5,2017-05-13 17:42:36,,4,看完了！哭成狗！友情，爱情，梦想，责任，勇气，这些听起来大而空的词汇就是这么真实的美好呀！
天马星,4,2017-05-05 17:33:03,,4,情感充沛，充满力量。虽然剧情老套，笑点略干，但不得不说人物形象塑造得好，一出太空家庭剧，一点也不像漫威超级英雄电影，今年继《金刚狼3》之后又一超级英雄佳作。@2017-05-0517:33:03
小周每天都很困,4,2017-05-07 13:38:30,,2,toomanydadissues
阿暖,3,2017-05-06 19:46:16,,2,最后可以说非常煽情，literally听到整个影院都是抽泣声。其实还是有些失望，弑父的概念流于表面，也并没有“宇宙大战”的宏大感。但是不正经的笑点真的太好笑，最后星爵打着打着突然变成一个贪吃蛇……哈哈哈哈哈哈哈真的朋克。给朋克加一星。
Xaviera,4,2017-05-06 23:29:21,,1,已成為追到目前為止最喜歡的Marvel系列
二月鸟语,3,2017-05-10 16:55:46,,2,5.8/10，怎么说呢，作为一部脱口秀类电影，虽然没有整段垮掉，但也仅限于纯娱乐类漫威电影了。完善漫威宇宙是其本份的任务，剧本本身有可以深挖的点，其实可以做娱乐的同时也留下些反思和思考，但一到可以做深度的地方，编剧导演就草草略过，关于父子关系，甚至是个人宇宙的建立，生命永恒等哲学命题。
Lucifer,3,2017-09-21 22:00:46,,0,最后不能明白啊
仿真男孩哪吒,4,2017-05-05 23:08:21,,1,若一年有一天不能做DC的迷妹大概不是银护就是复联要上映没有第一部那么惊艳却懂得扬长避短梗都老掉牙父子情太尴尬但只要金曲响起腿就抖起来剧情与动作戏都服从音乐上来就长镜头放babygroot这种大招更不要提CatStevens响起来有多犯规吃豆人和zune笑尿
你大立,NaN,2017-05-04 04:51:15,,4,如今漫威已经走儿童路线了？
nakedcello,4,2017-05-03 16:35:09,,1,还不错，jesuistonpere
寒枝雀静,4,2017-05-05 02:24:46,,1,“宇宙便是吾心，吾心便是宇宙”的辩证法。漫威从《奇异博士》之后玄乎的东西玩得越来越溜啊～文戏弱结尾拖沓笑点尴尬但还是好笑。但反英雄反造神普通人小时代命题还是原味，让人发觉相比其他系列这才是最合适的大众文化与商业文化融合的研究样本。感觉自己还可以吃这一套五光十色的银河姐妹花很久。
星尘战场,5,2017-05-05 20:08:23,,1,好喜欢好喜欢好喜欢好喜欢好喜欢
bird,2,2017-08-26 13:07:56,,3,无精打采昏昏欲睡
摩西不夜奔,4,2017-05-10 08:56:48,,2,漫威现在已经把电影从动作片做成了剧情片。
江声走,4,2017-05-08 22:14:47,,1,唯一拥有浪漫特质的漫威电影。
赱馬觀♣,3,2017-08-28 11:17:29,,0,你那一派也曾从偏见崛起，凭啥今天对我穷追猛打？算是一种刚柔兼顾的反击。不过古恩似乎忽略了一个重要差异：漫威属于在另一种艺术形式中已经取得重大成功并形成不可复制的经典特质之后下才转进的电影，品质是否还原尚存争议，热卖之功归谁还在两说。而西部与黑帮之所以最终进入正殿高位，主要是经过时间考验之后发现它们的确属于那种最适合用电影形式去表现的类型。
雨夜飞行,3,2017-08-27 23:08:59,,1,最感兴趣的是两姐妹相爱相杀，groot卖萌卖得有点烦了，剧情bug比较多也比较不合理，当个喜剧看看热闹还ok吧
大星,4,2017-05-12 10:49:50,,2,哇真的不开玩笑Chrispratt最后看着卡魔拉说WHAT的眼神好JB温柔真的受不了了！！！！！
J,5,2017-05-05 03:37:17,,3,服了。四星，一星献给播放器。
严冬,3,2018-07-01 23:01:27,,1,片头7分钟的超强娱乐性，让我在一瞬之间有了反思自己评第一部时是否偏见的恍惚。但是，嗯，为何《神奇四侠》《关键第四号》没火，IP汇聚效应？除了炫目的特技，有什么优势让它独立出来么？
一起吃地瓜,3,2018-06-08 20:19:40,,3,漫威电影看的不多，人物弄的混乱，都搞不清，这部里星爵这个角色其实很单薄，各种大杂烩。
Royo,4,2017-05-11 20:55:55,,2,生父&养父，勇度就是用来泪目的。小树苗手动点赞。还有为我在影院错过5个彩蛋默哀。
穿山,4,2017-06-08 18:45:24,,2,开场长镜头惊艳，一直在座位上跟着扭；勇度吹着小口哨操纵红箭，尤其暗室中连穿数人太帅；父子梗真是万年用不烂，此类科幻片不过是西部片的历险和家庭情节剧的伦理嫁接，但还真是套路得人心啊！
莫小巧,4,2017-05-07 14:50:15,,1,《银河护卫队》首先是喜剧，很多戏纯粹为搞笑，跟情节的推动丁点关系都没，但作为喜剧来说节奏创意都很考究。吐槽和装傻的方式其实蛮日系的。《王牌特工》式的大屠杀狂欢，场面更壮观，使用也更娴熟了。这一部的树人其实等于增加了小孩或宠物，作用除了卖萌外更多是制造不可控因素。
叶洲,3,2017-05-19 13:03:07,,1,美式喜剧还是这样比较好
三替,3,2017-05-08 22:19:44,,2,最后竟然哭了……荣耀属于宇宙星河
斯 琰 🌈 🍭,3,2017-05-06 22:46:31,,4,星爵和他爹互抽这不就是哈利破特和伏地魔的戏码吗？以及星爵老爹原来是“触手系”妖怪，触手系就该做羞羞的事情啊，搞得这么杀气腾腾的真是够了。非常非常喜欢那只“心灵美”的女昆虫。
脑子白腔荡骨鹅,4,2017-05-06 17:02:51,,1,感觉勇度像男一，我有被感动到，二番是浣熊或者吴克负责搞笑，三番树苗负责卖萌，笑点直白少了上部董德禄的乐趣。星爵似为了推进剧情而存在的道具，虽然还是个我是你爹的故事但身世和父子关系就像太空背景下的希腊神话，剧情的发展能想到相似故事，觉得有点有趣。好奇既然zune已故那这是软广还是致敬啊
猫语猫寻,5,2017-05-09 14:16:16,,2,1、这个系列就算最后把灭霸给洗白了我都不会觉得意外了！2、『尬』这个字的字境已经传入好莱坞，尬舞尬聊詹姆斯古恩都玩儿的得心应手！3、全中国影迷都与影院和影院的清洁大妈进行了一场名为：五个彩蛋的终极博弈！
天亮天黑,5,2017-05-07 23:08:19,,2,太精彩了，前边充满了各种巧妙的搞笑细节，尤其喜欢小树人的独舞、小浣熊的逗哏、以及勇度的涂鸦声光秀，简直就是漫威版的欢乐喜剧人，电影院里的心灵SPA会所。最后的催泪弹也来得猝不及防，多段攻击，属于憋不住的那种伤心。但还好，来得快，去得也快，字幕一出，所有人都破涕为笑了。
放开那个浪味仙,4,2017-05-08 17:40:57,,3,好喜欢这群逗逼的蛇精病啊！以及这个色彩绚丽的银河系。泪点设置的很故意，但还是看哭了。那种要失去些什么才能获得成长的套路。Vol.2又是一个金曲歌单~
影毒肥佬,5,2017-05-06 14:12:39,,0,Marvel超级英雄佐伊感动杨紫琼经典友情人性爱情搞笑科幻漫威动作喜剧9.3/10HAHAHAHAHA
波西米亚人,4,2017-05-08 21:39:38,,1,fatherandson插得真好呀！
M2,4,2019-10-16 21:42:37,,0,真正的父亲
嗯,5,2017-05-08 17:09:01,,3,画面好美啊。比第一部还好看
乔克得,4,2017-05-11 13:37:05,,4,看起来，漫威专心要为耍贱卖贫斗萌的小市民式英雄立传了，超级英雄主义不再是精英式的，也不再适应市场需要，解构变得实际而明智，银河护卫队就是史记里的本纪、世家外的平民列传，生动奇崛，血肉丰满，所有选择都不再是成为宇宙英雄和江湖神话的选择，而是要做什么样的人过什么样的生活的价值观选择
橘子脆壳,4,2017-04-28 11:03:13,,6,虽然他是你爸爸但我是你爹啊
20个小明≯,4,2018-05-12 15:15:49,,2,比第一部好看！……落课学生考前抱佛脚ing……
鬼腳七,2,2018-01-25 13:14:02,,4,太可怕了。整个片子只分为“Groot卖萌”和“跟着金曲蹦擦擦”两个部分，而且充斥着可能cctv6都不屑一顾的上世纪老梗，无聊到哭。
默语生,3,2017-05-05 23:20:54,,2,寻父弑父，凡人弑神，真是经久不衰的桥段。放在反类型片的解构背景之下就更好玩了。最近几年超级英雄们虽战力逆天，也要有不为人知的伤痛，人格缺陷发作滚倒在烂泥的样子比普通人还要难看。比起特效大场面和挥手秒全屏，大概这种“强如他们也不开心”的认知才是爽感的源泉吧。三星。
Neroat,4,2018-08-13 20:10:47,,3,比第一部要好看，Groot宝宝太太太太太可爱了吧！！！傻大个好搞笑哦。小浣熊绰号好多嘴炮技能max。谁能想到星爵他爸居然是颗星球呢…故事还挺有意思的，不过也逃不过一个“毁灭宇宙”这样中二的设定，就是勇度死得太可惜了。
狗鸡吧豆瓣,5,2017-08-16 21:36:40,,1,知不知道索尼很贵的，老爹。不要随便破坏孩子的私人财产啊。（我也有个zune！！！）天哪比第一部居然还好看！！！！所有人都好帅好帅好帅啊啊啊啊！！！！！！
老罗Lazzaro,3,2017-05-05 23:06:18,,0,玩法升级，在耍宝卖贱和劲歌金曲的基础上，配上开结和好尴尬互动惺惺相惜的接连套路，最后打出父子与姐妹两手感情牌。视效美术绚丽，但以家庭为主题以宇宙危机为背景的玩法，其格局对于漫威宇宙的开启影响小些。
火龙果不耐受者,3,2017-05-12 02:59:02,,1,除开视效和配乐以及搞笑的台词，整个剧本很无聊，故事展开也没新意，所谓的“银河护卫队”已经名存实亡了，明明就是一两个人的战斗而已。
你算哪块小饼干,5,2017-05-10 09:50:13,,1,二刷还能哭。
千山小脑斧,5,2017-05-06 00:10:32,,2,花那麼多錢請翻迪塞爾就只有一句台詞「愛慕古魯特」
魂,3,2017-05-05 17:15:13,,2,故事主线在第三幕开始前都非常不清晰，于是把第一部的优点不断放大堆砌来弥补故事的不足。结局有种低配版山姆·雷米《蜘蛛侠1》的感觉：“我有一个爹，他的名字叫勇度。”但还是差些火候，不够感人不够悲壮。
樂,5,2017-05-07 21:54:07,,1,每次大反派洗白都要洗得如此撕心裂肺特别令人受不了。
恒殊,5,2017-04-29 17:15:19,,3,笑裂了。。。
mOco,3,2018-07-30 14:46:01,,0,音乐赞呆。勇度很催泪，父子情反倒无聊了。
Lonely,4,2021-11-14 22:41:01,,0,7.0/10分。重看，蓝光。重看完《雷神3》《复仇者联盟3》后，再来重看这个系列。比第一部更加流畅，搞笑和动作场面更大。那支飞箭屠杀时的那一段不错。剧情依然很一般，天神老爸是个什么鬼东西。没认出《神秘博士》里的凯伦·吉兰来，那时候挺白皙可爱的，就是雀斑多了点。史泰龙的客串也是很一般。伊丽莎白·德比茨基饰演的那个金灿灿的大祭司，我看了半天认成了帕里斯·希尔顿，因为化妆特效后真的好像。最后的彩蛋有好几个，都是无聊搞笑性质的，不像以前那种可以承上启下的内容。最后，整体来说，虽然剧情稍差，但人物个性比较有特色，可以说是比较成功的商业系列吧。
无梦快乐酣睡者,4,2017-05-05 22:49:37,,1,主角你的粑粑很奇怪耶，走遍宇宙寻找生命，找着了又要把它们都弄死，最后说自己孤独，这不脑子有病吗
