user_name,star,comment_time,geo_ip,vote,short
未命名搪瓷🌈,5,2017-05-05 03:00:52,,3,光是个开头就可以甩DC一万八千条街，更加坚定以后要把漫威的首映都包了。通篇围绕着family这个主题，从各个维度都诠释的很到位，也把角色之间的连结更加牢固了。出乎意料的笑点把握的不错，泪也催的有理，找不到什么硬伤。（看到放映结束后男厕所排队，女厕所空无一人的异象也是觉得挺有趣）
胖丁桃,3,2017-05-05 22:18:51,,2,段子合集，糖精太多，结尾疯狂煽情，音乐也不及上一部贴合，居然连fatherissue都做的不如上一部。胖帕那肚子哟，都快赶上给小格鲁特配音的那一位了。3.5
宆亗,2,2023-05-05 23:08:11,重庆,1,重看；就是很烦这一套父亲叙事，甚至星爵失去两位父亲后也迫不及待地成为了格鲁特的父亲，烦不烦啊
LoVe,4,2017-05-10 12:05:22,,0,特效很酷炫
喜悦之地,5,2017-06-02 23:33:56,,0,蓝绿姐妹就是雷神基神的百合版，小蓝一心想要干掉灭霸，难道有望加入打灭霸豪华套餐？爸爸是天神这个设定好恶寒，大烂片《木星上行》也是这种成神后发现神是大反派的设定；配色貌似比第一部还花哨，还是更欣赏星战正传三部曲的配色。以上就是三个雷点，作为浣熊死忠粉以及漫威死忠粉，五星献上
✟✰ナギサ✰✟,4,2019-09-12 01:16:45,,0,日哭死我了
喵老师2333,3,2017-05-06 21:59:05,,2,完全嗨不起来还特别冗长
资深低阶路人,5,2017-05-06 12:51:07,,2,比第一部好很多。很多家长带小孩来看，以为有动物和小树苗就是童话了？同情儿童看这么黄暴重口的片子哦
温言,4,2017-05-13 16:08:28,,5,强行上演了“家和万事兴”。不过我老了，就喜欢这种大团圆的结局
躲猫猫社社长,4,2017-05-07 00:04:59,,1,银护2之帝国反击战第三幕拉的很长啊
兆龍他城,4,2017-05-06 22:55:09,,1,就……漫威大片吧……
AJ.Chen,5,2017-04-29 21:42:47,,1,超棒完全无尿点！比第一部还好看！音乐又无敌了！！
kopde,4,2018-03-03 21:59:37,,3,教科书一般的爆米花电影。。
溺死的鱼,4,2017-05-07 15:18:23,,2,同样是伐木累比隔壁的速激不知道高到哪里去
独行侠杀手阿何,4,2017-05-06 23:38:42,,0,银河系劲歌金曲第二辑。虚假父子情谊，父子撕逼，没想到大反派居然是他！星爵妈妈可怜可叹QAQ。SeanGunn好帅气，螳螂女好可爱！女神的星云抢眼异常！好几幕富有《星际迷航》的画面感，StanLee老爷子狂刷存在感，勇度和星爵才是亲父子！勇度爸爸的箭酷毙了！！！史泰龙的出演出戏十分，杨紫琼竟然拖到结束才出现QAQ。
文森特九六,4,2017-05-05 23:54:55,,2,一开场就是《外星恋》乱入，好家伙到了最后发现这俩片子煽情指数果然是有的一拼。前面的小打小闹明显要比疲软的高潮大战好看太多，尤其是越狱那段，爽得我一本满足。另外，星爵这厮幼时绝逼只看电视不看电影，你爸已经长了一副库尔特拉塞尔的面孔了，还要去意淫哈塞尔霍夫，你将来可还要碰上史泰龙呐。
451½°F™,4,2017-08-21 18:41:17,,2,交代星爵身世与父亲摧毁宇宙的阴谋（更像是一种自然病毒入侵），故事与格局与之后大战灭霸关系不大，因此更像是星爵、伊戈与勇度的「父子情」与「自我认同与谅解」，在这点上古恩做得非常好，甚至最后火箭的眼泪更是神来之笔。
обломов,4,2017-05-20 22:30:01,,0,巴蒂斯塔承包所有笑点妹想到，能把科幻片拍得如此动人漫威不容易
BBpanda,4,2017-05-07 21:22:28,,3,变身吃豆人真是太中二了......
Chery,4,2017-12-15 12:08:27,,0,和美队一样，2好于1
mysticark,3,2017-05-13 17:03:45,,0,看完这部“银河逗比队2”后才算终于见识到什么才是正宗的“太空肥皂剧”，不过若如此的话还不如真做成常年在电视上播出的肥皂剧呢。到最后出现了这么多满足各类CP党的素材，还有居然用微软的败家货而不用苹果的。
小哒1,4,2020-03-24 22:21:06,,0,候雪雯看过，特效非常爽.穿越虫洞，绑架浣熊，创造星球，找鳍状物，姐妹撕逼，扩张目标，舰队全灭，温情增幅，神或平庸，勇度牺牲.
戳戳三文鱼,3,2017-07-01 17:07:09,,1,没有上一部那么搞笑啦，但是我居然又泪点了（我的泪点是有多低
熊田平平,3,2017-06-20 19:13:01,,3,Groot大法好，就卯足劲卖萌；金曲大法好，就卯足劲放歌；彩蛋大法好，就卯足劲加彩蛋。然而第一次是惊艳，第二次就……更不用说在人物刻画、情感转折方面的敷衍了，父子线、姐妹线、爱情线、团队线都处理得很随便。星爵完全扁平化，毫无存在感。最后为了升华更是强行死勇度……
Vini_Kazma,5,2017-11-17 18:51:35,,0,Tobecontinued，Vol.3
石之海动画了吗,5,2017-08-22 21:57:53,,2,敲好看绝对超英电影中的一股清流…全员都蠢爆了我感觉这是漫威版银魂…
死咗,3,2017-05-21 15:09:11,,1,有很大贩卖笑料和感动的嫌疑，整体而言有些尬。感觉这一系列是ios游戏版的漫威，设计精良，操作略少。
五月微蓝,4,2017-05-14 00:12:07,,1,作为一个看漫威经常犯困的人，这部看得没有犯困我觉得主要是配乐的功劳。插曲都好好听啊！听得我差点都忘了这是一部科幻片了……最后《FatherandSon》一出来简直都要哭了，这是我超爱的一首歌啊！当年第一次听还是在StéphaneLambiel的一场花滑的表演赛上，RonanKeating现场唱的歌。
黑貓十一,4,2017-05-06 17:49:32,,8,三星半吧。真·宇宙种马是我爹（。真fucktheplanet（×bgm还是很棒！我还是喜欢rocket啊！这次又是个家族的故事，生不如养那不是必然的故事吗？黄金国度简直只是个黑网吧聚众打网游啊？宇宙葬礼就很燃了，我想看宇宙强盗的故事啊www这阵容是宇宙敢死队好吗！
方苒生,4,2017-05-08 10:14:17,,5,所有星星都给小树苗！
突然粉碎,3,2017-05-05 02:27:00,,2,小树人和它的彩蛋是唯一的惊喜，随身听、吃豆人漫威你是不是暗恋索尼大法很久了？霹雳游侠梗、玛丽·波平斯梗都是童年回忆，全片最喜欢小浣熊，他的眼泪不只为勇度而流，也为自己而流，宇宙种马绝育大师是亲爹，星爵太惨了，选有情有义的养父没毛病，整体上故事抓马，配乐绝佳，我仿佛在看SOA第一季…
豆丁,4,2017-10-25 21:10:02,,0,比第一部逊色
三童,4,2017-05-06 00:01:57,,1,又是同一个故事的不同版本。
张咏轩Wayne®,4,2017-05-05 12:54:45,,5,用情感为支撑，戳到很多泪点，血缘关系中的谎言和背叛，亲情关系里的理解和修补，满满的世故人情和意外感动，所有的一切在笑点和泪点齐飞的太空中如烟花般升腾，baby格鲁特全程可爱吸睛，开场以它为镜头视角的大战就绝对圈粉，复古和音乐，情怀与感动，生死和别离，这是给予护卫队成员的一次挑战和成长
皮卡丘Casper,3,2017-05-05 17:19:04,,4,风格化、剧情、笑点、音乐全部输给第一部
不能·喵大妍儿,5,2017-09-26 11:14:34,,3,出乎意料地好看！好几个梗真的是笑傻了
很好很会吃米,4,2017-05-07 01:06:28,,2,三年后的我成熟了，已经不会在电影院思考如何才能操到ChrisPratt了。三年后也没有人在乎BradleyCooper真人长什么样了。
生人回避,5,2017-05-07 21:45:01,,0,目前漫威最佳！不靠卖弄特效和打斗！剧情完整且独立！被小Groot萌一脸，被勇度泪目一脸！
Song³,4,2017-08-16 03:25:21,,1,WelcometothefreakingGuardiansoftheGalaxy，Let'ssmashthisillusiveEgo'sPlanet.
|,5,2017-05-07 19:16:50,,0,可以说是非常好看了！！迄今最佳漫威电影
豆包儿,4,2017-08-10 15:06:20,,1,奇怪为什么会觉得全程最逗得点是螳螂被石头砸晕那一刻。莫西干头蓝爸爸的矫情人生。
爱幻想的小孩,4,2017-05-13 08:45:39,,2,其实反派的出发点还挺有趣的，但是第二段拼凑感太强，每个场景有自己的节奏感，但是拼起来就很凌乱，指向性不是很明确，有点影响节奏。另外和巨石强森属性相似的戴夫·巴蒂斯塔这种肌肉男的拙略喜剧表演看起来很尴尬。小树取错东西的梗太重复，直翻白眼
老残,4,2017-07-21 12:54:49,,1,就算人都这样了，有超能力能满天飞，还是在这些感情生活里。《贻笑大方》里总说，拍一部电影，讲什么的啊？讲人性的
神仙鱼,3,2017-05-09 20:38:25,,2,口哨飞箭，结尾送别
Q这一切的一切,4,2017-05-07 23:49:48,,0,很好笑续集竟然没脱力但是因为熟悉感一方面对人物斗嘴／深入相处后的化学反应十分享受笑的不停，一方面对色彩美术设定配乐都有了一定免疫惊喜变少。rocket男主力maxpeterquill下一集行为动机又要编个新的了。stanlee看多了好腻哦。drax也出彩了。gunn从小看啥都容易迷上配角吧……
纤手破新橙,5,2017-05-05 19:42:34,,4,不要太赞，这部以家庭为主，迷你格鲁特从头萌到尾，笑点泪点都有，愿意二刷
梦行30,5,2017-08-10 18:35:30,,0,注意力无法从格鲁特移开！五星都是他的！勇度死的光荣！最后强行煽情！
狐轮冲压许愿机,4,2017-05-07 01:34:37,,1,俗套但是欢乐知道笑点都是故意为之的但还是在笑233333以及勇度葬礼时真的听到电影院里有人哭啊还不止一个？！
菜菜,1,2017-05-06 22:44:48,,3,怎么那么好看的第一部会有那么烂的续集……
喵妮咔,4,2017-05-12 09:22:04,,1,这次的星爵贱兮兮的感觉差了一些，但团队整体的感觉很棒。yondu最后的送别狠狠感动了一下，还有……彩蛋真的太多了
Moony,4,2017-05-05 17:50:36,,1,你们都完美人类了还不是天天打网游
夏之城,3,2017-05-05 21:25:08,,1,身世交代太长解high不少。搞笑的点也多少有点分散星爵还是weirdlyhot
东林君,3,2017-05-12 22:54:35,,3,像看8、90年代那波cult。中国电影解释不过去就用爱情，美国电影解释不过去就用父子，所谓缺什么补什么。
七十三,4,2017-05-06 22:24:42,,2,逗比中二又有情
野郞杨先生R,4,2017-05-06 16:41:46,,2,骚气耍贱的风格是心头好尤其是肉感的肥帕
scientist,4,2017-05-09 19:04:20,,2,笑点九分，配乐十分，剧情六分，比第一部nice～一个人包场，好怕有鬼……
当今天子,5,2020-04-07 22:57:18,,3,你有个混蛋父亲，还有个英雄父亲，混蛋说要给你全宇宙，英雄说要吃了你，混蛋说我这辈子就是为了与你相遇，英雄说我养你只是为了帮我偷东西。在生命的最后一刻，混蛋注视着他的大脑，英雄注视着他的儿子。
䒳,4,2017-05-06 02:46:10,,0,没有那么惊喜，感觉还是停留在第一部的水平。bgm也很故意。
godannar,3,2017-08-20 20:01:21,,1,用色非常使劲这一点我倒不讨厌，但选歌为什么能比第一部还烂？为什么？所幸，下周有EdgarWright。
阿底,3,2017-05-08 11:06:55,,3,还是那些老梗，三星全给萌萌哒树宝宝，还有真·父亲勇度！
Mickey,2,2017-05-05 19:10:00,,6,整部片子下来充斥着漏洞百出的剧情、蜜汁尴尬的笑点和说来就来的怀旧金曲，包袱过于密集，人物性格走向趋平？干脆一起说相声好了。银护1里蠢萌的格鲁特都不招人爱了。反派把火箭和勇度关起来，把格鲁特晾一边就是等着被救呢呗，星爵和他老爹的事儿啥也没交代火箭就知道一切前去拯救，真是未解之谜。
微升骤落,4,2017-05-05 08:45:00,,2,NUSentral，马来的影院有中文字幕简直友好的不行。
Tom,3,2017-05-06 20:18:05,,3,金曲大串烧+蜜汁笑点，剧情略显拖拉，煽情戏码用力过度。整体水准稍逊前作。
正义的伙伴,4,2023-04-30 23:47:43,四川,0,喜欢第一部的人，绝对也会喜欢第二部。原来史泰龙就是开头结尾客串两分钟啊。
申由己,5,2017-07-01 11:20:09,,1,树人是最大亮点！非常有喜感！
zhang 2nd,4,2017-05-06 19:40:52,,1,大法给了多少广告赞助啊。煽情有些过，不然就满分了
苹果碳酸水,4,2019-03-16 23:28:02,,0,还蛮好笑的
贝塔先生,3,2017-05-06 21:18:24,,3,尬。
阿萌,4,2017-05-06 12:32:25,,1,吾爹中二，伤透我的心。反派的最大敌人，想来是爱和遗物。babygroot做什么都是对的！那个远程控制的小飞机，简直是一群有钱宅人集体打游戏机。
肉美,3,2017-05-14 01:46:52,,3,看得有点累、彩蛋也没看完，因为太晚了放映员放弃了。但特别开心一路骑车回来！哈哈哈哈哈
Nanccccccy,5,2017-05-05 16:26:57,,2,终于知道了为什么一些review会说导演把b级片素材做成符合迪宝宝标准的pg13(Isaythatinagoodway)，导演的宅气和恶趣味贯穿全片#还能再爱JamesGunn二十年#
给我个电话亭，我要拯救地球！,3,2017-05-29 21:31:55,,1,betterchoicesofsongsbutlessinterestingstoryline
欧诺诺,5,2017-05-05 11:47:02,,2,除了把天神亲爹瞬间黑化，勇度昂劲写死，babygroot定义成小呆瓜，其他都不错。
Jonathan,2,2017-09-09 10:58:08,,2,对于永远分不清动画人物的我而言这种片子一定会在电影院里看睡着。个人感觉这种片子一点幽默感也没有，人物也混乱不堪，反正总体就是像游戏机里一样打打杀杀光电交错，反正主要的人物怎么都死不了，活着就起死回生了。有个屁意思啊。
沉山泥🐇,4,2017-05-05 23:37:10,,2,我都不理解为什么这么喜欢星爵的颜，花痴了一整部电影
清舞翩翩,4,2017-06-20 11:23:23,,2,好的爆米花电影标配，剧情简单直接粗暴。
蜷蜷,3,2017-05-11 15:10:56,,1,感觉没1好看
文文周,5,2017-05-06 16:55:43,,5,一个完美的产品的诞生就是需要每个参与的人都拿自己当一个技术，完成自己的规格指标。手低的人凭什么眼高？手高的人都知道自己多么微不足道。
米兎愛唱片,5,2017-08-13 08:36:40,,0,尽管剧情扯了点，但还是必须五星，给炫酷特效，完美配乐，和ZZ正确的世界观，最后还顺带宣扬了一下火葬与礼花祭奠，切题！顺带说一句，近年唯一一次看完片尾漫长的演剧名单，各种彩蛋分级展示，效果奇佳！不愧为美式大片漫威風的巅峰之作。
了了,4,2017-05-08 01:33:54,,2,比第一部更丰满了，但有些元素也沦为堆砌的符号，比如毫无存在感的劲歌金曲2
Page_Chen,4,2017-05-14 21:15:10,,2,做大家眼里的讨厌鬼，要有多大的勇气不随波逐流，要有多大的慈悲仍愿意善待这个世界？还好，有其他的讨厌鬼惺惺相惜——致蓝度和浣熊。
又烧包小队长,4,2017-05-07 21:00:12,,2,哭了，蓝色野爹感人。星爵在daddyissue上是可以赢过其他superhero了毕竟一片死俩爹…（亲爹不行，一个神，被炸弹炸死喷了）下部是否星爵带青春期Groot💡
深夜声噎,5,2017-05-05 02:46:39,,3,虽然故事老套，前面还是笑死，片头片尾做得十分漂亮可爱，对霓虹发光体毫无抵抗力啊啊啊，想要去百老汇二刷IMAX全画幅呜呜呜，somethingunspeakable的just不如跳舞。
雪,3,2022-12-05 22:17:56,上海,0,生不及养
幻影刺客,2,2017-09-03 16:28:32,,2,简直尴尬死了，和第一部比起来一个天上一个地下。
礼物啊,4,2017-04-29 13:36:55,,2,保護全宇宙，童年很重要！I'mGroot！
抽象大猪,4,2017-04-27 09:36:10,,3,卖萌和耍贱的功力都更加精进了，在各种科幻大片中以嘴炮取胜！
🦋,5,2018-05-05 17:46:47,,1,幽默和感动并存，浣熊和格鲁特日常卖萌，还有时不时的年代老歌愉悦身心。
面包真好吃,5,2017-05-26 18:08:24,,2,想看第二遍的精彩
٩😛ི۶,5,2017-05-06 23:36:41,,3,勇度爸爸TAT
城南草木生,3,2017-05-13 19:38:26,,3,。。。
杉爷,4,2017-11-12 01:11:05,,1,还是那句话，能把这种套路满满的超级英雄类电影每次都拍的有惊喜，本身就很牛逼了。刀子嘴豆腐心的浣熊，还有表面老不正经其实比谁都硬汉柔情的勇度大哥，正中Call点！
nikki,3,2017-08-16 20:49:36,,1,看得挺欢乐的，也喜欢里面不同星球的设定，在电影院看的话应该会效果更好。浣熊和大只佬承包主要笑点。昆虫女总让我想到滨崎步不知为什么。
有寂,4,2017-05-07 00:01:47,,1,浣熊和星云还是棒啊
豆友1576610,3,2017-05-05 03:18:43,,5,"把Walkman换Zune还能将就着听暴露了星爵伪索粉的本质，""我是你爹""的星战梗太尴尬了。@CGV"
林摸鱼,5,2017-05-06 17:08:20,,2,出乎意料，特别好看。
贾小年,4,2018-04-30 20:31:50,,0,为了复联3，补。
樱夏枫雪,3,2017-05-07 22:45:05,,2,感觉第一部比较好看。这一部太多搞笑片段，不是很喜欢这类型！可是大叫都看得那么开心，可能只有我觉得奇怪吧！
摩诃曼珠沙华,3,2018-05-26 22:40:18,,0,看完复联3再回来看银1，2，复联3就是银3嘛
xx@百年孤独,3,2017-05-09 08:53:54,,2,一次很贵的电影，勇度当然最赞，但是我真的没看过1，对格鲁特没感觉，开场的打斗配上音乐，勇度的葬礼配上烟花，还是不错。5.5with丁丁
薇羅尼卡,4,2017-05-08 13:11:07,,1,妈蛋，勇度挂掉的时候没想到我会泪目啊，尤其是太空开始放烟花的时候，简直哭死了。。真没想到会有种泪点。原版味道，纯纯蠢蠢的爱，十八年不变啊！PS：终于知道Groot的配音是谁了，简直太反差萌
熊仔面,3,2017-08-11 20:47:44,,1,小树挺萌的呀
小熊QQ,3,2017-05-06 14:45:37,,0,画面色彩依然出色
Η²,4,2017-05-08 23:28:35,,0,这次彩蛋看到饱…相较首部的帅气冒险侠盗气质，2故事稍显牵强，金曲除送别勇度那首外没有记住的旋律，有笑出森桥段但一些对白较话痨，只我觉他爹很扯吗？从星爵控制原力反击配曲响起那刻起，分数拉回，2个小时剧情演进诚意满满，有萌点有恶趣味，片尾的精神升华做的很棒，有情有义，直奔主题，团队与爱
赤井秀一的帽子,5,2017-05-20 18:00:22,,0,跟第一部一样的逗逼横流，星爵寻爹记到最后逆转得有些弱。但是结尾的YONDU我真的是看哭了，眼眶湿的有些措手不及...凭这点加了分。这个系列的诚意真的算可以的了。个人认为彩蛋太多了。9/10
鹿不鹿,4,2017-05-07 18:57:26,,3,就很好看！又哭又笑吸着养乐多和保洁阿姨一起看彩蛋！
Overwise,5,2017-05-09 23:12:04,,2,请见littledepp短评
焦糖爆爆D,4,2023-05-05 23:49:59,北京,0,“他只是你的生父，但不是你的爸爸。”太治愈。“你毕生追求的或许一直都在你身边”那还追个屁？“IamGroot！”J85
青色閃電,5,2017-05-05 18:49:20,,2,跟第一部一样好看哈哈哈哈哈！五个彩蛋也是没谁了。以及旁边的小哥一直在说Groot好萌好萌哈哈哈哈哈
Strelizeia,3,2017-05-06 15:06:55,,2,2不及1，音乐就最后那首和一开始小树卖萌的时候还行，其他整体节奏不及第一部干练。
初音方法论大帝,3,2019-12-02 23:35:38,,1,7.8分，稍差于第一部，主要是人物变多了对剧情的把控也变得更难了。电击脸那伙人太降智了，守卫太松懈了。电影插科打诨挺幽默的，确实可以让人放松心情。电影的主题是：亲爸的生恩比不上干爹的养情，对此我表示赞同。
假痞,3,2017-06-04 17:03:30,,2,没有第一部好看
盔酱兮,4,2017-05-05 23:06:17,,1,还是在复制第一部的路数，可是最后却成了套路。没有星爵尬舞，故事也没有那么暗黑，就连我最爱的BradleyCooper牌火箭的Cast排位也被放在了肌肉牌小树精后面，真是不得劲！
扎学家施耐庵,1,2023-10-02 19:26:10,英国,0,无聊🥱
炘少,4,2018-01-27 13:07:26,,1,alittlebitOK！
jj73浅之,3,2017-05-06 21:52:07,,1,不由分说地卖萌煽情和轰炸，笑也笑了爽也爽了萌也买了但看到最后累了。为了稳固第一部辛苦圈下的粉丝必须抢着热度出第二部，水准之上是一定的，但打磨和推敲不是必要的。最大化商业价值之后的流水线操作产品
Fiona和平,5,2017-05-17 18:00:45,,1,之前建立了很多“比第一部不好这样的心理阴影”，结果看下来还是超甜！笑点密集，人人都很可爱，关键时刻有特有的脱力感。有很少的几秒钟觉得情节有点点长。当大部分帅炸。值得去看，尊的
鏡花可可,5,2018-06-08 22:55:50,,0,娱乐性十足，很喜欢！
江湖遠人,4,2017-05-05 02:45:55,,2,GalaksiaPatromortiganto
梦游,5,2017-05-08 13:59:20,,1,格鲁特浣熊斯坦李比较可爱。最尴尬不是一个人看电影而是全场的人都走了只有我坚持看完五个彩蛋好尴尬啊
牛奶泼了,4,2017-08-27 00:10:25,,1,好好笑。
某J。624,4,2017-05-14 02:40:50,,1,看在有五个彩蛋的份上原谅主线这生硬的过度消费了。说这部也玩family是因为串门的范迪塞尔在隔壁玩这个是真的么？！
Pandakung,4,2017-05-07 16:03:33,,1,打打闹闹的时候文戏真的很无聊啊。Groot(o^^o)
哈卡,5,2017-05-05 17:14:43,,1,~没别的，就是爽
SleepyPino,4,2017-05-06 20:09:18,,1,对开场不满意，库尔特·拉塞尔年轻时可比这帅多了，不信你去问约翰·卡朋特。“我是你爸爸”这种梗太可怕了……
13@甜梦里,5,2017-05-08 22:29:17,,1,真受不了用BGM煽情的电影啊，眼泪哗哗的。开场的打斗场面是目前我最喜欢的打戏啦~赞赞赞
裸奔的芒果,4,2017-11-28 07:25:59,,1,观感略好于第一部。银护系列在自己独树一帜的风格上越走越娴熟，靠着和漫威宇宙里其他系列千丝万缕的致敬与彩蛋更是为电影创造了不小的趣味性。但从某种程度上来说着银护也因此受制于妇联的牵制，剧本难以有更进一步的发挥，摆脱不了全宇宙树敌打怪的氛围。当然，萌点与停不下来的粗口都是本片的亮点。
卡里加里博士,2,2017-05-13 02:10:36,,2,故事编的乱七八糟，还煽情，比第一部差太远了
豆友2174522,3,2017-11-12 20:42:21,,0,#柒捌捌〇看电影#1、父子情；2、姐妹情；3、可怜我家星云，都认不出了啦。
麦茬,5,2017-05-08 16:02:17,,3,如果火箭不偷电池，黄金甲在钻心脏的关键时刻是不是就不会来捣乱？富爸爸是不是就在第一轮被干掉？勇度是不是就不会死啦？！！
梅岭藏殊梅长苏,5,2017-05-05 21:55:02,,2,星爵太帅了！
口木君,5,2017-05-07 16:59:32,,3,主线剧情和三条感情戏把控得超好。勇度星云和火箭的人物塑造太棒，每一条线都戳泪点。最后宇宙葬眼泪狂飙。带着年代感的老式浪漫太扎心，笨拙的纯粹的让人忍俊不禁的爱意。拥有奇怪脑回路的一帮有趣英雄。这一次的配乐也好听到爆炸。漫威宇宙的一股清流hhh
Clarke,4,2017-05-08 23:01:31,,0,血统论都要反，感觉非常无产阶级革命情谊啊！视觉效果太密集，像是一桶彩虹七彩巧克力不断不断不断撒到你头上，怪力乱神就是这种体验吧！
培疯,3,2017-05-13 18:59:21,,3,就开头小树苗跳舞那段比较有趣。🌱
薄荷色草地,4,2017-05-07 00:46:01,,2,也许是期待太高，因为很爱第一部，这一部显得有点平淡，其实第一部喜欢的那些元素都有，比如卖萌的格鲁特，劲歌金曲，无时无刻的吐槽，但是感觉有点过于泛滥了，节奏被打乱了。希望第三部会更好，给四颗心鼓励一下。
YQY-Vader,4,2017-05-05 23:37:08,,1,歌是多了点，但是整体感觉不错，萌点笑点泪点都有，剧情没有太大问题，作为商业片很成功。在漫威系类也相当独树一帜，像一部花了心思的作品而不是流水线产品。
黄兔君,5,2017-05-16 23:29:14,,3,比第一部好看，虽然很多桥段都猜到了。帕帕演技比第一部细腻了很多，也瘦了。勇度让我想到了爸爸，所以结局有点控制不住情绪。那些霹雳游侠吃豆人劲歌金曲梗其实就是80一代的青春嘛，和星爵差不多大的人们都会有共鸣。和基友硬是坐到最后一分钟看完五个彩蛋，影院小帅哥还给我们报数wwww
爱的镇魂歌,4,2017-05-22 23:54:26,,1,蛮有意思的太空小品，打电动般绚烂的游戏感，并且人人都是天生段子手，宇宙级大危机碰上银互这伙逗比也会变得毫无紧张感。
Anamnesis,4,2017-08-26 19:53:47,,0,萌化了
帕格尼尼,4,2017-08-16 01:41:32,,1,好啦，第二部的话也是玩梗玩到飞起，服装以外形生物的设计和色彩以及星球上的各种自然环境等设定都给人一种非常愉悦的视觉享受，主题稍显俗套，而且故事格局相对变小，但瑕不掩瑜，同时彩蛋也是够多了……
面白饭Θ☉Θ,4,2017-05-21 18:13:31,,0,Groot实在太可爱了😍😍😍😍
RRRRX,5,2017-05-05 14:30:25,,1,又逗又可爱啊！FleetwoodMacrules!!!
枪杀杰西詹姆斯,4,2017-05-06 18:16:55,,0,这世上只有两种人，会跳舞的和不会跳舞的…哈哈哈哈哈哈…还有谁觉得那只鸭子是个大彩蛋！格鲁特可爱死了，来局王者荣耀吧
unidolphie,4,2023-05-10 20:36:19,北京,0,好喜欢勇度呜呜呜呜呜呜（看到杨紫琼的时候笑喷了，感觉说是EEAAO里的一个造型也毫不违和）
鹰婕,4,2017-05-15 19:25:28,,1,35/“fatherandson
奇异果汁杨慕斯,4,2017-05-05 23:06:28,,2,没有第一部好看，第一部每首歌我都好喜欢，这部里看完没一首能记得住的。最烦躁的是勇度居然死了！！！我还一心想着他能复活，呜呜呜。
水怪,2,2017-05-16 00:04:45,,3,尴尬
