user_name,star,comment_time,geo_ip,vote,short
万重山,4,2021-04-10 21:30:57,,9,电影不错。就是开场时进错厅了，看了好一会儿哥斯拉。还在想为啥哥斯拉预告片剪得这么详细。
贾小宁,5,2010-02-19 00:02:52,,0,魔力小百合为纳美人倾情献声
обломов,2,2019-12-16 20:54:20,,11,真是人傻钱多国的最爱了
六,4,2021-03-27 19:55:12,,9,其实蛮丧的，要靠神力才能赢。而事实上当年印第安人就是束手无策失了家园。
EL_CR,5,2018-02-28 13:52:36,,38,嗯…不知道该怎么嫌弃…那个画面…情节…整体效果…而且我有私心就是这是我看的第一部真正让人震撼的3D电影…回味无穷…
fiorile鱼,4,2010-03-30 15:50:38,,0,不过是3D
CyberKnight电子骑士,5,2009-12-22 22:50:52,,9,绝对是里程碑式的作品，非常有情怀，与变形金刚这种炫耀华丽特效的电影感觉完全不同。
梦里诗书,5,2015-01-29 18:50:37,,7,《阿凡达》作为一部科幻电影就剧情言，憾其未能有尽善尽美，这或是当年难获奥斯卡最佳影片的唯一理由，但卡梅隆用14年等待锻造的这场天神下凡，换来了足以震惊世界的电影视觉体验，那光影中美轮美奂的潘多拉星球传奇，叹为观止。
一只麦麦,5,2010-01-28 17:48:08,,6,这个故事告诉我们，拥有一只极品宠有多重要……有了你就是国服第一~2018上海电影节重看IMAX，依旧震撼感动，卡神就是卡神，能用最普世的故事传递出最美好的情感，自然场景和生物设计也太美了！跪拜……
樹一,4,2010-02-06 02:11:34,,7,有时候一部电影的好坏不在于你坐在电影院里的角度偏正，不在于音效场景有精良与否，而在于与你一同观看电影的那个人而已。
美好生活,5,2016-11-19 23:43:35,,8,这部电影讲了人类毁灭潘多拉星球的情景，但有些人类很善良，他们帮助纳威人把人类赶回地球。最后纳威人胜利了，一些善良的人留了下来。阿凡达观后感。
H,5,2017-01-16 07:35:33,,7,卡梅隆牛逼
寂地,5,2010-01-04 23:53:14,,11,好片！我喜欢！
LORENZO 洛伦佐,4,2010-05-04 05:37:52,,10,看完之后觉得剧情真是太无聊了3DIMAX都没打动我
私享史,4,2010-01-12 14:42:04,,4,这么多年过去了，唯有【北京CBD万达】的杜比立体声可以把我从座位上振得弹起来。那个，字幕好象用的是日语汉字字体。【广州美亚】二刷
arya爱吃米果团,5,2021-03-15 19:48:05,,16,啥也不说，IMAX原版！一定要去看！一生必看系列yyds
yoda6sa,5,2022-12-04 11:07:30,湖北,14,相隔十三年，画面依旧震撼，设定也很新颖，不愧是大师的作品！
毛毛,5,2021-03-13 11:26:33,,7,不是吹捧，感觉国内全部靠自己到2050也拍不出这样的电影
眠去,5,2010-01-09 15:29:23,,11,看夜里战马和阿凡达的脸就知道今年柳钉继续大热
艾尓格曼,5,2010-01-17 22:54:47,,0,3D
熟瓜太郎,5,2010-01-24 22:27:07,,0,我的潘多拉在哪里？
空羽,3,2010-01-06 12:25:25,,2,《泰若星球》的真人3D版……已经审美疲劳了。
冯楚寒,2,2018-07-10 04:11:58,,14,经不起时间的考验的一部电影
阿斯顿,1,2011-02-28 17:31:08,,2,好
小肚子✨,5,2010-01-10 13:50:22,,0,美国人民可以欢呼我们看到的只是陈永仁复仇记我们的土地上不会有印第安人在跳舞五星全给技术人员你们辛苦了
vivi,3,2010-02-16 16:03:39,,5,即使看IMAX~~~
momo,5,2010-02-13 20:14:47,,0,很有意义呼吁所有学历史，政科哲的人看！！！
生有涯知无涯,5,2021-03-17 18:29:36,,7,五颗星是送给当年第一次看3D电影的视觉震撼的。希望我们中国电影也能不断突破和创新！
高光光,5,2010-01-06 10:47:38,,1,Amazing!
Touma,5,2010-01-06 20:04:32,,7,打死也不看任何评论。
孟克依,4,2010-01-02 11:59:53,,0,主要因为有点像骇客帝国所以给四星，其次幻想的仍然不够疯狂~
空中飞人,5,2010-03-13 16:07:13,,1,和爸爸看电影~看在特效的情面上给你五分吧~
玲珑,4,2022-12-05 20:16:05,北京,13,娜蒂瑞训练杰克的情节一整个串戏到笑傲江湖，小师妹在教授学习中与新来的小师弟渐行渐近，抛弃了曾经青梅竹马的大师兄。只是金庸站了大师兄，于是大师兄不仅迅速柳暗花明人生巅峰青梅的天降还性格扭曲了，卡梅隆站了小师弟，于是大师兄被情节杀将死之际主动恳求主角继承领导位还要死心塌地认主角为兄弟。人生境遇如此的差异，不禁让人感叹主角光环的归属有多么重要。
衫弃,5,2010-02-11 22:33:30,,0,好看是好看，但没那么邪乎
遥_,4,2021-03-15 08:53:26,,13,先说结论，10年前能创造出这种电影，属实牛逼。它宏大的世界观，丰满的想象力，精湛的特效都令人赞叹。以前不理解为什么说一部科幻片是史诗般的巨作，现在明白了，它跳脱出特效，又用特效表现出了人与自然，生命之间的平衡与博弈，观看时会有沉重感，无力感，绝望感，那没有真正的正义与邪恶，只不过各自求生存，就如历史上那么多战争，不过是各自守护，它的底色永远是悲凉，和平真的万岁！
JimLynch,5,2021-03-12 14:28:09,,13,2021/3/12数字IMAX重映观影
梨之冻柠茶,3,2021-04-17 13:07:25,,6,特效包裹下的贫乏
一转身距离,5,2012-05-25 17:55:08,,1,赞啊！！
⠀吾曰唯唯,5,2021-03-15 20:33:12,,11,整个厅只有我们一家三口真是太爽了，坐的那排两端分别有安全出口灯，但老爸在左边挡住一个，老妈在右边挡住一个，我在中间看得好快乐。我妈：第四次在影院里看了，我还是那么想揪他尾巴。
豆友193911423,1,2022-05-03 19:21:08,,28,特效再好，这狗jb剧情和价值观真的劝退，无脑蠢比的白男能不能少一点？😅看得气人，滚吧看一半就弃了，有续集也不会看了，无语
品客,5,2010-01-21 21:27:14,,2,张韶涵。
Peter Cat,3,2010-01-23 23:25:30,,3,卡梅隆讲到底是资本时代套路之王，后人类的皮，人类中心主义的极致。故事和视听设计都太没有想象力，保守到土。
愚,4,2012-06-18 09:17:38,,0,有趣的世界
云鸢,3,2012-06-18 03:07:47,,4,看得比较早了，除了效果不错之外，没有留下什么其他的感受
宇宙塑胶魔怪,5,2010-01-14 16:23:42,,0,很恶俗地给了五星，因为海底世界+史前时代的潘多拉星球
WHEATBERRY,4,2010-01-19 20:24:34,,0,看的时候别吃东西，会吐的
King Sitcome,5,2010-01-18 15:23:25,,1,终于亲眼见证了一场革命。
披着人皮的鬼,4,2010-01-11 09:15:51,,0,12年后再看依然只有卧槽
ღ lulu,3,2010-01-03 22:43:00,,8,压根就没看完
iokanaan,4,2011-05-04 09:51:39,,1,这部电影被抬倒史诗的一个高度，或许是期待过高，挑刺的时候还是给了我许多尴尬的地方，我一直不能理解的，就像《本本杰明巴顿奇事》改成《返老还童》一样，好端端一部《阿凡达》硬是叫做了《天神下凡》，翻译们在彰显自己成语功底时还不忘掴自己一个耳光。
酱油郎独占花魁,5,2010-01-13 03:41:52,,6,一部以美国方式拯救世界的美国英雄片。Jake在潘多拉的第一天遇上了公主，他就成为了Jake，如果他遇上的是给了他一爪的野兽，他就会成为Miles.美国人总是为这种没有逻辑的幸运洋洋得意，而真正的科学家却被一枪打死
纳兰风澈,3,2016-08-09 01:27:03,,3,外来拆迁办与本地土著因土地纠纷引发的一系列外交谈判～
思阳,4,2009-12-27 08:38:29,,0,五星致视觉效果和自然主题，减一颗星致老套情节。
恰卜恰布,5,2011-08-05 11:35:43,,0,挺荡气回肠的
镜花水月,5,2011-04-21 13:37:06,,1,看了三遍啊……画面巨给力啊……
Fallcon,4,2012-03-13 21:56:18,,0,真是挺绚丽的情节基本上可以忽略过去了我觉得3D的效果没有我想象的那么好
旧书君,5,2010-01-04 21:21:47,,6,五十星，目前言语不能。//20210317重映：到底还是院线之王，整整一个年代前的电影在试听上还是超过现在绝大部分好莱坞流水线产品。（一起看IMAX3D技术12年零发展via熊）以及当初被人诟病的剧本，其实扎实的科幻核心和细节构筑才保证了成品的完美输出。正好在重映之前又读了一遍波尔安德森的《叫我乔》，作为《化身》的灵感来源，卡梅隆真的没少做功课。异族的精神同步率、包含智慧生命在内的盖娅系统、以此衍化出来的原始宗教与自然崇拜；虽然人文思辨上还是老一套，但履过历史车轮的车辙确实是宏大系列最好的开启方式。科技不断进化才是顶尖娱乐方式翻新的基石。再拜一下卡神。
陈楸帆,5,2010-01-10 00:34:34,,8,shoot！电影院看过4次以上，高清电视重温一次，我确认这是一部杰作，没有一分钟是多余的。2021.3.12，十二年后，我终于看懂了这部电影。这是一部呼唤人类觉醒的萨满电影，我要给它打十颗星。
敏感的小宇宙,5,2010-01-05 17:58:47,,0,史上最强钉子户~~~~色彩斑斓，眼未花，心却缭乱了
null,5,2010-02-14 14:17:25,,6,没有六星……
软蛋黄,4,2011-12-25 15:47:10,,0,好的电影能从中解读出不同的故事。
光影纪,5,2010-01-05 00:20:40,,2,用心绚丽绝对值得五星
纳什维尔的猫,5,2011-01-05 13:46:24,,0,是甜神码？？
蕉,3,2010-01-11 18:08:25,,9,野人也有爱......主题是真没啥感觉..说烂了也没人理你的
谷玄,5,2010-01-25 10:15:21,,0,虽然3D眼镜架在眼镜上有点重不过场面剧情确实很NICE。卡梅隆还在。
tlmgt,3,2017-06-15 02:19:48,,9,重刷还是觉得一般
没有很甜。,5,2021-03-22 09:37:21,,16,完全不像是十年前的电影，太超前了。不管是画面还是价值观，感觉导演是个自然主义者。至于人类，蝗虫过境耳。
虚弱橙,3,2017-06-21 23:57:18,,4,终于在渣渣投影仪上圆了3D梦，以今天的眼光来看依然是制作精良。情节一般般，人类中心主义的伪科幻，故事的内核是白人侵占能歌善舞的黑人原始部落，区别在于这里的土著有漂亮的蓝皮肤和会骑飞龙，这又说到要是非洲人在文明巅峰时期驯服了斑马和角马，今日谁胜谁负还不知道呢。
伊谢尔伦的风,4,2010-01-10 21:57:28,,3,史上最惨拆迁战争。
杨大志°,4,2016-12-29 09:21:32,,6,上课的时候和同学们一起看的，很遗憾没能去电影院。特效很棒，景也很美
夜夜读毛选,5,2010-01-10 19:12:14,,1,如同标题：天神下凡！
蒜 | BOY A 🌈,5,2010-02-02 16:37:40,,5,《阿凡达》再一次让电影具有了春药的性质，看《阿凡达》成了一种仪式：在这个寒冷的冬天，不看《阿凡达》是可耻的。——2010年2月《电影世界》文/雪风
甜椒Oli,4,2017-04-21 21:54:12,,5,技术真的是没的说的
ReMinD,4,2011-02-27 23:54:04,,0,3D效果非常棒。故事剧情就一般了。
🌈阿织,4,2021-04-03 22:20:35,,13,隔了十年第一次看，依然有感觉到视觉震撼，故事情节进展飞快不拖沓，也是好久没在影院看过这样让人不疲软的电影了。情节方面未免太起点男尊文，现实里残疾的男主在另一个世界成为人上人，那最关键的征服魅影的场面为什么不刻画出来呢，因为男主是天选之人？男主瞒着潘多拉星人三个月之久，最后树也被砍了，带着族人打仗也死了好多人，大家原谅你就因为你是个天选龙骑士？要是我是潘多拉人打完仗我干死丫的。
七七|烂柯人bot,2,2011-04-13 19:36:38,,6,原谅我真的太刻板印象了，我看了十分钟就觉得，这还是美国残疾军人也能救世界啊……
春暖花开,4,2010-01-21 20:51:29,,0,非常期待的作品。3D版本看的好头晕的，以后再看一遍
no~no,4,2010-01-03 15:22:25,,1,效果真棒啊，尽管是枪版的~
孟小椰,4,2010-01-08 21:17:16,,0,嗯……
与碟私奔,5,2018-01-19 12:40:26,,2,自从在万达电影院看过《阿凡达》IMAX3D版本其他就是电影与《阿凡达》的区别。【2021-3-12電影复映再看IMAX3D版】
大佛15 Pro Max,5,2021-03-18 10:58:03,,13,二刷之前一直想不起来原住民是如何击退科技先进的殖民者的，原来是靠星球上全部生物联合起来才扭转的战局。这不就是“机械降神”吗？战局逆转时有多激动人心，意识到这一点时就有多心寒。卡导的“机械降神”，感觉并不是剧本的无力，而是面对历史的无力。“别傻了，原住民怎么可能会赢？在潘多拉星球有巨大的神经网络可以战胜殖民者，但在我们的星球上，很遗憾，并没有什么奇迹、逆转。”殖民国家的历史，就是建立在一个个坟场、尸坑、“文明神秘消失的未解之谜”之上。这么看来，《阿凡达》的立意已可与《就英法联军远征中国给巴特勒上尉的信》比肩。在艺术性上，它扩展了电影艺术的手法边际，创造了一个美丽真实的世界；在思想上，它反思了殖民历史的血腥残忍；还能在商业上取得空前大概也是绝后的成功。《阿凡达》必定影史留名！
静静的投资,4,2013-02-09 11:15:36,,1,剧情渣了点。
裘笛,5,2009-12-22 23:04:21,,1,技術史的里程碑，不可不看(老柯靠這套技術授權就賺翻了吧)
我累特,5,2021-03-13 22:29:45,,6,10年后我发现当初那个电影院的设备到底有多烂了
麦提爽,5,2010-01-04 11:53:44,,0,这种技术恐怕这辈子是难以掌握了。
萬徳褔,5,2010-01-04 19:25:32,,1,我喜欢这种跨越物种的恋情！！！！！
肉一,4,2010-01-09 22:43:08,,0,1.好看2.男主角帅！个人认为有点像伊万麦克格雷格。是我喜欢的型。3.老套的好莱坞故事4.2D版本他们飞上飞下已经有点惊吓到恐高的我。5.没有必要再去看3D。6.主要是没有必要看第二遍。7.我以后要把我家装修成潘多拉星那样，踩哪儿亮哪儿，碰哪儿亮哪儿。
TimberNord,5,2012-04-22 01:03:54,,6,第一次3D的体验，好吧我是土逼
Lucifer,5,2010-01-26 23:47:01,,0,终于看了，很好啊
祥瑞御兔,5,2009-12-20 00:41:43,,0,一场伟大的反拆迁斗争的忠实记叙——另：在没有任何视觉效果且观看位置不好的情况下，我给这部片子五星。
石开,4,2009-12-18 10:18:24,,16,外星蓝精灵大战城管格格巫
小米=qdmimi,4,2010-01-18 22:47:57,,1,如果之前不听到那么多神三倒五的赞扬声就五星了……
大耳朵图图_,4,2017-03-18 20:08:43,,9,这片该算是3d始祖了吧？虽然主题传统，但表现手法和世界架构太棒了，女主角是真彩肤人种😂银河里边变绿色了，还是很美
monowl,NaN,2010-08-23 17:45:22,,0,看了IMAX的，2个小时三刻钟，好晕。
简单,5,2010-01-16 23:18:42,,1,牛逼的惊天动地！！！
闪通,5,2010-11-02 19:53:01,,1,回归电影的最初，让观者惊叹，让观者感动，让观者开心，让观者落泪。“阿凡达”告诉你：让电影为你造梦！
Paul,5,2010-01-12 16:22:00,,1,星際上最偉大的釘子戶對抗高技術野蠻拆遷.最後結論:人民永遠偉大而團結!拆遷辦人員，需要努力學習，提高業務技術及理論.釘子戶也要學習，團結就是力量.一切的對抗只是爲了更加和諧!
Sammy,5,2010-12-21 10:32:29,,0,环保主义者的逆袭。
只有霸王,4,2010-03-21 04:19:47,,0,的确很恢弘，但没有给我以《指环王③》的震撼。故事是好莱坞惯用的大俗套。卡梅隆这个人真不善于讲好结构丰满的故事。看在特效及部分桥段使我感动的份上，给予四星。
虫子,5,2009-12-17 08:06:58,,1,2D版，30%台词没听懂，本人对科幻片无爱，仍然震撼。。
fallingraining,4,2011-09-08 20:16:08,,0,剧情不是很有新意。特效确实没话说。有机会再看看3D的，估计感受会不一样。
曾于里,4,2013-02-22 20:02:24,,8,很遗憾，没有去影院，错过了传说中的令人惊艳的视觉效果。故事很俗套，不过还是挺感人。
莫夕,5,2010-01-17 17:16:18,,0,剧本其实只能说还好因为已有不少影片是将人类和外星生物的入侵与被入侵角色互调可能是卡梅隆写完剧本等待技术成熟的这十年耽搁到了但依然打5星就为生平第一次的3D体验吧视觉效果真的很好
搬砖少年,4,2010-01-20 11:39:32,,0,剧情大失望
abing,5,2010-01-05 08:05:56,,8,各种商业元素的成功组合+3D的突破性革命+四年5亿美元兢兢业业，相衬之下，张艺谋《三枪》之粗制滥造真乃耻辱，《十月围城》也只小儿作戏尔
不知所谓,5,2021-03-14 15:51:07,,5,"我的老天爷，谁说阿凡达没有好故事，多么瑰丽古典意味深长的好故事啊。也许几年前看，我会觉得它就是个童话罢了，而现在当我重新意识到自己的无知有多广袤、已知有多虚妄，这个故事的内涵便显得柔软谦卑又浩大。那些已知的、未知的、曾经知道又失落的东西都被包罗在其中。自然永远值得敬畏，野性的美永远高于人工的美。谁给我们的勇气，让我们仗着对宇宙仅有的一丁点已知、出于狭隘的目的狂妄地""takeeverythingwewant""？台词也太棒了，全是短句，全是隐喻，还有那个终极问题：你到底从哪来往哪去？整部片传递出心的力量，“真善美”的力量…可能不应该简单粗暴地定义为真善美，总之有时候、有些人就是能感觉到。希望自己永远拥有这样的力量，同时能越来越敏锐地觉知到他人的这种力量。"
何呵呵,4,2012-06-18 13:10:22,,0,没有期待的好看，但还不错。场景真的很宏伟，很震撼，不过这是不是有借了3D效果的嫌疑呢？还是传统的美国英雄主题。
猫在飞,5,2012-06-18 13:19:23,,0,极其唯美的制作，充满新意的剧情，突然就会想到了阿西莫夫的《基地》
子非,4,2012-06-18 13:02:34,,0,场面比较震撼
咖啡与橙,5,2012-06-18 15:43:54,,1,看完后感觉“好奇怪好奇怪”的一部电影给五星是因为技术上的突破卡梅隆生猛地造了个星球和物种出来nnd
吃人吃面不吃心,5,2009-12-18 20:48:19,,10,1，同样是Jack一个绚丽的死了一个猥亵的活着。2，除了海军陆战队，谁都不该成谜于网游！
薇羅尼卡,5,2010-02-14 03:47:21,,5,夜晚的潘多拉美得像个圣境，无法言说。如果人能选择下辈子，让我也变成一个纳维人。｜2021.3.16重看。依旧那么那么好，虽然故事稍显刻意，但依旧是在影院做过最美的梦。
暄暄,NaN,2012-12-06 09:47:31,,0,大学班主任带着我们一起去看的
我老了怎么办,5,2010-01-13 01:51:49,,0,...这种老饭新炒叫经典，不叫俗套....很多场景确实让人落泪，大家都关注环境和自然吧...不要做自然和我们生活星球的敌人....
斯文看客swain,5,2016-12-14 10:17:38,,4,一个完美的的世界，卡梅隆真造梦大师
深夜的阿斯伯格,4,2017-11-07 09:55:37,,1,很有趣的角度展示外星文明，纳美部族就如同我们人类，不知道外星人拿短短五十年就飞速发展起来的现代科技换取了地球和人类的哪些宝贵珍藏。
抗战30年,5,2010-01-04 09:41:38,,2,影院的屏幕很小，但也相当震撼了，最后的几十分钟，让我心血澎湃。
timeriver,5,2010-01-24 00:49:26,,0,3D最后一排侧边，前一晚睡太少，最后大战竟然给睡着了
lily,5,2011-06-29 10:37:53,,0,魔兽世界暗夜精灵+殖民地血泪史！
bornfreeyolo,4,2017-05-06 18:02:19,,5,绝对意义上的美轮美奂。
阿尔法,4,2010-03-24 22:19:05,,0,把所有经历都放在了新的世界创造，所有镜头都有刻意的这么去做~还有就是不禁想起了《与狼共舞》
曾二郎,5,2017-05-24 20:11:49,,3,此片精髓在于硬汉上校，一个强劲的反派
vitamine R,4,2010-02-09 19:55:53,,0,要是真有阿凡达的存在咱们都是哪凉快哪呆着的内位
Lucifer@CCC,3,2010-03-04 22:40:36,,0,3D的看着有点儿晕，不过还算一部不错的片子~
温岭阿浪,4,2021-03-12 22:26:46,,7,没想到这电影有仨小时，膀胱都要憋炸。一放完就冲进厕所，没想到里面的人比地铁还要多！本片运用了非常多的母题，外在的有科幻、玄幻、机甲朋克、丛林探险、战争、克隆、巫术，内在则表现为环保、历史和文明。中国人会想到圆明园的毁灭，西方人会想到印第安的殖民。一种文明遭受迫害，无论哪国观众都会心痛。就像鲁迅评价《西游记》的游戏说，本片也正是娱乐之中蕴含着的人文反思。本片想象力不算很出彩，科幻玄幻大杂烩在二次元实属常见。但在银幕上却非常稀罕。哪怕超级英雄电影，设定构架也都是尽可能简化（如主角和反派人设雷同）不会做的很复杂。这既是为了省钱，也是怕线多戏乱。而本片的特殊就在于它敢于打破规则，扩充各种设定，不计成本地将各类母题塞入其中，并且都能用上，不显杂乱。当然，剧本写的是挺一般，这不是卡梅隆的长项。
比芭宝,4,2010-01-11 01:29:15,,0,2010.01.10考研结束的那天……@U-town。女皇皇甫+小玉
大楼东,5,2010-01-05 12:26:43,,0,介不就是天朝的強暴拆遷麼。畫面著實nb
瞎子,4,2009-12-31 12:54:45,,8,故事一般，视觉效果一流。部落在生命之树下唱歌换体那两段感觉像老谋子拍的奥运开幕式……可能片子里的光影效果太斑斓的缘故吧。
sharon,4,2017-03-22 21:42:23,,7,经典在于特效技术里程碑式的突破
张春[阿卡纳],5,2010-01-06 23:07:04,,8,看完电影，真不想回到箱子里啊。
金英俊,5,2010-01-30 18:43:25,,0,东莞IMAX
言知檀,4,2010-05-01 18:40:54,,0,美丽的荧光树和各种植物。为了卡梅隆十年磨一剑的精神。
独立日,5,2011-01-29 14:13:55,,1,开创电影新纪元的作品
怪猫,4,2012-05-25 16:54:42,,0,米帝的城管大战拆迁户
江边一只鸟,4,2010-05-31 01:16:34,,0,纳威族就是一群长着尾巴的印第安人，金马伦。。。。你想说的太多了，虽然这真是一部别人想也不敢想要去拍的电影
anne|燕南飞,5,2010-01-18 23:09:15,,0,还想看Imax的！
XL,4,2010-04-28 01:25:32,,0,美丽、壮观，但不精彩
束,4,2010-01-21 13:44:04,,0,CityDream!
赫恩曼尼,3,2012-07-01 10:50:02,,9,明明是想靠近，却孤单到天明
观察日记,1,2021-03-14 22:28:05,,13,又看到这部电影的消息了，那就来打个一星吧😃当年被迫看了第二遍，第一遍是自己委婉地要大人带去的，认了；第二遍是大人觉得好看隔了几天又买票强行要我再看一遍，这我可就不干了，💩烂片……这片子可以在我最讨厌的外语片里排第二，第一我在座位上睡着了不记得内容和片名，第三是fbb参演的金刚狼，对f没意见就是不记得具体的电影名了，电影一般般，学校组织观看，因为被迫的所以本身一般的电影显得更难看了
空思,4,2010-02-07 16:50:56,,0,ISeeYou!
尘,4,2010-01-10 14:49:39,,0,看到吐
n,NaN,2012-06-18 20:27:00,,0,棒！！！！
高詩遠,5,2021-03-20 16:22:59,,4,从小学到现在都没有看过，终于等到了重新搬上大荧幕，算是追忆了一下十年前的时代印记。当一个电影观众是很幸福的一件事情，因为作品本身的魅力是无法改变的，无论是十年前，还是身处当下这个时代，这依然是完美的画面，这依然是寓意深刻的故事，这依然是电影界的明天。
光年‖影视歌三栖民工,4,2010-03-07 22:32:27,,0,看电影的时候，我老是情不自禁想起阿凡提·达，我错了。。。
豆友227242827,5,2021-03-12 20:50:56,,3,《阿凡达》，詹姆斯·卡梅隆导演的好莱坞史诗级影片，11年前在全世界，特别是中国掀起了3D电影的狂潮和革命。至今想到它，仍然震撼于这部影片极具冲击力的视觉效果和深刻的内在底蕴！
诸葛若见,5,2011-06-18 19:48:35,,5,卡梅隆在电影中的创世纪
塔塔君Minkun,4,2022-01-04 09:40:05,,4,误删补写，2021-03-15重看。比起李安那两部片的电影工业实验，卡梅隆明显为自己的大型电影实验找到了最适合的文本——不论故事具体如何，这是一个必须要去“看”的电影：从零开始建立新的客观存在的世界，无论多么详实的设定最终都必须回归到“看见”本身；从人类到阿凡达的身份转变，也意味着一种VR式的异世界穿越故事体系，通过一个新的躯体（3D眼镜、革新时代的特效）而看见异世界，通过健壮的四肢的接触、感知到空间感的双眼亲自体认异世界的客观存在。
菠萝,5,2010-01-24 23:21:59,,1,JamesCameron，曾经之世界之王，在这一刻，进入了神域……剧情并非苍白，而是已入大巧不工之境。今典电影院。
孤独落单,4,2018-02-11 10:41:30,,27,即便3D电影遍地的如今，它依然是让我突然想起，依旧有兴趣再看一遍的作品！真实的人类和幻想中异族间的感情不是我打动我的地方。特效、色彩、3D、情节安排让我没有出戏和片刻离开的想法！
睡懒觉的cc,4,2010-01-04 20:18:53,,0,【宁/秀】我终于绝望的发现我对所有科幻片都不感冒，对《星球大战》是，对《阿凡达》亦是。看的是3D版本，画面的质感确实是好的非比寻常，但很多的情节点都能找到模板，好像《天空之城》《幽灵公主》《风之谷》。我终于觉悟过来我还是比较适合看剧情类电影，但当面对这样牛X的画面我也无话可说了
我还是我,3,2011-08-04 09:57:56,,0,x
砖头Ⓥ茅坑,5,2010-01-09 17:58:39,,6,有谁是像我一样看的是国语配音普通版么……
