user_name,star,comment_time,geo_ip,vote,short
九尾黑猫,4,2010-01-06 01:22:42,,14,侏罗纪版《沙丘》。重看16分钟加长版，突然感受出不一样的东西。对于生命的渴望，最原始的感触，人与自然的连结。这不只是一个故事的外壳，深入进去，会发现是一种自省，一种呼喊。
刘没胖!,5,2009-12-24 13:02:30,,21,美到连膀胱都跟着爆炸的画面
李圆脸,5,2021-03-14 17:17:59,,22,如果在2021年的今天上映，那也应该是全球票房冠军。
LeungChanXXX,NaN,2015-06-24 17:56:30,,10,#个人无感的公认佳作#
AI~young,4,2021-03-14 02:23:13,,17,欧美发达国家的原始积累之路都是罪恶的
crow,5,2021-03-29 00:40:34,,36,2021看还是很精彩
我是直的,2,2022-11-01 15:02:08,河南,19,这不就是科幻外太空版入侵印第安吗还教他们语言给他们盖学校人家过得好好的用得着你们这些自大的美国佬么呕还有男主是去入赘的么当年就排斥看现在被强安利还是不喜欢
多看电影爱电影,4,2017-03-02 09:55:19,,11,剧情，3D效果真是震撼！
天马星,4,2021-03-13 23:26:52,,10,【重映2021】剧情还是流畅，终于看到IMAX版，不过这版翻译太敷衍，很多信息不翻甚至翻错，体验最好的还是上影节那版。【SIFF2018】终于在大银幕还是LUXE巨幕上看到这部史诗巨作，不得不说「阿凡达」的沉浸感无与伦比，绚烂瑰丽的潘多拉星球更是美轮美奂，162分钟太短了！太短了！
Nightfall,5,2021-03-29 23:59:42,,24,重映在看依旧感觉恢宏震撼，卡梅隆的格局与野心真的封顶，12年前的作品依旧吊打当下的许多伪3D。喜欢他娓娓道来的叙事手法，虽然老套，但功底深厚，起承转合的心路历程随着主角感同身受。总有关于政治与人性的折射，但感触最深的是不要跟不同频的人讲道理，利己性的人只在乎眼前的利益。而科学和善良才是生命延续的真理。从美学角度看，蓝绿色真的太舒适了，纳美星人设定高级感满满，植物动物的设计感至今也是望尘莫及，更何况小到呼吸阀都不过时。但卡神的男主总是叫Jack。女主总是在有未婚夫的情况下遇见爱情。反派憋气功力一流。希望卡神长命百岁，我真的想看第二部！
宁宁,4,2018-03-22 00:03:37,,67,特效不错，视觉震撼，卡梅隆创造了一个充满活力的星球，一切让人感觉很真实难忘。
悟空,5,2021-03-14 03:40:10,,22,谁能想到这电影永不过时
ynian2011,4,2022-12-16 14:58:02,安徽,35,我还挺喜欢那个飞行员小姐姐的，酷毙了好嘛
Sophie  Z,4,2010-01-13 20:59:58,,6,血泪拆迁史
夕阳的泪痕,4,2022-12-14 12:06:43,江苏,24,西方殖民者的自照，但电影还是美化了，因为潘多拉赶走了天空人。但现实中，当年的印第安人和非洲土著可比这个惨烈多了。
米粒,5,2010-01-06 15:28:56,,30,！！！终于如愿以偿。后半段哭着看完；卡梅隆绝对很会掌握观众哭点，比如最后那个镜头；每个成功男人的背后，永远站着一个女人。
恶魔的步调,5,2010-02-13 09:22:50,,12,我觉得电影应该改名成《FromPandorawithLove》，中文译名就叫做《薛定谔猫之恋》，什么avatar什么阿凡达阿凡提实在太不通俗了。
陈哈,5,2010-01-05 20:37:55,,9,女主角像张韶涵，诶……
Mr. Infamous,5,2011-03-08 20:43:20,,10,十一年前火到一票难求，要等到寒假回去，才能带全家人去看第一场3D电影，满场老少面对奇观的呜呜哦哦终生难忘。失眠后赶个七点IMAX早场看完，精神亢奋，森林山海追随魅影骑士那一刻，窝火的情绪被吊得高昂，开战时内心独白全是“Die，bitches!”除了察觉翻译太烂，全片丝毫没有预料中的任何失色，反而历久弥新，惊叹不愧卡神。这大梦一场，梦得见奔跑，飞翔，梦得见呼吸，牵绊，还梦得见性灵，敬畏，真是曼妙至极。对于未来，科幻片里少有安心，军商因着暴戾与暴利，永远以自视甚高的姿态做着野蛮无知的行径，而人类，终归是毁灭地球与自取灭亡的物种。太期待续集，但求别再往后跳档了。
扌丁月佥,5,2017-03-23 08:20:15,,15,最喜欢的电影之一，全程无尿点，感情戏也非常感人。
Minder,5,2021-03-12 22:30:17,,15,十年前，卡梅隆将四百多年前白人的罪行讲述给了全世界，一切是那么残酷而真切。数百上千年的文明与智慧淹没在了殖民扩张之下，强大带来的不是领导和崇高，而是骄傲的毁灭即使现在我们向往自然，所做的一切也只不过是在它的残骸上膜拜。正如影片中所说：“人类杀死了他们的地球母亲”
小海,5,2015-04-19 22:07:09,,12,我用六年看一部电影。
Lan~die,5,2010-01-26 20:06:40,,9,1.26，我的阿凡达日。卡梅隆毕生精华之作，“让电影回归到最初的意义：造一个梦。”米兰·昆德拉曾说，伟大的作品只能诞生于他们所属艺术的历史中，同时参与这个历史。因为只有在历史中，人们才能抓住什么是新的，什么是重复的，什么是发明，什么是模仿。这是部了不起的作品，卡梅隆书写了历史。
巴喆,4,2012-01-11 17:45:19,,7,这电影极大地革新了人类的一种观看方式。
淡水无香,4,2016-05-28 14:45:01,,10,女主角莫阿特以及猛兽们就是潘多拉的化身：你顺遂，她就为你奉献爱与温柔；你忤逆，她就会变得很可怕。
胖丁桃,3,2021-03-12 21:41:35,,14,这些年视效技术发展得很快，现在看虽然依然觉得潘多拉星球很美，但已经没有觉得特别震撼了；对殖民的反思又充满了拼贴和居高临下的伪善，3.5.没有在11年前看终究是一个遗憾。
yocofcjx28,4,2016-11-20 08:38:18,,13,大制作！但剧情稍显薄弱。
legolas,3,2022-12-13 21:12:04,浙江,23,十年后的今天第一次看，被这烂俗狗血无聊跳跃的剧情给震惊了。
昵称被占不开心,4,2017-03-21 16:15:49,,12,Iseeyou特效赞
Eldorado,4,2021-03-24 10:58:53,,16,出电影院：我不做人啦！
Leon Winters W,5,2015-12-30 00:50:34,,11,继铁达尼号又一个经典之作！杰克得知哥哥死亡的真实原因后使得他在几周里就从简单的原住民体操开始，接连学会了射箭、打猎、骑草泥马（一种头部类似食蚁兽，以吸食花蜜为生的六足奇蹄目动物）乃至骑草拟龙（一种类似翼龙的兽类），最终甚至征服了狂草拟龙，成为族中第一勇士
遇见彩虹🌈,5,2017-11-15 10:54:08,,50,11年后重映依旧很惊艳！美伦美奂，3D电影神作！
木由,5,2020-04-12 05:35:08,,18,特别感动。看多少遍都像个小孩子一样，又惊奇又热爱。
冰红深蓝,4,2014-12-08 21:11:54,,22,3D效果确实是开创性的，但故事也就一般。（7.5/10）
冰拥天下,5,2021-03-16 22:17:46,,26,场面和特效放在十年后的今天依然出类拔萃，不愧是开创时代的作品，绝对值得反复观看。影片本身也带有强烈的哲学性思考。首先，我们太习惯于人类反抗外星人的科幻神话，而当人类自身成为侵略者时我们又当如何选择，征服者与被征服者的关系永远不应该取决于立场，而应该尊重正义。其次，工业文明与自然生态是否意味着根本性的对立，我们究竟需要为科技进步付出怎样的代价，生存与毁灭之间的距离永远只在毫厘之间。
瞧一瞧,4,2018-03-24 09:43:57,,16,蓝色星球，一直在等待阿凡达第二部
汽车大师,5,2010-01-04 21:58:09,,6,故事老套也好，人物脸谱也好，战火一点燃我就全然忘却了3D眼镜的存在——这是卡梅隆的力量
连城易脆,5,2013-12-05 13:53:29,,14,詹姆斯卡梅隆下一部电影会引领一个什么新的潮流呢？
豆友150396461,4,2021-03-16 16:51:05,,25,故事不够好，烂大街的狗血故事。但特效足够好，天马行空的想象力为这个异想世界编织了一双美丽的翅膀。即便是如今再看也是吊打当今八成以上电影的程度，完全值回票价。
李濛Lemon,5,2015-04-20 15:21:25,,8,特技的震撼程度已经不需要赘述了，说它带来了一次电影的革命毫不夸张。除此之外，剧情也是可圈可点，3小时时长的故事，无一处多余，无一处拖沓，无论主线支线都铺垫到位，张弛有度，卡梅隆就这样实现了艺术、技术和商业的完美平衡。
暴富的女孩是我,3,2017-03-21 10:26:48,,13,看了好多遍，都没看完过……个人不太喜欢
汪金卫,5,2010-01-10 16:41:48,,7,一个让人流连忘返的真实的美妙的新世界！！伟大的卡梅隆赢了！这部片看普通3D和2D差不多。//20150418北京电影节万达石景山IMAX3D。没想到时隔五年，终于圆了IMAX梦。依旧牛逼得一塌糊涂。
Hook,5,2021-03-15 23:22:14,,19,我竟然不是二刷，我是一刷啊！迟了十年的震惊！而且这个故事真的好惨啊！大树都倒下了呜呜
Doublebitch,5,2010-01-10 17:11:08,,8,人生第一次IMAX
小川,5,2021-03-12 11:22:37,,16,五角场万达imax上午8:30场重映版。我不喜欢人类，我想住进森林，人的躯体孱弱、肮脏，是诞生偏执和狂妄的温床，赛博化是人的自我进化吗？工业文明会有一种光明的前景吗？直到结尾男主在爱娃下真正进入阿凡达，一种沉重的负担方才落下，躯体是沉重的累赘，是应当超越的重担，娜塔莉给杰克戴上面罩简直是网友见面会，野蛮上校让人想起《头号玩家》，经典打不过找本体，称其为”爸爸”疑似内涵海明威；异星文明对于人类的自我审视，永远站在弱者一方叙事，异域情调和多异之美的完美展现，精彩纷呈。
LEMON酱,5,2017-03-04 12:12:07,,13,对于这部电影来说，剧情并不是最主要的。
魚生,5,2022-09-23 06:18:35,荷兰,15,时隔13年，再次在大荧幕上重温这部经典，还是很震撼，卡梅隆太牛逼了！期待年底的阿凡达2！丨@PathéSchouwburgplein，22Sep2022
红发雪糕筒,2,2011-11-21 22:19:13,,18,我不管它的3D有多NB，画面有多梦幻，我就是不能原谅这样毫无新意的美式狗血剧情！
仲夏之门,3,2021-03-12 23:23:28,,11,3.5，IMAX3D重刷复魅失败，技术上的超群拔萃，不足充当剧作和人物设计四处漏风的幌子。卡梅隆专注于“架构”而非“诠释”，带来的最直接损害即为开场让人目不暇接的东方灵性元素，原始丛林间具象而幽微的呢喃，后半段光彩尽失，扁平为某种想当然（被工业惰性说服）的超意志神力，看上去辽远而宏阔，却是经不起注视的肥皂泡。好在表面叙事动力匮乏，多少被画内丰富的运动感所掩盖，节奏仍是一气呵成的，也借此重新定义了影院视听场环绕下的”Iseeyou”。可叹的是受此巨大幻象蛊惑，好莱坞从此如同失心疯的上校，踏上了一条力比多燃烧过剩的不归路。
寒枝雀静,3,2015-02-16 09:28:56,,9,环保课重看，太假了，太假了，卡梅隆一生黑。
妈咪宝贝,4,2016-11-19 23:18:52,,12,3D消效果真是不错
有心打扰,5,2010-04-19 13:18:33,,10,技术革命，身临奇境。从那一刻起，我爱上了走进影院欣赏电影的时光。
白斬糖,4,2021-03-17 02:49:28,,10,三刷。第一回看是10岁的自己在家乡影院，第二回是17岁第一次去往纽约的飞机上。如果好莱坞真的在童年当过我的造梦机器，那《阿凡达》确实是其中第一座为我建造了乌托邦的圣山。如今看来，这个像《巴克劳》一样高喊反殖民口号的剧情即便倒退三十年也俯拾皆是，而视觉意义上无论是3D还是特效都不再令人欣喜，叙事节奏更是差强人意。但《阿凡达》最大的精准在于，它手下的纳威世界贯彻着异常完整和自足的世界观，甚至隐现了一种政治诉求的实体：没有个体，每一个存在都被同一种集体潜意识统筹；没有后天经验的杂沓，一切需要知道的，将要选择的，都已经预先储存在了个体之中，只等待被事实质料激发。这些来自神秘学和人种志的碎片却和精神分析的结论奇迹般地相符：这个种群和本我无限地接近，并指出地球人灭亡的终极原因是自我经验试图摆脱群体先验。
爱情海,4,2017-03-20 21:55:04,,11,３D电影迈向新的时代。
寒露微霜,4,2021-03-16 20:48:29,,15,我竟不知道阿凡达讲的是原住民抗击殖民侵略的斗争，十年前的视觉特效真的很绝，唯一的槽点是男主是个天降弥赛亚美式傻白男
闻人林,5,2021-03-08 06:47:40,,7,11年后电视播重观。杰作。炸树那段看哭了。【中间有一段看得心里难过。我们是不是只有幻想的世界里，才能让尊重自然与生命的一方得到胜利。11-01-2010】
jj73浅之,4,2010-01-06 00:42:48,,9,20210313cbd万达看重映。正在看旧约创世纪的我，对这一切都好熟悉，果然若不读圣经对西方一切都只是一知半解。大战开始到英雄颂歌之前这段竟然很好哭，差点想五星了。没想到两遍都在本命年看，而现在，本片出品公司20世纪福斯都已不复存在///这种打游戏通关+神雕侠侣爱情+美国英雄主义的剧情经不起深究，这与卡梅隆不是电影科班出身一样不成问题。纳美星生物神经系统的观点非常萌，以及，我感动得哽咽了，因为这不就是我高中时的原始社会最大同最纯洁最具能量的观点么。。。卡梅隆承袭了终结者以来对现代科技和文明的反思，这是科幻者的根本
青山绿水,3,2018-03-20 16:25:30,,50,事后在电脑上看的阿凡达，可能是赞誉太过吧，想象和实际出现落差，感觉除了景色艳丽缤纷之外，没太记住什么😂
素水,4,2021-03-14 23:14:17,,8,确实是一个祛魅的过程。一方面依旧震撼于十一年后依旧不过时的特效，另一方面又无奈于首鼠两端的女性主义，对翼龙的驯化也太像一场强奸了。
呀哈哈,4,2021-03-13 19:40:50,,11,故事俗套，大男主爽文。画面在十年后看依然不输
启明星的指引,3,2018-03-22 01:26:33,,48,不愧是科幻巨制，画面好的没的说，就是剧情感觉一般般。
SHIN泡泡,5,2022-07-06 00:12:11,,22,真的好看为什么十几年了我才看
一蓑烟雨任平生,5,2021-03-13 02:14:45,,11,这就是电影啊，它给所有人造了一个梦，你甚至能感觉到它的存在
纵横四海,3,2021-03-20 00:31:05,,28,特效炸天，剧情老套，老美的思维就是屠杀和殖民，不明白殖民入侵者的飞船上为什么要贴中国龙的形象，他们应该贴白头鹰才对，若中国人拍这样的体裁绝对不是殖民和屠杀，而是一带一路，架桥铺路，延伸到潘多拉星，与阿凡达合作共赢，共建美好家园。
大志的小耳朵,4,2017-05-09 22:52:02,,8,好看，剧情倒不是很吸引我，但是特效好美啊！
媛媛,4,2018-03-24 07:45:02,,14,震撼的画面，视觉的冲击，作为一部三D片来说效果不错了，值得推荐的一部电影！！
做一件事很难吗,4,2018-03-23 12:40:39,,10,想当年这部片子一票难求啊逼真的画面特效自此好像开启了3D观影
寒木春华,3,2021-03-16 23:30:46,,11,三星只想给这算得上恢宏无比的潘多拉星球。其他的我看不到的一点乐观的东西，血腥暴力残酷，强者的殖民主义道路，帝国主义的傲慢野蛮，最后就像上演了一场自导自演自我感动的迎接光明未来的美好结局。虚伪，讽刺，可笑，如此不合时宜，这时候重映。
冰茶茶,4,2021-03-12 22:33:33,,11,看的重映版IMAX，剧情方面虽然欠缺一些，但是能够想象在首映时的震撼程度！
ceshitl,5,2021-03-14 19:52:20,,18,时隔十一年，终于把我的遗憾补完了
左胸上的吸盘,3,2010-02-03 21:36:55,,11,冬梅。2月2日。万达影城。如果身边没有冬梅，我根本不可能硬挺着把这片子看完。
巽,4,2010-01-23 21:00:38,,8,四星是因为它真实再现了强制拆迁现场以及很不留情的痛殴人类。对了，我真的很想骑那样一直鸟or龙。
元宝宝,4,2017-04-03 11:56:57,,10,生命力源于平衡！难道说中国的太极，万法自然无根无极也是同理？
随风的蒲公英,4,2017-03-23 21:21:20,,6,剧情很新颖，里面的特技真的特别棒！
南州,5,2012-05-23 23:03:20,,0,神片很好
樂(Yue)言,5,2021-03-14 19:23:14,,13,09年的史詩巨制今天來看仍然是我迄今為止看過的所有電影中視覺效果最最最震撼的。
The 星星,2,2020-04-09 13:41:18,,14,当本片所使用的技术已经不再先进时，它还有什么意义在影史留名
先闭嘴吧,4,2022-12-27 13:50:30,湖北,13,把阿美丽卡理所当然的入侵和掠夺描写得淋漓尽致
禁止生气,3,2022-08-01 16:08:36,,11,还好没有在影院看。。。画面是美的，想象是丰富的，剧情是阿丑喜欢的，侵略、武力、所谓的反抗。男主一个前海军战士，前半段表现的跟六岁爱掏鸟蛋的熊孩子一样让人冒火，看完真想骂一句你神经病啊
基瑞尔,4,2021-03-12 21:41:39,,6,2009.12-2021.3，听到片尾，才惊觉风光正盛的Leona都可惜地“糊”了【。几十年过去，SigourneyWeaver在银幕上的形象从一如终，始终写就故事里那个最勇敢、坚韧的角色；《异形》是，这里同样也是。即使只为这份诠释而看，也已经心满意足。
Kyri,5,2009-12-24 12:48:45,,0,等待是值得的要去电影院再看一次
DEPARTURES,5,2018-04-15 21:19:47,,5,BJIFF2018Day3通州万达2号厅北影节最后一场，为影院而生的片，十年以后极其震撼，补上当年的IMAX3D！催更催续集催十年！
等会儿,5,2010-01-10 01:40:22,,16,纳美人都是A罩杯！就像你，如果你是蓝色的，如果我们是蓝色的，如果我们能一起飞翔，如果你对我挣扎就再也不会离开，如果你拯救了我，如果我们拯救彼此，如果我们一起奔驰跳跃在天堂般的星球上，如果真有天堂……和爱
兔小样儿,NaN,2012-09-04 20:51:38,,0,特效不错，故事一般。
豆皮子子,NaN,2012-09-04 20:37:19,,0,IseeU
Baikal Lake,5,2012-09-04 10:57:31,,1,恶搞暴力拆迁，哈哈。生态文明观。
卡比巴拉的海,4,2017-04-09 20:51:06,,8,美轮美奂
Octopus,2,2018-06-05 22:55:47,,6,剧情太弱智了，根本不是科幻。以及，前海军士兵成为纳美人的弥撒亚战胜人类/美帝，究竟应该说是政治正确还是用心险恶？最后，评分比《现代启示录》还高是什么道理？
童年末日,3,2021-03-14 23:35:16,,8,6/10，令人极其生理不适的反人类电影。挂着“天人合一”的名，行的全是conquer的实。典型的欧美人自我安慰的精神分裂电影，又当又立的，把一部分人归类到单纯的恶，再把一部分人塑造成天降伟人拯救被压迫。好家伙，坏事干尽的是你，拯救人世的还是你。这种电影的本质却从来都不是真反思，而是欧美人为自己良心不安的自我安慰的需要。什么时候这种电影要是具有“普世”价值了，那人类才是真的没救了。本中国人是不为这种伪善买单的。我唯一能原谅它的就是，mygod，还好这是一部十二年前的电影，如果是新推出的爆款我能气的七窍生烟！
城南草木生,5,2010-02-15 23:50:58,,3,真是美丽的野兽，最后还是用现代武器群殴了，这个漏要是能补上，自然力量战胜高科技，就完美了
Solar power,4,2022-05-13 16:08:03,,10,反映了印第安和移民之间的历史冲突，
灰灰会飞,5,2021-03-19 06:27:14,,21,真好看，特效放到现在看依然出色，随着杰克的走动仿佛被潘多拉的树叶拂过脸颊。感谢重映，经典永不过时。
👩‍🔬,3,2021-03-14 23:59:41,,8,白人好殖民的德行真几百年都不变。一边掠夺着你，一边用流行文化产品包装假模假样反思和道歉还要你夸他，正反话都被自己说了。
yum,3,2009-12-25 14:51:28,,1,Grace说“i'mascientist，remember，idon'tbelieveinfairytales”是最好的总结。城管钉子户，背叛族人，自然和谐，风之谷、风中奇缘都卖弄过了；动作场面CG音效也铺得有点显摆...唯一坚持住的就是配角控
兽兽·美术吗？,4,2010-01-31 12:33:15,,0,优雅姐说这素一部偶像剧~
我来我征服,5,2021-03-12 03:39:58,,9,如果你认为阿凡达是个三星电影，我敢确定，你一定是在央6或者电脑上看到它的，纯属大葱蘸番茄酱，瞎吃。IMAX才是你打开它的唯一正确方式。简单的故事，不稀奇的主题，但卓绝的想象力和创造力，以及10年过后丝毫不过时的技术，让你无法不打出个五星。20210312北京槐房万达影城重映零点场
我是棒东东,5,2022-12-10 22:00:43,浙江,29,终于在2上映前看了，十年前就这么好的剧本技术，牛了👍🏻
木石子,3,2021-03-13 01:27:34,,10,我认为阿凡达最大的意义是推广发展了3D技术。至于电影的内容和人物的塑造，还是好莱坞的老生常谈。电影科幻部分的想象更是相当低级（至少今天来看是这样的），外星生物的形象无非是多两条腿少几只眼睛，并没有让人眼前一亮或者更超前的设定。
匡轶歌,5,2010-01-13 21:16:07,,12,一定要看3D，一定要坐前排。心潮保证能澎湃，热血保证能沸腾。
呆萌小七,3,2018-03-20 21:20:17,,49,当时看真的感觉太赞了，再看就不过如此了！
Maket1980,4,2021-03-23 22:03:16,,13,虽然久仰大名，但时隔多年的现在，在重映的时候才看，这也是我首次在杜比影厅看视效大片。一言以蔽之：以最顶尖的工业制作技术和最顶尖的电影拍摄技术仅仅是拍了一个平庸的故事，且故事的推进、人物情感的转变、角色行为的动机都有难以说服人的地方，主题也是老生常谈的话题，可以说是剧本落了下乘，没能配得上如此顶尖的技术水平，不免是件遗憾的事。当所有的技术都高妙无比之时，故事的不突出就显得尤为突出了。
河堤上的貓,5,2018-03-25 21:43:56,,30,一定要去電影院看！大屏幕的特性真的超震撼的！真是視覺享受啊
魏知超,5,2010-01-06 14:09:57,,8,故事四颗星，故事以外六颗星。
十一伏特,5,2012-07-23 12:16:48,,4,十几年后重映，依然是最能体现3D视觉特效的大作，完全独立的新星球环境，深焦景深的拍摄让人能够尽量身临其境。故事创作上可能是有意识地保守，有痕迹地套用美国人最熟悉的西部片套路——新大陆上的外来文明和原住民之间的冲突。技术创新，内核传统，这样来使更多人接受，确保票房大卖。
𐂂,4,2012-05-23 12:49:49,,0,矮油其实很不错的啦。想起来两三年以前去和我弟看这电影，回去一路上脑子里还算着当天英语考试的分==。我喜欢纳美公主，不过真人长得略微捉鸡
lizengjiang,5,2012-05-22 21:17:39,,0,画面太绚丽了
幻影猫熊,NaN,2012-05-23 10:29:01,,0,掀起了3D观影新纪元的第一篇章
青鸟,NaN,2012-05-23 14:48:01,,0,不一样的视觉，很震撼，很美
夏宝宝爱吃饭,5,2012-05-22 20:22:58,,0,感觉是在玩游戏啊
芥末蘸酱,5,2010-01-10 16:50:09,,0,@金街万达&津湾中影2D版鉴定报告:史诗!IMAX3D:的确会有些晕3菜.不过那种临场感是2D不能给的.
已汪销,5,2022-10-04 21:39:15,日本,21,只有震撼过于超前了
花渡,5,2021-03-16 18:34:01,,15,十一年后依旧在神坛闪耀的作品，甚至会有一种人类视效原地踏步了十年的恐惧。卡梅隆在两个半小时里所做的不是编写了一个故事，而是创造了一个世界，一个天然的有机化的「万物互联」与「人机接口」的世界，其癫狂畅想若是和马斯克碰撞在一起会是怎样的火花。「我们的能量都是借来的，也是需要归还的」应当是生命都应具有的生命信条。＃疫后重映
迷宫中的站起来,4,2021-03-12 15:50:11,,6,Imax重看。老派的斯皮尔伯格电影，踏入舱体连接的并非虚拟的躯壳，而是仅隔窗之遥的另一副肉身。同样的，与万物生灵的缔结也通过可见的纽带建立，纳威人的形态亦不是闪烁的赛博光点，而仅是被隐喻化的被殖民者群体，落到实处的形象。3d当然会过时，但质朴的情感描述不会，就在Neytiri抱起Jack那一刻。
素年锦时,4,2017-04-09 22:04:31,,7,特效棒的无法形容。不得不佩服米国的电影制作水平。
锦鲤,2,2017-01-25 22:46:48,,12,人类电影史上具有里程碑意义的作品.蓝绿色的脸看上去有种诡异的萌感
辄馨,NaN,2010-01-10 16:02:52,,9,得到外来者武器的部落，迅速与其他部落产生分化，以魅影骑士为核心的父系集权制社会取代萨满-酋长双系统治模式；在外来技术和高效组织模式推动下，纳维人开始对其他部落展开征服，实现潘多拉星史上首次统一；然而一小撮反对力量又开始谋求对社会结构的再度分裂——阿凡达II
豆友170566010,5,2023-01-21 15:51:05,山西,11,除夕六公主打卡
Q。,4,2012-02-26 04:51:56,,4,或许在电影院里观看一定会为科技之神奇而惊叹万分，潘多拉星风景堪称美轮美奂，超炫的技术也给观众带来无与伦比的视觉体验，但脱去3D的外衣，这就是只是一个普通的不能再普通的故事。不过⋯其实我最不想的事情是去脑补那是一个大美女⋯⋯★★★☆
岛上的夏奈,4,2010-06-06 00:03:52,,6,剧情二流，画面一流
